Description,Category
"XMLUnit 2.x Development Moved to GitHub

XMLUnit provides help with testing code that creates or consumes XML.

XMLUNit 2.x is available for both Java and .NET with a similar API. Development of this version has moved to a GitHub organization[1] with two git repositories for Java and .NET respectively.

All discussion about XMLUnit independent of any version will happen on the XMLUnit general mailing list[2].

XMLUnit for Java 1.x will still be maintained using the Sourceforge infrastructure that has served as well for many years.

We don't intend to maintain XMLUnit for .NET 0.x any longer.

[1] https://github.com/xmlunit
[2] https://sourceforge.net/p/xmlunit/mailman/xmlunit-general/XMLUnit 2.x Development Moved to GitHub

XMLUnit provides help with testing code that creates or consumes XML.

XMLUNit 2.x is available for both Java and .NET with a similar API. Development of this version has moved to a GitHub organization[1] with two git repositories for Java and .NET respectively.

All discussion about XMLUnit independent of any version will happen on the XMLUnit general mailing list[2].

XMLUnit for Java 1.x will still be maintained using the Sourceforge infrastructure that has served as well for many years.

We don't intend to maintain XMLUnit for .NET 0.x any longer.

[1] https://github.com/xmlunit
[2] https://sourceforge.net/p/xmlunit/mailman/xmlunit-general/","Categories
XML, Build Tools, QA Automation"
"The PoDoFo library is a free, portable C++ library. It can parse and modify existing PDF files and create new ones from scratch. It also includes several tools to work with PDF files.
It features an unique approach which provides access to PDF documents via an object tree. Therefore, PDFs can be created and or manipulated using a simple tree structure.

Development of PoDoFo has been moved to GitHub: https://github.com/podofo/podofo

Please raise new issues in the GitHub project.The PoDoFo library is a free, portable C++ library. It can parse and modify existing PDF files and create new ones from scratch. It also includes several tools to work with PDF files.
It features an unique approach which provides access to PDF documents via an object tree. Therefore, PDFs can be created and or manipulated using a simple tree structure.

Development of PoDoFo has been moved to GitHub: https://github.com/podofo/podofo

Please raise new issues in the GitHub project.","Categories
Data Formats, Graphics, PDF"
"CAJUN is a C++ API for the JSON data interchange format with an emphasis on an intuitive, concise interface. The library provides JSON types and operations that mimic standard C++ as closely as possible in concept and design.CAJUN is a C++ API for the JSON data interchange format with an emphasis on an intuitive, concise interface. The library provides JSON types and operations that mimic standard C++ as closely as possible in concept and design.","Categories
JSON"
"odt2daisy is an OpenOffice.org Writer extension, enabling to export in DAISY XML, Full DAISY (xml+audio) and Audiobook format. DAISY is an NISO Z39.86 standard for blind, visual impaired, print-disabled, and learning-disabled people.odt2daisy is an OpenOffice.org Writer extension, enabling to export in DAISY XML, Full DAISY (xml+audio) and Audiobook format. DAISY is an NISO Z39.86 standard for blind, visual impaired, print-disabled, and learning-disabled people.","Categories
Word Processors, Data Formats, Speech"
"ZPLDesigner is a free and easy-to-use software utility that allows you to create, preview and print label based on Zebra Programming Language (ZPL).

ZPL commands
ZPL Designer can help you to write ZPL code. The left panel provides a list of the main ZPL commands used to design a label. By hovering the mouse pointer over the desired ZPL command, a detailled description will be displayed on the top ""Help"" panel. Clicking on it will add this command to the ZPL editor.

ZPL Viewer
By pressing F5 or clicking on Preview button, ZPL Designer will display the result of you ZPL code on a Preview tab.
You will be able to zoom/unzoom, rotate or save the generated label as an image.

You can choose how to render your ZPL code: a local Zebra printer or by using the labelary.com webservice.
An industrial ZPL printer with embedded website and network is required when you choose to use ""Local Zebra Printer"" as renderer.ZPLDesigner is a free and easy-to-use software utility that allows you to create, preview and print label based on Zebra Programming Language (ZPL).

ZPL commands
ZPL Designer can help you to write ZPL code. The left panel provides a list of the main ZPL commands used to design a label. By hovering the mouse pointer over the desired ZPL command, a detailled description will be displayed on the top ""Help"" panel. Clicking on it will add this command to the ZPL editor.

ZPL Viewer
By pressing F5 or clicking on Preview button, ZPL Designer will display the result of you ZPL code on a Preview tab.
You will be able to zoom/unzoom, rotate or save the generated label as an image.

You can choose how to render your ZPL code: a local Zebra printer or by using the labelary.com webservice.
An industrial ZPL printer with embedded website and network is required when you choose to use ""Local Zebra Printer"" as renderer.","Categories
Integrated Development Environments (IDE), Data Formats, Printing"
"litePDF is a Windows library (DLL), which allows creating new and editing of existing PDF documents with simple API. Page content is drawn with standard GDI functions through a device context (HDC or TCanvas, in case of Delphi or C++ Builder).litePDF is a Windows library (DLL), which allows creating new and editing of existing PDF documents with simple API. Page content is drawn with standard GDI functions through a device context (HDC or TCanvas, in case of Delphi or C++ Builder).","Categories
PDF"
"portable python protocol simulator for testing purposes. Support radius, diameter, dhcp, ldap, EAP calculations(SIM, AKA, AKA')portable python protocol simulator for testing purposes. Support radius, diameter, dhcp, ldap, EAP calculations(SIM, AKA, AKA')","Categories
Data Formats"
"tiny viewer for the XPS file format.
Supports external and internal links.
Many different console parameters possible so you can adapt it easyly for your needs.
Can load xps files from pipes. Very small exe size (242 KB).tiny viewer for the XPS file format.
Supports external and internal links.
Many different console parameters possible so you can adapt it easyly for your needs.
Can load xps files from pipes. Very small exe size (242 KB).","Categories
Data Formats"
"A c# pure RRD tools impl
all RRD tools functions http://oss.oetiker.ch/rrdtool/
pure c# implement,mean than can run without extenal RRD tools
full compatible with jrobin http://jrobin.org

The project on codeplexhttp://sharprobin.codeplex.com/A c# pure RRD tools impl
all RRD tools functions http://oss.oetiker.ch/rrdtool/
pure c# implement,mean than can run without extenal RRD tools
full compatible with jrobin http://jrobin.org

The project on codeplexhttp://sharprobin.codeplex.com/","Categories
Data Formats, Monitoring, Graphics"
"This project has been moved to GitHub: https://github.com/tomschr/dbcookbook/

The DoCookBook project aims to create an open source book about DocBook and the DocBook XSL stylesheets written as a cookbook and released under a Creative Commons license.This project has been moved to GitHub: https://github.com/tomschr/dbcookbook/

The DoCookBook project aims to create an open source book about DocBook and the DocBook XSL stylesheets written as a cookbook and released under a Creative Commons license.","Categories
XML, DocBook, Documentation"
"Java library for access to Moodle's web services via the REST protocol
(09/11/2013) Development of this project has been resurrected and the current code may be downloaded from https://github.com/bantonia/MoodleRest
A compiled .jar will be available here once the code has been finalized.
(30/03/2012 A newer version (V0.1.5) to work with Moodle 2.2 has been uploaded. Although still requires more documentation (better than it was) etc... Calls to create and update users now provides facilities to add preferences and customfields. Removed the batch calling of the web services (not needed as all calls are via POST and not GET), code is still there but commented out. V0.1.4 was removed, too many bugs!

Previous versions using the Moodle 2.1 webservice calls are still here.

Code for the next release which is under development can be downloaded from:

https://github.com/bantonia/MoodleRest

Note: The software is supplied as is under the GNU version 2.0 License.Java library for access to Moodle's web services via the REST protocol
(09/11/2013) Development of this project has been resurrected and the current code may be downloaded from https://github.com/bantonia/MoodleRest
A compiled .jar will be available here once the code has been finalized.
(30/03/2012 A newer version (V0.1.5) to work with Moodle 2.2 has been uploaded. Although still requires more documentation (better than it was) etc... Calls to create and update users now provides facilities to add preferences and customfields. Removed the batch calling of the web services (not needed as all calls are via POST and not GET), code is still there but commented out. V0.1.4 was removed, too many bugs!

Previous versions using the Moodle 2.1 webservice calls are still here.

Code for the next release which is under development can be downloaded from:

https://github.com/bantonia/MoodleRest

Note: The software is supplied as is under the GNU version 2.0 License.","Categories
Web Services"
Devolia Geo is a RPC (Remote Procedure Call) service offering user geolocation (i.e. the service returns the closest city and country names from latitude and longitude or IP address).Devolia Geo is a RPC (Remote Procedure Call) service offering user geolocation (i.e. the service returns the closest city and country names from latitude and longitude or IP address).,"Categories
Web Services, Application Servers, Mobile"
Generic viewer for UN/EDIFACT files and interpreter for MSCONS and ORDRSP messagesGeneric viewer for UN/EDIFACT files and interpreter for MSCONS and ORDRSP messages,"Categories
Data Formats"
An STL format importer/exporter plugin script for Google SketchUp. Supports both binary and ASCII import and export.An STL format importer/exporter plugin script for Google SketchUp. Supports both binary and ASCII import and export.,"Categories
Data Formats, Computer-aided technologies (CADD/CAM/CAE)"
"Java Marine API is an NMEA 0183 library for Java.

For furher info and latest source code, see project's Github pages.

http://github.com/ktuukkan/marine-api/Java Marine API is an NMEA 0183 library for Java.

For furher info and latest source code, see project's Github pages.

http://github.com/ktuukkan/marine-api/","Categories
Data Formats, Libraries, GPS"
