Description,Category
Common Hardware Recovery Solutions by Ukrainian-Russian network from http://hardw.net/forumCommon Hardware Recovery Solutions by Ukrainian-Russian network from http://hardw.net/forum,"Categories
Terminals, File Sharing, Security, Hardware, Scientific/Engineering, Exam"
"RSS reader for Baudot Teletype machines Simulates a classic ""news ticker"", printing current news and weather on old Baudot teletype machines.

(All later versions of this program are on Github, at https://github.com/John-Nagle/baudotrss)

(Google Voice support has been removed due to changes by Google Voice. There is now some Twilio support.)RSS reader for Baudot Teletype machines Simulates a classic ""news ticker"", printing current news and weather on old Baudot teletype machines.

(All later versions of this program are on Github, at https://github.com/John-Nagle/baudotrss)

(Google Voice support has been removed due to changes by Google Voice. There is now some Twilio support.)","Categories
Serial, Printing"
"CCE let you display and input Chinese/Japanese/Korean/UTF8 in many OS: Linux *BSD Solaris LynxOS QNX SCOUnix Minix Hurd BeOS Windows Darwin MacOSX. It supports console(framebuffer/VGA) & X11(through GGI/SDL), bitmap/TrueType fonts and many input methods.CCE let you display and input Chinese/Japanese/Korean/UTF8 in many OS: Linux *BSD Solaris LynxOS QNX SCOUnix Minix Hurd BeOS Windows Darwin MacOSX. It supports console(framebuffer/VGA) & X11(through GGI/SDL), bitmap/TrueType fonts and many input methods.","Categories
Terminal Emulators"
Just a simple telnet server for those who have none. Written in Java this telnet server relys on telnetd2 from Dieter Wimberger as basic framework and adds a shell that runs on Windows and Unix.Just a simple telnet server for those who have none. Written in Java this telnet server relys on telnetd2 from Dieter Wimberger as basic framework and adds a shell that runs on Windows and Unix.,"Categories
Telnet, Networking"
"ajaxWM is a themable ajax-and-python-based window manager, which provides multiple flexible terminals in a web-browser for comfortable remote-controlling of a computer via a network without having to install any software on the client-side.ajaxWM is a themable ajax-and-python-based window manager, which provides multiple flexible terminals in a web-browser for comfortable remote-controlling of a computer via a network without having to install any software on the client-side.","Categories
Terminal Emulators, Dynamic Content, Systems Administration"
txtkit is a visual text mining tool for exploring large amounts of multilingual texts. It's an multiuser-application which mainly focuses on the process of reading and reasoning as series of decisions and events.txtkit is a visual text mining tool for exploring large amounts of multilingual texts. It's an multiuser-application which mainly focuses on the process of reading and reasoning as series of decisions and events.,"Categories
Terminals, Communications, Image Viewers, Data Visualization, Computer Aided Instruction (CAI)"
"A ""Clientless"" VNC solution implemented with Ajax technology. You can remote your PC anywhere without pre-installing any client. As it is purely HTTP, you can VNC even behind firewall or proxy. Java VNC server able to run on Windows/Mac/Linux.A ""Clientless"" VNC solution implemented with Ajax technology. You can remote your PC anywhere without pre-installing any client. As it is purely HTTP, you can VNC even behind firewall or proxy. Java VNC server able to run on Windows/Mac/Linux.","Categories
Terminals, Systems Administration, Screen Capture"
TelScript. Telnet client as COM object controled by VB script. Dramatically extends telnet client functionality. Win32TelScript. Telnet client as COM object controled by VB script. Dramatically extends telnet client functionality. Win32,"Categories
Terminal Emulators, Telnet"
"Steganography tool which establishes a full-duplex steganographic data transfer protocol utilizing Real-time Transfer Protocol (RTP) packet payloads as the cover medium. The tool provides interactive chat, file transfer, and remote shell access.Steganography tool which establishes a full-duplex steganographic data transfer protocol utilizing Real-time Transfer Protocol (RTP) packet payloads as the cover medium. The tool provides interactive chat, file transfer, and remote shell access.","Categories
Terminals, Internet Phone, Chat, Streaming, File Sharing, Security"
"Terminal emulation widget based on KDE4` Konsole, rewritten entirely with QT4.Terminal emulation widget based on KDE4` Konsole, rewritten entirely with QT4.","Categories
Terminal Emulators"
Lan Core is a free & open source software that lets you to build a thin client network on a Windows operating system. It was originally designed to work in a server or workstation with Windows XP Professional using the native remote desktop protocol.Lan Core is a free & open source software that lets you to build a thin client network on a Windows operating system. It was originally designed to work in a server or workstation with Windows XP Professional using the native remote desktop protocol.,"Categories
Terminals, Desktop Environment, Networking, Remote Desktop"
A simple console displayed clock that can be scaled to the size of the terminal window.A simple console displayed clock that can be scaled to the size of the terminal window.,"Categories
Terminals"
A gtk-based serial terminal optimized for logging and file capture.A gtk-based serial terminal optimized for logging and file capture.,"Categories
Serial, GNOME"
A collection of bash shell scripts to make life a little easier.A collection of bash shell scripts to make life a little easier.,"Categories
Terminals, Software Development, System Shells, Systems Administration"
gtermix is a gtk+ telnet client intended for calling BBSes. It utilizes a custom VGA textmode emulating terminal widget that allows it to accurately render bulletin board systems as they were in DOS terminal programs.gtermix is a gtk+ telnet client intended for calling BBSes. It utilizes a custom VGA textmode emulating terminal widget that allows it to accurately render bulletin board systems as they were in DOS terminal programs.,"Categories
Terminal Emulators, Telnet, BBS, GNOME"
"Eterm is a color vt102 terminal emulator intended as an xterm replacement. It is designed with a Freedom of Choice philosophy, leaving as much power, flexibility, and freedom as possible in the hands of the user.Eterm is a color vt102 terminal emulator intended as an xterm replacement. It is designed with a Freedom of Choice philosophy, leaving as much power, flexibility, and freedom as possible in the hands of the user.","Categories
Terminal Emulators, Desktop Environment"
Arabeyes is a Meta project that is aimed at fully supporting the Arabic language in the Unix/Linux environment. It is designed to be a central location to standardize the Arabization process. Arabeyes relies on voluntary contributions.Arabeyes is a Meta project that is aimed at fully supporting the Arabic language in the Unix/Linux environment. It is designed to be a central location to standardize the Arabization process. Arabeyes relies on voluntary contributions.,"Categories
Text Editors, Terminal Emulators, Desktop Environment, Mathematics"
"Serial Debugger, moninter and control the behavior of the serial ports.Serial Debugger, moninter and control the behavior of the serial ports.","Categories
Serial, Communications"
GameSrv allows you to host old DOS based BBS door games on the internet via telnet or rlogin.GameSrv allows you to host old DOS based BBS door games on the internet via telnet or rlogin.,"Categories
Telnet, BBS, Console Games"
"SSHDOS is a DOS port of SSH, SCP, SFTP and Telnet clients. Needs a packet driver (or a PPP driver for dialup connection) only. There are two separate packages for SSH1 and for SSH2.SSHDOS is a DOS port of SSH, SCP, SFTP and Telnet clients. Needs a packet driver (or a PPP driver for dialup connection) only. There are two separate packages for SSH1 and for SSH2.","Categories
Terminals, Communications, Cryptography, Internet"
"xrootconsole tails a file in a window on your X11 root window. It aims to be as simple and resource-light as possible, within reason: it should run smootlhy on a P133 laptop. The program is non-interactive; all configuration is done on the command line.xrootconsole tails a file in a window on your X11 root window. It aims to be as simple and resource-light as possible, within reason: it should run smootlhy on a P133 laptop. The program is non-interactive; all configuration is done on the command line.","Categories
Terminal Emulators, Systems Administration, Logging"
WinMac is attempt to clone Mac OS X for the intel platform using the Apple Darwin 1.2 kernel. There are currently two teams working on the project. The kernel team is working on the basic compiling of Darwin on Intel. The GUI team is researching the AquaWinMac is attempt to clone Mac OS X for the intel platform using the Apple Darwin 1.2 kernel. There are currently two teams working on the project. The kernel team is working on the basic compiling of Darwin on Intel. The GUI team is researching the Aqua,"Categories
Terminal Emulators, Enlightenment, Operating System Kernels"
"Wordindex takes huge amounts of document type files (html, pdf, zip, text, ps, etc...) and full text indexes them. All data is stored in a MySQL database and a alpha web based search util has been written.Wordindex takes huge amounts of document type files (html, pdf, zip, text, ps, etc...) and full text indexes them. All data is stored in a MySQL database and a alpha web based search util has been written.","Categories
Terminal Emulators, Search Engines"
"dtach is a program that emulates the detach feature of screen. It is
designed to be transparent and un-intrusive; it avoids interpreting the
input and output between attached terminals and the program under its
control.dtach is a program that emulates the detach feature of screen. It is
designed to be transparent and un-intrusive; it avoids interpreting the
input and output between attached terminals and the program under its
control.","Categories
Terminals"
"This project has been moved to GitHub.
See:

https://github.com/crayzeewulf/libserial/This project has been moved to GitHub.
See:

https://github.com/crayzeewulf/libserial/","Categories
Serial, Hardware"
Termie is a simple RS232 terminal.Termie is a simple RS232 terminal.,"Categories
Serial"
This is a bash script that will duplicate the effect of the matrix in a terminal. It is composed of 3 files all of which are required for proper execution.This is a bash script that will duplicate the effect of the matrix in a terminal. It is composed of 3 files all of which are required for proper execution.,"Categories
Telnet, Console Games"
Expect.pm is a perl implementation of the popular Expect extension for Tcl/Tk by Don Libes. You'll also find the IO::Tty and IO::Stty Perl modules here.Expect.pm is a perl implementation of the popular Expect extension for Tcl/Tk by Don Libes. You'll also find the IO::Tty and IO::Stty Perl modules here.,"Categories
Terminals, Installation/Setup"
"A MUD-Client for Windows (Win32) and KDE, featuring perl, python and ruby scripting, as well as multi-window output. The main focus is a very strong scripting engine (nearly everything is accessible from a script) while trying to stay user friendly.A MUD-Client for Windows (Win32) and KDE, featuring perl, python and ruby scripting, as well as multi-window output. The main focus is a very strong scripting engine (nearly everything is accessible from a script) while trying to stay user friendly.","Categories
Telnet, Multi-User Dungeons (MUD), Dynamic Content"
"Configuration framework for: emacs, zsh, tcsh, ksh, bash, screen, top, metacity, gnome-terminal,... It run on all posix platform and include special stuff for epita you can find source here: http://github.com/ctaf42/ctafconfConfiguration framework for: emacs, zsh, tcsh, ksh, bash, screen, top, metacity, gnome-terminal,... It run on all posix platform and include special stuff for epita you can find source here: http://github.com/ctaf42/ctafconf","Categories
Emacs, Terminals, Window Managers"
(serial ports on) steroids enables users to execute remote c functions in python shell over serial interface. It generates c code for the target and a python script for the host automatically from a c header file.(serial ports on) steroids enables users to execute remote c functions in python shell over serial interface. It generates c code for the target and a python script for the host automatically from a c header file.,"Categories
Serial, System"
"Python-Talk is a Python implementation of a talker environment, such as Elsewhere-Too (aka ewtoo). It is a new and innovative style of talker, with easy to understand code.Python-Talk is a Python implementation of a talker environment, such as Elsewhere-Too (aka ewtoo). It is a new and innovative style of talker, with easy to understand code.","Categories
Telnet, Chat, Multi-User Dungeons (MUD)"
pyLPCTools is a replacement for the Flash Programming Tools use with the Philips(tm)/NXP(tm) LPC2xxx series of ARM based microcontrollers. pyLPCTools is a script together with some ARM assembly language and a Python user interface. Please Donate !!pyLPCTools is a replacement for the Flash Programming Tools use with the Philips(tm)/NXP(tm) LPC2xxx series of ARM based microcontrollers. pyLPCTools is a script together with some ARM assembly language and a Python user interface. Please Donate !!,"Categories
Serial, Build Tools, Installation/Setup, Electronic Design Automation (EDA)"
"""Le Putty"" is a ssh suite for Windows based on the very popular Putty project, but with added functionality that can not be included in the regular Putty.
""Le Putty"" should be as much as possible compatible with the original Putty.""Le Putty"" is a ssh suite for Windows based on the very popular Putty project, but with added functionality that can not be included in the regular Putty.
""Le Putty"" should be as much as possible compatible with the original Putty.","Categories
Terminal Emulators, Security, Internet"
"OpenSource mud client designed to work on both windows,linux and MAC OS X. Written in Gtk+ and C with SQLLite, Python, MSP, MXP, HTML, and ZMP support. Provides plugin support, automapper functionality, triggers, aliases and macros.OpenSource mud client designed to work on both windows,linux and MAC OS X. Written in Gtk+ and C with SQLLite, Python, MSP, MXP, HTML, and ZMP support. Provides plugin support, automapper functionality, triggers, aliases and macros.","Categories
Telnet, Chat, GNOME"
"PlayShell is a simple console-based application for playing media files in Linux using known media players like SoX, VLC, MPlayer and FFplay as backend.PlayShell is a simple console-based application for playing media files in Linux using known media players like SoX, VLC, MPlayer and FFplay as backend.","Categories
Terminal Emulators, Players, Video"
A Windows NT4.0 and Windows 2000 Serial multi port driver for the Philips UART SC28L198 and 16C550 based single and multi port compatibles.A Windows NT4.0 and Windows 2000 Serial multi port driver for the Philips UART SC28L198 and 16C550 based single and multi port compatibles.,"Categories
Serial, Hardware Drivers"
"Universal BootLoader Tool helps you easily recover from a failed rom flash, and is known to turn an free update rom into a full rom. (e.g. from the free WM5 update rom available for hx4700 Pocket PCs on HP.com) Only tested with HP iPAQ Pocket PCs.Universal BootLoader Tool helps you easily recover from a failed rom flash, and is known to turn an free update rom into a full rom. (e.g. from the free WM5 update rom available for hx4700 Pocket PCs on HP.com) Only tested with HP iPAQ Pocket PCs.","Categories
Terminal Emulators, System Shells, Boot, Interface Engine/Protocol Translator"
"A real-time serial port device driver,
works with RT-Linux and RTAI.A real-time serial port device driver,
works with RT-Linux and RTAI.","Categories
Serial, Communications, System"
Shell Explorer is a GUI based X-Terminal which supports telnet & FTP. This provides ease and convenience of GUI for working with remote files.Shell Explorer is a GUI based X-Terminal which supports telnet & FTP. This provides ease and convenience of GUI for working with remote files.,"Categories
Terminal Emulators, System Shells"
"This program allows you to use your PalmOS device as a LCD status display for your computer! You can display system stats (such as: CPU load graphs, CPU temperatures, free disk space), news alerts, stock indexes, graphs, etc. Can be used with most LCD soThis program allows you to use your PalmOS device as a LCD status display for your computer! You can display system stats (such as: CPU load graphs, CPU temperatures, free disk space), news alerts, stock indexes, graphs, etc. Can be used with most LCD so","Categories
Serial, Terminal Emulators, Emulators, Hardware"
"MobileUnixJ2ME is an open source project written in JavaME.It implements on mobilephones a terminal Unix-like, a Python interpreter, a RMS-filesystem, a GUI and a lot of Unix-like commands.MobileUnixJ2ME is an open source project written in JavaME.It implements on mobilephones a terminal Unix-like, a Python interpreter, a RMS-filesystem, a GUI and a lot of Unix-like commands.","Categories
Terminal Emulators"
"A small note taking program for the terminal. Tnote aims to be a small, quick and easy to use note taking app for the terminal similar to sticky style gui note taking apps such as Tomboy notes.A small note taking program for the terminal. Tnote aims to be a small, quick and easy to use note taking app for the terminal similar to sticky style gui note taking apps such as Tomboy notes.","Categories
Text Editors, Terminal Emulators, To-Do Lists"
Unix users on OS X frequently have the problem of trying to copy text in a terminal window. TerminalAutoCopy is a SIMBL plugin that automatically copies text selected in a terminal window to the clipboard.Unix users on OS X frequently have the problem of trying to copy text in a terminal window. TerminalAutoCopy is a SIMBL plugin that automatically copies text selected in a terminal window to the clipboard.,"Categories
Terminal Emulators"
"Necarsac - Cargar y Sacar

Programas para poder montar y desmontar con mayor facilidad
sin tener que especificar direccion ya que los dispositivos
son cargados en carpetas creadas previamente la cargar.Necarsac - Cargar y Sacar

Programas para poder montar y desmontar con mayor facilidad
sin tener que especificar direccion ya que los dispositivos
son cargados en carpetas creadas previamente la cargar.","Categories
Terminals"
"Atani Software has a primary focus of developing games for various platforms and also try to keep the good old BBS' alive with releases of door games, etc.Atani Software has a primary focus of developing games for various platforms and also try to keep the good old BBS' alive with releases of door games, etc.","Categories
Telnet, BBS, Role-Playing Games (RPG), Puzzle Games"
"Ssnooper is a program to created to aid in the debugging of serial line (RS232) connections. With ssnooper, a computer with two free serial ports can be connected between two serial devices to intercept and log all communications.Ssnooper is a program to created to aid in the debugging of serial line (RS232) connections. With ssnooper, a computer with two free serial ports can be connected between two serial devices to intercept and log all communications.","Categories
Serial, Debuggers, Hardware"
"PCMan is an easy-to-use telnet client mainly targets BBS users formerly running under MS Windows. PCMan X is a newly developed, open-source and cross-platform version written with wxWidgets, supporting X Window, MS Windows, and Mac OS X.PCMan is an easy-to-use telnet client mainly targets BBS users formerly running under MS Windows. PCMan X is a newly developed, open-source and cross-platform version written with wxWidgets, supporting X Window, MS Windows, and Mac OS X.","Categories
Telnet, BBS, Internet"
"Async Professional CLX is a comprehensive communications toolkit for
Borland Kylix. It provides direct access to serial ports, and supports
terminal emulation, file transfer protocols, & much more.Async Professional CLX is a comprehensive communications toolkit for
Borland Kylix. It provides direct access to serial ports, and supports
terminal emulation, file transfer protocols, & much more.","Categories
Terminals, Communications, Software Development"
"Keep It Simple Bus is a PC+MCU based Robotics Framework that utilizes serial port to interface to multiple DC/Servo/Stepper motors through PIC12F683 ising binary protocol. Main goal is to do it as cheap as possible with minimal number of components, fastKeep It Simple Bus is a PC+MCU based Robotics Framework that utilizes serial port to interface to multiple DC/Servo/Stepper motors through PIC12F683 ising binary protocol. Main goal is to do it as cheap as possible with minimal number of components, fast","Categories
Serial, Robotics"
"Guake Terminal is a Quake-style terminal for GNOME made with PyGTK. Its works like Tilda (from GNOME), Kuake and Yakuake(from KDE).
Is usefully for any user that like a quick access to a terminal emulator.Guake Terminal is a Quake-style terminal for GNOME made with PyGTK. Its works like Tilda (from GNOME), Kuake and Yakuake(from KDE).
Is usefully for any user that like a quick access to a terminal emulator.","Categories
Terminal Emulators, GNOME"
"A software implementation of a ray hardware client, and/or a Java implementation of the appliance link protocol (ALP).A software implementation of a ray hardware client, and/or a Java implementation of the appliance link protocol (ALP).","Categories
Terminals, Communications, Desktop Environment"
Allows you to redirect all communication data from RS232 compliant serial port device into a text file for further analysis. RS232 Data Logger redirects data from any available serial port/ports and works under Virtual Machine.Allows you to redirect all communication data from RS232 compliant serial port device into a text file for further analysis. RS232 Data Logger redirects data from any available serial port/ports and works under Virtual Machine.,"Categories
Serial, Debuggers, Logging"
"Simple Linux implementation of Borland's conio (conio.h) library. It uses Ncurses. It includes most functions required to write a basic application using conioh (i.e. getch(), cprintf(), puts() and more).Simple Linux implementation of Borland's conio (conio.h) library. It uses Ncurses. It includes most functions required to write a basic application using conioh (i.e. getch(), cprintf(), puts() and more).","Categories
Terminals, User Interface (UI)"
"PXES is a Linux micro distribution that will convert (or recycle) in minutes any compliant hardware into a versatile thin client capable of accessing any Unix/Linux XDMCP server, Microsoft Terminal Server through RDP protocol, Citrix ICA server or VNC sePXES is a Linux micro distribution that will convert (or recycle) in minutes any compliant hardware into a versatile thin client capable of accessing any Unix/Linux XDMCP server, Microsoft Terminal Server through RDP protocol, Citrix ICA server or VNC se","Categories
Terminal Emulators, GNOME, Installation/Setup, Boot"
"SSH2 client for MacOS before X, based on BetterTelnet, lsh and GUSI.SSH2 client for MacOS before X, based on BetterTelnet, lsh and GUSI.","Categories
Telnet, Cryptography"
"KHexTerm is a simple serial port terminal, useful for testing of peripheral still using RS-232 interfaces.
KHexTerm provides a easy to use GUI written in C++ using Qt 4.x and supports hex and text input/output modes.KHexTerm is a simple serial port terminal, useful for testing of peripheral still using RS-232 interfaces.
KHexTerm provides a easy to use GUI written in C++ using Qt 4.x and supports hex and text input/output modes.","Categories
Serial"
"Linux on Sound is a project to create a transparent console interface over eSpeak (http://espeak.sourceforge.net/), to increase linux console's accessibility.Linux on Sound is a project to create a transparent console interface over eSpeak (http://espeak.sourceforge.net/), to increase linux console's accessibility.","Categories
Terminals, Speech"
"A QT4 port for putty, the free telnet/ssh client.

Q4 2015/Q1 2016 will see qputty updated to use the latest putty release (0.66). Q2 2016 will see support for QT5.A QT4 port for putty, the free telnet/ssh client.

Q4 2015/Q1 2016 will see qputty updated to use the latest putty release (0.66). Q2 2016 will see support for QT5.","Categories
Terminal Emulators"
This is a serial-to-ethernet and/or ethernet-to-serial gateway project. Such a software could reveal useful in many cases.This is a serial-to-ethernet and/or ethernet-to-serial gateway project. Such a software could reveal useful in many cases.,"Categories
Serial, Networking"
small cross platform application to remind you working at the terminal is mad!small cross platform application to remind you working at the terminal is mad!,"Categories
Terminals, Games/Entertainment"
This is a final-year programming project aimed to build a terminal emulator for Videotex (Viewdata) over a 2400 baud dial-up modem connection. This project won a little award from Hong Kong Computer Society. Borland's Turbo C for DOS 2.0 was the programming tool.This is a final-year programming project aimed to build a terminal emulator for Videotex (Viewdata) over a 2400 baud dial-up modem connection. This project won a little award from Hong Kong Computer Society. Borland's Turbo C for DOS 2.0 was the programming tool.,"Categories
Terminal Emulators"
