Description,Category
"The Common Desktop Environment was created by a collaboration of Sun, HP, IBM, DEC, SCO, Fujitsu and Hitachi. Used on a selection of commercial UNIXs, it is now available as open-source software for the first time.

For support, see: https://sourceforge.net/p/cdesktopenv/wiki/Home/The Common Desktop Environment was created by a collaboration of Sun, HP, IBM, DEC, SCO, Fujitsu and Hitachi. Used on a selection of commercial UNIXs, it is now available as open-source software for the first time.

For support, see: https://sourceforge.net/p/cdesktopenv/wiki/Home/","Categories
Desktop Environment, Window Managers"
"Ditto is an extension to the standard windows clipboard. It saves each item placed on the clipboard allowing you access to any of those items at a later time. Ditto allows you to specify what gets saved, text, images or html.Ditto is an extension to the standard windows clipboard. It saves each item placed on the clipboard allowing you access to any of those items at a later time. Ditto allows you to specify what gets saved, text, images or html.","Categories
Desktop Environment"
emesene is a platform independent instant messaging client for the Windows Live Messenger (tm) network. emesene is distributed free of charge under the GNU General Public License 2 or any later version.emesene is a platform independent instant messaging client for the Windows Live Messenger (tm) network. emesene is distributed free of charge under the GNU General Public License 2 or any later version.,"Categories
MSN Messenger, GNOME"
Maintaining a GnuWin32.sourceforge.net package archive: Automatic download and installation of the newest binary and documentation GnuWin32 packages.Maintaining a GnuWin32.sourceforge.net package archive: Automatic download and installation of the newest binary and documentation GnuWin32 packages.,"Categories
Office/Business, Desktop Environment, Build Tools"
"The DJ Project is a set of tools to improve Java capabilities on the Desktop. The DJ Native Swing sub-project, among other things, allows integrating a Web Browser, Flash Player, HTML editor, or VLC-based player in Swing applications.

DJ Native Swing code: https://github.com/Chrriis/DJ-Native-Swing

DJ Sweet code: https://github.com/Chrriis/DJ-Sweet

DJ Swing Suite code: https://github.com/Chrriis/DJ-Swing-SuiteThe DJ Project is a set of tools to improve Java capabilities on the Desktop. The DJ Native Swing sub-project, among other things, allows integrating a Web Browser, Flash Player, HTML editor, or VLC-based player in Swing applications.

DJ Native Swing code: https://github.com/Chrriis/DJ-Native-Swing

DJ Sweet code: https://github.com/Chrriis/DJ-Sweet

DJ Swing Suite code: https://github.com/Chrriis/DJ-Swing-Suite","Categories
Desktop Environment"
"Midi Sheet Music is a free program that plays MIDI music files while highlighting the piano notes and sheet music notes. Works on Windows, Mac OS X, and Ubuntu Linux.Midi Sheet Music is a free program that plays MIDI music files while highlighting the piano notes and sheet music notes. Works on Windows, Mac OS X, and Ubuntu Linux.","Categories
Desktop Environment, MIDI"
"Tools for Windows users with dual or multiple monitors. Has hotkeys for moving windows around, restrict mouse/cursor movement between screens, application launcher, wallpaper creator and changer and a screen capture tool.Tools for Windows users with dual or multiple monitors. Has hotkeys for moving windows around, restrict mouse/cursor movement between screens, application launcher, wallpaper creator and changer and a screen capture tool.","Categories
Desktop Environment, System"
"A large repository of open-source programs built for Cygwin, including X11 desktops, language interpreters, multimedia frameworks, cross-compiler toolchains, and much more. Also hosted here is the cygport tool for building Cygwin packages.

cygport releases and the Ports Git repositories are hosted here; Ports packages are available from the website.A large repository of open-source programs built for Cygwin, including X11 desktops, language interpreters, multimedia frameworks, cross-compiler toolchains, and much more. Also hosted here is the cygport tool for building Cygwin packages.

cygport releases and the Ports Git repositories are hosted here; Ports packages are available from the website.","Categories
Office/Business, Desktop Environment, Games/Entertainment"
