Description,Category
"OpenVPN ALS is a web-based SSL VPN server written in Java. It has a browser-based AJAX UI which allows easy access to intranet services. OpenVPN ALS is a direct descendant of Adito, which was a fork of SSL-Explorer.OpenVPN ALS is a web-based SSL VPN server written in Java. It has a browser-based AJAX UI which allows easy access to intranet services. OpenVPN ALS is a direct descendant of Adito, which was a fork of SSL-Explorer.","Categories
Security, Internet, AJAX, VPN"
"Parrot is a cloud friendly operating system designed for Pentesting, Computer Forensic, Reverse engineering, Hacking, Cloud pentesting, privacy/anonimity and cryptography. Based on Debian and developed by Frozenbox network.Parrot is a cloud friendly operating system designed for Pentesting, Computer Forensic, Reverse engineering, Hacking, Cloud pentesting, privacy/anonimity and cryptography. Based on Debian and developed by Frozenbox network.","Categories
Security, OS distribution, Live CD"
"Open Source - GPLv3 inc images.

*** PLEASE NOTE: There are now 2 seperate versions here.
*** One is Pre Firefox 57. The other is Post Firefox 57.
*** For those providing mirrors, please enable your users to realize this.

Vidalia Based, Tor as a Service Solution.
MicroSip: enables FREE PC to PC video calling with no account sign-up and no middleman server.
WASTE: enables chat, file transfer and support. *** AI Powered ***
Tor/i2p: enables safer browsing.
Tor/i2p Profile: Browse over Tor/i2p on Firefox (Vanilla, ESR), Waterfox (Classic, New), Palemoon , LibreWolf and legacy CyberFox.

As with all versions of Tor - do not rely on this for strong anonymity.

A usability enhanced Privacy Pack.

An installer, for :
Vista 32/64, Win7 32/64, Win8 32/64, Win10 32/64, Win11, Linux (Wine)Open Source - GPLv3 inc images.

*** PLEASE NOTE: There are now 2 seperate versions here.
*** One is Pre Firefox 57. The other is Post Firefox 57.
*** For those providing mirrors, please enable your users to realize this.

Vidalia Based, Tor as a Service Solution.
MicroSip: enables FREE PC to PC video calling with no account sign-up and no middleman server.
WASTE: enables chat, file transfer and support. *** AI Powered ***
Tor/i2p: enables safer browsing.
Tor/i2p Profile: Browse over Tor/i2p on Firefox (Vanilla, ESR), Waterfox (Classic, New), Palemoon , LibreWolf and legacy CyberFox.

As with all versions of Tor - do not rely on this for strong anonymity.

A usability enhanced Privacy Pack.

An installer, for :
Vista 32/64, Win7 32/64, Win8 32/64, Win10 32/64, Win11, Linux (Wine)","Categories
Security, Browsers, VoIP"
To protect yourself when your VPN disconnects. It blocks Internet access and any others specified applications. It prevents unsecured connections after your VPN connection goes down and reload applications when reconnecting the VPN.To protect yourself when your VPN disconnects. It blocks Internet access and any others specified applications. It prevents unsecured connections after your VPN connection goes down and reload applications when reconnecting the VPN.,"Categories
Security, Internet, VPN"
Thanks for your support..Thanks for your support..,"Categories
Antivirus"
"Web AND Mobile (Apple iPhone) based, multi user, java port of the KeePass project. A free, easy to use password manager which helps you to manage your passwords in a secure way. Focused on deep encryption and ease of use.Web AND Mobile (Apple iPhone) based, multi user, java port of the KeePass project. A free, easy to use password manager which helps you to manage your passwords in a secure way. Focused on deep encryption and ease of use.","Categories
Office/Business, Cryptography, Systems Administration, Password Generators"
"A pronounceable password generator plugin for KeePass.


DISCLAIMER:
Compared to traditional randomly generated passwords of the same length, pronounceable passwords are inherently weaker against brute force attacks. Using pronounceable passwords sacrifice some resistance against brute force attacks to reduce the risk of inadvertent password exposure. Whether this trade-off is worth it or not depends entirely on your use case.

When using this application I recommend generating considerably longer passwords to make any brute force attack as difficult as possible. This application uses FIPS-181 for generating passwords and it is particularly vulnerable to brute force attacks that are targeted specifically towards the algorithm. I added modifications to the implementation (such as allowing the insertion of random numbers or symbols between syllables) with the intention of protecting against a targeted attack, but I cannot make any supported claims as to its effectiveness.A pronounceable password generator plugin for KeePass.


DISCLAIMER:
Compared to traditional randomly generated passwords of the same length, pronounceable passwords are inherently weaker against brute force attacks. Using pronounceable passwords sacrifice some resistance against brute force attacks to reduce the risk of inadvertent password exposure. Whether this trade-off is worth it or not depends entirely on your use case.

When using this application I recommend generating considerably longer passwords to make any brute force attack as difficult as possible. This application uses FIPS-181 for generating passwords and it is particularly vulnerable to brute force attacks that are targeted specifically towards the algorithm. I added modifications to the implementation (such as allowing the insertion of random numbers or symbols between syllables) with the intention of protecting against a targeted attack, but I cannot make any supported claims as to its effectiveness.","Categories
Cryptography, Password Managers, Password Generators, Encryption Algorithms"
"Free-SA is logs processor and report generating tool. It can be used to control traffic usage, to evaluate conformance to the Internet access security policies, to investigate security incidents, to evaluate web server efficiency and to detect troubles with server configuration.Free-SA is logs processor and report generating tool. It can be used to control traffic usage, to evaluate conformance to the Internet access security policies, to investigate security incidents, to evaluate web server efficiency and to detect troubles with server configuration.","Categories
Security, HTTP Servers, Log Analysis"
"The OpenCA PKI Development Project is a collaborative effort to develop a robust, full-featured and Open Source out-of-the-box Certification Authority implementing the most used protocols with full-strength cryptography world-wide.The OpenCA PKI Development Project is a collaborative effort to develop a robust, full-featured and Open Source out-of-the-box Certification Authority implementing the most used protocols with full-strength cryptography world-wide.","Categories
Cryptography, HTTP Servers"
"The Network Tracking Database (NetDB for short) tracks all changes to the MAC address tables on your switches and the ARP tables on your routers over time stored in MySQL. It supports extensive switch, VLAN and vendor code reports from a CLI or Web App. NetDB can generate CSV reports, track the usage of static IP addresses, record neighbor discovery data and much more.

There is now a VM ""appliance"" with easier upgrades available in the Files section.

See the http://netdbtracking.sourceforge.net for more details.The Network Tracking Database (NetDB for short) tracks all changes to the MAC address tables on your switches and the ARP tables on your routers over time stored in MySQL. It supports extensive switch, VLAN and vendor code reports from a CLI or Web App. NetDB can generate CSV reports, track the usage of static IP addresses, record neighbor discovery data and much more.

There is now a VM ""appliance"" with easier upgrades available in the Files section.

See the http://netdbtracking.sourceforge.net for more details.","Categories
Security, Monitoring"
"VeraCrypt is a free disk encryption software brought to you by IDRIX (https://www.idrix.fr) and based on TrueCrypt 7.1a.

It adds enhanced security to the algorithms used for system and partitions encryption making it immune to new developments in brute-force attacks. It also solves many vulnerabilities and security issues found in TrueCrypt.

This enhanced security adds some delay ONLY to the opening of encrypted partitions without any performance impact to the application use phase. This is acceptable to the legitimate owner but it makes it much harder for an attacker to gain access to the encrypted data.

All released files are PGP signed with key ID=0x680D16DE, available on key servers and downloadable at https://www.idrix.fr/VeraCrypt/VeraCrypt_PGP_public_key.asc

VeraCrypt can mount TrueCrypt volumes. It also can convert them to VeraCrypt format.

Documentation: https://www.veracrypt.fr/en/Documentation.html
FAQ : https://www.veracrypt.fr/en/FAQ.htmlVeraCrypt is a free disk encryption software brought to you by IDRIX (https://www.idrix.fr) and based on TrueCrypt 7.1a.

It adds enhanced security to the algorithms used for system and partitions encryption making it immune to new developments in brute-force attacks. It also solves many vulnerabilities and security issues found in TrueCrypt.

This enhanced security adds some delay ONLY to the opening of encrypted partitions without any performance impact to the application use phase. This is acceptable to the legitimate owner but it makes it much harder for an attacker to gain access to the encrypted data.

All released files are PGP signed with key ID=0x680D16DE, available on key servers and downloadable at https://www.idrix.fr/VeraCrypt/VeraCrypt_PGP_public_key.asc

VeraCrypt can mount TrueCrypt volumes. It also can convert them to VeraCrypt format.

Documentation: https://www.veracrypt.fr/en/Documentation.html
FAQ : https://www.veracrypt.fr/en/FAQ.html","Categories
Security, Cryptography, File Systems, Encryption"
"AirSnort is a wireless LAN (WLAN) tool which cracks encryption keys on 802.11b WEP networks. AirSnort operates by passively monitoring transmissions, computing the encryption key when enough packets have been gathered.AirSnort is a wireless LAN (WLAN) tool which cracks encryption keys on 802.11b WEP networks. AirSnort operates by passively monitoring transmissions, computing the encryption key when enough packets have been gathered.","Categories
Cryptography, Monitoring, Internet"
"OpenAS2 is a java-based implementation of the EDIINT AS2 standard. It is intended to be used as a server. It is extremely configurable and supports a wide variety of signing and encryption algorithms.
Requirements:
- Java 1.8 or newer (tested with the LTS versions of Java up to 17)
- Any OS that runs Java

Planned enhancements in the next major release:
- User interace configuration GUI
- Certificate Exchange Management

IMPORTANT: Java 1.7 is no longer supported.OpenAS2 is a java-based implementation of the EDIINT AS2 standard. It is intended to be used as a server. It is extremely configurable and supports a wide variety of signing and encryption algorithms.
Requirements:
- Java 1.8 or newer (tested with the LTS versions of Java up to 17)
- Any OS that runs Java

Planned enhancements in the next major release:
- User interace configuration GUI
- Certificate Exchange Management

IMPORTANT: Java 1.7 is no longer supported.","Categories
Communications, Security, Internet, Load Balancers"
"Open source DKIM library, MTA filter implementation and associated tools.Open source DKIM library, MTA filter implementation and associated tools.","Categories
Email Spam Filter, Anti-Spam, Libraries"
"Low Orbit Ion Cannon.

The project only keeps and maintains (bug fixing) the code written by the original author - Praetox, but is not associated or related to it.

DISCLAIMER: USE ON YOUR OWN RISK. THIS SOFTWARE IS PROVIDED BY THE COPYRIGHT HOLDER OR CONTRIBUTORS ""AS IS"" AND ANY EXPRESS OR IMPLIED WARRANTIES, INCLUDING, BUT NOT LIMITED TO, THE IMPLIED WARRANTIES OF MERCHANTABILITY AND FITNESS FOR A PARTICULAR PURPOSE ARE DISCLAIMED. IN NO EVENT SHALL THE COPYRIGHT HOLDER OR CONTRIBUTORS BE LIABLE FOR ANY DIRECT, INDIRECT, INCIDENTAL, SPECIAL, EXEMPLARY, OR CONSEQUENTIAL DAMAGES.Low Orbit Ion Cannon.

The project only keeps and maintains (bug fixing) the code written by the original author - Praetox, but is not associated or related to it.

DISCLAIMER: USE ON YOUR OWN RISK. THIS SOFTWARE IS PROVIDED BY THE COPYRIGHT HOLDER OR CONTRIBUTORS ""AS IS"" AND ANY EXPRESS OR IMPLIED WARRANTIES, INCLUDING, BUT NOT LIMITED TO, THE IMPLIED WARRANTIES OF MERCHANTABILITY AND FITNESS FOR A PARTICULAR PURPOSE ARE DISCLAIMED. IN NO EVENT SHALL THE COPYRIGHT HOLDER OR CONTRIBUTORS BE LIABLE FOR ANY DIRECT, INDIRECT, INCIDENTAL, SPECIAL, EXEMPLARY, OR CONSEQUENTIAL DAMAGES.","Categories
Security"
"Ophcrack is a Windows password cracker based on a time-memory trade-off using rainbow tables. This is a new variant of Hellman's original trade-off, with better performance. It recovers 99.9% of alphanumeric passwords in seconds.Ophcrack is a Windows password cracker based on a time-memory trade-off using rainbow tables. This is a new variant of Hellman's original trade-off, with better performance. It recovers 99.9% of alphanumeric passwords in seconds.","Categories
Security, Systems Administration, Password Crackers"
"Expand a TrueCrypt volume on the fly without reformatting. All kind of volumes (container files, disks and partitions) formatted with the NTFS file system are supported.Expand a TrueCrypt volume on the fly without reformatting. All kind of volumes (container files, disks and partitions) formatted with the NTFS file system are supported.","Categories
Cryptography, File Systems"
"Matriux is a GNU/Linux, Debian based security distribution designed for penetration testing and cyber forensic investigations. It is a distribution designed for security enthusiasts and professionals, can also be used normally as your default OS.Matriux is a GNU/Linux, Debian based security distribution designed for penetration testing and cyber forensic investigations. It is a distribution designed for security enthusiasts and professionals, can also be used normally as your default OS.","Categories
Security, OS distribution, Penetration Testing"
"The OVAL Interpreter is a freely available reference implementation that demonstrates the evaluation of OVAL Definitions. Based on a set of OVAL Definitions the interpreter collects system information, evaluates it, and generates a detailed OVAL Results file.

Developed to demonstrate the usability of OVAL Definitions and to ensure correct syntax and adherence to the OVAL Schemas by definition writers, it is not a fully functional scanning tool nor an enterprise scanning tool. It is a simplistic, command-line application that has the ability to execute OVAL Content on an end system. To learn more about organizations that provide OVAL content and tools or otherwise support the OVAL Language, please see the OVAL Adoption Program (http://oval.mitre.org/adoption/).The OVAL Interpreter is a freely available reference implementation that demonstrates the evaluation of OVAL Definitions. Based on a set of OVAL Definitions the interpreter collects system information, evaluates it, and generates a detailed OVAL Results file.

Developed to demonstrate the usability of OVAL Definitions and to ensure correct syntax and adherence to the OVAL Schemas by definition writers, it is not a fully functional scanning tool nor an enterprise scanning tool. It is a simplistic, command-line application that has the ability to execute OVAL Content on an end system. To learn more about organizations that provide OVAL content and tools or otherwise support the OVAL Language, please see the OVAL Adoption Program (http://oval.mitre.org/adoption/).","Categories
Security, Systems Administration"
File system/directory monitoring utilities with loggin and task processing support (can execute files or make a WCF service call). Multiple configuration options. Source code libraries can be used to create a custom file system monitor.File system/directory monitoring utilities with loggin and task processing support (can execute files or make a WCF service call). Multiple configuration options. Source code libraries can be used to create a custom file system monitor.,"Categories
Security, Frameworks, File Managers, Logging"
"A network access control (NAC) system featuring a captive-portal for registration and remediation, wired and wireless management, 802.1X support, isolation of devices, integration with IDS; it can be used to secure networks from small to large.

Source code is hosted here: https://github.com/inverse-inc/packetfence
Issue tracker tracker is hosted here: http://www.packetfence.org/bugs/A network access control (NAC) system featuring a captive-portal for registration and remediation, wired and wireless management, 802.1X support, isolation of devices, integration with IDS; it can be used to secure networks from small to large.

Source code is hosted here: https://github.com/inverse-inc/packetfence
Issue tracker tracker is hosted here: http://www.packetfence.org/bugs/","Categories
Security, Wireless, Monitoring"
Add security to your desktop by automatically locking and unlocking the screen when you and your phone leave/enter the desk. Think of a proximity detector for your mobile phone via bluetooth.Add security to your desktop by automatically locking and unlocking the screen when you and your phone leave/enter the desk. Think of a proximity detector for your mobile phone via bluetooth.,"Categories
Security"
"NOTE: Project has moved to github, including file downloads.

SharpPcap is a cross-platform packet capture framework for the .NET environment, based on the famous pcap / WinPcap libraries. It provides an API for capturing, injecting, analyzing and building packets using any .NET language such as C# and VB.NET.NOTE: Project has moved to github, including file downloads.

SharpPcap is a cross-platform packet capture framework for the .NET environment, based on the famous pcap / WinPcap libraries. It provides an API for capturing, injecting, analyzing and building packets using any .NET language such as C# and VB.NET.","Categories
Security, Monitoring, Internet"
"Fsum Frontend is a files integrity checker. It can calculate 96 hash and checksum algorithms(CRC32, MD5, SHA1, SHA2, ADLER, DHA256, FORK256, ...). You can verify your files using a .sfv/.md5/.sha1/.sha2 file or create your own checksum file.Fsum Frontend is a files integrity checker. It can calculate 96 hash and checksum algorithms(CRC32, MD5, SHA1, SHA2, ADLER, DHA256, FORK256, ...). You can verify your files using a .sfv/.md5/.sha1/.sha2 file or create your own checksum file.","Categories
Cryptography, Algorithms, File Managers"
"ANts P2P realizes a third generation P2P net. It protects your privacy while you are connected and makes you not trackable, hiding your identity (ip) and crypting everything you are sending/receiving from others.ANts P2P realizes a third generation P2P net. It protects your privacy while you are connected and makes you not trackable, hiding your identity (ip) and crypting everything you are sending/receiving from others.","Categories
File Sharing, Security, Intelligent Agents"
"iAlertU is an alarm system for your Apple MacBook that uses the built in motion detection to trigger the alarm and the iSight to capture the image of the thief.

Among many other features, it incorporates the ability for users with iPhone, iPad, or iPod Touch to connect to and control iAlertU remotely.iAlertU is an alarm system for your Apple MacBook that uses the built in motion detection to trigger the alarm and the iSight to capture the image of the thief.

Among many other features, it incorporates the ability for users with iPhone, iPad, or iPod Touch to connect to and control iAlertU remotely.","Categories
Security"
"Angry IP scanner is fast and friendly network scanner for Windows, Linux, and Mac. It is very extensible, allowing it to be used for very wide range of purposes, with the primary goal of being useful to network administrators.Angry IP scanner is fast and friendly network scanner for Windows, Linux, and Mac. It is very extensible, allowing it to be used for very wide range of purposes, with the primary goal of being useful to network administrators.","Categories
Security, Monitoring, Internet"
"CacheGuard Web Gateway works as a transparent (or explicit) HTTP/HTTPS proxy and blocks undesirable URLs and malware (viruses, trojans & worms) at the gateway. The URL guarding is mainly based on automatically updated lists of URLs. Malware are detected even in encrypted (HTTPS) Web traffic and are instantly blocked before entering your networks.

CacheGuard Web Gateway is distributed as an open source OS to install on a virtual or hardware machine of your choice. Once installed on a machine, CacheGuard-OS transforms that machine into a network appliance to implement as a link to the internet (or other WAN).

CacheGuard-OS is based on a Linux kernel and mainly uses OpenSSL, ClamAV and Squid. CacheGuard Web Gateway is especially designed to address organization requirements by providing functional and easy to handle security solutions.CacheGuard Web Gateway works as a transparent (or explicit) HTTP/HTTPS proxy and blocks undesirable URLs and malware (viruses, trojans & worms) at the gateway. The URL guarding is mainly based on automatically updated lists of URLs. Malware are detected even in encrypted (HTTPS) Web traffic and are instantly blocked before entering your networks.

CacheGuard Web Gateway is distributed as an open source OS to install on a virtual or hardware machine of your choice. Once installed on a machine, CacheGuard-OS transforms that machine into a network appliance to implement as a link to the internet (or other WAN).

CacheGuard-OS is based on a Linux kernel and mainly uses OpenSSL, ClamAV and Squid. CacheGuard Web Gateway is especially designed to address organization requirements by providing functional and easy to handle security solutions.","Categories
Security, Networking, Internet"
"IOS6 and recent iTunes updates have broken a few features. We have made some partial fixes, but they are not complete. If you'd like to help support our development, or take over the development please let us know.

Explore the internal file structure of your iphone (or of a seized phone in the case of forensic teams) using either the iphone's own backup files or (for jail broken iphones) ssh. Viewing of plist, sqlite, and hex are supported. IOS 5 is now supported

iOS 6 only partially works at the moment (some features fail or are missing). Unfortunately paid work means we can't fix this right now, but would welcome anyone else submitting patches.IOS6 and recent iTunes updates have broken a few features. We have made some partial fixes, but they are not complete. If you'd like to help support our development, or take over the development please let us know.

Explore the internal file structure of your iphone (or of a seized phone in the case of forensic teams) using either the iphone's own backup files or (for jail broken iphones) ssh. Viewing of plist, sqlite, and hex are supported. IOS 5 is now supported

iOS 6 only partially works at the moment (some features fail or are missing). Unfortunately paid work means we can't fix this right now, but would welcome anyone else submitting patches.","Categories
Security, Mobile, Data Recovery"
"The Inside Security Rescue Toolkit is a multi-purpose disaster recovery and network analysis system. It runs from a credit card-sized CD-ROM for convenient transport or download. It has read-write support for NTFS-partitions, full partition handling suppThe Inside Security Rescue Toolkit is a multi-purpose disaster recovery and network analysis system. It runs from a credit card-sized CD-ROM for convenient transport or download. It has read-write support for NTFS-partitions, full partition handling supp","Categories
Other/Nonlisted Topic, Security"
"This ASN.1 compiler turns ASN.1 specifications into C code. The asn1c is shipped together with conformant BER/DER/XER/PER codecs. The X.509, GSM TAP3, MEGACO, RRC and LDAP encoding and decoding examples are part of the source code distribution.

NOTE: THE asn1c PROJECT HAS LARGELY MOVED TO GITHUB: http://github.com/vlm/asn1cThis ASN.1 compiler turns ASN.1 specifications into C code. The asn1c is shipped together with conformant BER/DER/XER/PER codecs. The X.509, GSM TAP3, MEGACO, RRC and LDAP encoding and decoding examples are part of the source code distribution.

NOTE: THE asn1c PROJECT HAS LARGELY MOVED TO GITHUB: http://github.com/vlm/asn1c","Categories
Telephony, Cryptography, Code Generators, Compilers, Networking, Interface Engine/Protocol Translator"
"Note: WE ARE UNABLE TO UPDATE THE SCANNER AT THIS MOMENT!
Note: WE APPRECIATE YOUR CONTRIBUTION.

Detects file inclusion, sql injection, command execution vulnerabilities of a target Joomla! web site. We'll update it soon. The database update is currently maintained by web-center.si. Send your contributions, recommendations and bugs report to joomscan at yehg.net or creating a ticket at Trac here.Note: WE ARE UNABLE TO UPDATE THE SCANNER AT THIS MOMENT!
Note: WE APPRECIATE YOUR CONTRIBUTION.

Detects file inclusion, sql injection, command execution vulnerabilities of a target Joomla! web site. We'll update it soon. The database update is currently maintained by web-center.si. Send your contributions, recommendations and bugs report to joomscan at yehg.net or creating a ticket at Trac here.","Categories
Security"
