Description,Category
"Myopa is fundraising, contact management and mailing list management software rolled into one for charities and other voluntary organisations. Particularly aimed at UK charities. For more information visit our webpage: http://myopa.sourceforge.netMyopa is fundraising, contact management and mailing list management software rolled into one for charities and other voluntary organisations. Particularly aimed at UK charities. For more information visit our webpage: http://myopa.sourceforge.net","Categories
Other/Nonlisted Topic, Knowledge Management"
"Software which allows for a user to manage installed software on a computer and download/install software. All software listed in the database is free (monetarily), allowing people to discover free software that they would not otherwise find.Software which allows for a user to manage installed software on a computer and download/install software. All software listed in the database is free (monetarily), allowing people to discover free software that they would not otherwise find.","Categories
Other/Nonlisted Topic, Systems Administration, Installation/Setup"
A library for communication with various dive computers.A library for communication with various dive computers.,"Categories
Other/Nonlisted Topic"
"This project collects information about the economic system of the computer game ""Pirates of the Burning Sea"" from ""Flying Labs System"". All those informations were collected manually.This project collects information about the economic system of the computer game ""Pirates of the Burning Sea"" from ""Flying Labs System"". All those informations were collected manually.","Categories
Other/Nonlisted Topic, Project Management, Front-Ends, Role-Playing Games (RPG), Software Testing"
"Chequered Flag is an open-source attempt to create the first universal game editor for Geoff Crammond's F1GP and WC. The long-term goal of the project is to incorporate all editing facilities, both current and future in this program.Chequered Flag is an open-source attempt to create the first universal game editor for Geoff Crammond's F1GP and WC. The long-term goal of the project is to incorporate all editing facilities, both current and future in this program.","Categories
Other/Nonlisted Topic, Simulation Games"
A PalmOS utility that provides InfraRed remote control shutter release for a number of different Pentax cameras. Its functionality is similar to that of the Pentax Remote Control F product.A PalmOS utility that provides InfraRed remote control shutter release for a number of different Pentax cameras. Its functionality is similar to that of the Pentax Remote Control F product.,"Categories
Other/Nonlisted Topic"
"*** Project Moved ***
This is not the code you are looking for!!!
Current development on this project has moved to GitHub. Look for the project at : http://github.com/Dragonrun1/yapeal
Yapeal not only grabs the data from the API for you but also saves the data into a MySQL database as well. It was made to be ran from a crontab job or a scheduled task and works in the background to 'Auto-magically' as I call it, keep the database updated so all you have to do is work with the database tables not the API and XML. It was designed to have a set and forget configuration.*** Project Moved ***
This is not the code you are looking for!!!
Current development on this project has moved to GitHub. Look for the project at : http://github.com/Dragonrun1/yapeal
Yapeal not only grabs the data from the API for you but also saves the data into a MySQL database as well. It was made to be ran from a crontab job or a scheduled task and works in the background to 'Auto-magically' as I call it, keep the database updated so all you have to do is work with the database tables not the API and XML. It was designed to have a set and forget configuration.","Categories
Other/Nonlisted Topic, MMORPG"
"A Joomla Component to select a file to download using up to 4 selection criteria, in 4 selection drop down menus.A Joomla Component to select a file to download using up to 4 selection criteria, in 4 selection drop down menus.","Categories
Other/Nonlisted Topic"
Drink&Track is a full-blown application suite which calculates blood alcohol values and presents the drunkenness in various graphics and statistics.Drink&Track is a full-blown application suite which calculates blood alcohol values and presents the drunkenness in various graphics and statistics.,"Categories
Other/Nonlisted Topic, Games/Entertainment, Dynamic Content, Medical"
"Multimedia property handlers for Windows Vista. Allows users to tag AVIs (and eventually PNGs, WAVs, etc.) with XMP metadata from the Vista shell. Properties will be indexed and available using Vista search.Multimedia property handlers for Windows Vista. Allows users to tag AVIs (and eventually PNGs, WAVs, etc.) with XMP metadata from the Vista shell. Properties will be indexed and available using Vista search.","Categories
Other/Nonlisted Topic"
"Enviracom is a protocol spoken by a subset of Honeywell thermostats and other HVAC hardware. The enviracom unix daemon is a software project that will support interaction with an enviracom network, and the ability to control HVAC hardware.Enviracom is a protocol spoken by a subset of Honeywell thermostats and other HVAC hardware. The enviracom unix daemon is a software project that will support interaction with an enviracom network, and the ability to control HVAC hardware.","Categories
Other/Nonlisted Topic"
"Written in python, Reverse Phone Lookup is a simple program that when given a phone number, will search the white pages and display the information returned (First Name, Last Name, Address, City, State, and Zip code). Note: This program no longer works.Written in python, Reverse Phone Lookup is a simple program that when given a phone number, will search the white pages and display the information returned (First Name, Last Name, Address, City, State, and Zip code). Note: This program no longer works.","Categories
Other/Nonlisted Topic, Search Engines"
"** Deprecated **

Important! All of the software on this web site has been deprecated, and has not been maintained since 2014. All of this software is now being maintained on Github - and can be obtained from https://github.com/jpaulm .

Changes and enhancements are still ongoing, and while older software should still work, newer features described in the literature will not be available in SourceForge.

The old license was the Artistic license - the software is now in process of being converted to LGPL. This will gradually take place (on Github) over the next few months (in 2016).

JavaFBP is now also on Maven.** Deprecated **

Important! All of the software on this web site has been deprecated, and has not been maintained since 2014. All of this software is now being maintained on Github - and can be obtained from https://github.com/jpaulm .

Changes and enhancements are still ongoing, and while older software should still work, newer features described in the literature will not be available in SourceForge.

The old license was the Artistic license - the software is now in process of being converted to LGPL. This will gradually take place (on Github) over the next few months (in 2016).

JavaFBP is now also on Maven.","Categories
Other/Nonlisted Topic, Build Tools, Data Visualization"
"Kuma is desktop mascot program for KDE.
It is port of ""Teddy"" that runs on Windows.
Kuma mascot do animation, move mascot on desktop,
hook keyboard input and mouse event.Kuma is desktop mascot program for KDE.
It is port of ""Teddy"" that runs on Windows.
Kuma mascot do animation, move mascot on desktop,
hook keyboard input and mouse event.","Categories
Other/Nonlisted Topic, KDE"
"Open Wound is a free CGI cut-up engine based on the experimental writing and art of Tzara, Burroughs, and Gysin. They meant to rupture the perception of reality by disjointing found text using cut-up newspapers. Open Wound bleeds 1000x faster.Open Wound is a free CGI cut-up engine based on the experimental writing and art of Tzara, Burroughs, and Gysin. They meant to rupture the perception of reality by disjointing found text using cut-up newspapers. Open Wound bleeds 1000x faster.","Categories
Other/Nonlisted Topic, Games/Entertainment, Dynamic Content, New Age, Information Analysis, Education"
"iROS is a meta-operating system for technology-rich ""interactive rooms"". The core components (Event Heap, DataHeap, iCrafter) provide communication, data storage, and service management for an iRoom.iROS is a meta-operating system for technology-rich ""interactive rooms"". The core components (Event Heap, DataHeap, iCrafter) provide communication, data storage, and service management for an iRoom.","Categories
Other/Nonlisted Topic, Operating System Kernels, Distributed Computing, HMI"
"CyCaM Es un gestor de cybercafes pensado para ser pequeño, rapido, flexible y eficaz.CyCaM Es un gestor de cybercafes pensado para ser pequeño, rapido, flexible y eficaz.","Categories
Other/Nonlisted Topic, Systems Administration, Networking"
Collaborative Filtering in Dating ServicesCollaborative Filtering in Dating Services,"Categories
Other/Nonlisted Topic, Information Analysis"
Web-based video auditioning and media sharing software for supporting live theater performances.Web-based video auditioning and media sharing software for supporting live theater performances.,"Categories
Other/Nonlisted Topic"
"NipperME or 'Nipper Made Easy', is a GUI application that sits on top of the commandline tool Nipper located at http://nipper.titania.co.uk/ This tool provides Nipper commandline options presented to you in a nicely laid out GUI.NipperME or 'Nipper Made Easy', is a GUI application that sits on top of the commandline tool Nipper located at http://nipper.titania.co.uk/ This tool provides Nipper commandline options presented to you in a nicely laid out GUI.","Categories
Other/Nonlisted Topic, Networking"
"A simple, lightweight, ad-free weather reporting application. Features include a system tray icon that reports the current temperature and conditions. Uses Yahoo!'s RSS weather feed, but support for weather.com's weather feed will be added soon.A simple, lightweight, ad-free weather reporting application. Features include a system tray icon that reports the current temperature and conditions. Uses Yahoo!'s RSS weather feed, but support for weather.com's weather feed will be added soon.","Categories
Other/Nonlisted Topic, RSS Feed Readers"
"Xinkro is just a digital stopwatch with the standard functions you would expect in a stopwatch (start, stop, pause). It also features an OSD (Onscreen display), thus avoiding the waste of valuable screen space.Xinkro is just a digital stopwatch with the standard functions you would expect in a stopwatch (start, stop, pause). It also features an OSD (Onscreen display), thus avoiding the waste of valuable screen space.","Categories
Other/Nonlisted Topic, Benchmark"
"Вічний календар на PHP українською мовою. GNU-ліцензія. Приклад http://www.biblos.in/calendarUA/ Є потреба: у локалізації на інші мови,оптимізація коду...Вічний календар на PHP українською мовою. GNU-ліцензія. Приклад http://www.biblos.in/calendarUA/ Є потреба: у локалізації на інші мови,оптимізація коду...","Categories
Other/Nonlisted Topic, Dynamic Content"
A command line frontend for the JMdict XML file which uses a database for fast access.A command line frontend for the JMdict XML file which uses a database for fast access.,"Categories
Other/Nonlisted Topic"
"Startway is an open-source Windows application that allows the user to create a list of buttons and associate an action to each one, to run when a quick access to a program is wanted. The user can share his button list with other users on the Internet.Startway is an open-source Windows application that allows the user to create a list of buttons and associate an action to each one, to run when a quick access to a program is wanted. The user can share his button list with other users on the Internet.","Categories
Other/Nonlisted Topic"
"VMT (formerly Vehicle Maintenance Tracker) tracks the maintenance of multiple properties. Property can include vehicles, boats, planes, buildings, etc. This project is comparible to Auto-Do-It. Since this program uses Java, it is cross-platform.VMT (formerly Vehicle Maintenance Tracker) tracks the maintenance of multiple properties. Property can include vehicles, boats, planes, buildings, etc. This project is comparible to Auto-Do-It. Since this program uses Java, it is cross-platform.","Categories
Other/Nonlisted Topic, Office/Business, Database"
"Open Home Server - OHS OHS will be a complete homeserver used as NAS, backup-space, central user-management, media-streamer, ... It will have a easy to use web-interface for configuration of the Services.Open Home Server - OHS OHS will be a complete homeserver used as NAS, backup-space, central user-management, media-streamer, ... It will have a easy to use web-interface for configuration of the Services.","Categories
Other/Nonlisted Topic"
"Tool for helping in the diagnosis of the dislexy, based on the speech recognition done with the usage of HTKTool for helping in the diagnosis of the dislexy, based on the speech recognition done with the usage of HTK","Categories
Other/Nonlisted Topic, Education, Speech Recognition"
iTouch-Control is a plugin for Audacious media player wich helps you control the player using your keyboard multimedia keys.iTouch-Control is a plugin for Audacious media player wich helps you control the player using your keyboard multimedia keys.,"Categories
Other/Nonlisted Topic, Sound/Audio"
"HPN is a functional - as opposed to microcode - cross-platform emulation of a classic 1970s Hewlett-Packard scientific calculator for any command-line interface. Its operations completely model the historical and groundbreaking HP-35 series, and functions to support the HP-45 and the later HP-65, 67 and HP-15C are in the pipeline.HPN is a functional - as opposed to microcode - cross-platform emulation of a classic 1970s Hewlett-Packard scientific calculator for any command-line interface. Its operations completely model the historical and groundbreaking HP-35 series, and functions to support the HP-45 and the later HP-65, 67 and HP-15C are in the pipeline.","Categories
Other/Nonlisted Topic, Scientific/Engineering, Education, Calculators, RPN Calculators"
"The enhanced version of the Vnc Thumbnail Viewer written in Java. Open-source software by Intelligent Millionaire Co., Ltd (www.the-im.com).
The main developer is Thosaphol Rodkwamtuk.

The source code repository of this project has its new home on GitHub: https://github.com/the-im/enhanced-vnc-thumbnail-viewerThe enhanced version of the Vnc Thumbnail Viewer written in Java. Open-source software by Intelligent Millionaire Co., Ltd (www.the-im.com).
The main developer is Thosaphol Rodkwamtuk.

The source code repository of this project has its new home on GitHub: https://github.com/the-im/enhanced-vnc-thumbnail-viewer","Categories
Other/Nonlisted Topic"
jTomtom is et Java GPS updater. With jTomtom you can update the QuickFix et Radar POI in your Tomtom GPSjTomtom is et Java GPS updater. With jTomtom you can update the QuickFix et Radar POI in your Tomtom GPS,"Categories
Other/Nonlisted Topic, Hardware Drivers"
"Better ASN (developed by Thawte Technologies,) is a Java ASN.1 API that achieves near 100% encoding efficiency for typical ASN.1 usage. An ASN.1 to Java compiler is provided, facilitating custom extension of the API for any application.Better ASN (developed by Thawte Technologies,) is a Java ASN.1 API that achieves near 100% encoding efficiency for typical ASN.1 usage. An ASN.1 to Java compiler is provided, facilitating custom extension of the API for any application.","Categories
Communications, Other/Nonlisted Topic, Internet"
This software has been extensively used to teach Decision Analysis at Stanford University. It has also been used by many to solve trees in Excel for professional projects.This software has been extensively used to teach Decision Analysis at Stanford University. It has also been used by many to solve trees in Excel for professional projects.,"Categories
Other/Nonlisted Topic"
UsbViewer in C# Get some USB device information via C#. The project is a clone of the Microsoft usbview that is written in C. Usb hubs not supported. The Project is under the The GNU Lesser General Public License version 2.1 (LGPLv2.1).UsbViewer in C# Get some USB device information via C#. The project is a clone of the Microsoft usbview that is written in C. Usb hubs not supported. The Project is under the The GNU Lesser General Public License version 2.1 (LGPLv2.1).,"Categories
Other/Nonlisted Topic"
"ThinkingRock is a platform independent Java application for Getting Things Done (GTD) - the management methodology and best-selling book by David Allen. Open TR2.2.1 folder, select the file you require for your operating system.Source file for developer.ThinkingRock is a platform independent Java application for Getting Things Done (GTD) - the management methodology and best-selling book by David Allen. Open TR2.2.1 folder, select the file you require for your operating system.Source file for developer.","Categories
Other/Nonlisted Topic"
RP-L2TP is a user-space implementation of L2TP for Linux and other UNIX systems.RP-L2TP is a user-space implementation of L2TP for Linux and other UNIX systems.,"Categories
Other/Nonlisted Topic, Networking"
"this Kashidaakaari(machine) software is like wilcom embroidery software.
almost all embroidery softwares are of high price. so i planned to make
software which has standards like wilcom but free of cost.this Kashidaakaari(machine) software is like wilcom embroidery software.
almost all embroidery softwares are of high price. so i planned to make
software which has standards like wilcom but free of cost.","Categories
Other/Nonlisted Topic"
Multi-File Compare is a program that will take a list of multiple files and compare all of them against each other to find differences and duplicates as efficiently as possible.Multi-File Compare is a program that will take a list of multiple files and compare all of them against each other to find differences and duplicates as efficiently as possible.,"Categories
Other/Nonlisted Topic"
"Andy's PHP Knowledgebase using MySQL is a database driven Web Application for storing, searching and updating article content for a knowledgebase. Andy's PHP Knowledgebase is easily customized and has potential for a variety of creative uses.Andy's PHP Knowledgebase using MySQL is a database driven Web Application for storing, searching and updating article content for a knowledgebase. Andy's PHP Knowledgebase is easily customized and has potential for a variety of creative uses.","Categories
Other/Nonlisted Topic, Dynamic Content, Search Engines"
"The SourceForge page is not updated anymore
Please use: https://github.com/ilius/pyglossaryThe SourceForge page is not updated anymore
Please use: https://github.com/ilius/pyglossary","Categories
Other/Nonlisted Topic, GNOME, Education, Dictionary"
