Description,Category
"DEP4E integrates DocBook XML and DocBook XSL into Eclipse IDE to create, edit and process DocBook projects.DEP4E integrates DocBook XML and DocBook XSL into Eclipse IDE to create, edit and process DocBook projects.","Categories
DocBook, Build Tools, Documentation"
A radius protocol application is running on Windows platform. now the code of this application is copyed from freeradius 2.1.12 and be edited to fit the VS 2010.A radius protocol application is running on Windows platform. now the code of this application is copyed from freeradius 2.1.12 and be edited to fit the VS 2010.,"Categories
Data Formats"
"Use this suite of Application Programming Interface (API) platforms to share web content across multiple channels. Mobile and tablet applications, widgets, and web pages may use the APIs to deliver and update content. The APIs allow content reuse and reduce development costs and product time-to-market. The APIs are available as .NET or Java instances. For more information, see the ReadMe.txt file in the downloadable zip archive.

The Centers for Disease Control and Prevention (CDC) and the Department of Health and Human Services (HHS) Assistant Secretary for Public Affairs office (ASPA) developed these APIs in collaboration with the Food and Drug Administration’s (FDA) Center for Tobacco Products (CTP).

The CDC, FDA/CTP, HHS/ASPA, and the National Institute of Health’s National Institute for Allergy and Infectious Diseases (NIH/NIAID) use these platforms.

https://syndication.hhs.gov
http://tools.cdc.gov
http://tools.niaid.nih.gov
http://tools.fda.govUse this suite of Application Programming Interface (API) platforms to share web content across multiple channels. Mobile and tablet applications, widgets, and web pages may use the APIs to deliver and update content. The APIs allow content reuse and reduce development costs and product time-to-market. The APIs are available as .NET or Java instances. For more information, see the ReadMe.txt file in the downloadable zip archive.

The Centers for Disease Control and Prevention (CDC) and the Department of Health and Human Services (HHS) Assistant Secretary for Public Affairs office (ASPA) developed these APIs in collaboration with the Food and Drug Administration’s (FDA) Center for Tobacco Products (CTP).

The CDC, FDA/CTP, HHS/ASPA, and the National Institute of Health’s National Institute for Allergy and Infectious Diseases (NIH/NIAID) use these platforms.

https://syndication.hhs.gov
http://tools.cdc.gov
http://tools.niaid.nih.gov
http://tools.fda.gov","Categories
RSS, Medical, Multimedia"
htmldom parses the HTML file and provides methods for iterating and searching the parse tree in a similar way as Jquery. To report bugs please mail me at bhimsen.pes@gmail.comhtmldom parses the HTML file and provides methods for iterating and searching the parse tree in a similar way as Jquery. To report bugs please mail me at bhimsen.pes@gmail.com,"Categories
HTML/XHTML, Internet, Libraries"
"TinyREST allows a Java programmer to easily create a REST server without having to install a J2EE server. Creating a new server is as easy as copying the service jar, setting up a configuration file and writing your own service handler class. The resulting project can be made to start up as a service.

Annotations can now be used to write handler class and methods.

JDBC database access as well as file system access is allowed from the service.TinyREST allows a Java programmer to easily create a REST server without having to install a J2EE server. Creating a new server is as easy as copying the service jar, setting up a configuration file and writing your own service handler class. The resulting project can be made to start up as a service.

Annotations can now be used to write handler class and methods.

JDBC database access as well as file system access is allowed from the service.","Categories
HTTP Servers, Web Services, Application Servers"
"Java application for creating graphs, with a simple and intuitive interface. Obtaining LaTeX code for designed graph is a single-click operation. Allows creating less and more complicated graphs for LaTeX documents without any knowledge about TikZ library.

The program lets you design and edit vertices, edges and labels to your liking thanks to a wide range of variants adequate to TikZ library.

GraTeX incorporates common editing mechanisms like saving/loading projects, undo-redo & copy-paste operations, and many other useful features.

The application has been developed by two students of University of Science and Technology in Krakow, Poland.Java application for creating graphs, with a simple and intuitive interface. Obtaining LaTeX code for designed graph is a single-click operation. Allows creating less and more complicated graphs for LaTeX documents without any knowledge about TikZ library.

The program lets you design and edit vertices, edges and labels to your liking thanks to a wide range of variants adequate to TikZ library.

GraTeX incorporates common editing mechanisms like saving/loading projects, undo-redo & copy-paste operations, and many other useful features.

The application has been developed by two students of University of Science and Technology in Krakow, Poland.","Categories
TeX/LaTeX"
"enc2ly is a small tool to dump musical information contained in an Encore binary file to a Lilypond text one. Encore is a popular music notation program from GVOX, which uses a proprietary data format.enc2ly is a small tool to dump musical information contained in an Encore binary file to a Lilypond text one. Encore is a popular music notation program from GVOX, which uses a proprietary data format.","Categories
Data Formats"
"Restful Web Service adapter for the NextBus prediction and transit network reporting service. This implementation uses XSD Schema, JAXB and a domain object model to decouple the consuming application from the over-the-wire representation of the data. NextBus is currently providing real-time bus data in several major metro transit agencies including, but not limited to MBTA (Boston), Toronto, Seattle, Brooklyn, Staten Island as well as a number of University towns. In additional to the standalone Adapter, an Enterprise Service Bus pump and demonstration subscription client are available for those interested in Asynchronous integration of the transit feed.Restful Web Service adapter for the NextBus prediction and transit network reporting service. This implementation uses XSD Schema, JAXB and a domain object model to decouple the consuming application from the over-the-wire representation of the data. NextBus is currently providing real-time bus data in several major metro transit agencies including, but not limited to MBTA (Boston), Toronto, Seattle, Brooklyn, Staten Island as well as a number of University towns. In additional to the standalone Adapter, an Enterprise Service Bus pump and demonstration subscription client are available for those interested in Asynchronous integration of the transit feed.","Categories
XML, XML-RPC, Libraries"
"Specialized tool for PostProcessors of books produced by Project Gutenberg Distributed Proofreaders.
Parses the markup structure of a project file out of the formatting rounds; reports about the text structure found, and identifies markup errors.
Planned future features: generation of normalized dp output by rejoining split paragraphs and moving around footnotes, renumbering of pages; conversion to basic LaTeX and basic HTML markup for further processing.Specialized tool for PostProcessors of books produced by Project Gutenberg Distributed Proofreaders.
Parses the markup structure of a project file out of the formatting rounds; reports about the text structure found, and identifies markup errors.
Planned future features: generation of normalized dp output by rejoining split paragraphs and moving around footnotes, renumbering of pages; conversion to basic LaTeX and basic HTML markup for further processing.","Categories
HTML/XHTML, TeX/LaTeX"
"This is my first Project originally named ""CoLiBro"". It is a C-HTTP and HTML Wrapper to process webdata automatically.

Some examples are:
- Receive website to check if it is up
- Download your personal data from eg. Online-Banking, Bills, ...
- Process data contained in websites eg. weather data
- Receive mass of data, especially to crawl a website?
- ...

Examples and API Documentation plannedThis is my first Project originally named ""CoLiBro"". It is a C-HTTP and HTML Wrapper to process webdata automatically.

Some examples are:
- Receive website to check if it is up
- Download your personal data from eg. Online-Banking, Bills, ...
- Process data contained in websites eg. weather data
- Receive mass of data, especially to crawl a website?
- ...

Examples and API Documentation planned","Categories
Browsers, Dynamic Content, Web Services"
"This Projects aims to create a server-client architecture to make annotation of web elements not only possible, but easy to use.

The idea for this project has its roots within a practical software study for the module software Engeneering of the Unisversity of Leipzig, Germany.

Under the given liscence we want for everyone interested in supporting or further development to do so.

For usage and installation see our [Wiki].This Projects aims to create a server-client architecture to make annotation of web elements not only possible, but easy to use.

The idea for this project has its roots within a practical software study for the module software Engeneering of the Unisversity of Leipzig, Germany.

Under the given liscence we want for everyone interested in supporting or further development to do so.

For usage and installation see our [Wiki].","Categories
Communications, Semantic Web"
"Porting of the SmartM3 Triple Space's KP on JavaScript.
Due to limitations on JS connectivity a ""WebSocket to TCP"" relay has been developed in order to enable JavaScript KP to communicato with a SmartM3 SIB.
Relay is based on jWebSocketServer.
User manual currently only in italian :(Porting of the SmartM3 Triple Space's KP on JavaScript.
Due to limitations on JS connectivity a ""WebSocket to TCP"" relay has been developed in order to enable JavaScript KP to communicato with a SmartM3 SIB.
Relay is based on jWebSocketServer.
User manual currently only in italian :(","Categories
WWW/HTTP, Mobile, Semantic Web"
"The Java OutlookExpress Reader is a package that allows the reading of .dbx files, the format used to store OutlookExpress emails and folders.
The main reader class loads all the data from a given .dbx and parses it, allowing easy access to information through public variables and classes.

This is an implementation of the work done by Arne Schloh (http://oedbx.aroh.de/).The Java OutlookExpress Reader is a package that allows the reading of .dbx files, the format used to store OutlookExpress emails and folders.
The main reader class loads all the data from a given .dbx and parses it, allowing easy access to information through public variables and classes.

This is an implementation of the work done by Arne Schloh (http://oedbx.aroh.de/).","Categories
Data Formats, Libraries"
This application allows you to quickly convert binary data to text and vice versa.This application allows you to quickly convert binary data to text and vice versa.,"Categories
Data Formats"
"osGraphX is a 3D file viewer. Based on openscenegraph, it can load all the OSG supported file formats.osGraphX is a 3D file viewer. Based on openscenegraph, it can load all the OSG supported file formats.","Categories
Data Formats, 3D Rendering, Image Viewers"
this tool tries to repair your broken pcap and pcapng files by fixing the global header respectively packet blocks and recovering the packets by searching und guessing the packet headers or blocksthis tool tries to repair your broken pcap and pcapng files by fixing the global header respectively packet blocks and recovering the packets by searching und guessing the packet headers or blocks,"Categories
Data Formats, Log Analysis, Monitoring"
"XML is intolerant of errors. This program will automatically salvage XML files by finding the first XML error, then truncating a configurable number of characters before the error and finally using the great xmllint to recover the xml file by automatically adding the correct end tags. The program starts with a default of 50 characters truncation.

This truncation value may need to be changed if the truncation happens in the middle of a complex tag as xmllint may not know how to recover the file correctly. Additionally some extra text or data may be recoverable by changing the truncation amount to less than 50 characters.The extra truncation is needed in the first place because the XML validator used is not able to perfectly identify where the XML corruption begins and will often not flag the corruption for several characters after it begins.XML is intolerant of errors. This program will automatically salvage XML files by finding the first XML error, then truncating a configurable number of characters before the error and finally using the great xmllint to recover the xml file by automatically adding the correct end tags. The program starts with a default of 50 characters truncation.

This truncation value may need to be changed if the truncation happens in the middle of a complex tag as xmllint may not know how to recover the file correctly. Additionally some extra text or data may be recoverable by changing the truncation amount to less than 50 characters.The extra truncation is needed in the first place because the XML validator used is not able to perfectly identify where the XML corruption begins and will often not flag the corruption for several characters after it begins.","Categories
Text Processing, XML-RPC, Data Recovery"
"InkPlot is an extension (plugin) for the SVG Editor Inkscape to insert graphs from Gnuplot.

It allows you to
- preview the graph
- add it as SVG into Inkscape
- edit already generated graphs
- use a preamble file for reusable style and commands
- customize default settings in a config fileInkPlot is an extension (plugin) for the SVG Editor Inkscape to insert graphs from Gnuplot.

It allows you to
- preview the graph
- add it as SVG into Inkscape
- edit already generated graphs
- use a preamble file for reusable style and commands
- customize default settings in a config file","Categories
XML, Vector Graphics, Data Visualization"
"Detects DataMatrix barcodes in images and decodes them. Currently in C#, usable from any .net language, Mono Planned. Licensed the GPL Simple usage, unlimited fiddling possible. See the Wiki (English) for our DocumentationDetects DataMatrix barcodes in images and decodes them. Currently in C#, usable from any .net language, Mono Planned. Licensed the GPL Simple usage, unlimited fiddling possible. See the Wiki (English) for our Documentation","Categories
Data Formats, Digital Camera"
A python script that uses wxwidgets. View or edit delimited data.A python script that uses wxwidgets. View or edit delimited data.,"Categories
Text Processing, Data Formats, Database"
"FIX Pusher is a tool for developers and administrators working with the Financial Information eXchange (""FIX"") protocol. The FIX protocol is an industry driven standard for the electronic communication of trade related messages, released and maintained by FIX Protocol, Ltd.

FIX Pusher can send and receive FIX messages. It supports you simulating workflows with third party systems speaking the FIX protocol. The application acts as acceptor or initiator. FIX Pusher can interpret and modify QuickFIX conform, customized data dictionaries containing user defined fields. The tool supports FIX versions 4.0 - 5.0 SP2.

The application ships with the option for exporting message details into Excel© sheets and graphical analysis of message logs. FIX Pusher is a 100% Java open source implementation running on Windows, Linux/Unix and Mac OS. It requires JRE version of 1.6 or higher for proper functioning.

Related project: FIX Agora http://fixagora.sourceforge.netFIX Pusher is a tool for developers and administrators working with the Financial Information eXchange (""FIX"") protocol. The FIX protocol is an industry driven standard for the electronic communication of trade related messages, released and maintained by FIX Protocol, Ltd.

FIX Pusher can send and receive FIX messages. It supports you simulating workflows with third party systems speaking the FIX protocol. The application acts as acceptor or initiator. FIX Pusher can interpret and modify QuickFIX conform, customized data dictionaries containing user defined fields. The tool supports FIX versions 4.0 - 5.0 SP2.

The application ships with the option for exporting message details into Excel© sheets and graphical analysis of message logs. FIX Pusher is a 100% Java open source implementation running on Windows, Linux/Unix and Mac OS. It requires JRE version of 1.6 or higher for proper functioning.

Related project: FIX Agora http://fixagora.sourceforge.net","Categories
Data Formats, Financial, Investment Management"
Raw JSON Library (RJL) is a high-performance JSON (RFC 4627 compliant) generator. It is designed for server-side intensive json generation and is released under the BSD license.Raw JSON Library (RJL) is a high-performance JSON (RFC 4627 compliant) generator. It is designed for server-side intensive json generation and is released under the BSD license.,"Categories
JSON"
Biblatex style to format bibliography according to Russian standard GOST 7.0.5-2008Biblatex style to format bibliography according to Russian standard GOST 7.0.5-2008,"Categories
TeX/LaTeX, Education, Desktop Publishing"
"SGML parser for Java, based on OpenSP.SGML parser for Java, based on OpenSP.","Categories
SGML"
"c++ library to read/write DXF files in binary and ascii form and to read DWG from r14 to v2015

Continued at: https://github.com/LibreCAD/libdxfrwc++ library to read/write DXF files in binary and ascii form and to read DWG from r14 to v2015

Continued at: https://github.com/LibreCAD/libdxfrw","Categories
Scientific/Engineering, CAD, Libraries"
"The libtld is used to extract the TLD from any URI from anywhere in the world. The library recognizes all TLDs, whatever the number of levels the TLD includes (i.e. .com has one, .au has up to 4 such as .schools.nsw.edu.au) this library will be capable of extracting it. The library is for C, C++, and PHP.The libtld is used to extract the TLD from any URI from anywhere in the world. The library recognizes all TLDs, whatever the number of levels the TLD includes (i.e. .com has one, .au has up to 4 such as .schools.nsw.edu.au) this library will be capable of extracting it. The library is for C, C++, and PHP.","Categories
Data Formats, Internet, Libraries"
A python based utility to export key value pair into a CSV file.A python based utility to export key value pair into a CSV file.,"Categories
CSV"
"Editor for Diablo III *.stl files, written in QTEditor for Diablo III *.stl files, written in QT","Categories
Data Formats"
This software allows for a user to generate test data. This is useful for testing Hadoop or other data processing clusters.This software allows for a user to generate test data. This is useful for testing Hadoop or other data processing clusters.,"Categories
Other/Nonlisted Topic, Information Analysis, CSV"
"RDBToOnto allows to automatically generate fine-tuned OWL ontologies from relational databases.

A major feature of this full-fledged tool is the ability to produce structured ontologies with deeper hierarchies by exploiting both the database schema and the stored data.

RDBToOnto can be exploited to produce RDF Linked Data.

It can also be used to generate highly accurate RDB-to-RDF mapping rules (for D2RQ Server and Triplify).RDBToOnto allows to automatically generate fine-tuned OWL ontologies from relational databases.

A major feature of this full-fledged tool is the ability to produce structured ontologies with deeper hierarchies by exploiting both the database schema and the stored data.

RDBToOnto can be exploited to produce RDF Linked Data.

It can also be used to generate highly accurate RDB-to-RDF mapping rules (for D2RQ Server and Triplify).","Categories
Semantic Web"
"Translate local OpenStreetMap files to shapefiles

#Atencion: ver documentacion para ejecutar
#Ultima version 101Translate local OpenStreetMap files to shapefiles

#Atencion: ver documentacion para ejecutar
#Ultima version 101","Categories
Data Formats, Mapping"
turquaz mavisi web templateturquaz mavisi web template,"Categories
HTML/XHTML"
Simple C API for working with bitmap (.bmp) files.Simple C API for working with bitmap (.bmp) files.,"Categories
Data Formats, Raster Graphics"
VNC for use with the BrowserMob Selenium JavaScript Validator. This tool is made available for users of BrowserMob FREE Website Monitoring and Load Testing. The BrowserMob Local Validation Service can be downloaded from https://browsermob.com/tools.VNC for use with the BrowserMob Selenium JavaScript Validator. This tool is made available for users of BrowserMob FREE Website Monitoring and Load Testing. The BrowserMob Local Validation Service can be downloaded from https://browsermob.com/tools.,"Categories
HTML/XHTML, Browsers, Monitoring, Load Testing"
"Azzet is a generic asset loading java library. Assets can be loaded from multiple sources (filesystem, classpath, http, database, ftp) and in any supported format . The barebone library contains the default sources and no formats. By Magnos Software.Azzet is a generic asset loading java library. Assets can be loaded from multiple sources (filesystem, classpath, http, database, ftp) and in any supported format . The barebone library contains the default sources and no formats. By Magnos Software.","Categories
Data Formats, Front-Ends, Libraries"
"Stand-alone Java library implementing parser/formatter/comparator/validator for JSON/XML-like text formats oriented on JSON-like object model (list,map,scalar + reflection). Library is designed to maximize adaptivity via set of extendable modules.Stand-alone Java library implementing parser/formatter/comparator/validator for JSON/XML-like text formats oriented on JSON-like object model (list,map,scalar + reflection). Library is designed to maximize adaptivity via set of extendable modules.","Categories
XML, JSON, Libraries"
"/!\ Developer(s) needed to optimize routines, multi-processing; any kind of help is accepted :)/!\ Developer(s) needed to optimize routines, multi-processing; any kind of help is accepted :)","Categories
Data Formats, Cryptography, Exam"
"This is an eclipse project for common java platform (API), to use in RTMP client development.This is an eclipse project for common java platform (API), to use in RTMP client development.","Categories
Data Formats, Streaming, Web Conferencing"
"Simple XML processing using C++14:
-> header-only
-> fully portable
-> simple API
-> powerful features
-> high performance

Overview: http://zenxml.sourceforge.netSimple XML processing using C++14:
-> header-only
-> fully portable
-> simple API
-> powerful features
-> high performance

Overview: http://zenxml.sourceforge.net","Categories
XML, Software Development"
Automatic publishing system for www. TeX interpreter with pure php and css. Output is %filename%.html and %filename%.css files.Automatic publishing system for www. TeX interpreter with pure php and css. Output is %filename%.html and %filename%.css files.,"Categories
HTML/XHTML, Printing, Education"
"LibNebular is C++ Linux library for uniform image file manipulation as String key-value pairs (with sometimes BLOB values) where different file types are intruduced through DL ("".so"") libraries. Includes BMP and JPEG plugins. Can easily be ported.LibNebular is C++ Linux library for uniform image file manipulation as String key-value pairs (with sometimes BLOB values) where different file types are intruduced through DL ("".so"") libraries. Includes BMP and JPEG plugins. Can easily be ported.","Categories
Data Formats, Graphics"
"Note: The project has moved to https://github.com/pyhys/minimalmodbus The files available here are very old, download from Github instead.

MinimalModbus is an easy-to-use Python module for talking to instruments (slaves) from a computer (master) using the Modbus protocol, and is intended to be running on the master. Example code includes drivers for Eurotherm and Omega process controllers. The only dependence is the pySerial module (also pure Python).

This software supports the ‘Modbus RTU’ and ‘Modbus ASCII’ serial communication versions of the protocol, and is intended for use on Linux, OS X and Windows platforms. It is open source, and has the Apache License, Version 2.0.Note: The project has moved to https://github.com/pyhys/minimalmodbus The files available here are very old, download from Github instead.

MinimalModbus is an easy-to-use Python module for talking to instruments (slaves) from a computer (master) using the Modbus protocol, and is intended to be running on the master. Example code includes drivers for Eurotherm and Omega process controllers. The only dependence is the pySerial module (also pure Python).

This software supports the ‘Modbus RTU’ and ‘Modbus ASCII’ serial communication versions of the protocol, and is intended for use on Linux, OS X and Windows platforms. It is open source, and has the Apache License, Version 2.0.","Categories
Data Formats, Communications, Hardware Drivers"
