Description,Category
vcsadump is a tool for taking full-color snapshots of Linux virtual consoles (VC screenshots) in HTML format.vcsadump is a tool for taking full-color snapshots of Linux virtual consoles (VC screenshots) in HTML format.,"Categories
Terminals, WWW/HTTP, Systems Administration"
"A gathering spot for terminal emulators written in RealBasic and specifically mud clients. As a starting point, we provide RB Terminal Emulation Suite, an extensible frame work for developing terminal emulator clients.A gathering spot for terminal emulators written in RealBasic and specifically mud clients. As a starting point, we provide RB Terminal Emulation Suite, an extensible frame work for developing terminal emulator clients.","Categories
Terminal Emulators, Telnet, Multi-User Dungeons (MUD)"
A small pure Java port of BSD's NCurses console management tool. Makes heavy use of ANSI escape sequences.A small pure Java port of BSD's NCurses console management tool. Makes heavy use of ANSI escape sequences.,"Categories
Terminals, Desktop Environment, Software Development"
"ScriptEchoColor simplifies Linux terminal text colorizing, formatting and several steps of script coding.ScriptEchoColor simplifies Linux terminal text colorizing, formatting and several steps of script coding.","Categories
Text Processing, Terminal Emulators, Other/Nonlisted Topic, Usability, System Shells"
GbDas is a real-time data acquisition software written in Gambas. It uses Advantech 4000 series modules via RS-232 to acquire data from a variety of meteorological sensorsGbDas is a real-time data acquisition software written in Gambas. It uses Advantech 4000 series modules via RS-232 to acquire data from a variety of meteorological sensors,"Categories
Serial"
"FreeM** is a flexible client for MOO, MUD, and similar. Feature requests welcome; send them to funnyman3595@gmail.com.FreeM** is a flexible client for MOO, MUD, and similar. Feature requests welcome; send them to funnyman3595@gmail.com.","Categories
Terminals, Communications, Multi-User Dungeons (MUD)"
"ValDisk is a boot/root floppy set made for low-end machines (laptops) to be put to good use, such as for serial or network clients. It's goal is to run in as little as 4 MB of RAM, therefor it does not use a ramdisk.ValDisk is a boot/root floppy set made for low-end machines (laptops) to be put to good use, such as for serial or network clients. It's goal is to run in as little as 4 MB of RAM, therefor it does not use a ramdisk.","Categories
Terminals, Boot"
SoftDash PC allows realtime control of the Connect2Car MFC controller unit installed in a vehicle. Softdash PC can communicate with the MFC hardware either via a serial connection or a Bluetooth Connection. This project allows for open ended expansion.SoftDash PC allows realtime control of the Connect2Car MFC controller unit installed in a vehicle. Softdash PC can communicate with the MFC hardware either via a serial connection or a Bluetooth Connection. This project allows for open ended expansion.,"Categories
Serial, User Interface (UI), Hardware Drivers, HMI"
ev2vnc sends USB keyboard and mouse events to a VNC sessionev2vnc sends USB keyboard and mouse events to a VNC session,"Categories
Terminals"
NewaIO is an internet application system separate from the web.NewaIO is an internet application system separate from the web.,"Categories
Data Formats, Terminals, Communications, Internet, Sound/Audio"
"This is a telnet chat server that allows multiple people to connect and chat at once, similar to IRC. Any telnet client can be used as the client. Multiple telnet clients have been tested.This is a telnet chat server that allows multiple people to connect and chat at once, similar to IRC. Any telnet client can be used as the client. Multiple telnet clients have been tested.","Categories
Telnet, Chat"
"Gapito, Gnome Parallel Terminal, allows to run several SSH or telnet sessions in parallel, replicating user input over all of them. It is very useful to administrate clusters of machines.Gapito, Gnome Parallel Terminal, allows to run several SSH or telnet sessions in parallel, replicating user input over all of them. It is very useful to administrate clusters of machines.","Categories
Terminal Emulators"
<Console-Based Windows Process Manager><Console-Based Windows Process Manager>,"Categories
Terminal Emulators, System Shells"
"A lightweight, tabbed terminal emulator written in GTK 2.A lightweight, tabbed terminal emulator written in GTK 2.","Categories
Terminal Emulators"
httpShell is a way for connecting remotely to a computer with an indirect connection by help of a PHP-enabled HTTP server.httpShell is a way for connecting remotely to a computer with an indirect connection by help of a PHP-enabled HTTP server.,"Categories
Terminals, WWW/HTTP"
"NetStation is a linux distribution for diskless thin clients terminals using standard x86 hardware. It can boot from network, floppy or flash-disk and connect to an application server using VNC, RDP, XDM, SSH, Telnet or Citrix ICA.NetStation is a linux distribution for diskless thin clients terminals using standard x86 hardware. It can boot from network, floppy or flash-disk and connect to an application server using VNC, RDP, XDM, SSH, Telnet or Citrix ICA.","Categories
Terminal Emulators"
CSE Senior Design Project for an automated Robotic Truck. This will be software and hardware that allows for the autonomous nature of a the RC vehicle.CSE Senior Design Project for an automated Robotic Truck. This will be software and hardware that allows for the autonomous nature of a the RC vehicle.,"Categories
Telnet, Simulation, Intelligent Agents"
Some useful utilities for basic actions on the commmand line. Input and output functions allow an easy way of taking text from input and converting it into python objects. And a standard interface for terminal control features such as coloring.Some useful utilities for basic actions on the commmand line. Input and output functions allow an easy way of taking text from input and converting it into python objects. And a standard interface for terminal control features such as coloring.,"Categories
Terminals"
"TFFC i mean Terminal(or Trivial) Functions for Curses. I need some functions for text mode in DJGPP under pdcurses(it works also with ncurses) for input text,menu, scrolling text on the screen and others. I don't like(it very difficult to write some prTFFC i mean Terminal(or Trivial) Functions for Curses. I need some functions for text mode in DJGPP under pdcurses(it works also with ncurses) for input text,menu, scrolling text on the screen and others. I don't like(it very difficult to write some pr","Categories
Terminals"
Xpacket - the porpular Packet-Radio Terminal Plan is a Port to Linux. Actually there are the Sources from 1.81b8 . We need all Help!Xpacket - the porpular Packet-Radio Terminal Plan is a Port to Linux. Actually there are the Sources from 1.81b8 . We need all Help!,"Categories
Serial"
This project is dll which can help user to communicate with serial port.This project is dll which can help user to communicate with serial port.,"Categories
Serial"
Wrapped shell scripts to change the OS X Finder. One script to display hidden files and another script to return Finder to normal mode. Just double click them to use.Wrapped shell scripts to change the OS X Finder. One script to display hidden files and another script to return Finder to normal mode. Just double click them to use.,"Categories
Terminals, Desktop Environment, File Managers"
Simple Serial COM read/write program. I needed it for Caller ID read modem driver so it has command auto complete for AT commands. It is a good replacement for HyperTerminal. Made for .NET Framework 2.0Simple Serial COM read/write program. I needed it for Caller ID read modem driver so it has command auto complete for AT commands. It is a good replacement for HyperTerminal. Made for .NET Framework 2.0,"Categories
Serial, Telephony, Interface Engine/Protocol Translator"
"wMug.NET is a scriptable, skinnable TCP/IP control application allowing users to create and control TCP/IP connections to a variety of chat servers, such as IRC, MSN, MUD, MUGs, or servers of any other type deemed suitable for the application. [Note examwMug.NET is a scriptable, skinnable TCP/IP control application allowing users to create and control TCP/IP connections to a variety of chat servers, such as IRC, MSN, MUD, MUGs, or servers of any other type deemed suitable for the application. [Note exam","Categories
Telnet, Chat"
"Soicmp is a remote shell system, similar to telnet or netcat that allows a user to connect to a remote shell daemon, by using ICMP protocol instead of classical TCP. http://soicmp.sourceforge.net/ http://billiejoex.altervista.org/Prj_Py_soicmp.shtmlSoicmp is a remote shell system, similar to telnet or netcat that allows a user to connect to a remote shell daemon, by using ICMP protocol instead of classical TCP. http://soicmp.sourceforge.net/ http://billiejoex.altervista.org/Prj_Py_soicmp.shtml","Categories
Terminals, Security, Networking"
"OS X RS232 Serial monitor program for sending and receiving data and monitoring and controlling the handshake signals. It can be used for debugging serial connections, serial device drivers, embedded systems connected to the serial etc.OS X RS232 Serial monitor program for sending and receiving data and monitoring and controlling the handshake signals. It can be used for debugging serial connections, serial device drivers, embedded systems connected to the serial etc.","Categories
Serial, Communications"
"MUD client for use with the Discworld MUD, if it works for any other MUDs that's a bonus!MUD client for use with the Discworld MUD, if it works for any other MUDs that's a bonus!","Categories
Telnet, Multi-User Dungeons (MUD)"
"A simple, quick and plug-and-play wrapper for the curses library that provides a shell-like UI. Features include customizable prompt, tab completion, command history and thread-safety (simultaneous input/output). Scotty stands for Shell CreatiOn ToolkiT.A simple, quick and plug-and-play wrapper for the curses library that provides a shell-like UI. Features include customizable prompt, tab completion, command history and thread-safety (simultaneous input/output). Scotty stands for Shell CreatiOn ToolkiT.","Categories
Terminals, User Interface (UI)"
"The goal of this project is to make a program (or a set of programs) to fully control a remote machine trought a TCP/IP network.
The project consist on two parts: The host app to receive & interpret commands and a GUI to send the commands (the client).The goal of this project is to make a program (or a set of programs) to fully control a remote machine trought a TCP/IP network.
The project consist on two parts: The host app to receive & interpret commands and a GUI to send the commands (the client).","Categories
Terminals, Communications, Window Managers, Systems Administration"
Home Server Download Daemon (HSDD) is free non-GUI download manager for home network servers written in Java. HSDD is controlled remotely by telnet protocol.Home Server Download Daemon (HSDD) is free non-GUI download manager for home network servers written in Java. HSDD is controlled remotely by telnet protocol.,"Categories
Telnet, File Transfer Protocol (FTP), WWW/HTTP, Download Managers"
RS232 Terminal ProgramRS232 Terminal Program,"Categories
Serial"
A terminal program for the GGI graphics systemA terminal program for the GGI graphics system,"Categories
Terminal Emulators"
"AsmFind is a small, fast disk search utility. It will search for files, directories or text using a Boyer-Moore search.AsmFind is a small, fast disk search utility. It will search for files, directories or text using a Boyer-Moore search.","Categories
Terminal Emulators, Desktop Environment"
"An ANSI drawing tool supporting most formats (ANSI/ASCII), AVATAR, BINARY, PCBOARD. It does support TheDrawFonts file too. It will be a replacement for the good old dos based TheDraw and it is designed in the spirit of ACiD DrawAn ANSI drawing tool supporting most formats (ANSI/ASCII), AVATAR, BINARY, PCBOARD. It does support TheDrawFonts file too. It will be a replacement for the good old dos based TheDraw and it is designed in the spirit of ACiD Draw","Categories
Terminals, BBS, Graphic Design"
"Gnome-sshman is an SSH session manager for GNOME. It is easy and fast to use, and is useful for system administrators that need to connect to many SSH servers.Gnome-sshman is an SSH session manager for GNOME. It is easy and fast to use, and is useful for system administrators that need to connect to many SSH servers.","Categories
Telnet"
