Description,Category
"*** For the latest v5 with integrated YouTube Web (controllable with the YouTube app on your phone) please download from https://www.microsoft.com/en-gb/p/sleep/9ppgrg6t7dcj ***

Do you use your computer for playback of films, streamed TV etc. before going to sleep?

In these cases, Windows' sleep functionality is suspended and won't kick in once the video has finished.

The solution for many is to use a sleep timer to send the computer to sleep after the estimated amount of time of the video. But you need to remember to do this every time. Sleep# handles this automatically:

Sleep# sends your computer to sleep after the playback of fullscreen video, providing Windows has been idle for a predefined amount of time.

There is a grace period at the end of the fullscreen video before sending your computer to sleep, allowing you to interrupt the process should you still be awake.

Sleep# works with VLC media player, Windows Media Player, Google Play Movies & TV amongst others.*** For the latest v5 with integrated YouTube Web (controllable with the YouTube app on your phone) please download from https://www.microsoft.com/en-gb/p/sleep/9ppgrg6t7dcj ***

Do you use your computer for playback of films, streamed TV etc. before going to sleep?

In these cases, Windows' sleep functionality is suspended and won't kick in once the video has finished.

The solution for many is to use a sleep timer to send the computer to sleep after the estimated amount of time of the video. But you need to remember to do this every time. Sleep# handles this automatically:

Sleep# sends your computer to sleep after the playback of fullscreen video, providing Windows has been idle for a predefined amount of time.

There is a grace period at the end of the fullscreen video before sending your computer to sleep, allowing you to interrupt the process should you still be awake.

Sleep# works with VLC media player, Windows Media Player, Google Play Movies & TV amongst others.","Categories
Media Players, Home Theater PC, Home Automation"
"Explore procedural worlds on your GPU. Worlds are defined by GLSL programs that map XYZ coordinates to the distance to the nearest surface. Design your own worlds, modify parameters in realtime and render hires videos of your recorded journey.Explore procedural worlds on your GPU. Worlds are defined by GLSL programs that map XYZ coordinates to the distance to the nearest surface. Design your own worlds, modify parameters in realtime and render hires videos of your recorded journey.","Categories
Screen Savers, 3D Rendering, Fractal"
"Cloo is an open source, easy to use, managed library which enables .NET/Mono applications to take full advantage of the OpenCL framework.Cloo is an open source, easy to use, managed library which enables .NET/Mono applications to take full advantage of the OpenCL framework.","Categories
Games/Entertainment, Scientific/Engineering, Multimedia"
"A easy-to-use player, can load and drag&drop rar/7z/zip media&subtitle&lyric. Full support DVD menu&TV, multiple audio,video and subtitle tracks. auto config codepage, font. Use mouse to handle scale of subtitle,video,aspect, DVD menu,scan TVA easy-to-use player, can load and drag&drop rar/7z/zip media&subtitle&lyric. Full support DVD menu&TV, multiple audio,video and subtitle tracks. auto config codepage, font. Use mouse to handle scale of subtitle,video,aspect, DVD menu,scan TV","Categories
Players, Media Players"
"NOTE: Project migrated to GitHub in Dec 2020! See https://github.com/Enselic/recordmydesktop

recordMyDesktop is a program that captures audio-video data of a linux desktop session, producing an ogg-encapsulated theora-vorbis file. recordMyDesktop tries to be as unobstrusive as possible by proccessing only regions of the screen that have changedNOTE: Project migrated to GitHub in Dec 2020! See https://github.com/Enselic/recordmydesktop

recordMyDesktop is a program that captures audio-video data of a linux desktop session, producing an ogg-encapsulated theora-vorbis file. recordMyDesktop tries to be as unobstrusive as possible by proccessing only regions of the screen that have changed","Categories
Screen Capture, Video Capture"
Imagination is a lightweight and simple DVD slide show maker written in C language and built with the GTK+3 toolkit and Cairo featuring 69 transitions. It requires the ffmpeg encoder and libsox to export the slideshow.Imagination is a lightweight and simple DVD slide show maker written in C language and built with the GTK+3 toolkit and Cairo featuring 69 transitions. It requires the ffmpeg encoder and libsox to export the slideshow.,"Categories
DVD"
"Crystal Space is an Open Source 3D SDK for Unix, Windows, and MacOS/X. It renders with OpenGL and features GLSL shaders, CG shaders, deferred rendering, dynamic shadows, bullet based physics library, terrain engine, skeleton based animation meshes, exporter for Blender, portals, etc...Crystal Space is an Open Source 3D SDK for Unix, Windows, and MacOS/X. It renders with OpenGL and features GLSL shaders, CG shaders, deferred rendering, dynamic shadows, bullet based physics library, terrain engine, skeleton based animation meshes, exporter for Blender, portals, etc...","Categories
Real Time Strategy, First Person Shooters, Role-Playing Games (RPG), Frameworks, 3D Rendering"
"Enterprise telephony recording and retrieval system with web based user interface. The project currently supports recording voice from VoIP SIP, Cisco Skinny (aka SCCP), raw RTP and audio sound device and runs on multiple operating systems and database systems.
It can record audio from most PBX and telephony systems such as BroadWorks, Metaswitch, Asterisk, FreeSwitch, OpenSIPS, Avaya, Nortel, Mitel, Siemens, Cisco Call Manager, Cosmocom, NEC, etc...
It is amongst others being used in Call Centers and Contact Centers for Quality monitoring (QM) purposes.Enterprise telephony recording and retrieval system with web based user interface. The project currently supports recording voice from VoIP SIP, Cisco Skinny (aka SCCP), raw RTP and audio sound device and runs on multiple operating systems and database systems.
It can record audio from most PBX and telephony systems such as BroadWorks, Metaswitch, Asterisk, FreeSwitch, OpenSIPS, Avaya, Nortel, Mitel, Siemens, Cisco Call Manager, Cosmocom, NEC, etc...
It is amongst others being used in Call Centers and Contact Centers for Quality monitoring (QM) purposes.","Categories
Telephony, CRM, Audio Recording, PBX"
"mtPaint is a painting program designed for creating icons and pixel-based artwork. It can edit indexed palette or 24 bit RGB images and offers painting, palette, and image manipulation tools.mtPaint is a painting program designed for creating icons and pixel-based artwork. It can edit indexed palette or 24 bit RGB images and offers painting, palette, and image manipulation tools.","Categories
Raster Graphics"
"pcdtojpeg converts PCD (Kodak Photo CD) image files into high quality JPEG images. Conversions are at the maximum available PCD resolution, and are fully color managed - no blown highlights or color casts. A C++ PCD decoder library is also available.pcdtojpeg converts PCD (Kodak Photo CD) image files into high quality JPEG images. Conversions are at the maximum available PCD resolution, and are fully color managed - no blown highlights or color casts. A C++ PCD decoder library is also available.","Categories
Scanner, Image Converters"
The goal of this project is to develop a v4l driver for the Sony R-Engine MPEG2 encoder/decoder (aka Fujitsu's MB86393). The Sony R-Engine MPEG2 encoder/decoder is found in the more recent Sony Vaio Picturebooks (model PCG-C1M* and newer).The goal of this project is to develop a v4l driver for the Sony R-Engine MPEG2 encoder/decoder (aka Fujitsu's MB86393). The Sony R-Engine MPEG2 encoder/decoder is found in the more recent Sony Vaio Picturebooks (model PCG-C1M* and newer).,"Categories
Video Capture"
"UPDATE: Chromium is no longer updated or maintained. The project is frozen.

Chromium is a flexible framework for scalable real-time rendering on clusters of workstations, derived from the Stanford WireGL project code base.UPDATE: Chromium is no longer updated or maintained. The project is frozen.

Chromium is a flexible framework for scalable real-time rendering on clusters of workstations, derived from the Stanford WireGL project code base.","Categories
Clustering, 3D Rendering, Data Visualization"
A Python interface to the gnuplot plotting program.A Python interface to the gnuplot plotting program.,"Categories
CGI Scripts, Software Development, Presentation, Data Visualization"
"NASPRO, acronym for ""NASPRO Architecture for Sound PROcessing"" is a collection of free and open source sound processing software built around the LV2 plugin standard.NASPRO, acronym for ""NASPRO Architecture for Sound PROcessing"" is a collection of free and open source sound processing software built around the LV2 plugin standard.","Categories
Scientific/Engineering, Sound/Audio"
"NOTE: Blue's SourceCode, Issue Tracker, and new releases have moved to http://www.github.com/kunstmusik/blue. Older file Releases and Mailing Lists remain here on Sourceforge at this time.

blue is a music composition environment for use with the Csound sound system. It is written in Java and runs on Linux, Windows, and MacOSX.NOTE: Blue's SourceCode, Issue Tracker, and new releases have moved to http://www.github.com/kunstmusik/blue. Older file Releases and Mailing Lists remain here on Sourceforge at this time.

blue is a music composition environment for use with the Csound sound system. It is written in Java and runs on Linux, Windows, and MacOSX.","Categories
Sound/Audio"
"LFI Player is a simple yet relatively powerful 3D laser display application written using MS Visual C/C++ and MFC. Object-oriented design provides extensability to the display of multiple laser file format types, and use of a variety of output hardware.LFI Player is a simple yet relatively powerful 3D laser display application written using MS Visual C/C++ and MFC. Object-oriented design provides extensability to the display of multiple laser file format types, and use of a variety of output hardware.","Categories
3D Rendering"
"This project is now located at http://xiph.org/quicktime/ Xiph QuickTime Components (XiphQT) is, in short, the solution for Mac and Windows users who want to use Xiph formats in any QuickTime-based application, e.g. playing Ogg Vorbis in iTunes or producThis project is now located at http://xiph.org/quicktime/ Xiph QuickTime Components (XiphQT) is, in short, the solution for Mac and Windows users who want to use Xiph formats in any QuickTime-based application, e.g. playing Ogg Vorbis in iTunes or produc","Categories
Graphics, Sound/Audio"
"GIMP is an acronym for GNU Image Manipulation Program. Use GIMP as a simple paint program, an expert quality photo retouching program, an online batch processing system, a mass production image renderer, an image format converter, etc. GIMP is expandable and extensible; it can be augmented with plug-ins and extensions to do just about anything. The advanced scripting interface allows everything from the simplest task to the most complex image manipulation procedures to be easily scripted.GIMP is an acronym for GNU Image Manipulation Program. Use GIMP as a simple paint program, an expert quality photo retouching program, an online batch processing system, a mass production image renderer, an image format converter, etc. GIMP is expandable and extensible; it can be augmented with plug-ins and extensions to do just about anything. The advanced scripting interface allows everything from the simplest task to the most complex image manipulation procedures to be easily scripted.","Categories
Printing, Graphic Design, Photo Editors"
DVD Flick aims to be a tool to convert various PC video formats to a DVD that can be played on pretty much any standalone DVD player. Its main target audience is people who know at least the basics about DVDs and video and audio files.DVD Flick aims to be a tool to convert various PC video formats to a DVD that can be played on pretty much any standalone DVD player. Its main target audience is people who know at least the basics about DVDs and video and audio files.,"Categories
Video Converters"
VoodooHDA is an open source audio driver for devices compliant with the Intel High Definition Audio specification. It is intended as a replacement for AppleHDA on Mac OS X with support for a wide range of audio controllers and codecs.VoodooHDA is an open source audio driver for devices compliant with the Intel High Definition Audio specification. It is intended as a replacement for AppleHDA on Mac OS X with support for a wide range of audio controllers and codecs.,"Categories
Hardware Drivers, Sound/Audio"
"xVideoServiceThief is a tool for downloading your favourite video clips from a lot of video websites. xVideoServiceThief also provide you the ability to convert each video in most popular formats: AVI, MPEG1, MPEG2, WMV, MP4, 3GP, MP3 file formats.xVideoServiceThief is a tool for downloading your favourite video clips from a lot of video websites. xVideoServiceThief also provide you the ability to convert each video in most popular formats: AVI, MPEG1, MPEG2, WMV, MP4, 3GP, MP3 file formats.","Categories
Internet, Video"
"ABIC is a multiplatform tool for converting images from and to a wide variety of formats, for example: JPEG, TIFF, PNG, JPEG-2000, WebP. It can also read some historic ones, in particular Amiga IFF (ILBM).
ABIC is completely free, open sourced, and is also entirely nag-free.ABIC is a multiplatform tool for converting images from and to a wide variety of formats, for example: JPEG, TIFF, PNG, JPEG-2000, WebP. It can also read some historic ones, in particular Amiga IFF (ILBM).
ABIC is completely free, open sourced, and is also entirely nag-free.","Categories
Image Converters"
TV Scheduling service that allows timed captures of Digital TV to your hard drive using a digital tuner device. (DVB-T BDA)TV Scheduling service that allows timed captures of Digital TV to your hard drive using a digital tuner device. (DVB-T BDA),"Categories
Video Capture, Home Theater PC"
"Eagle Mode is a zoomable user interface (ZUI) with file manager, file viewers, games, and more.

This project is about a futuristic style of human-computer interaction, where the user can visit almost everything simply by zooming in. It features a portable C++ toolkit API for developing such ZUIs, and it features the Eagle Mode application, which provides a virtual cosmos with plugin applications.

The most important one is the professional file manager with its rich, scriptable command set. It integrates file viewers for most of the common file types, as well as an audio and video player. Furthermore, the virtual cosmos contains a chess game, a netwalk game, a 3D minesweeper game, a multi-function clock, a stock watchlist, some fractals, and a Linux kernel configurator in form of a kernel patch.Eagle Mode is a zoomable user interface (ZUI) with file manager, file viewers, games, and more.

This project is about a futuristic style of human-computer interaction, where the user can visit almost everything simply by zooming in. It features a portable C++ toolkit API for developing such ZUIs, and it features the Eagle Mode application, which provides a virtual cosmos with plugin applications.

The most important one is the professional file manager with its rich, scriptable command set. It integrates file viewers for most of the common file types, as well as an audio and video player. Furthermore, the virtual cosmos contains a chess game, a netwalk game, a 3D minesweeper game, a multi-function clock, a stock watchlist, some fractals, and a Linux kernel configurator in form of a kernel patch.","Categories
Board Games, Puzzle Games, User Interface (UI), File Managers, HMI, Media Players"
"EasyTAG is an utility for viewing and editing tags for MP3, MP2, MP4/AAC, FLAC, Ogg Vorbis, MusePack, Monkey's Audio and WavPack files. Its simple and nice GTK+ interface makes tagging easier.EasyTAG is an utility for viewing and editing tags for MP3, MP2, MP4/AAC, FLAC, Ogg Vorbis, MusePack, Monkey's Audio and WavPack files. Its simple and nice GTK+ interface makes tagging easier.","Categories
Audio Editing"
"CinePaint 1.4.4 Windows version released 2021/5/6. Linux and MacOS versions coming.

CinePaint is a deep paint image retouching tool that supports higher color fidelity than ordinary painting tools. CinePaint opens high fidelity image file formats such as DPX, 16-bit TIFF, and OpenEXR, and conventional formats like JPEG and PNG.


--
Robin Rowe
CinePaint Project Manager
Beverly Hills, California
robin.rowe@cinepaint.org
imdb.me/robinrowe
323-535-0952CinePaint 1.4.4 Windows version released 2021/5/6. Linux and MacOS versions coming.

CinePaint is a deep paint image retouching tool that supports higher color fidelity than ordinary painting tools. CinePaint opens high fidelity image file formats such as DPX, 16-bit TIFF, and OpenEXR, and conventional formats like JPEG and PNG.


--
Robin Rowe
CinePaint Project Manager
Beverly Hills, California
robin.rowe@cinepaint.org
imdb.me/robinrowe
323-535-0952","Categories
Raster Graphics"
"Unofficial fork of the GyachE (www.phrozensmoke.com), intended for bug-fixes and further development.Unofficial fork of the GyachE (www.phrozensmoke.com), intended for bug-fixes and further development.","Categories
Chat, Conferencing, Speech"
"Geeqie is a lightweight image viewer. It was forked from GQview. The development is focused on features for photo collection maintenance: raw format, Exif/IPTC/XMP metadata and integration with programs like UFraw, ImageMagick, Gimp, gPhoto or ExifTo

The current development and project can be found on http://www.geeqie.org/. The sourceforge page will be deleted soon.Geeqie is a lightweight image viewer. It was forked from GQview. The development is focused on features for photo collection maintenance: raw format, Exif/IPTC/XMP metadata and integration with programs like UFraw, ImageMagick, Gimp, gPhoto or ExifTo

The current development and project can be found on http://www.geeqie.org/. The sourceforge page will be deleted soon.","Categories
Image Viewers, Metadata Editors"
"A simple, easy-to-use program for converting multiple image files from one format to another. Supports the following image formats: BMP, EMF, EXIF, GIF, JPG/JPEG, PNG, TIF/TIFF, and WMF.A simple, easy-to-use program for converting multiple image files from one format to another. Supports the following image formats: BMP, EMF, EXIF, GIF, JPG/JPEG, PNG, TIF/TIFF, and WMF.","Categories
Image Converters"
AVStoDVD is a flexible tool to convert various media formats to DVD compliant streams and author them into a highly compatible multiple tracks DVD with customizable menus.AVStoDVD is a flexible tool to convert various media formats to DVD compliant streams and author them into a highly compatible multiple tracks DVD with customizable menus.,"Categories
Video Converters, DVD Burners"
"ffdshow is DirectShow and VFW codec for decoding/encoding many video and audio formats, including DivX and XviD movies using libavcodec, xvid and other opensourced libraries with a rich set of postprocessing filters.ffdshow is DirectShow and VFW codec for decoding/encoding many video and audio formats, including DivX and XviD movies using libavcodec, xvid and other opensourced libraries with a rich set of postprocessing filters.","Categories
Video, Sound/Audio"
"This project provides an open source MacOS v10.14-v12.6 (Mojave to Monterey) compatible CoreMIDI 64 bit device driver for M-Audio's MIDISPORT range of USB MIDI interfaces. This driver supports the following devices:

MIDISPORT 1x1
MIDISPORT 2x2
MIDISPORT 4x4
MIDISPORT 8x8/S
Oxygen 8 Keyboard

Other devices which are compatible may also work, although presently, these are the only ones which have been tested.This project provides an open source MacOS v10.14-v12.6 (Mojave to Monterey) compatible CoreMIDI 64 bit device driver for M-Audio's MIDISPORT range of USB MIDI interfaces. This driver supports the following devices:

MIDISPORT 1x1
MIDISPORT 2x2
MIDISPORT 4x4
MIDISPORT 8x8/S
Oxygen 8 Keyboard

Other devices which are compatible may also work, although presently, these are the only ones which have been tested.","Categories
Hardware Drivers, MIDI"
"Portable Webcam is a handy tool to open your webcam easily and quickly. Its portable software and 1 file only. You can take photos with 1 click only.

How to use:
Just open the software, your webcam will open automatically.Portable Webcam is a handy tool to open your webcam easily and quickly. Its portable software and 1 file only. You can take photos with 1 click only.

How to use:
Just open the software, your webcam will open automatically.","Categories
Capture"
"HotShots is an application for capturing screens and saving them in a variety of image formats as well as adding annotations and graphical data (arrows, lines, texts, ...).HotShots is an application for capturing screens and saving them in a variety of image formats as well as adding annotations and graphical data (arrows, lines, texts, ...).","Categories
Desktop Environment, Screen Capture, Graphic Design"
"Batch Image Manager is a small and free batch picture converter and resizer (or photo resizer). It can rename, resize and change the format of your images, photos and pictures.Batch Image Manager is a small and free batch picture converter and resizer (or photo resizer). It can rename, resize and change the format of your images, photos and pictures.","Categories
Office/Business, Graphics, Image Converters"
"If, like me, you have a car radio or a clock radio which cannot play tracks in random order from your usb stick itself, this application might be useful for you.
It generates random numbers and puts them in front of every file in a specified folder. So all you've got to do when you want a new play order for your music tracks is run this application.If, like me, you have a car radio or a clock radio which cannot play tracks in random order from your usb stick itself, this application might be useful for you.
It generates random numbers and puts them in front of every file in a specified folder. So all you've got to do when you want a new play order for your music tracks is run this application.","Categories
Audio Conversion"
An open source Roku channel customizable via a single xml templateAn open source Roku channel customizable via a single xml template,"Categories
Media Players"
"The ULTIMATE RCT3!!!! ""CTR/CS/Editor/Custom Utility/Custom Mod/Custom Stall/Creator/SID Editor Data/CTR & CS Creator Plugin/RCT3 Model/RCT3 Model Plugin/"" Mass Roller Coaster Tycoon 3 Repository!!!! (100% Safe/Legal!!!)The ULTIMATE RCT3!!!! ""CTR/CS/Editor/Custom Utility/Custom Mod/Custom Stall/Creator/SID Editor Data/CTR & CS Creator Plugin/RCT3 Model/RCT3 Model Plugin/"" Mass Roller Coaster Tycoon 3 Repository!!!! (100% Safe/Legal!!!)","Categories
3D Modeling, Subversion, Game Development Frameworks"
"RAW yuv player project is moved to GITHUB.

Visit: https://github.com/Tee0125/yuvplayer

Old description:
Lightweight player for raw YUV/UYVY files.RAW yuv player project is moved to GITHUB.

Visit: https://github.com/Tee0125/yuvplayer

Old description:
Lightweight player for raw YUV/UYVY files.","Categories
Image Viewers, Codec, Media Players"
Web browser plug-in for hosting real 3D on the websites.Web browser plug-in for hosting real 3D on the websites.,"Categories
Games/Entertainment, Browser Extensions and Plugins, Animation"
"Technology demonstrator of 3D rendering and navigation within a standards compliant web page (requires browser SVG support), no need for a plugin. Intended for use creating basic informative diagrams, ideal for live 3D animations through a web 2.0 mashup. Uses JavaScript to generate SVG (inline) from X3D (inline) using a VRMLScript compliant environment object (an implementation of the VRMLScript standard in JS).Technology demonstrator of 3D rendering and navigation within a standards compliant web page (requires browser SVG support), no need for a plugin. Intended for use creating basic informative diagrams, ideal for live 3D animations through a web 2.0 mashup. Uses JavaScript to generate SVG (inline) from X3D (inline) using a VRMLScript compliant environment object (an implementation of the VRMLScript standard in JS).","Categories
Software Development, Internet, 3D Rendering"
"DPG for X (dpg4x) is a program that was designed to allow the easy creation of DPG video files on Linux, but now it can also run on OS X and Windows. DPG is a special format of MPEG-1 video specifically made for playback on a Nintendo DS.DPG for X (dpg4x) is a program that was designed to allow the easy creation of DPG video files on Linux, but now it can also run on OS X and Windows. DPG is a special format of MPEG-1 video specifically made for playback on a Nintendo DS.","Categories
Video Converters"
tvpvrd - (TV Personal Video Recorder Daemon). A Unix server/daemon to make scheduled recordings of TV broadcasts using one or multiple Video capture cards with optional automatic transcoding (using ffmpeg)tvpvrd - (TV Personal Video Recorder Daemon). A Unix server/daemon to make scheduled recordings of TV broadcasts using one or multiple Video capture cards with optional automatic transcoding (using ffmpeg),"Categories
Video Converters, Video Capture, Load Balancers"
