Description,Category
Live MP3/OGG/AAC Flash Player for Icecast and Shoutcast. It has some interesting and necessary features like reconnect on network errors to make sure users never get silence and cache management to avoid memory memory consumption. Works with Flash 10.1 and newer.Live MP3/OGG/AAC Flash Player for Icecast and Shoutcast. It has some interesting and necessary features like reconnect on network errors to make sure users never get silence and cache management to avoid memory memory consumption. Works with Flash 10.1 and newer.,"Categories
Streaming, Players"
"ZNC is an IRC bouncer with many advanced features such as a built-in web interface, persistent connection (detaching), multiple users, per channel playback buffer, SSL, IPv6, transparent DCC bouncing, and c++ module support, to name a few.ZNC is an IRC bouncer with many advanced features such as a built-in web interface, persistent connection (detaching), multiple users, per channel playback buffer, SSL, IPv6, transparent DCC bouncing, and c++ module support, to name a few.","Categories
IRC Clients"
"This is the Standard French translation project for phpBB3. We are doing translations of the actual software itself (language files, packages and imagesets).This is the Standard French translation project for phpBB3. We are doing translations of the actual software itself (language files, packages and imagesets).","Categories
BBS, Message Board, Internationalization (I18N)"
"EGroupware has moved to Github, please find all our downloads there: https://github.com/EGroupware/egroupware/releases

EGroupware is a multi-user, web-based groupware suite. Currently available modules include: email, addressbook, calendar, infolog (notes, to-do's, phone calls), content management, wiki, project management, tracker, timesheet, knowledge base, CalDAV/CardDAVEGroupware has moved to Github, please find all our downloads there: https://github.com/EGroupware/egroupware/releases

EGroupware is a multi-user, web-based groupware suite. Currently available modules include: email, addressbook, calendar, infolog (notes, to-do's, phone calls), content management, wiki, project management, tracker, timesheet, knowledge base, CalDAV/CardDAV","Categories
File Sharing, Email Clients, Scheduling, Office Suites, Project Management, Site Management"
"PeerGuardian is a privacy oriented firewall application. It blocks connections to and from hosts specified in huge blocklists (thousands or millions of IP ranges). Its origin seeds in targeting aggressive IPs while you use P2P.

PeerGuardian Linux:
Not developed actively anymore. Team might still be around. Some unreleased changes on git. Outdated technology.

Peerguardian OS X:
Not developed anymore. We've lost contact with the OS X developer.

PeerGuardian Windows:
Not developed anymore. It's highly recommended to use PeerBlock instead, which is a continuation of PeerGuardian's development in Windows, with bug fixes and support for Windows Vista and Windows 7. Collaboration with peerblock.com is welcome!

PeerGuardian is an open project. Not only is its source code open for you to read, use, and modify - but the project is open for you to join and contribute in any form (code, documentation, bug reports, web and support).PeerGuardian is a privacy oriented firewall application. It blocks connections to and from hosts specified in huge blocklists (thousands or millions of IP ranges). Its origin seeds in targeting aggressive IPs while you use P2P.

PeerGuardian Linux:
Not developed actively anymore. Team might still be around. Some unreleased changes on git. Outdated technology.

Peerguardian OS X:
Not developed anymore. We've lost contact with the OS X developer.

PeerGuardian Windows:
Not developed anymore. It's highly recommended to use PeerBlock instead, which is a continuation of PeerGuardian's development in Windows, with bug fixes and support for Windows Vista and Windows 7. Collaboration with peerblock.com is welcome!

PeerGuardian is an open project. Not only is its source code open for you to read, use, and modify - but the project is open for you to join and contribute in any form (code, documentation, bug reports, web and support).","Categories
File Sharing, Firewall"
"Untangle is a Linux-based network gateway with pluggable modules for network applications like spam blocking, web filtering, anti-virus, anti-spyware, intrusion prevention, bandwidth control, captive portal, VPN, firewall, and more. Visit http://untangle.comUntangle is a Linux-based network gateway with pluggable modules for network applications like spam blocking, web filtering, anti-virus, anti-spyware, intrusion prevention, bandwidth control, captive portal, VPN, firewall, and more. Visit http://untangle.com","Categories
Email, Security, Networking, Logging, Internet"
"Find the next step in your career. Find and apply for remote jobs and jobs in your area using the Slashdot Job Board. Browse by job, company, location, and more.License
GNU Library or Lesser General Public License version 2.0 (LGPLv2)","Categories
Email, Office/Business, Games/Entertainment, Browsers, Design, Education"
"OpenKM is a electronic document management system and record management system EDRMS ( DMS, RMS, CMS ).

It provides modern and flexible architecture that meet today's IT demands, based on open technology (Java, Tomcat, GWT, Lucene, Hibernate, Spring and jBPM), powerful and scalable multiplatform application.

OpenKM is a Web 2.0 application that works with Internet Explorer, Firefox, Safari and Opera.

Can be configured in major DMBS like Oracle, PostgreSQL and MySQL among others.

Due to its technological architecture design, OpenKM meets the document management needs of businesses of all sizes (from SMEs to big corporations). Thanks to its elegant and intuitive interface, OpenKM transforms complex operations into easy tasks.

The most relevant functions of OpenKM is the indexing of the most common types of files: text, Office, Office 2007, OpenOffice, PDF, HTML, XML, MP3, JPEG, etc.

For a complete feature list take a look at http://goo.gl/au8cQyOpenKM is a electronic document management system and record management system EDRMS ( DMS, RMS, CMS ).

It provides modern and flexible architecture that meet today's IT demands, based on open technology (Java, Tomcat, GWT, Lucene, Hibernate, Spring and jBPM), powerful and scalable multiplatform application.

OpenKM is a Web 2.0 application that works with Internet Explorer, Firefox, Safari and Opera.

Can be configured in major DMBS like Oracle, PostgreSQL and MySQL among others.

Due to its technological architecture design, OpenKM meets the document management needs of businesses of all sizes (from SMEs to big corporations). Thanks to its elegant and intuitive interface, OpenKM transforms complex operations into easy tasks.

The most relevant functions of OpenKM is the indexing of the most common types of files: text, Office, Office 2007, OpenOffice, PDF, HTML, XML, MP3, JPEG, etc.

For a complete feature list take a look at http://goo.gl/au8cQy","Categories
File Sharing, Workflow Management, Knowledge Management, OCR, Document Management"
This software suite is designed to extend the functionality of the Asterisk PBX through platform-independant web-client applications. Includes the VICIdial inbound/outbound contact center application. The suite is scalable across multiple Asterisk servers.This software suite is designed to extend the functionality of the Asterisk PBX through platform-independant web-client applications. Includes the VICIdial inbound/outbound contact center application. The suite is scalable across multiple Asterisk servers.,"Categories
Chat, Telephony, CRM, PBX"
"WE HAVE MOVED OFF SOURCEFORGE. PLEASE VISIT http://openwebmail.acatysmoof.com. OpenWebMail is a full-featured webmail, addressbook, calendar, and webdisk system that is designed to manage very large mail folder files in a quick and memory efficient wWE HAVE MOVED OFF SOURCEFORGE. PLEASE VISIT http://openwebmail.acatysmoof.com. OpenWebMail is a full-featured webmail, addressbook, calendar, and webdisk system that is designed to manage very large mail folder files in a quick and memory efficient w","Categories
POP3, Email Clients, Calendar"
"Opensource frimware for platforms based on some SoC (Realtek RTL8186 - Wive-NG, Realtek RTL8671B/RTL8671BH/RTL8672 - Wive-NG-DSL, Ralink RT3050/RT3052 - Wive-NG-RTNL, MT7620/MT7621 - Wive-NG-MT)

For detailed discussion of commercial use please mail to info@wi-cat.ru.

For more details in russian please go to https://wi-cat.ru
Any support for end user only in https://wi-cat.ru/forums/ forum page.
Author page: http://wive-ng.sf.net
Commercial support support@wi-cat.ru

Supported device list:
1) Wive-NG-HQ - latest FW tree (only commercial access)
2) Wive-NG-MT (current) - https://wi-cat.ru/wive-ng/ustroystva-postavlyaemyie-s-os-wive-ng-mt-s-zavoda-2015-2017g/
3) Wive-NG-RTNL (EOL) - http://wive-ng.sourceforge.net/?WR-NL_RT3050%282%29:Sovmestimye_ustroystva
4) Wive-NG-ADSL (EOL) - http://wive-ng.sourceforge.net/?W422G.v3_8671BH_%284%2F16%29Opensource frimware for platforms based on some SoC (Realtek RTL8186 - Wive-NG, Realtek RTL8671B/RTL8671BH/RTL8672 - Wive-NG-DSL, Ralink RT3050/RT3052 - Wive-NG-RTNL, MT7620/MT7621 - Wive-NG-MT)

For detailed discussion of commercial use please mail to info@wi-cat.ru.

For more details in russian please go to https://wi-cat.ru
Any support for end user only in https://wi-cat.ru/forums/ forum page.
Author page: http://wive-ng.sf.net
Commercial support support@wi-cat.ru

Supported device list:
1) Wive-NG-HQ - latest FW tree (only commercial access)
2) Wive-NG-MT (current) - https://wi-cat.ru/wive-ng/ustroystva-postavlyaemyie-s-os-wive-ng-mt-s-zavoda-2015-2017g/
3) Wive-NG-RTNL (EOL) - http://wive-ng.sourceforge.net/?WR-NL_RT3050%282%29:Sovmestimye_ustroystva
4) Wive-NG-ADSL (EOL) - http://wive-ng.sourceforge.net/?W422G.v3_8671BH_%284%2F16%29","Categories
Ham Radio, Wireless"
"Megaupload Downloader is a programme born to avoid users tons of advertisement, poup-ups, etc.. that we get when we try to download from free file hosting services.Megaupload Downloader is a programme born to avoid users tons of advertisement, poup-ups, etc.. that we get when we try to download from free file hosting services.","Categories
File Sharing, Internet"
"The official website of this project is https://danielnoethen.de/butt

butt (broadcast using this tool) is an easy to use, multi OS streaming tool.
It supports ShoutCast and IceCast and runs on Linux, MacOS and Windows.
The main purpose of butt is to stream live audio data from your computers Mic or Line input
to an Shoutcast or Icecast server. Recording is also possible.
It is NOT intended to be a server by itself or automatically stream a set of audio files.The official website of this project is https://danielnoethen.de/butt

butt (broadcast using this tool) is an easy to use, multi OS streaming tool.
It supports ShoutCast and IceCast and runs on Linux, MacOS and Windows.
The main purpose of butt is to stream live audio data from your computers Mic or Line input
to an Shoutcast or Icecast server. Recording is also possible.
It is NOT intended to be a server by itself or automatically stream a set of audio files.","Categories
Streaming, Audio Recording"
"OS X FOSS portable applications are packaged so you can carry around on any portable device, USB thumb drive, iPod, portable hard drive, memory card, other portable device (or also on your internal hard disk), taking your preferences with you.OS X FOSS portable applications are packaged so you can carry around on any portable device, USB thumb drive, iPod, portable hard drive, memory card, other portable device (or also on your internal hard disk), taking your preferences with you.","Categories
Text Editors, Communications, Other/Nonlisted Topic, Office/Business, Internet, Simulation, Physics, Multimedia"
"FileZilla® is a cross-platform FTP, SFTP, and FTPS client with a vast list of features, which supports Windows, Mac OS X, Linux, and more. FileZilla's dynamic tools help you move files between your local machine and your Web site's server effortlessly. For example, Filezilla lets you compare your files with in-directory server files to manage file syncing. You can also tab browse between servers and transfer files to them simultaneously, as well as edit server files on the go. And Filezilla is available in 47 languages worldwide!FileZilla® is a cross-platform FTP, SFTP, and FTPS client with a vast list of features, which supports Windows, Mac OS X, Linux, and more. FileZilla's dynamic tools help you move files between your local machine and your Web site's server effortlessly. For example, Filezilla lets you compare your files with in-directory server files to manage file syncing. You can also tab browse between servers and transfer files to them simultaneously, as well as edit server files on the go. And Filezilla is available in 47 languages worldwide!","Categories
File Sharing, File Transfer Protocol (FTP), Networking, FTP Clients"
"aMule stands for all-platform eMule file-sharing program. It is affiliated with the eMule project and was forked from xMule on 08/2003. It connects to the eDonkey2000 network, supports Linux, Mac, Solaris, *BSD platforms, and nearly every processor arch.aMule stands for all-platform eMule file-sharing program. It is affiliated with the eMule project and was forked from xMule on 08/2003. It connects to the eDonkey2000 network, supports Linux, Mac, Solaris, *BSD platforms, and nearly every processor arch.","Categories
File Sharing"
"A very nice MSN compatible messenger application, aMSN Messenger is a multiplatform MSN messenger clone. Works pretty much like its Windows based counterpart. Perfect for keeping in touch with those friends who have not yet seen the light. Works on linuxA very nice MSN compatible messenger application, aMSN Messenger is a multiplatform MSN messenger clone. Works pretty much like its Windows based counterpart. Perfect for keeping in touch with those friends who have not yet seen the light. Works on linux","Categories
MSN Messenger, Networking, Internet, Messaging"
GSM modem based bulk sms sending tool. Mobile number and message can be imported from Microsoft Excel Worksheet (xlsx) and Text (txt) files to send sms using any GSM modem or phone connected with pc through usb or serial interface.GSM modem based bulk sms sending tool. Mobile number and message can be imported from Microsoft Excel Worksheet (xlsx) and Text (txt) files to send sms using any GSM modem or phone connected with pc through usb or serial interface.,"Categories
Communications"
"Liberté Linux is a secure, lightweight, and easy to use Gentoo-based Linux distribution intended as a communication aid in hostile environments. Liberté installs on a USB key, and boots on any computer or laptop.Liberté Linux is a secure, lightweight, and easy to use Gentoo-based Linux distribution intended as a communication aid in hostile environments. Liberté installs on a USB key, and boots on any computer or laptop.","Categories
Email, Security, Live CD"
"EiskaltDC is a program for UNIX-like systems that uses the Direct Connect protocol. It is compatible with other DC clients, such as the original DC from Neomodus, DC++ and derivatives. EiskaltDC also interoperates with all common DC hub software.EiskaltDC is a program for UNIX-like systems that uses the Direct Connect protocol. It is compatible with other DC clients, such as the original DC from Neomodus, DC++ and derivatives. EiskaltDC also interoperates with all common DC hub software.","Categories
File Sharing"
"X-Chat Aqua is X-Chat with an Aqua interface for MacOS X. X-Chat Aqua uses the irc engine from X-Chat, and is designed to look and feel like the GTK+ front end.X-Chat Aqua is X-Chat with an Aqua interface for MacOS X. X-Chat Aqua uses the irc engine from X-Chat, and is designed to look and feel like the GTK+ front end.","Categories
IRC Clients"
"NetTime is a simple, free time synchronization client for Win32, providing a client and server for SNTP and RFC868. Its main claim to fame is that it is small, simple and unobtrusive.NetTime is a simple, free time synchronization client for Win32, providing a client and server for SNTP and RFC868. Its main claim to fame is that it is small, simple and unobtrusive.","Categories
Communications, Networking, Internet"
"=========================
WEBCAMSTUDIO IS NO MORE MAINTAINED
=========================
We are looking for someone to take over.
If interested please contact:
soylent.tv@gmail.com

WebcamStudio is a multifeatured virtual webcam software that can be used with Skype or a flash website like UStream, to create a professional looking broadcast, including banners, animations, transit animations and icons, etc...

This tool is not meant as a video editor but as a live video mixer giving you the possibilities to change the look of the broadcast on the fly.

For more info about the WebcamStudio project, please visit our Wiki Home page: https://sourceforge.net/p/webcamstudio/wiki/Home/

IMPORTANT:
=======
The former homepages of the project:
http://code.google.com/p/webcamstudio
http://ws4gl.org
should be considered only as a reference to old project news, forums, info etc.
Have in mind that some of these old links may not work anymore.=========================
WEBCAMSTUDIO IS NO MORE MAINTAINED
=========================
We are looking for someone to take over.
If interested please contact:
soylent.tv@gmail.com

WebcamStudio is a multifeatured virtual webcam software that can be used with Skype or a flash website like UStream, to create a professional looking broadcast, including banners, animations, transit animations and icons, etc...

This tool is not meant as a video editor but as a live video mixer giving you the possibilities to change the look of the broadcast on the fly.

For more info about the WebcamStudio project, please visit our Wiki Home page: https://sourceforge.net/p/webcamstudio/wiki/Home/

IMPORTANT:
=======
The former homepages of the project:
http://code.google.com/p/webcamstudio
http://ws4gl.org
should be considered only as a reference to old project news, forums, info etc.
Have in mind that some of these old links may not work anymore.","Categories
Streaming, Conferencing, Audio Recording"
"Async Professional is a comprehensive communications toolkit for Embarcadero Delphi, C++Builder, & ActiveX environments. It provides direct access to serial ports, TAPI, and the Microsoft Speech API. It supports faxing, terminal emulation, VOIP, & more.Async Professional is a comprehensive communications toolkit for Embarcadero Delphi, C++Builder, & ActiveX environments. It provides direct access to serial ports, TAPI, and the Microsoft Speech API. It supports faxing, terminal emulation, VOIP, & more.","Categories
Terminals, Communications, Software Development, Networking, Internet"
"Peers is a very simple softphone. It's a SIP User-Agent, written in java, it works on windows, linux and mac. It can be used with SIP servers like opensips or asterisk IPBX. It supports G711 codec (PCMU and PCMA) and telephone-events (DTMF).Peers is a very simple softphone. It's a SIP User-Agent, written in java, it works on windows, linux and mac. It can be used with SIP servers like opensips or asterisk IPBX. It supports G711 codec (PCMU and PCMA) and telephone-events (DTMF).","Categories
Internet Phone, Telephony, Networking, Softphones"
"The open source Enterprise Content Management (ECM) software that handles any type of content, allowing users to easily share and collaborate on content.The open source Enterprise Content Management (ECM) software that handles any type of content, allowing users to easily share and collaborate on content.","Categories
File Sharing, Enterprise, Dynamic Content, Productivity"
Gpredict is a real-time satellite tracking and orbit prediction application. Gpredict can track an unlimited number of satellites and display the data in tables and various graphical view.Gpredict is a real-time satellite tracking and orbit prediction application. Gpredict can track an unlimited number of satellites and display the data in tables and various graphical view.,"Categories
Ham Radio, Astronomy, Physics"
TComPort by Dejan Crnila. Delphi/C++ Builder serial communications components. It is generally easy to use for basic Serial Communications purposes. Alternative to the TurboPower ASYNCPro at http://sourceforge.net/projects/tpapro/TComPort by Dejan Crnila. Delphi/C++ Builder serial communications components. It is generally easy to use for basic Serial Communications purposes. Alternative to the TurboPower ASYNCPro at http://sourceforge.net/projects/tpapro/,"Categories
Terminals, Communications, Hardware Drivers"
SeedDMS is an easy to use but powerful Open Source Document Management System based on PHP and MySQL or sqlite3. Many years of development has made it a mature and enterprise ready plattform for sharing and storing documents.SeedDMS is an easy to use but powerful Open Source Document Management System based on PHP and MySQL or sqlite3. Many years of development has made it a mature and enterprise ready plattform for sharing and storing documents.,"Categories
File Sharing, Document Management"
"Simple, web-based address & phone book, contact manager, organizer. Groups, addresses, e-Mails, phone numbers & birthdays. vCards, LDIF, Excel, iPhone, Gmail & Google-Maps supported. PHP / MySQL based. http://php-addressbook.sourceforge.net/demoSimple, web-based address & phone book, contact manager, organizer. Groups, addresses, e-Mails, phone numbers & birthdays. vCards, LDIF, Excel, iPhone, Gmail & Google-Maps supported. PHP / MySQL based. http://php-addressbook.sourceforge.net/demo","Categories
Email, Other/Nonlisted Topic, CRM, Social Networking"
"Claroline is collaborative learning environment based on PHP/mySQL. It allows teachers or education institutions to create and administer courses through the web. The software provides group management, forums, document repositories, calendar, SCORM,...Claroline is collaborative learning environment based on PHP/mySQL. It allows teachers or education institutions to create and administer courses through the web. The software provides group management, forums, document repositories, calendar, SCORM,...","Categories
Communications, Internet, Education, Learning Management Systems (LMS)"
"EchoVNC is a secure, ""firewall-friendly"" remote-desktop tool with support for VNC, Remote Desktop, and RAdmin servers and viewers. With it, a Windows PC or OSX Mac can be remotely accessed regardless of firewall, router or web-proxy configuration.EchoVNC is a secure, ""firewall-friendly"" remote-desktop tool with support for VNC, Remote Desktop, and RAdmin servers and viewers. With it, a Windows PC or OSX Mac can be remotely accessed regardless of firewall, router or web-proxy configuration.","Categories
Communications, Networking, Internet, Remote Desktop"
"New version stable.
The proposal was fulfilled.
REST DW was created to facilitate the creation of CRUDs in the same model that we created applications for Client / Server Database.
Today to be able to write data in a Bank via WebService is very complex for simple operations, making scheduling of simple screens time-consuming.
With REST DW, you no longer have to worry about creating SQL Insertion, Deletion, Read and Execution methods via Webservice; Simply add a RESTDataBase connection component and add a RESTClientSQL component that will already have your SQL solution fully functional as it did back in the day and with all the power of modern REST / JSON technology with data compression and everything the language can offer,
Use it, have fun, and need support.
Skype: cyber_one27@hotmail.com
I am available.

Vídeos :
https://www.youtube.com/watch?v=6FVXT36j-7U

Site/Forum: http://resteasyobjects.com.br/
Blog : http://delphitotal
License GPL - 3.0New version stable.
The proposal was fulfilled.
REST DW was created to facilitate the creation of CRUDs in the same model that we created applications for Client / Server Database.
Today to be able to write data in a Bank via WebService is very complex for simple operations, making scheduling of simple screens time-consuming.
With REST DW, you no longer have to worry about creating SQL Insertion, Deletion, Read and Execution methods via Webservice; Simply add a RESTDataBase connection component and add a RESTClientSQL component that will already have your SQL solution fully functional as it did back in the day and with all the power of modern REST / JSON technology with data compression and everything the language can offer,
Use it, have fun, and need support.
Skype: cyber_one27@hotmail.com
I am available.

Vídeos :
https://www.youtube.com/watch?v=6FVXT36j-7U

Site/Forum: http://resteasyobjects.com.br/
Blog : http://delphitotal
License GPL - 3.0","Categories
Communications, Software Development"
Project moved to https://torrent-file-editor.github.io/Project moved to https://torrent-file-editor.github.io/,"Categories
BitTorrent"
DSPAM is a scalable and open-source content-based spam filter designed for multi-user enterprise systems.DSPAM is a scalable and open-source content-based spam filter designed for multi-user enterprise systems.,"Categories
Email Spam Filter"
"Artha is a handy thesaurus based on WordNet with distinct features like global hotkey look-up, passive desktop notifications, regular expression based search, etc.. Artha may be used as a free open-source replacement to the proprietary WordWeb Pro.Artha is a handy thesaurus based on WordNet with distinct features like global hotkey look-up, passive desktop notifications, regular expression based search, etc.. Artha may be used as a free open-source replacement to the proprietary WordWeb Pro.","Categories
Communications, Education, Linguistics"
