Description,Category
"NZBGet is a usenet downloader, written in C++ and designed with performance in mind to achieve maximum download speed by using very little system resources. It supports all platforms including Windows, Mac, Linux and works on all devices including PC, NAS, WLAN routers and media players.NZBGet is a usenet downloader, written in C++ and designed with performance in mind to achieve maximum download speed by using very little system resources. It supports all platforms including Windows, Mac, Linux and works on all devices including PC, NAS, WLAN routers and media players.","Categories
NNTP, Usenet News, Other file transfer protocol"
"MailArchiva is a powerful, full featured email archiving (email archiver) and compliance solution for mail systems such as Microsoft Exchange. It stores all incoming, outgoing and internal emails for long term storage. A web based user interface is availMailArchiva is a powerful, full featured email archiving (email archiver) and compliance solution for mail systems such as Microsoft Exchange. It stores all incoming, outgoing and internal emails for long term storage. A web based user interface is avail","Categories
Email Spam Filter, Mail Transfer Agents, Enterprise, Data Warehousing, Database, Security"
"CuteFlow is a webbased document circulation/workflow tool. Users are able to define ""documents"" which are send step by step to every user in a list. It's an electronical way for doing (i.e. internal) document circulations.CuteFlow is a webbased document circulation/workflow tool. Users are able to define ""documents"" which are send step by step to every user in a list. It's an electronical way for doing (i.e. internal) document circulations.","Categories
Email, Office/Business"
"A Web-based Usenet News Reader written by PHP, support NNTP/NNRP access to News Server. Authentication can be easily configured with flexibility. It also supports the charset conversion between different Chinese charsets, both Traditional and Simplified.A Web-based Usenet News Reader written by PHP, support NNTP/NNRP access to News Server. Authentication can be easily configured with flexibility. It also supports the charset conversion between different Chinese charsets, both Traditional and Simplified.","Categories
Usenet News, Message Board"
"Easy to use, easy to install, actively maintained and actively supported, phpseclib is the best way to utilize SSH, SFTP and RSA in PHP.Easy to use, easy to install, actively maintained and actively supported, phpseclib is the best way to utilize SSH, SFTP and RSA in PHP.","Categories
Communications"
"dcm4che is an implementation of DICOM and IHE actors in Java. Homepage: http://www.dcm4che.org, Google Group: http://groups.google.com/group/dcm4che?hl=en, Wiki: http://www.dcm4che.org/confluence, Issue Tracking: http://www.dcm4che.org/jiradcm4che is an implementation of DICOM and IHE actors in Java. Homepage: http://www.dcm4che.org, Google Group: http://groups.google.com/group/dcm4che?hl=en, Wiki: http://www.dcm4che.org/confluence, Issue Tracking: http://www.dcm4che.org/jira","Categories
Communications, Graphics, Medical"
"FileBot is the ultimate tool for renaming your movies, tv shows or anime and downloading subtitles. It's smart, streamlined for simplicity and just works. FileBot supports Windows, Linux and Mac, plus there's a full-featured command-line interface for all sorts of automation.FileBot is the ultimate tool for renaming your movies, tv shows or anime and downloading subtitles. It's smart, streamlined for simplicity and just works. FileBot supports Windows, Linux and Mac, plus there's a full-featured command-line interface for all sorts of automation.","Categories
File Sharing, File Managers, Cataloguing"
"Modbus TCP, Modbus UDP and Modbus RTU client/server library for .NET

Supports Function Codes:

- Read Coils (FC1)
- Read Discrete Inputs (FC2)
- Read Holding Registers (FC3)
- Read Input Registers (FC4)
- Write Single Coil (FC5)
- Write Single Register (FC6)
- Write Multiple Coils (FC15)
- Write Multiple Registers (FC16)

V5.6: Upload lates version
- This will probably the last version for .NET Framework 4.0
- The next Version will be based on new .NET5 and redesigned

V5.5: Bugfixes and MQTT Bridge removed

V5.0: Major Bugfixes and Event Handlers changed

V4.4 HF1: Bugfix excessive CPU-Load Modbus TCP Server

V4.4: Bugfix Modbus RTU and MQTT

V4.3: Bugfixes Modbus RTU
Webview for Modbus Server Simulator and MQTT functionality for ServerModbus TCP, Modbus UDP and Modbus RTU client/server library for .NET

Supports Function Codes:

- Read Coils (FC1)
- Read Discrete Inputs (FC2)
- Read Holding Registers (FC3)
- Read Input Registers (FC4)
- Write Single Coil (FC5)
- Write Single Register (FC6)
- Write Multiple Coils (FC15)
- Write Multiple Registers (FC16)

V5.6: Upload lates version
- This will probably the last version for .NET Framework 4.0
- The next Version will be based on new .NET5 and redesigned

V5.5: Bugfixes and MQTT Bridge removed

V5.0: Major Bugfixes and Event Handlers changed

V4.4 HF1: Bugfix excessive CPU-Load Modbus TCP Server

V4.4: Bugfix Modbus RTU and MQTT

V4.3: Bugfixes Modbus RTU
Webview for Modbus Server Simulator and MQTT functionality for Server","Categories
Communications, Software Development, Scientific/Engineering"
"This is an archive for old versions of OpenEMM. You will find the latest version of OpenEMM here: https://wiki.openemm.org

OpenEMM is a browser-based enterprise application for email automation like info and marketing newsletters, transaction mails or multi-stage email campaigns.

OpenEMM offers tons of features for professional users, among them: a great user interface, template-based HTML mailings, automatic bounce management, mail opening and link tracking, lots of graphical realtime statistics, a content management system, self-defined and behaviour-based target groups, a multi-queue mail backend for maximum sending performance, a time-driven automated data import and export feature, an extensive set of webservices, a plugin interface to easily extend the core functionality, a scripting feature to enhance the functionality of OpenEMM with triggerable customized actions and an audit-proof user activity log.This is an archive for old versions of OpenEMM. You will find the latest version of OpenEMM here: https://wiki.openemm.org

OpenEMM is a browser-based enterprise application for email automation like info and marketing newsletters, transaction mails or multi-stage email campaigns.

OpenEMM offers tons of features for professional users, among them: a great user interface, template-based HTML mailings, automatic bounce management, mail opening and link tracking, lots of graphical realtime statistics, a content management system, self-defined and behaviour-based target groups, a multi-queue mail backend for maximum sending performance, a time-driven automated data import and export feature, an extensive set of webservices, a plugin interface to easily extend the core functionality, a scripting feature to enhance the functionality of OpenEMM with triggerable customized actions and an audit-proof user activity log.","Categories
Mailing List Servers, CRM, Marketing Automation"
"Free Windows Mbox Viewer.
Gain access to mbox archives or single eml messages.
View attachments and export single mails in eml format.
Access large box files such as Google Takeout or Mozilla Thunderbird Archives.

Development of mbox viewer continues now at github: https://github.com/eneam/mboxviewer

**NOTE**: Windows Defender may sometimes report incorrectly that mbox-viewer contains malware. Please report the case to the development. Development will ask Windows Security to update Windows Defender rules to resolve the issue. Last time the incorrect detection was corrected by Microsoft Security within few hours. User will need to run Windows Update to install the latest updated detection rules.Free Windows Mbox Viewer.
Gain access to mbox archives or single eml messages.
View attachments and export single mails in eml format.
Access large box files such as Google Takeout or Mozilla Thunderbird Archives.

Development of mbox viewer continues now at github: https://github.com/eneam/mboxviewer

**NOTE**: Windows Defender may sometimes report incorrectly that mbox-viewer contains malware. Please report the case to the development. Development will ask Windows Security to update Windows Defender rules to resolve the issue. Last time the incorrect detection was corrected by Microsoft Security within few hours. User will need to run Windows Update to install the latest updated detection rules.","Categories
Email Clients"
"SSVNC adds encryption security to VNC. It provides a GUI for Windows, MacOSX, and Unix that automatically starts up an SSL or SSH tunnel for connections to any VNC server. It also supports VeNCrypt encryption. The Unix viewer has many new features.SSVNC adds encryption security to VNC. It provides a GUI for Windows, MacOSX, and Unix that automatically starts up an SSL or SSH tunnel for connections to any VNC server. It also supports VeNCrypt encryption. The Unix viewer has many new features.","Categories
Terminal Emulators, Conferencing"
"Addon for Mozilla Thunderbird and SeaMonkey providing OpenPGP-based encryption and authentication.

Enigmail requires GnuPG.Addon for Mozilla Thunderbird and SeaMonkey providing OpenPGP-based encryption and authentication.

Enigmail requires GnuPG.","Categories
Email"
"playSMS is a free and open source SMS management software, a web interface for SMS gateways and bulk SMS services.playSMS is a free and open source SMS management software, a web interface for SMS gateways and bulk SMS services.","Categories
Communications, WWW/HTTP, Mobile"
"Please note that OWFS source code, and all Issue/Tickets/merge requests have now been moved to https://github.com/owfs/owfs/.

Developer mailing lists will still be kept at Sourceforge.
----
OWFS -- 1-Wire file system. Use the Dallas 1-Wire and iButton chips with standard filesystem commands. Create temperature loggers. Monitor everything. OWHTTPD -- same system, only used as a light weight web server. OWFS is also ported to embedded routers, Mac OSX and Windows.

Basically you can use these inexpensive little sensors and other chips with very simple wiring to sense and control the physical environment. The interface is very flexible -- everything from a web browser, to read and writing directly to the chip's ""file"" to integrating with your programs -- even over the internet.

There is a growing number of 1-wire sensors: temperature, voltage, humidity, light, ultraviolet, pressure, thermisters, thermocouples, programmable microcontrollers, relays, lights, LCD panels, etcPlease note that OWFS source code, and all Issue/Tickets/merge requests have now been moved to https://github.com/owfs/owfs/.

Developer mailing lists will still be kept at Sourceforge.
----
OWFS -- 1-Wire file system. Use the Dallas 1-Wire and iButton chips with standard filesystem commands. Create temperature loggers. Monitor everything. OWHTTPD -- same system, only used as a light weight web server. OWFS is also ported to embedded routers, Mac OSX and Windows.

Basically you can use these inexpensive little sensors and other chips with very simple wiring to sense and control the physical environment. The interface is very flexible -- everything from a web browser, to read and writing directly to the chip's ""file"" to integrating with your programs -- even over the internet.

There is a growing number of 1-wire sensors: temperature, voltage, humidity, light, ultraviolet, pressure, thermisters, thermocouples, programmable microcontrollers, relays, lights, LCD panels, etc","Categories
Communications, WWW/HTTP, Logging, Hardware Drivers, File Systems, Scientific/Engineering"
"Network Security Toolkit (NST) is a bootable ISO image (Live USB Flash Drive) based on Fedora 36 providing easy access to best-of-breed Open Source Network Security Applications and should run on most x86_64 systems.

The main intent of developing this toolkit was to provide the security professional and network administrator with a comprehensive set of Open Source Network Security Tools. The majority of tools published in the article: Top 125 Security Tools by INSECURE.ORG are available in the toolkit. An advanced Web User Interface (WUI) is provided for system/network administration, navigation, automation, network monitoring, host geolocation, network analysis and configuration of many network and security applications found within the NST distribution. In the virtual world, NST can be used as a network security analysis, validation and monitoring tool on enterprise virtual servers hosting virtual machines.Network Security Toolkit (NST) is a bootable ISO image (Live USB Flash Drive) based on Fedora 36 providing easy access to best-of-breed Open Source Network Security Applications and should run on most x86_64 systems.

The main intent of developing this toolkit was to provide the security professional and network administrator with a comprehensive set of Open Source Network Security Tools. The majority of tools published in the article: Top 125 Security Tools by INSECURE.ORG are available in the toolkit. An advanced Web User Interface (WUI) is provided for system/network administration, navigation, automation, network monitoring, host geolocation, network analysis and configuration of many network and security applications found within the NST distribution. In the virtual world, NST can be used as a network security analysis, validation and monitoring tool on enterprise virtual servers hosting virtual machines.","Categories
Communications, Security, Systems Administration, Internet"
"Multiuser HylaFAX PHP/MySQL Web interface for viewing faxes online, downloading & emailing in PDF format, and categorizing & archiving all sent and received faxes.Multiuser HylaFAX PHP/MySQL Web interface for viewing faxes online, downloading & emailing in PDF format, and categorizing & archiving all sent and received faxes.","Categories
Fax, OCR"
RSS to FidoNet (rss2fido) by_Rain 27/09-2006g. The program is designed to track new items RSS and forming specially messages to FidoNet.RSS to FidoNet (rss2fido) by_Rain 27/09-2006g. The program is designed to track new items RSS and forming specially messages to FidoNet.,"Categories
FIDO"
"This project implements a simple STUN server and client on Windows, Linux, and Solaris. The STUN protocol (Simple Traversal of UDP through NATs) is described in the IETF RFC 3489, available at http://www.ietf.org/rfc/rfc3489.txtThis project implements a simple STUN server and client on Windows, Linux, and Solaris. The STUN protocol (Simple Traversal of UDP through NATs) is described in the IETF RFC 3489, available at http://www.ietf.org/rfc/rfc3489.txt","Categories
Internet Phone, Telephony, Networking, Internet"
"Kraken is a continuation of the Openfire IM Gateway plugin, but in a way that works for any XMPP server. It provides a way for XMPP users to log into, and communicate through, their legacy IM accounts such as AIM, ICQ, MSN, Yahoo, and friends.Kraken is a continuation of the Openfire IM Gateway plugin, but in a way that works for any XMPP server. It provides a way for XMPP users to log into, and communicate through, their legacy IM accounts such as AIM, ICQ, MSN, Yahoo, and friends.","Categories
MSN Messenger, AOL Instant Messenger, IRC Clients, ICQ, XMPP, Messaging"
"MicroPlanet Gravity is a full featured Usenet News Client, newsreader, for Windows XP, Vista and Win7 (32 and 64 bit). Easy to use and highly customizable with binaries support. Also provides the advanced user with rules, scoring and filtering.MicroPlanet Gravity is a full featured Usenet News Client, newsreader, for Windows XP, Vista and Win7 (32 and 64 bit). Easy to use and highly customizable with binaries support. Also provides the advanced user with rules, scoring and filtering.","Categories
Usenet News"
openCRX moved to https://github.com/opencrxopenCRX moved to https://github.com/opencrx,"Categories
File Sharing, CRM, ERP, Calendar"
"Remote control software for applications using Bluetooth or Wi-Fi.

anyRemote supports wide range of modern cell phones line Nokia, SonyEricsson, Motorola, majority of Android phones and others.Remote control software for applications using Bluetooth or Wi-Fi.

anyRemote supports wide range of modern cell phones line Nokia, SonyEricsson, Motorola, majority of Android phones and others.","Categories
Telephony, Wireless"
"Mobicents is the leading Open Source VoIP Platform. It is the First and Only Open Source Certified implementation of JSLEE 1.1 (JSR 240), and SIP Servlets 1.1 (JSR 289). Mobicents also includes a powerful and extensible Media Server.Mobicents is the leading Open Source VoIP Platform. It is the First and Only Open Source Certified implementation of JSLEE 1.1 (JSR 240), and SIP Servlets 1.1 (JSR 289). Mobicents also includes a powerful and extensible Media Server.","Categories
VoIP, Video Conferencing"
"With HelloNzb you can download (binary) files from Usenet servers via NZB index files. The software is based on Java and can thus run on many platforms (tested on Windows and Linux). Automatic archive verification via PAR2, automatic RAR archive extraction, built-in yEnc- and UU-decoding. Portable, no installation required.With HelloNzb you can download (binary) files from Usenet servers via NZB index files. The software is based on Java and can thus run on many platforms (tested on Windows and Linux). Automatic archive verification via PAR2, automatic RAR archive extraction, built-in yEnc- and UU-decoding. Portable, no installation required.","Categories
NNTP, Usenet News"
"The NCID (Network Caller ID) project is Caller ID (CID) distributed over a network. The project contains the NCID package and 4 optional client packages. Each package is described at the NCID web site. A non-inclusive list of 3rd party addons is also available at the web site

Available Packages:
NCID - contains the server, gateways, and a client with output modules
LCDncid - a client that uses LCDproc to display Caller ID on a LCD display
NCIDandroid - a client and gateway for Android devices
NCIDdisplay - a homebrew client that displays on large LED modules
NCIDpop - a popup client for Windows, Mac, and LinuxThe NCID (Network Caller ID) project is Caller ID (CID) distributed over a network. The project contains the NCID package and 4 optional client packages. Each package is described at the NCID web site. A non-inclusive list of 3rd party addons is also available at the web site

Available Packages:
NCID - contains the server, gateways, and a client with output modules
LCDncid - a client that uses LCDproc to display Caller ID on a LCD display
NCIDandroid - a client and gateway for Android devices
NCIDdisplay - a homebrew client that displays on large LED modules
NCIDpop - a popup client for Windows, Mac, and Linux","Categories
Telephony, Internet"
"An open source bluetooth stack for Linux (and other operating systems). Support for SDP/L2CAP/RFCOMM.

No further development is expected for this project as BlueZ has taken the official role as bluetooth stack for Linux.An open source bluetooth stack for Linux (and other operating systems). Support for SDP/L2CAP/RFCOMM.

No further development is expected for this project as BlueZ has taken the official role as bluetooth stack for Linux.","Categories
Communications, Networking"
"전자문서 유통 클라이언트 기술규격(v2.0)을 만족하는 유통 클라이언트 API 구현 프로젝트입니다. 이 프로젝트의 결과물을 이용하여 유통 메시징 서버(#메일 서버)의 클라이언트를 제작할 수 있는데 본 프로젝트에서는 클라이언트 API를 이용하여 안드로이드 용 앱을 구현하여 공개합니다.

클라이언트 API는 ecc-open-sdk이며, 안드로이드 용 앱은 오픈 #메일입니다. 구글플레이에서 ""오픈 #메일""을 검색하세요.

Twitter : https://twitter.com/OpenSharpMail
Facebook : https://www.facebook.com/OpenSharpMail전자문서 유통 클라이언트 기술규격(v2.0)을 만족하는 유통 클라이언트 API 구현 프로젝트입니다. 이 프로젝트의 결과물을 이용하여 유통 메시징 서버(#메일 서버)의 클라이언트를 제작할 수 있는데 본 프로젝트에서는 클라이언트 API를 이용하여 안드로이드 용 앱을 구현하여 공개합니다.

클라이언트 API는 ecc-open-sdk이며, 안드로이드 용 앱은 오픈 #메일입니다. 구글플레이에서 ""오픈 #메일""을 검색하세요.

Twitter : https://twitter.com/OpenSharpMail
Facebook : https://www.facebook.com/OpenSharpMail","Categories
Communications"
"Zentyal Server is an easy to use and affordable Linux server, specially designed to meet the needs of small and medium businesses

Thanks to Zentyal's Samba integration, Zentyal provides native compatibility with Microsoft Active Directory, allowing you to join Microsoft clients to a domain and manage them easily.

Zentyal Server incorporates all the network services required in a small and medium business environment:

* Directory & Domain Server with native compatibility with Microsoft Active Directory
* Mail Server with ActiveSync and webmail
* Gateway with firewall and proxy
* Infrastructure Server with DNS/DHCP server, Certification Authority and Virtual Private Networks

For more information and download, please access the project's home page.Zentyal Server is an easy to use and affordable Linux server, specially designed to meet the needs of small and medium businesses

Thanks to Zentyal's Samba integration, Zentyal provides native compatibility with Microsoft Active Directory, allowing you to join Microsoft clients to a domain and manage them easily.

Zentyal Server incorporates all the network services required in a small and medium business environment:

* Directory & Domain Server with native compatibility with Microsoft Active Directory
* Mail Server with ActiveSync and webmail
* Gateway with firewall and proxy
* Infrastructure Server with DNS/DHCP server, Certification Authority and Virtual Private Networks

For more information and download, please access the project's home page.","Categories
Email, Calendar, Authentication/Directory, Email Servers"
"SmartCam - Smart Phone Web Camera - Turns a camera phone (S60, WinMo6.x, Android, Samsung Bada) with bluetooth or WiFi into a handy webcam ready to use with your PCSmartCam - Smart Phone Web Camera - Turns a camera phone (S60, WinMo6.x, Android, Samsung Bada) with bluetooth or WiFi into a handy webcam ready to use with your PC","Categories
Streaming, Digital Camera, Mobile"
"Nokia NBU, NBF, NFB, NFC and ARC backup file parser, extractor and viewer. It can help you to check content of backup or extract files from it. Requires MS .Net Framework 2Nokia NBU, NBF, NFB, NFC and ARC backup file parser, extractor and viewer. It can help you to check content of backup or extract files from it. Requires MS .Net Framework 2","Categories
Data Formats, Telephony, Mobile"
Halite is an open-source BitTorrent client and is based on the excellent libtorrent library from Rasterbar Software. The remote control interface for Halite has been put on the back burner while the more pressing features that a bittorrent client needs.Halite is an open-source BitTorrent client and is based on the excellent libtorrent library from Rasterbar Software. The remote control interface for Halite has been put on the back burner while the more pressing features that a bittorrent client needs.,"Categories
BitTorrent"
"Megacubo is an intuitive, multi-language and cross-platform IPTV player with support for history, bookmarks and much more.

You can add as many IPTV lists you want (M3U format) and record live broadcasts to your PC or device.

With Miniplayer mode, you can work or navigate on your PC while watching any broadcast.Megacubo is an intuitive, multi-language and cross-platform IPTV player with support for history, bookmarks and much more.

You can add as many IPTV lists you want (M3U format) and record live broadcasts to your PC or device.

With Miniplayer mode, you can work or navigate on your PC while watching any broadcast.","Categories
Streaming, Other/Nonlisted Topic"
