Description,Category
"EHR/EMR cross-platform software for the design, implementation and use of autonomous, open, database models for multilingual medical knowledge management systems from primary care to continuing care.EHR/EMR cross-platform software for the design, implementation and use of autonomous, open, database models for multilingual medical knowledge management systems from primary care to continuing care.","Categories
Database, Medical, Knowledge Management"
"R portable configures R to work with the PortableApps framework, so that R can be ran from a thumb drive or portable hard drive without leaving artifacts on the computer.R portable configures R to work with the PortableApps framework, so that R can be ran from a thumb drive or portable hard drive without leaving artifacts on the computer.","Categories
Statistics"
"Java Marine API is an NMEA 0183 library for Java.

For furher info and latest source code, see project's Github pages.

http://github.com/ktuukkan/marine-api/Java Marine API is an NMEA 0183 library for Java.

For furher info and latest source code, see project's Github pages.

http://github.com/ktuukkan/marine-api/","Categories
Data Formats, Libraries, GPS"
"Variant detection in massively parallel sequencing. For one sample, calls SNPs, indels, and consensus genotypes. For tumor-normal pairs, further classifies each variant as Germline, Somatic, or LOH, and also detects somatic copy number changes. THE LATEST VERSION IS AVAILABLE ON GITHUBVariant detection in massively parallel sequencing. For one sample, calls SNPs, indels, and consensus genotypes. For tumor-normal pairs, further classifies each variant as Germline, Somatic, or LOH, and also detects somatic copy number changes. THE LATEST VERSION IS AVAILABLE ON GITHUB","Categories
Bio-Informatics"
This is a simple BACnet Server aimed at developers who want to explore or test their BACnet Client implementations of the ASHRAE BACnet protocol. It is based on Steve Karg's fine implementation of the BACnet Stack.This is a simple BACnet Server aimed at developers who want to explore or test their BACnet Client implementations of the ASHRAE BACnet protocol. It is based on Steve Karg's fine implementation of the BACnet Stack.,"Categories
Data Formats, SCADA"
"A memory device programmer (Flash / EPROM / E2PROM) board and software, connected to PC by USB port. Placa e software para gravação de memórias (Flash / EPROM / E2PROM), conectada ao PC através de porta USB.A memory device programmer (Flash / EPROM / E2PROM) board and software, connected to PC by USB port. Placa e software para gravação de memórias (Flash / EPROM / E2PROM), conectada ao PC através de porta USB.","Categories
Hardware, Embedded Systems, Test and Measurement"
"asciiTeX is an ASCII equation renderer, i.e., it can generate ASCII-art representations of mathematical formula's. You can use asciiTeX to quickly insert equations in e.g. e-mails, in comments in your source-code, etc. The syntax is similar to LaTeXasciiTeX is an ASCII equation renderer, i.e., it can generate ASCII-art representations of mathematical formula's. You can use asciiTeX to quickly insert equations in e.g. e-mails, in comments in your source-code, etc. The syntax is similar to LaTeX","Categories
Scientific/Engineering"
Machine Learning framework in PythonMachine Learning framework in Python,"Categories
Machine Learning"
The tools in this package allow conversion of tracts from one CAMINO to TRACKVIS and vice versa in a very effective way with ability to handle over a million tracts.The tools in this package allow conversion of tracts from one CAMINO to TRACKVIS and vice versa in a very effective way with ability to handle over a million tracts.,"Categories
Interface Engine/Protocol Translator"
Msieve is a C library implementing a suite of algorithms to factor large integers. It contains an implementation of the SIQS and GNFS algorithms; the latter has helped complete some of the largest public factorizations knownMsieve is a C library implementing a suite of algorithms to factor large integers. It contains an implementation of the SIQS and GNFS algorithms; the latter has helped complete some of the largest public factorizations known,"Categories
Cryptography, Mathematics"
TML has moved to http://www.villalon.cl/tml.html and the code to https://github.com/villalon/tmlTML has moved to http://www.villalon.cl/tml.html and the code to https://github.com/villalon/tml,"Categories
Artificial Intelligence, Linguistics, Research"
Neuroph OCR - Handwriting Recognition is developed to recognize hand written letter and characters. It's engine derived's from the Java Neural Network Framework - Neuroph and as such it can be used as a standalone project or a Neuroph plug in.Neuroph OCR - Handwriting Recognition is developed to recognize hand written letter and characters. It's engine derived's from the Java Neural Network Framework - Neuroph and as such it can be used as a standalone project or a Neuroph plug in.,"Categories
Frameworks, Handwriting Recognition, Machine Learning, OCR, Neural Network Libraries"
"INDI is an instrument neutral distributed interface control protocol that aims to provide backend driver support and automation for a wide range of Astronomical devices (telescopes, focusers, CCDs..etc).

Project migrated to Github: https://github.com/indilib/indiINDI is an instrument neutral distributed interface control protocol that aims to provide backend driver support and automation for a wide range of Astronomical devices (telescopes, focusers, CCDs..etc).

Project migrated to Github: https://github.com/indilib/indi","Categories
Hardware Drivers, Interface Engine/Protocol Translator, Astronomy"
"A simple API suite to send and receive SMS messages with an ETSI 07.05 compatible GSM phone/terminal (in PDU mode)
Tested with serial, irda and USB (via cdc-acm kernel driver)A simple API suite to send and receive SMS messages with an ETSI 07.05 compatible GSM phone/terminal (in PDU mode)
Tested with serial, irda and USB (via cdc-acm kernel driver)","Categories
Software Development, Scientific/Engineering"
"JsMath is a means of including mathematical notation in web pages. It interprets TeX code within your document and uses JavaScript, CSS and unicode fonts to typeset the resulting formulas. It works across multiple browsers and platforms, without MathMLJsMath is a means of including mathematical notation in web pages. It interprets TeX code within your document and uses JavaScript, CSS and unicode fonts to typeset the resulting formulas. It works across multiple browsers and platforms, without MathML","Categories
Message Board, Mathematics"
This project aims a proving an Hardware as a VSCP node (M2M) to store information remotely on the CAN network.This project aims a proving an Hardware as a VSCP node (M2M) to store information remotely on the CAN network.,"Categories
Serial, Emulators, Log Rotation, Embedded Systems, Test and Measurement"
"BioPAX is a standard language for integration, exchange, visualization and analysis of biological pathway data. BioPAX supports data exchange between pathway data groups and thus reduces the complexity of interchange between data formats by providing an accepted standard format for pathway data. By offering a standard, with well-defined semantics for pathway representation, BioPAX allows pathway databases and software to interact more efficiently. In addition, BioPAX enables the development of pathway visualization from databases and facilitates analysis of experimentally generated data through combination with prior knowledge. The BioPAX effort is coordinated closely with that of other pathway related standards initiatives namely; PSI-MI, SBML, CellML, and SBGN in order to deliver a compatible standard in the areas where they overlap.BioPAX is a standard language for integration, exchange, visualization and analysis of biological pathway data. BioPAX supports data exchange between pathway data groups and thus reduces the complexity of interchange between data formats by providing an accepted standard format for pathway data. By offering a standard, with well-defined semantics for pathway representation, BioPAX allows pathway databases and software to interact more efficiently. In addition, BioPAX enables the development of pathway visualization from databases and facilitates analysis of experimentally generated data through combination with prior knowledge. The BioPAX effort is coordinated closely with that of other pathway related standards initiatives namely; PSI-MI, SBML, CellML, and SBGN in order to deliver a compatible standard in the areas where they overlap.","Categories
Bio-Informatics"
"A speech synthesis and recognition library that is cross-platform, accessible from Java and C++, and has a very small API. Uses CMU Sphinx4 and FreeTTS internally.A speech synthesis and recognition library that is cross-platform, accessible from Java and C++, and has a very small API. Uses CMU Sphinx4 and FreeTTS internally.","Categories
Games/Entertainment, User Interface (UI), Robotics, HMI, Speech"
TRMSim-WSN (Trust and Reputation Models Simulator for Wireless Sensor Networks) is a Java-based simulator aimed to test Trust and Reputation models for WSNs. It provides several Trust and Reputation models and new ones can be easily added.TRMSim-WSN (Trust and Reputation Models Simulator for Wireless Sensor Networks) is a Java-based simulator aimed to test Trust and Reputation models for WSNs. It provides several Trust and Reputation models and new ones can be easily added.,"Categories
Security, Frameworks, User Interface (UI), Benchmark, Simulation, Bio-Informatics"
"EQAlign born as a software that assists to align a German Equatorial Mount (GEM) exactly to the Earth polar axis. Today, in adition to polar align feature, EQAlign is a full featured astronomical software.EQAlign born as a software that assists to align a German Equatorial Mount (GEM) exactly to the Earth polar axis. Today, in adition to polar align feature, EQAlign is a full featured astronomical software.","Categories
Astronomy"
The Orientation Library is a collection of routines for rotation/orientation manipulation. It ranges from general tools to others for crystal orientations. It is written in C and is well-documented. An interactive program enables to run the routines.The Orientation Library is a collection of routines for rotation/orientation manipulation. It ranges from general tools to others for crystal orientations. It is written in C and is well-documented. An interactive program enables to run the routines.,"Categories
Simulation, Mathematics, Physics"
"xc3sprog is a suite of utilities for programming Xilinx FPGAs, CPLDs, and EEPROMs with the Xilinx Parallel Cable and other JTAG adapters under linux. Originally based on code written by Andrew Rogers (http://www.rogerstech.co.uk/ ).xc3sprog is a suite of utilities for programming Xilinx FPGAs, CPLDs, and EEPROMs with the Xilinx Parallel Cable and other JTAG adapters under linux. Originally based on code written by Andrew Rogers (http://www.rogerstech.co.uk/ ).","Categories
Electronic Design Automation (EDA)"
"Defraser is a forensic analysis application that can be used to detect full and partial multimedia files in datastreams. It is typically used to find (and restore) complete or partial video files in datastreams (for instance, unallocated diskspace).Defraser is a forensic analysis application that can be used to detect full and partial multimedia files in datastreams. It is typically used to find (and restore) complete or partial video files in datastreams (for instance, unallocated diskspace).","Categories
Data Formats, Information Analysis, Video"
"Siril is an astronomical image processing software for Linux. Dev here is stopped: as of 2013/02, Siril development has moved and is regaining activity here https://free-astro.org/index.php?title=SirilSiril is an astronomical image processing software for Linux. Dev here is stopped: as of 2013/02, Siril development has moved and is regaining activity here https://free-astro.org/index.php?title=Siril","Categories
Astronomy"
The bflow* Toolbox is an open source tool kit for business process management. The objective of bflow* is to explore new ways and scenarios for the development and use of modelling tools.The bflow* Toolbox is an open source tool kit for business process management. The objective of bflow* is to explore new ways and scenarios for the development and use of modelling tools.,"Categories
UML, Simulation, Exam, Workflow Management, Business Performance Management"
LaserCalc is an Open Source wxWidgets application for the calculation of optical beam paths and laser resonators based on Gaussian beam matrix optics. In addition beam paths can be optimized to match given beam parameters (mode matching).LaserCalc is an Open Source wxWidgets application for the calculation of optical beam paths and laser resonators based on Gaussian beam matrix optics. In addition beam paths can be optimized to match given beam parameters (mode matching).,"Categories
Simulation, Physics"
"UMLet is an open-source Java tool for rapidly drawing UML diagrams, with a focus on a sound and pop-up-free user interface. Its homepage is www.umlet.com.UMLet is an open-source Java tool for rapidly drawing UML diagrams, with a focus on a sound and pop-up-free user interface. Its homepage is www.umlet.com.","Categories
UML, Data Visualization"
"An Open Source IEC 61131-3 Integrated Development Environment, providing PLCOpen SoftPLC programming, CanOpen IO's, and SVG based HMI.An Open Source IEC 61131-3 Integrated Development Environment, providing PLCOpen SoftPLC programming, CanOpen IO's, and SVG based HMI.","Categories
Other/Nonlisted Topic, Compilers, Robotics, Simulation, Data Visualization, HMI"
"A fixed point math header-library for C, under a liberal license.A fixed point math header-library for C, under a liberal license.","Categories
Mathematics, Embedded Systems, Libraries"
"OpenMEDIS is a simple, flexible, and standardized tool to collect (inventory) and process (manage) information on health technology infrastructure, e.g. medical devices in low- and middle income countries.

The latest source code is available in the folder Code/trunk. There are also sub-projects of openMEDIS that contain the source-code of installations in each country.OpenMEDIS is a simple, flexible, and standardized tool to collect (inventory) and process (manage) information on health technology infrastructure, e.g. medical devices in low- and middle income countries.

The latest source code is available in the folder Code/trunk. There are also sub-projects of openMEDIS that contain the source-code of installations in each country.","Categories
Data Warehousing, Front-Ends, Information Analysis"
Astrology software inspired by the SYMBOLON deck. This software calculates the planet positions and make symbolon card tables according to the calculated constellation. It can draw the classical circular horoscope also.Astrology software inspired by the SYMBOLON deck. This software calculates the planet positions and make symbolon card tables according to the calculated constellation. It can draw the classical circular horoscope also.,"Categories
New Age, Astronomy"
Both forward-chaining and backward-chaining rules (which may include python code) are compiled into python. Can also automatically assemble python programs out of python functions which are attached to backward-chaining rules. See pyke.sourceforge.neBoth forward-chaining and backward-chaining rules (which may include python code) are compiled into python. Can also automatically assemble python programs out of python functions which are attached to backward-chaining rules. See pyke.sourceforge.ne,"Categories
Code Generators, Software Distribution, Installation/Setup, Artificial Intelligence"
"Foma is a compiler, programming language, and C library for constructing finite-state automata and transducers for various uses. It has specific support for many natural language processing applications such as producing morphological analyzers.Foma is a compiler, programming language, and C library for constructing finite-state automata and transducers for various uses. It has specific support for many natural language processing applications such as producing morphological analyzers.","Categories
Code Generators, Compilers, Mathematics"
"OpenFOAM - The Open Source CFD Toolbox. OpenFOAM is a generic, programmable software tool for Computational Fluid Dynamics (CFD). For more information, see:
- Main Website: https://openfoam.org
- C++ Source Documentation: https://cpp.openfoam.org
- Issue (Bug) Tracking: https://bugs.openfoam.org
- User Guide: https://cfd.direct/openfoam/user-guideOpenFOAM - The Open Source CFD Toolbox. OpenFOAM is a generic, programmable software tool for Computational Fluid Dynamics (CFD). For more information, see:
- Main Website: https://openfoam.org
- C++ Source Documentation: https://cpp.openfoam.org
- Issue (Bug) Tracking: https://bugs.openfoam.org
- User Guide: https://cfd.direct/openfoam/user-guide","Categories
Simulation, Computational Fluid Dynamics (CFD)"
Cewolf is a tag library for charts of all kinds. It enables every JSP to easily embed chart images. It can be used by any web applications running in a servlet container. No Java scriplet code is needed to define charts.Cewolf is a tag library for charts of all kinds. It enables every JSP to easily embed chart images. It can be used by any web applications running in a servlet container. No Java scriplet code is needed to define charts.,"Categories
Dynamic Content, Graphics, Data Visualization"
MyHDL is a Python package for using Python as a hardware description and verification language.MyHDL is a Python package for using Python as a hardware description and verification language.,"Categories
Electronic Design Automation (EDA)"
The project has moved on Google Code: http://code.google.com/p/beagle.The project has moved on Google Code: http://code.google.com/p/beagle.,"Categories
Artificial Intelligence"
"The Napkin Look and Feel is a pluggable Java look and feel that looks like it was scrawled on a napkin. You can use it to make provisional work actually look provisonal, or just for fun.The Napkin Look and Feel is a pluggable Java look and feel that looks like it was scrawled on a napkin. You can use it to make provisional work actually look provisonal, or just for fun.","Categories
Software Development, Presentation, HMI"
"OptFrame is a framework for efficient implementation of metaheuristics and optimization methods. It has already been used in some real combinatorial problems and applied to Operations Research. Since November 2017, project has been moved to GitHub (new releases will also be included here in SourceForge, but Git mainline is no longer supported here). For more information, visit: https://github.com/OptFrame/optframeOptFrame is a framework for efficient implementation of metaheuristics and optimization methods. It has already been used in some real combinatorial problems and applied to Operations Research. Since November 2017, project has been moved to GitHub (new releases will also be included here in SourceForge, but Git mainline is no longer supported here). For more information, visit: https://github.com/OptFrame/optframe","Categories
Frameworks, Scientific/Engineering, Libraries"
"open2300 - reads/writes data from the Lacrosse WS2300 family of weather stations. Includes tools that send data to: logfiles, webpages with graphs, XML file, MySQL, Weather Underground, Citizen Weather. Library of 50+ functions for your own programs (C)open2300 - reads/writes data from the Lacrosse WS2300 family of weather stations. Includes tools that send data to: logfiles, webpages with graphs, XML file, MySQL, Weather Underground, Citizen Weather. Library of 50+ functions for your own programs (C)","Categories
Hardware Drivers, Physics"
JSci is a set of open source Java packages. The aim is to encapsulate scientific methods/principles in the most natural way possible. As such they should greatly aid the development of scientific based software.JSci is a set of open source Java packages. The aim is to encapsulate scientific methods/principles in the most natural way possible. As such they should greatly aid the development of scientific based software.,"Categories
Mathematics"
"Arrowmatcher is a ballistics software for crossbow archers. It can calculate the speed, kinetic energy, trajectory, aiming solution and much more of an arrow (or bullet). It uses a simplified 6 degree of freedom model.Arrowmatcher is a ballistics software for crossbow archers. It can calculate the speed, kinetic energy, trajectory, aiming solution and much more of an arrow (or bullet). It uses a simplified 6 degree of freedom model.","Categories
Data Visualization, Physics"
"Radiation detection and measurement education is necessary for a wide variety of people working with radiation. The equipment and laboratory setup needed for delivering this education are expensive and difficult to assemble due to the large variety of the type of experiments that are desirable to cover. For a basic education one needs to have gamma, beta, alpha and neutron sources, at least one detector to detect each type of radiation and other supplemental instrumentation to perform experiments. Although the radiation exposure due to these radioactive sources in an education laboratory is low, shielding and a private secured place is needed. Nearly two hundred thousand dollars is needed to construct such a basic laboratory described as above. In order to overcome these difficulties, a model of a basic Radiation Detection Laboratory has been created to provide a virtual environment for designing and simulating such experiments. Team: Dagistan Sahin, Muzaffer Sena Sahin, Korcan KayrinRadiation detection and measurement education is necessary for a wide variety of people working with radiation. The equipment and laboratory setup needed for delivering this education are expensive and difficult to assemble due to the large variety of the type of experiments that are desirable to cover. For a basic education one needs to have gamma, beta, alpha and neutron sources, at least one detector to detect each type of radiation and other supplemental instrumentation to perform experiments. Although the radiation exposure due to these radioactive sources in an education laboratory is low, shielding and a private secured place is needed. Nearly two hundred thousand dollars is needed to construct such a basic laboratory described as above. In order to overcome these difficulties, a model of a basic Radiation Detection Laboratory has been created to provide a virtual environment for designing and simulating such experiments. Team: Dagistan Sahin, Muzaffer Sena Sahin, Korcan Kayrin","Categories
Medical, Physics, Education"
"NGSolve is a general purpose Finite Element Library on top of Netgen. With the basic library one can solve heat flow equations, Maxwell equations, and solid mechanical problems. Several add-ons are available for particular application classes.

New paper:
J. Schöberl: ""C++11 Implementation of Finite Elements in NGSolve"", ASC Report 30/2014, Institute for Analysis and Scientific Computing, Vienna University of Technology, 2014
http://www.asc.tuwien.ac.at/~schoeberl/wiki/publications/ngs-cpp11.pdfNGSolve is a general purpose Finite Element Library on top of Netgen. With the basic library one can solve heat flow equations, Maxwell equations, and solid mechanical problems. Several add-ons are available for particular application classes.

New paper:
J. Schöberl: ""C++11 Implementation of Finite Elements in NGSolve"", ASC Report 30/2014, Institute for Analysis and Scientific Computing, Vienna University of Technology, 2014
http://www.asc.tuwien.ac.at/~schoeberl/wiki/publications/ngs-cpp11.pdf","Categories
Simulation, Mathematics"
Software for quantifying growth in Arabidopsis thaliana roots.Software for quantifying growth in Arabidopsis thaliana roots.,"Categories
Bio-Informatics"
Mjograph is an XY (2D) graph editor that runs on Mac OSX and Java with the goal to provide researchers with a quick way to visualize numerical data and also create publication-quality plots.Mjograph is an XY (2D) graph editor that runs on Mac OSX and Java with the goal to provide researchers with a quick way to visualize numerical data and also create publication-quality plots.,"Categories
Data Visualization"
IPC 175x Utilities is a collection of software tools to support the IPC 1750 series of supplier declaration standards. These utilities are being developed to help electronics industry supply chain stakeholders implement the IPC 1750 series of standard.IPC 175x Utilities is a collection of software tools to support the IPC 1750 series of supplier declaration standards. These utilities are being developed to help electronics industry supply chain stakeholders implement the IPC 1750 series of standard.,"Categories
Electronic Design Automation (EDA)"
Working hardware has been built and is in a late beta stage. Software is also available.Working hardware has been built and is in a late beta stage. Software is also available.,"Categories
Bio-Informatics, HMI, Medical"
