Description,Category
"jlibrtp aims to create a library that makes it easy to support RTP (RFC 3550,3551) in Java applications. SRTP (RFC 3771) has been delayed in favor of RFC 4585.jlibrtp aims to create a library that makes it easy to support RTP (RFC 3550,3551) in Java applications. SRTP (RFC 3771) has been delayed in favor of RFC 4585.","Categories
Internet Phone, Streaming"
"TrueDownloader Open source download accelerator / manager written in Visual Basic 6 for Windows. Supports HTTP and FTP downloads. MultiSegmented download, ZIP file preview, low CPU usage.TrueDownloader Open source download accelerator / manager written in Visual Basic 6 for Windows. Supports HTTP and FTP downloads. MultiSegmented download, ZIP file preview, low CPU usage.","Categories
File Sharing, File Transfer Protocol (FTP), WWW/HTTP"
A simple program for downloading images from 4chan threads. Monitors the thread for new images until it 404's.A simple program for downloading images from 4chan threads. Monitors the thread for new images until it 404's.,"Categories
BBS"
"tellmatic is a php and mysql based newsletter script to create, manage and send personalized newsletters or mass mails. uses wysiwyg and has a form editor. adresses and newsletter are stored in unlimited groups. handle bouncemails and failed adressestellmatic is a php and mysql based newsletter script to create, manage and send personalized newsletters or mass mails. uses wysiwyg and has a form editor. adresses and newsletter are stored in unlimited groups. handle bouncemails and failed adresses","Categories
Mailing List Servers, CRM, Site Management"
"ACiD View 6 is is a multimedia viewer for Windows. Its the first to support a variety of both textmode and bitmap graphic formats such as ANSI/ASCII, XBIN, GIF, JPEG and PNG. Additional features include a modem-speed simulator, VGA previewing and more!ACiD View 6 is is a multimedia viewer for Windows. Its the first to support a variety of both textmode and bitmap graphic formats such as ANSI/ASCII, XBIN, GIF, JPEG and PNG. Additional features include a modem-speed simulator, VGA previewing and more!","Categories
BBS, Presentation, Image Viewers, Image Converters"
"This is a web based instant 1 on 1 private online video conferencing solution.

It's a solution for conducting easy to setup face to face meetings without leaving your office or home. It's the easiest and most cost-effective way to meet somebody and discuss one on one, to make a video call just by providing a private room access link.This is a web based instant 1 on 1 private online video conferencing solution.

It's a solution for conducting easy to setup face to face meetings without leaving your office or home. It's the easiest and most cost-effective way to meet somebody and discuss one on one, to make a video call just by providing a private room access link.","Categories
Chat, VoIP, Video Conferencing"
"C library intended to give C/C++ developers a quick and easy way to send e-mail from their applications. Supports multiple To/Cc/Bcc recipients and multiple attachments without size limitation. For the actual SMTP communication either libcurl can be used or the built in SMTP support. The library can also be used to just create a multipart MIME message body.

Also comes with a command line application (quickmail) for sending mails (mutiple attachments supported) from command line or scripts.

Cross-platform.
Binary packages available for Windows (32-bit and 64-bit).C library intended to give C/C++ developers a quick and easy way to send e-mail from their applications. Supports multiple To/Cc/Bcc recipients and multiple attachments without size limitation. For the actual SMTP communication either libcurl can be used or the built in SMTP support. The library can also be used to just create a multipart MIME message body.

Also comes with a command line application (quickmail) for sending mails (mutiple attachments supported) from command line or scripts.

Cross-platform.
Binary packages available for Windows (32-bit and 64-bit).","Categories
Email, Libraries, Other file transfer protocol"
EchoMac: A Program for MacOS X to connect to the Echolink Amateur Radio networkEchoMac: A Program for MacOS X to connect to the Echolink Amateur Radio network,"Categories
Ham Radio"
"jamod is an object oriented implementation of the Modbus protocol, realized 100% in Java. It allows to quickly realize master and slave applications in various transport flavors (IP and serial).jamod is an object oriented implementation of the Modbus protocol, realized 100% in Java. It allows to quickly realize master and slave applications in various transport flavors (IP and serial).","Categories
Communications, Scientific/Engineering"
"ZMail allows you to send email from anyone, to anyone. You can use ZMail to send fake or anonymous emails. Have fun!ZMail allows you to send email from anyone, to anyone. You can use ZMail to send fake or anonymous emails. Have fun!","Categories
Post-Office, Mail Transfer Agents"
"A live Help support chat system in PHP that allows
the operators of the websites to
monitor their visitors as they are browsing the site
and proactively open
a chat session with the visitor . Mysql database, messages, auto inviteA live Help support chat system in PHP that allows
the operators of the websites to
monitor their visitors as they are browsing the site
and proactively open
a chat session with the visitor . Mysql database, messages, auto invite","Categories
Chat, CGI Scripts, Customer Service"
"SquirrelOutlook is a standards-based webmail package written in PHP4 (Squirrelmail). It includes built-in pure PHP support for the IMAP and SMTP protocols, and all pages render in pure HTML 4.0 for maximum compatibility across browsers.SquirrelOutlook is a standards-based webmail package written in PHP4 (Squirrelmail). It includes built-in pure PHP support for the IMAP and SMTP protocols, and all pages render in pure HTML 4.0 for maximum compatibility across browsers.","Categories
Email Clients, WWW/HTTP"
"Expire permet de saisir et d'exporter une fiche de métadonnées selon la norme ISO 19139, ISO19115 et ISO19110 conformément à la directive européenne INSPIRE. L'application génère un XML que l'on peut ensuite importer directement dans GeoSouExpire permet de saisir et d'exporter une fiche de métadonnées selon la norme ISO 19139, ISO19115 et ISO19110 conformément à la directive européenne INSPIRE. L'application génère un XML que l'on peut ensuite importer directement dans GeoSou","Categories
File Sharing, Archiving, GIS"
"A set of tools/code to facilitate communicating to the Hava and Vulkano network streaming video devices (http://myhava.com and http://myvulkano.com). Long term goal to create MythTV hooks (Linux) but some bits are useful elsewhere. Hope to utilize any official Vulkano SDK for Linux one is ever released.

Note my Hava died in May 2013 so there will likely be no more updates for Hava devices. I bought a Vulkano to replace it and hope to have similar functionality for it soon.A set of tools/code to facilitate communicating to the Hava and Vulkano network streaming video devices (http://myhava.com and http://myvulkano.com). Long term goal to create MythTV hooks (Linux) but some bits are useful elsewhere. Hope to utilize any official Vulkano SDK for Linux one is ever released.

Note my Hava died in May 2013 so there will likely be no more updates for Hava devices. I bought a Vulkano to replace it and hope to have similar functionality for it soon.","Categories
Streaming, Video Capture, Home Theater PC"
"Multi-agent system that helps to create fail-safe distributed storage in SOHO LAN.

Source code has been published to GitHub:
https://github.com/savermyas/JSaverStorageMulti-agent system that helps to create fail-safe distributed storage in SOHO LAN.

Source code has been published to GitHub:
https://github.com/savermyas/JSaverStorage","Categories
File Sharing"
"Craybot is a relatively simple, multipurpose IRC bot written in Python with Twisted. Twisted (http://twistedmatrix.com/trac/) is required to use the bot. Documentation may be found at http://tinyurl.com/craybot2docCraybot is a relatively simple, multipurpose IRC bot written in Python with Twisted. Twisted (http://twistedmatrix.com/trac/) is required to use the bot. Documentation may be found at http://tinyurl.com/craybot2doc","Categories
IRC Clients"
tesse is Transparent Extensible Steganographic fileSystem with Encryptiontesse is Transparent Extensible Steganographic fileSystem with Encryption,"Categories
Communications, Security, File Systems"
"Green Mountain Callbook enables its user to search a public domain database of over 700,000 US and Canadian amateur radio callsigns quickly and easily to retrieve information about the licensee such as name, operator class, and mailing address.Green Mountain Callbook enables its user to search a public domain database of over 700,000 US and Canadian amateur radio callsigns quickly and easily to retrieve information about the licensee such as name, operator class, and mailing address.","Categories
Ham Radio"
Makes a USB disk into a filesharing systemMakes a USB disk into a filesharing system,"Categories
File Sharing, File Transfer Protocol (FTP), File Sync"
"New v1.1.3.140 - Now includes a DB script! Managing SVN rights for multiple repos mirrored at multiple locations can be a daunting task. svnDashboard provides a simple, web-based, AJAX-enabled user interface for managing Several repositories and users.New v1.1.3.140 - Now includes a DB script! Managing SVN rights for multiple repos mirrored at multiple locations can be a daunting task. svnDashboard provides a simple, web-based, AJAX-enabled user interface for managing Several repositories and users.","Categories
Subversion, File Sync"
This is a set of Cocoa wrapper classes to access serial ports in Mac OS X.This is a set of Cocoa wrapper classes to access serial ports in Mac OS X.,"Categories
Serial, Communications"
"Addons to the Django Framework for mobile clients. MoGo was originally built to handle JP specific issues, but code to handle other locales are welcome as well. Developed and maintained by MARIMORE Inc http://www.marimore.co.jp

THIS PROJECT HAS MOVED TO https://github.com/marimore/mobiledjangoAddons to the Django Framework for mobile clients. MoGo was originally built to handle JP specific issues, but code to handle other locales are welcome as well. Developed and maintained by MARIMORE Inc http://www.marimore.co.jp

THIS PROJECT HAS MOVED TO https://github.com/marimore/mobiledjango","Categories
Internet Phone, Libraries"
"SMADRET Means Always Do Really Encrypt Talk (or Find A Better Acronym). It is a SOCKS 4-proxy that listens on localhost and acts as a middleman between your chat client and the outside world, intercepting messages and performing PGP-encryption using GnuPSMADRET Means Always Do Really Encrypt Talk (or Find A Better Acronym). It is a SOCKS 4-proxy that listens on localhost and acts as a middleman between your chat client and the outside world, intercepting messages and performing PGP-encryption using GnuP","Categories
Chat, Cryptography"
EnCrypted fiLe Sharing In jaVaEnCrypted fiLe Sharing In jaVa,"Categories
Chat, File Sharing, Cryptography"
"A Python script that connects to Gmail in IMAP's IDLE mode and pushes new messages to an iPhone using Prowl. An always on server with Python and OpenSSL installed, and the Prowl iPhone application ($3) are required.A Python script that connects to Gmail in IMAP's IDLE mode and pushes new messages to an iPhone using Prowl. An always on server with Python and OpenSSL installed, and the Prowl iPhone application ($3) are required.","Categories
Email"
"QTTabBar is extension for Windows Explorer that brings tabbed browsing to Microsoft's file browser, along with a host of other great features. Under new management! Now in public beta!QTTabBar is extension for Windows Explorer that brings tabbed browsing to Microsoft's file browser, along with a host of other great features. Under new management! Now in public beta!","Categories
Window Managers, System Shells"
"KeePass Password Safe is a free, open source, lightweight, and easy-to-use password manager for Windows, Linux and Mac OS X, with ports for Android, iPhone/iPad and other mobile devices. With so many passwords to remember and the need to vary passwords to protect your valuable data, it’s nice to have KeePass to manage your passwords in a secure way. KeePass puts all your passwords in a highly encrypted database and locks them with one master key or a key file. As a result, you only have to remember one single master password or select the key file to unlock the whole database. And the databases are encrypted using the best and most secure encryption algorithms currently known, AES and Twofish. See our features page for details.KeePass Password Safe is a free, open source, lightweight, and easy-to-use password manager for Windows, Linux and Mac OS X, with ports for Android, iPhone/iPad and other mobile devices. With so many passwords to remember and the need to vary passwords to protect your valuable data, it’s nice to have KeePass to manage your passwords in a secure way. KeePass puts all your passwords in a highly encrypted database and locks them with one master key or a key file. As a result, you only have to remember one single master password or select the key file to unlock the whole database. And the databases are encrypted using the best and most secure encryption algorithms currently known, AES and Twofish. See our features page for details.","Categories
Office/Business, Database, Security, Desktop Environment, Internet, Password Generators"
"Classic Shell adds some missing features to Windows 7, 8, 8.1 and Vista like a classic start menu, toolbar for Explorer and others.

[b]Note:[/b] The software available here is not the latest version. Visit the new website www.classicshell.net to download the latest version and to access the new forums and documentation.Classic Shell adds some missing features to Windows 7, 8, 8.1 and Vista like a classic start menu, toolbar for Explorer and others.

[b]Note:[/b] The software available here is not the latest version. Visit the new website www.classicshell.net to download the latest version and to access the new forums and documentation.","Categories
Desktop Environment, System Shells"
"Tool Command Language (Tcl) is an interpreted language and very portable interpreter for that language. Tcl is embeddable and extensible, and has been widely used since its creation in 1988 by John Ousterhout.

Bug reports to http://core.tcl.tk/tcl/

Follow code development at http://core.tcl.tk/tcl/Tool Command Language (Tcl) is an interpreted language and very portable interpreter for that language. Tcl is embeddable and extensible, and has been widely used since its creation in 1988 by John Ousterhout.

Bug reports to http://core.tcl.tk/tcl/

Follow code development at http://core.tcl.tk/tcl/","Categories
Desktop Environment, Interpreters, Internet"
"VirtuaWin is an application for the Windows user community that misses the wonderful multiple desktop functionality often used on Unix systems. It is simple, reliable and highly configurable, supporting up to 20 virtual desktops.VirtuaWin is an application for the Windows user community that misses the wonderful multiple desktop functionality often used on Unix systems. It is simple, reliable and highly configurable, supporting up to 20 virtual desktops.","Categories
Window Managers"
"Windows X-server based on the xorg git sources (like xming or cygwin's xwin), but compiled with Visual C++ 2012 Express Edition. Source code can also be compiled with VS2008, VS2008 Express Edition and VS2010 Express Edition, although current project and makefile are not fully compatible anymore.

Versions starting from 1.14.3.0 are not compatible with Windows XP anymore.Windows X-server based on the xorg git sources (like xming or cygwin's xwin), but compiled with Visual C++ 2012 Express Edition. Source code can also be compiled with VS2008, VS2008 Express Edition and VS2010 Express Edition, although current project and makefile are not fully compatible anymore.

Versions starting from 1.14.3.0 are not compatible with Windows XP anymore.","Categories
Terminal Emulators, Window Managers"
"Wine is an Open Source implementation of the Windows API on top of X and Unix. Wine provides both a development toolkit for porting Windows sources to Unix and a program loader, allowing many unmodified Windows binaries to run on x86-based Unixes.Wine is an Open Source implementation of the Windows API on top of X and Unix. Wine provides both a development toolkit for porting Windows sources to Unix and a program loader, allowing many unmodified Windows binaries to run on x86-based Unixes.","Categories
Desktop Environment, Emulators"
"Save monitor configurations of Windows 7 or 10 and easily switch between them with a click in a popup menu of your taskbar.

The tool is designed for users with two or more monitors who in certain situations would like to quickly change their monitor setup (e.g. enable/disable a TV which is attached to the HDMI port, make an attached TV the primary display to remove tearing switch which monitor is on the left/right...). Along the monitor state and setup the resolution is also saved and restored.

The program works by saving a current monitor setup as configured using the windows control panel to an xml file. Once saved the configuration can be quickly restored at any time. Requires .NET 4.0 Framework to be installed.

The program is quite simple and in an early development stage. It is provided without any warranty. If you accidentally disable all your monitors boot into safe mode to fix the problem.

If you like the program say thanks by clicking the Donation link in the menu!Save monitor configurations of Windows 7 or 10 and easily switch between them with a click in a popup menu of your taskbar.

The tool is designed for users with two or more monitors who in certain situations would like to quickly change their monitor setup (e.g. enable/disable a TV which is attached to the HDMI port, make an attached TV the primary display to remove tearing switch which monitor is on the left/right...). Along the monitor state and setup the resolution is also saved and restored.

The program works by saving a current monitor setup as configured using the windows control panel to an xml file. Once saved the configuration can be quickly restored at any time. Requires .NET 4.0 Framework to be installed.

The program is quite simple and in an early development stage. It is provided without any warranty. If you accidentally disable all your monitors boot into safe mode to fix the problem.

If you like the program say thanks by clicking the Donation link in the menu!","Categories
Desktop Environment, Systems Administration, Home Theater PC"
"Launchy is a free utility designed to help you forget about your start menu, your desktop icons, and your file manager. Launchy indexes and launches your applications, documents, project files, folders, and bookmarks with just a few keystrokes!Launchy is a free utility designed to help you forget about your start menu, your desktop icons, and your file manager. Launchy indexes and launches your applications, documents, project files, folders, and bookmarks with just a few keystrokes!","Categories
Other/Nonlisted Topic, Desktop Environment, Search"
"PNotes is light-weight, flexible, skinnable manager of virtual notes on your desktop. It supports multiple languages, individual note's settings, transparency and scheduling. Absolutely portable as well - no traces in registry. PNotes.NET edition requires .NET framework 4 Client ProfilePNotes is light-weight, flexible, skinnable manager of virtual notes on your desktop. It supports multiple languages, individual note's settings, transparency and scheduling. Absolutely portable as well - no traces in registry. PNotes.NET edition requires .NET framework 4 Client Profile","Categories
Office/Business, To-Do Lists, Desktop Environment"
The docking library for .Net Windows Forms development which mimics Visual Studio .Net.The docking library for .Net Windows Forms development which mimics Visual Studio .Net.,"Categories
Window Managers, User Interface (UI)"
"So far this project consists of a source rpm that can be used to easily create a binary rpm package that, when installed, gives access to Microsoft's TrueType core fonts for the Web.So far this project consists of a source rpm that can be used to easily create a binary rpm package that, when installed, gives access to Microsoft's TrueType core fonts for the Web.","Categories
Desktop Environment, Fonts"
Use Wine (Wine Is Not an Emulator) to run Windows applications on Darwin and Mac OS X.Use Wine (Wine Is Not an Emulator) to run Windows applications on Darwin and Mac OS X.,"Categories
Desktop Environment, Emulators"
WindowsPager is a pager utility for the Windows XP/Vista/Seven desktop. It fit smoothly into the Desktop panel. WindowsPager provide unlimited support for so called 'virtual desktops' or 'workspaces'.WindowsPager is a pager utility for the Windows XP/Vista/Seven desktop. It fit smoothly into the Desktop panel. WindowsPager provide unlimited support for so called 'virtual desktops' or 'workspaces'.,"Categories
Desktop Environment"
"Console is a Windows console window enhancement. Console features include: multiple tabs, text editor-like text selection, different background types, alpha and color-key transparency, configurable font, different window stylesConsole is a Windows console window enhancement. Console features include: multiple tabs, text editor-like text selection, different background types, alpha and color-key transparency, configurable font, different window styles","Categories
Terminals, Desktop Environment, System"
"X File Explorer (Xfe) is an MS-Explorer like file manager for X. It is based on the popular, but discontinued, X Win Commander, which was developed by Maxim Baranov.
Xfe aims to be the filemanager of choice for all the Unix addicts!X File Explorer (Xfe) is an MS-Explorer like file manager for X. It is based on the popular, but discontinued, X Win Commander, which was developed by Maxim Baranov.
Xfe aims to be the filemanager of choice for all the Unix addicts!","Categories
Desktop Environment"
"Nagstamon is a Nagios status monitor which resides in systray or desktop (Linux, macOS, Windows) as floating statusbar to inform you in realtime about the status of your hosts and services. It allows to connect to multiple Nagios based monitors. Currently supported are Nagios, Icinga, Opsview, Op5 Ninja, Check_MK Multisite, Centreon and Thruk.Nagstamon is a Nagios status monitor which resides in systray or desktop (Linux, macOS, Windows) as floating statusbar to inform you in realtime about the status of your hosts and services. It allows to connect to multiple Nagios based monitors. Currently supported are Nagios, Icinga, Opsview, Op5 Ninja, Check_MK Multisite, Centreon and Thruk.","Categories
GNOME, Monitoring, Customer Service"
"Changes the drive icons shown in Windows ""My Computer"", to a nearly Vista drive icon, showing the drive's free space with a smooth colored horizontal bar.Changes the drive icons shown in Windows ""My Computer"", to a nearly Vista drive icon, showing the drive's free space with a smooth colored horizontal bar.","Categories
Desktop Environment, Storage, File Systems"
"K-3D is the free (as in freedom) 3d modeling, animation, and rendering system.K-3D is the free (as in freedom) 3d modeling, animation, and rendering system.","Categories
GNOME, Games/Entertainment, 3D Modeling, 3D Rendering, Vector Graphics, Data Visualization"
"uGet, the Best Download Manager for Linux.

uGet is a lightweight yet powerful Open Source download manager for GNU/Linux developed with GTK+, which also comes packaged as a portable Windows app.

- Quick Links -
Features: https://ugetdm.com/features
Screenshots: https://ugetdm.com/screenshots
Blog: https://ugetdm.com/blog
Support: https://ugetdm.com/qa
Frequently Asked Questions (FAQs): https://ugetdm.com/qa/faq
RSS Feed: https://ugetdm.com/rss
GitHub: https://github.com/chhuang-oneuGet, the Best Download Manager for Linux.

uGet is a lightweight yet powerful Open Source download manager for GNU/Linux developed with GTK+, which also comes packaged as a portable Windows app.

- Quick Links -
Features: https://ugetdm.com/features
Screenshots: https://ugetdm.com/screenshots
Blog: https://ugetdm.com/blog
Support: https://ugetdm.com/qa
Frequently Asked Questions (FAQs): https://ugetdm.com/qa/faq
RSS Feed: https://ugetdm.com/rss
GitHub: https://github.com/chhuang-one","Categories
GNOME, File Transfer Protocol (FTP), WWW/HTTP, Download Managers"
"Xournal is a GTK+/Gnome application for notetaking, sketching, keeping a journal using a stylus on Tablet PCs and other platforms. It aims to provide superior graphical quality (subpixel resolution) and overall functionality.Xournal is a GTK+/Gnome application for notetaking, sketching, keeping a journal using a stylus on Tablet PCs and other platforms. It aims to provide superior graphical quality (subpixel resolution) and overall functionality.","Categories
GNOME, Vector Graphics, Education"
