Description,Category
"Pty is a Go package for using unix pseudo-terminals. Note that the examples are for demonstration purpose only, to showcase how to use the library. They are not meant to be used in any kind of production environment. Start assigns a pseudo-terminal tty os.File to c.Stdin, c.Stdout, and c.Stderr, calls c.Start, and returns the File of the tty's corresponding pty. InheritSize applies the terminal size of pty to tty. This should be run in a signal handler for syscall.SIGWINCH to automatically resize the tty when the pty receives a window size change notification.Pty is a Go package for using unix pseudo-terminals. Note that the examples are for demonstration purpose only, to showcase how to use the library. They are not meant to be used in any kind of production environment. Start assigns a pseudo-terminal tty os.File to c.Stdin, c.Stdout, and c.Stderr, calls c.Start, and returns the File of the tty's corresponding pty. InheritSize applies the terminal size of pty to tty. This should be run in a signal handler for syscall.SIGWINCH to automatically resize the tty when the pty receives a window size change notification.","Categories
Terminals, Frameworks"
"Teller is a productivity secret manager for developers supporting cloud-native apps and multiple cloud providers. Mix and match all vaults and other key stores and safely use secrets as you code, test, and build applications. It's quick, easy, and safe. Never leave your command line for secrets. Create a simple configuration for mixing any number of vaults and key stores using your cloud-native clusters or traditional cloud providers. Teller is open source and secure by-design. It also helps maintain great secrets hygiene and prevents secret sprawl. Avoid custom scripts and unapproved 3rd parties. Use your CISO/infosec-approved vaults, and help keep company policies. Using Teller helps keep a healthy posture. When you have an easy way to use secrets, you don’t stick’em in code or in various funny configs. Teller is completely open source and transparent at what it does. You can also add your own providers.Teller is a productivity secret manager for developers supporting cloud-native apps and multiple cloud providers. Mix and match all vaults and other key stores and safely use secrets as you code, test, and build applications. It's quick, easy, and safe. Never leave your command line for secrets. Create a simple configuration for mixing any number of vaults and key stores using your cloud-native clusters or traditional cloud providers. Teller is open source and secure by-design. It also helps maintain great secrets hygiene and prevents secret sprawl. Avoid custom scripts and unapproved 3rd parties. Use your CISO/infosec-approved vaults, and help keep company policies. Using Teller helps keep a healthy posture. When you have an easy way to use secrets, you don’t stick’em in code or in various funny configs. Teller is completely open source and transparent at what it does. You can also add your own providers.","Categories
Terminals, Frameworks"
"DevDash is a highly configurable terminal dashboard for developers and creators. It will allow you to choose and display the most up-to-date metrics you need, at one place. The data will be automatically refreshed while you’re doing other productive tasks. Get started and create your first dashboard, or see DevDash in action with many examples (including their configuration). Change the display of your widgets (colors or size). Understand how to use time period for many widgets in DevDash. Choose the widgets you want. Place your widgets where you want. Choose the data you want to display, the colors you want to use, and a lot of other things for each widget. Don't want to personalize everything? Don't overwrite the defaults, then. Unlimited amount of different dashboards with different configurations. Data refreshed automatically via time ticks, or via a keyboard shortcut (Ctrl + r by default).DevDash is a highly configurable terminal dashboard for developers and creators. It will allow you to choose and display the most up-to-date metrics you need, at one place. The data will be automatically refreshed while you’re doing other productive tasks. Get started and create your first dashboard, or see DevDash in action with many examples (including their configuration). Change the display of your widgets (colors or size). Understand how to use time period for many widgets in DevDash. Choose the widgets you want. Place your widgets where you want. Choose the data you want to display, the colors you want to use, and a lot of other things for each widget. Don't want to personalize everything? Don't overwrite the defaults, then. Unlimited amount of different dashboards with different configurations. Data refreshed automatically via time ticks, or via a keyboard shortcut (Ctrl + r by default).","Categories
Terminals"
"Command line monitoring for goroutines. Simply import and call grmon.Start() somewhere in your code. By default, grmon will automatically refresh every 5s. Pause automatic refresh(p) to enable the cursor and expand the full trace for a selected goroutine(<enter>).Command line monitoring for goroutines. Simply import and call grmon.Start() somewhere in your code. By default, grmon will automatically refresh every 5s. Pause automatic refresh(p) to enable the cursor and expand the full trace for a selected goroutine(<enter>).","Categories
Terminals"
"mpb is a Go lib for rendering progress bars in terminal applications. Synchronized decorator's width among multiple bars. Elapsed time, ewma based ETA, Percentage, Bytes counter. Cancel the whole rendering process. Dynamically add or remove bars. Set the total while the bar is running. Multiple progress bars are supported.mpb is a Go lib for rendering progress bars in terminal applications. Synchronized decorator's width among multiple bars. Elapsed time, ewma based ETA, Percentage, Bytes counter. Cancel the whole rendering process. Dynamically add or remove bars. Set the total while the bar is running. Multiple progress bars are supported.","Categories
Terminals"
Go package to make lightweight ASCII line graph in command line apps with no other dependencies. This package also brings a small utility for command-line usage.Go package to make lightweight ASCII line graph in command line apps with no other dependencies. This package also brings a small utility for command-line usage.,"Categories
Terminals"
"JiraCLI is an interactive command line tool for Atlassian Jira that will help you avoid Jira UI to some extent. This tool is not yet considered complete but has all the essential features required to improve your workflow with Jira. The tool started with the idea of making issue search and navigation as straightforward as possible. However, with the help of outstanding supporters like you, we evolved, and the tool now includes all necessary features like issue creation, cloning, linking, ticket transition, and much more. Note that some features might work slightly differently in cloud installation versus on-premise installation due to the nature of the data. Yet, we've attempted to make the experience as similar as possible. jira-cli is available as a downloadable packaged binary for Linux, macOS, and Windows from the releases page.JiraCLI is an interactive command line tool for Atlassian Jira that will help you avoid Jira UI to some extent. This tool is not yet considered complete but has all the essential features required to improve your workflow with Jira. The tool started with the idea of making issue search and navigation as straightforward as possible. However, with the help of outstanding supporters like you, we evolved, and the tool now includes all necessary features like issue creation, cloning, linking, ticket transition, and much more. Note that some features might work slightly differently in cloud installation versus on-premise installation due to the nature of the data. Yet, we've attempted to make the experience as similar as possible. jira-cli is available as a downloadable packaged binary for Linux, macOS, and Windows from the releases page.","Categories
Terminals, Command Line Tools"
"Redpanda Console (previously known as Kowl) is a web application that helps you manage and debug your Kafka/Redpanda workloads effortlessly. Explore your topics' messages in our message viewer through ad-hoc queries and dynamic filters. Find any message you want using JavaScript functions to filter messages. Supported encodings are JSON, Avro, Protobuf, XML, MessagePack, Text and Binary (hex view). The used encoding (except Protobuf) is recognized automatically. Redpanda is a Kafka®-compatible streaming data platform that is proven to be 10x faster and 6x lower in total costs. It is also JVM-free, ZooKeeper®-free, Jepsen-tested, and source available. A single binary with built-in everything. No ZooKeeper®. No JVM. Deploys in minutes. Spins up in milliseconds. Plays nice with Kubernetes and microservices. Works natively with your Kafka tools. Love streaming again!Redpanda Console (previously known as Kowl) is a web application that helps you manage and debug your Kafka/Redpanda workloads effortlessly. Explore your topics' messages in our message viewer through ad-hoc queries and dynamic filters. Find any message you want using JavaScript functions to filter messages. Supported encodings are JSON, Avro, Protobuf, XML, MessagePack, Text and Binary (hex view). The used encoding (except Protobuf) is recognized automatically. Redpanda is a Kafka®-compatible streaming data platform that is proven to be 10x faster and 6x lower in total costs. It is also JVM-free, ZooKeeper®-free, Jepsen-tested, and source available. A single binary with built-in everything. No ZooKeeper®. No JVM. Deploys in minutes. Spins up in milliseconds. Plays nice with Kubernetes and microservices. Works natively with your Kafka tools. Love streaming again!","Categories
Terminals"
"ipatool is a command line tool that allows you to search for iOS apps on the App Store and download a copy of the app package, known as an ipa file. Supported operating system (Windows, Linux or macOS). Apple ID is set up to use the App Store. To authenticate with the App Store, use the auth command. To search for apps on the App Store, use the search command. To obtain a license for an app, use the purchase command. To download a copy of the ipa file, use the download command.ipatool is a command line tool that allows you to search for iOS apps on the App Store and download a copy of the app package, known as an ipa file. Supported operating system (Windows, Linux or macOS). Apple ID is set up to use the App Store. To authenticate with the App Store, use the auth command. To search for apps on the App Store, use the search command. To obtain a license for an app, use the purchase command. To download a copy of the ipa file, use the download command.","Categories
Terminals, Command Line Tools"
"The Next Terminal open-source project has gained nearly 3,000 Stars on GitHub and has a large number of users, so you can absolutely trust the stability of Next Terminal. You can access RDP, SSH, VNC, TELNET and other protocol assets in a system without plug-ins, just a browser. You can view the currently active sessions at any time, and monitor and block them. For character protocols, you can even restrict the execution and logging of certain commands. Next Terminal observes and logs every online resource, connection, interactive session and other security event in all environments. These events are recorded in a structured audit log, making it easy to see what is happening and who is responsible. Next Terminal is developed with Golang. After compilation, there is only one binary file, and the built-in sqlite can be used to store files. It is very lightweight and supports one-line command installation.The Next Terminal open-source project has gained nearly 3,000 Stars on GitHub and has a large number of users, so you can absolutely trust the stability of Next Terminal. You can access RDP, SSH, VNC, TELNET and other protocol assets in a system without plug-ins, just a browser. You can view the currently active sessions at any time, and monitor and block them. For character protocols, you can even restrict the execution and logging of certain commands. Next Terminal observes and logs every online resource, connection, interactive session and other security event in all environments. These events are recorded in a structured audit log, making it easy to see what is happening and who is responsible. Next Terminal is developed with Golang. After compilation, there is only one binary file, and the built-in sqlite can be used to store files. It is very lightweight and supports one-line command installation.","Categories
Terminals"
"A GitHub (gh) CLI extension to display a dashboard with pull requests and issues by filters you care about. Write multiple configuration files to easily switch between completely different dashboards. Repo name-to-path mappings can be an exact match (full name, full path) or wildcard matched using the owner and partial path. To override the default set of terminal colors and instead create your own color scheme, you can define one in your config.yml file. If you choose to go this route, you need to specify all of the following keys as colors in hex format (#RRGGBB), otherwise, validation will fail. You can customize each section's layout as well as the global layout.A GitHub (gh) CLI extension to display a dashboard with pull requests and issues by filters you care about. Write multiple configuration files to easily switch between completely different dashboards. Repo name-to-path mappings can be an exact match (full name, full path) or wildcard matched using the owner and partial path. To override the default set of terminal colors and instead create your own color scheme, you can define one in your config.yml file. If you choose to go this route, you need to specify all of the following keys as colors in hex format (#RRGGBB), otherwise, validation will fail. You can customize each section's layout as well as the global layout.","Categories
Terminals"
"Kingpin is a fluent-style, type-safe command-line parser. It supports flags, nested commands, and positional arguments. Second to parsing, providing the user with useful help is probably the most important thing a command-line parser does. Kingpin tries to provide detailed contextual help if --help is encountered at any point in the command line (excluding after --). Flags can be specified at any point after their definition, not just immediately after their associated command. Kingpin can be used for simple flag+arg applications. Kingpin supports reading arguments from a file.Kingpin is a fluent-style, type-safe command-line parser. It supports flags, nested commands, and positional arguments. Second to parsing, providing the user with useful help is probably the most important thing a command-line parser does. Kingpin tries to provide detailed contextual help if --help is encountered at any point in the command line (excluding after --). Flags can be specified at any point after their definition, not just immediately after their associated command. Kingpin can be used for simple flag+arg applications. Kingpin supports reading arguments from a file.","Categories
Terminals"
"CLI tool and library for generating a Software Bill of Materials from container images and filesystems. syft is a CLI tool and Go library for generating a Software Bill of Materials (SBOM) from container images and filesystems. Exceptional for vulnerability detection when used with a scanner like Grype. Generates SBOMs for container images, filesystems, archives, and more to discover packages and libraries. Supports OCI, Docker and Singularity image formats. Linux distribution identification. Works seamlessly with Grype (a fast, modern vulnerability scanner). Able to create signed SBOM attestations using the in-toto specification. Convert between SBOM formats, such as CycloneDX, SPDX, and Syft's own format.CLI tool and library for generating a Software Bill of Materials from container images and filesystems. syft is a CLI tool and Go library for generating a Software Bill of Materials (SBOM) from container images and filesystems. Exceptional for vulnerability detection when used with a scanner like Grype. Generates SBOMs for container images, filesystems, archives, and more to discover packages and libraries. Supports OCI, Docker and Singularity image formats. Linux distribution identification. Works seamlessly with Grype (a fast, modern vulnerability scanner). Able to create signed SBOM attestations using the in-toto specification. Convert between SBOM formats, such as CycloneDX, SPDX, and Syft's own format.","Categories
Terminals"
"RxtxConsole is an API and GUI software, developed by Doidx with JSerialCom as the kernel.
It can be used for multi- UART/RS232 interface operation. The platform supports Windows/MAC/Linux.
Note: Developed with Java17

Follow these steps step by step to apply RxtxConsole,
1. LIST, to obtain all Serial ports currently available on the system.
2. CONNECT, Select a Serial port for connection and place it in the connection pool for use
3. CONNECTED, check that the Serial ports are connected. Sometimes, the Serial ports
that you try to connect may have been used by other applications.
4. USE, select a connected serial port for which the command is transmitted only.
5. Start p2p communication with each other, ex: SCPI...
6. If you want to make other Settings on the system, you can USE SYS to changeRxtxConsole is an API and GUI software, developed by Doidx with JSerialCom as the kernel.
It can be used for multi- UART/RS232 interface operation. The platform supports Windows/MAC/Linux.
Note: Developed with Java17

Follow these steps step by step to apply RxtxConsole,
1. LIST, to obtain all Serial ports currently available on the system.
2. CONNECT, Select a Serial port for connection and place it in the connection pool for use
3. CONNECTED, check that the Serial ports are connected. Sometimes, the Serial ports
that you try to connect may have been used by other applications.
4. USE, select a connected serial port for which the command is transmitted only.
5. Start p2p communication with each other, ex: SCPI...
6. If you want to make other Settings on the system, you can USE SYS to change","Categories
Serial, User Interface (UI), Interface Engine/Protocol Translator"
"A terminal based graphical activity monitor inspired by gtop and vtop. Working and tested on Linux, FreeBSD and macOS. Windows support is planned. OpenBSD works with some caveats. Clone the repo and then run scripts/download.sh to download the correct binary for your system from the releases tab. gotop ships with a few colorschemes which can be set with the -c flag followed by the name of one. You can find all the colorschemes in the colorschemes folder.A terminal based graphical activity monitor inspired by gtop and vtop. Working and tested on Linux, FreeBSD and macOS. Windows support is planned. OpenBSD works with some caveats. Clone the repo and then run scripts/download.sh to download the correct binary for your system from the releases tab. gotop ships with a few colorschemes which can be set with the -c flag followed by the name of one. You can find all the colorschemes in the colorschemes folder.","Categories
Terminals"
"WTF (aka 'wtfutil') is the personal information dashboard for your terminal, providing at-a-glance access to your very important but infrequently-needed stats and data. Used by thousands of developers and tech people around the world, WTF is free and open-source. To support the continued use and development of WTF, please consider sponsoring WTF via GitHub Sponsors. Oversee your services with Airbrake. Keep an eye on your OpsGenie schedules, Google Calendar, Git and GitHub repositories. Track your deployments via New Relic. See who’s away in BambooHR, which Jira tickets are assigned to you, and what time it is in Barcelona. And dozens more. Use WTF to monitor systems, services, and important information. WTF is only compatible with Go versions 1.16.0 or later (due to the use of Go modules and newer standard library functions). If you would like to use gccgo to compile, you must use gccgo-9 or later which introduces support for Go modules.WTF (aka 'wtfutil') is the personal information dashboard for your terminal, providing at-a-glance access to your very important but infrequently-needed stats and data. Used by thousands of developers and tech people around the world, WTF is free and open-source. To support the continued use and development of WTF, please consider sponsoring WTF via GitHub Sponsors. Oversee your services with Airbrake. Keep an eye on your OpsGenie schedules, Google Calendar, Git and GitHub repositories. Track your deployments via New Relic. See who’s away in BambooHR, which Jira tickets are assigned to you, and what time it is in Barcelona. And dozens more. Use WTF to monitor systems, services, and important information. WTF is only compatible with Go versions 1.16.0 or later (due to the use of Go modules and newer standard library functions). If you would like to use gccgo to compile, you must use gccgo-9 or later which introduces support for Go modules.","Categories
Terminals"
"NPS is a lightweight, high-performance, powerful intranet penetration proxy server, with a powerful web management terminal. Comprehensive protocol support, compatible with almost all commonly used protocols, such as tcp, udp, http(s), socks5, p2p, http proxy. Full platform compatibility (linux, windows, macos, Synology, etc.), support installation as a system service simply. Comprehensive control, both client and server control are allowed. Https integration, support to convert backend proxy and web services to https, and support multiple certificates. Just simple configuration on web ui can complete most requirements. Complete information display, such as traffic, system information, real-time bandwidth, client version, etc. Powerful extension functions, everything is available (cache, compression, encryption, traffic limit, bandwidth limit, port reuse, etc.) Domain name resolution has functions such as custom headers, 404 page configuration, host modification, etc.NPS is a lightweight, high-performance, powerful intranet penetration proxy server, with a powerful web management terminal. Comprehensive protocol support, compatible with almost all commonly used protocols, such as tcp, udp, http(s), socks5, p2p, http proxy. Full platform compatibility (linux, windows, macos, Synology, etc.), support installation as a system service simply. Comprehensive control, both client and server control are allowed. Https integration, support to convert backend proxy and web services to https, and support multiple certificates. Just simple configuration on web ui can complete most requirements. Complete information display, such as traffic, system information, real-time bandwidth, client version, etc. Powerful extension functions, everything is available (cache, compression, encryption, traffic limit, bandwidth limit, port reuse, etc.) Domain name resolution has functions such as custom headers, 404 page configuration, host modification, etc.","Categories
Terminals, Proxy Servers"
"The program is designed to transfer the G-code to the controller of the Burny1250 plasma cutting machines. If there is a postprocessor for a modern cam program, then it is necessary to resolve the issue only with the transfer data to the controller Burny1250.

The program may be needed for machines:
B & W SYSTEMS CNC Plasma Cutter (BWPC01)
LOCKFORMER Vulcan NT 2000
Aviator XLT
Innerlogic Proline 2200 Precision Plasma Cutter
Innerlogic SR-45i CNC plasma
C&G Aviator XL CNC plasma cutter
FLAMETEK CNC Profile Burner
SOITAAB - LINEA STAR LINEA STAR 1530
and other similar.
This is what the our program does. We also have a postprocessor for the correct making of G-code for Burny1250. Contact us for get a postprocessor. If you have a similar machine, but it is not a Burny1250 and it has differences, please contact us.The program is designed to transfer the G-code to the controller of the Burny1250 plasma cutting machines. If there is a postprocessor for a modern cam program, then it is necessary to resolve the issue only with the transfer data to the controller Burny1250.

The program may be needed for machines:
B & W SYSTEMS CNC Plasma Cutter (BWPC01)
LOCKFORMER Vulcan NT 2000
Aviator XLT
Innerlogic Proline 2200 Precision Plasma Cutter
Innerlogic SR-45i CNC plasma
C&G Aviator XL CNC plasma cutter
FLAMETEK CNC Profile Burner
SOITAAB - LINEA STAR LINEA STAR 1530
and other similar.
This is what the our program does. We also have a postprocessor for the correct making of G-code for Burny1250. Contact us for get a postprocessor. If you have a similar machine, but it is not a Burny1250 and it has differences, please contact us.","Categories
Terminals"
