Description,Category
"A simple tool to rearrange/merge/delete pages from PDF files. The modular backend system uses either JPedal or JPod to display PDFs and iText or Apache PDFBox to save them.

!!!!!!!!!!!!!!!!!!!!!!!!!!!!!!!!!!!
Development of this project has moved to GitHub.
Please check https://github.com/mgropp/pdfjumbler for current releases!
!!!!!!!!!!!!!!!!!!!!!!!!!!!!!!!!!!!A simple tool to rearrange/merge/delete pages from PDF files. The modular backend system uses either JPedal or JPod to display PDFs and iText or Apache PDFBox to save them.

!!!!!!!!!!!!!!!!!!!!!!!!!!!!!!!!!!!
Development of this project has moved to GitHub.
Please check https://github.com/mgropp/pdfjumbler for current releases!
!!!!!!!!!!!!!!!!!!!!!!!!!!!!!!!!!!!","Categories
Office/Business, PDF"
"The RecordEditor is a Data File editor for Flat Files (delimited and fixed field position). It supports Unix / PC / Legacy (e.g. Mainframe) file formats, both Text and binary files.

The Editor uses a Record-Layout description to format the files. This is ideal for Fixed width (Text or Binary) files, Cobol Data Files, Mainframe files and complicated Csv files. Cobol Copybooks can be used to format Cobol Data files.

As well as an editor, The following utilities are supplied
* Formatted Compare
* File Copy and reformat Utility
* FileWizard this is use to work out the format of a File. It can generally find both Text and binary / packed deicimal fields in a file


For Simple Csv you should look at its sister project reCsvEditor.

Note: The core Editor code is also used in the ""Protocol buffers editor"" and ""Avro Editor""The RecordEditor is a Data File editor for Flat Files (delimited and fixed field position). It supports Unix / PC / Legacy (e.g. Mainframe) file formats, both Text and binary files.

The Editor uses a Record-Layout description to format the files. This is ideal for Fixed width (Text or Binary) files, Cobol Data Files, Mainframe files and complicated Csv files. Cobol Copybooks can be used to format Cobol Data files.

As well as an editor, The following utilities are supplied
* Formatted Compare
* File Copy and reformat Utility
* FileWizard this is use to work out the format of a File. It can generally find both Text and binary / packed deicimal fields in a file


For Simple Csv you should look at its sister project reCsvEditor.

Note: The core Editor code is also used in the ""Protocol buffers editor"" and ""Avro Editor""","Categories
Text Editors, Data Formats, Software Testing, Mainframe"
This project aims at providing a plugin for Microsoft Word 2003 to open OpenOffice XML documentsThis project aims at providing a plugin for Microsoft Word 2003 to open OpenOffice XML documents,"Categories
Word Processors, XML, Office Suites"
"XForms to XHTML+Javascript (AJAX) conversion based on a unique XSL transformation. Suitable server-side (PHP) or client-side (Internet Explorer, Mozilla FireFox, Opera, Safari) browser treatement where an XSLT 1.0 engine is availableXForms to XHTML+Javascript (AJAX) conversion based on a unique XSL transformation. Suitable server-side (PHP) or client-side (Internet Explorer, Mozilla FireFox, Opera, Safari) browser treatement where an XSLT 1.0 engine is available","Categories
HTML/XHTML, Browsers, User Interface (UI)"
A plugin for the Gnome editor »gedit« that supports you in editing LaTeX documents and BibTeX bibliographies.A plugin for the Gnome editor »gedit« that supports you in editing LaTeX documents and BibTeX bibliographies.,"Categories
Integrated Development Environments (IDE), TeX/LaTeX, GNOME"
"Semantic MediaWiki is an extension to the MediaWiki software (powering Wikipedia), which extends the Wiki with ideas from the Semantic Web. We focus on usability and tight integration.

See the web site for further details and GitHub at https://github.com/SemanticMediaWiki/SemanticMediaWiki/releases for the file releases! (since version 2.4.0).Semantic MediaWiki is an extension to the MediaWiki software (powering Wikipedia), which extends the Wiki with ideas from the Semantic Web. We focus on usability and tight integration.

See the web site for further details and GitHub at https://github.com/SemanticMediaWiki/SemanticMediaWiki/releases for the file releases! (since version 2.4.0).","Categories
Front-Ends, Dynamic Content, Semantic Web"
BibDesk is a graphical bibTeX bibliography manager for Mac OS X.BibDesk is a graphical bibTeX bibliography manager for Mac OS X.,"Categories
Text Processing, TeX/LaTeX"
"MsgViewer is email-viewer utility for .msg e-mail messages, implemented in pure Java. MsgViewer works on Windows/Linux/Mac Platforms. Also provides a java api to read mail messges (msg files) programmatically.MsgViewer is email-viewer utility for .msg e-mail messages, implemented in pure Java. MsgViewer works on Windows/Linux/Mac Platforms. Also provides a java api to read mail messges (msg files) programmatically.","Categories
Data Formats, Email"
"Talend Open Studio for Data Integration is only available for download from https://www.talend.com/lp/open-studio-for-data-integration/.

Open Studio for Data Integration is fully open source, so you can see the code and work with it. Embed existing Java code libraries, create your own components or leverage community components and code to extend your project.

Millions of downloads and a full range of robust, open source integration software tools have made Talend the open source leader in cloud and big data integration.

For more information, visit community.talend.com or help.talend.comTalend Open Studio for Data Integration is only available for download from https://www.talend.com/lp/open-studio-for-data-integration/.

Open Studio for Data Integration is fully open source, so you can see the code and work with it. Embed existing Java code libraries, create your own components or leverage community components and code to extend your project.

Millions of downloads and a full range of robust, open source integration software tools have made Talend the open source leader in cloud and big data integration.

For more information, visit community.talend.com or help.talend.com","Categories
Data Formats, Enterprise, Data Warehousing, Front-Ends, Code Generators, Distributed Computing, ETL"
"The National Library of New Zealand's Metadata Extraction Tool automatically extracts preservation-related metadata from digital files, then output that metadata in XML formats. It can be used through a graphical user interface or command-line interface.

Please take the latest code from 'https://github.com/DIA-NZ/Metadata-Extraction-Tool.git'. The code on source forge will not be updated henceforth as it is moved to github.The National Library of New Zealand's Metadata Extraction Tool automatically extracts preservation-related metadata from digital files, then output that metadata in XML formats. It can be used through a graphical user interface or command-line interface.

Please take the latest code from 'https://github.com/DIA-NZ/Metadata-Extraction-Tool.git'. The code on source forge will not be updated henceforth as it is moved to github.","Categories
Data Formats, Other/Nonlisted Topic, Information Analysis"
"XMLTreeEdit displays XML files as tree views and allows basic operations: adding, editting and deleting text nodes and their attributes.

The main goal is providing a simple tool to create/edit XML configuration files for users without knowledge of XML.

Built in Free Pascal Lazarus, which allows easy compilation for different target platforms.
Currently binary executables were produced and tested on Windows (XP, 7) and Ubuntu Linux (GTK2).

For developers: there are two units listed separately to support XML configuration files in your application:
XMLfile.pas - Lazarus/Free Pascal
uXMLConfig.pas - Delphi (2007..XE2)XMLTreeEdit displays XML files as tree views and allows basic operations: adding, editting and deleting text nodes and their attributes.

The main goal is providing a simple tool to create/edit XML configuration files for users without knowledge of XML.

Built in Free Pascal Lazarus, which allows easy compilation for different target platforms.
Currently binary executables were produced and tested on Windows (XP, 7) and Ubuntu Linux (GTK2).

For developers: there are two units listed separately to support XML configuration files in your application:
XMLfile.pas - Lazarus/Free Pascal
uXMLConfig.pas - Delphi (2007..XE2)","Categories
Text Editors, XML"
"This software implements the IEC60870-5-104 protocol (client side) for substation data acquisition and control via tcp/ip network using the QT UI Framework. It can be compiled on Linux and Windows platforms. It's possible to poll and view data from the remote system (RTU) and also send commands.
>>> Have a look also at my new SCADA project here:
https://github.com/riclolsen/json-scadaThis software implements the IEC60870-5-104 protocol (client side) for substation data acquisition and control via tcp/ip network using the QT UI Framework. It can be compiled on Linux and Windows platforms. It's possible to poll and view data from the remote system (RTU) and also send commands.
>>> Have a look also at my new SCADA project here:
https://github.com/riclolsen/json-scada","Categories
Data Formats, SCADA, Test and Measurement"
"Track your roaming staff, know their whereabouts and give them orders instantly. Works with web admin app,
Android, Nokia etc. clients...Track your roaming staff, know their whereabouts and give them orders instantly. Works with web admin app,
Android, Nokia etc. clients...","Categories
XML, Browsers, AJAX"
AlphaInnotec heatpump controler Luxtronik 2 saves the data of the last 48h in DTA files. This project should help to decode this files.AlphaInnotec heatpump controler Luxtronik 2 saves the data of the last 48h in DTA files. This project should help to decode this files.,"Categories
Data Formats"
"Set of classes for PHP that allow Excel XML files to be generated dynamically.
Nearly a full implementation of the MS XML architecture.
Requires PHP 5+
Does not require any XML librariesSet of classes for PHP that allow Excel XML files to be generated dynamically.
Nearly a full implementation of the MS XML architecture.
Requires PHP 5+
Does not require any XML libraries","Categories
XML, Libraries, Report Generators"
OdtPHP is a PHP librairy designed to use OpenDocument file as a template for PHP. It's a kind of PHPLib for OpenOffice document.OdtPHP is a PHP librairy designed to use OpenDocument file as a template for PHP. It's a kind of PHPLib for OpenOffice document.,"Categories
Text Processing, XML"
"Java flat text parser. Parse any delimited or fixed width strings. Bind user friendly column names to text positions via XML. Easily parse strings, dates, doubles, integers, etc.Java flat text parser. Parse any delimited or fixed width strings. Bind user friendly column names to text positions via XML. Easily parse strings, dates, doubles, integers, etc.","Categories
Data Formats"
"XML Copy Editor is a fast, free, validating XML editor.XML Copy Editor is a fast, free, validating XML editor.","Categories
Text Processing, XML"
"QPDF is a C++ library and set of programs that inspect and manipulate the structure of PDF files. It can encrypt and linearize files, expose the internals of a PDF file, and do many other operations useful to end users and PDF developers.QPDF is a C++ library and set of programs that inspect and manipulate the structure of PDF files. It can encrypt and linearize files, expose the internals of a PDF file, and do many other operations useful to end users and PDF developers.","Categories
Data Formats, PDF"
"OpenBEXI is a WYSIWYG HTML builder using the magic of HTML5 and CSS3 . By resizing, dragging and dropping various HTML widgets it is easy to build a web page.
All texts using the DOJO editor, pictures, charts, chart-flows, Dygraphs, timelines, lists and DOJO widgets edited on your browser look like the HTML page you are going to publish to your web site.
OpenBEXI provides a powerful CSS and JavaScript editor to change on the fly the presentation and the behavior of your web pages.
Tools allow you to create, manage and publish web projects and HTML pages for Internet.OpenBEXI is a WYSIWYG HTML builder using the magic of HTML5 and CSS3 . By resizing, dragging and dropping various HTML widgets it is easy to build a web page.
All texts using the DOJO editor, pictures, charts, chart-flows, Dygraphs, timelines, lists and DOJO widgets edited on your browser look like the HTML page you are going to publish to your web site.
OpenBEXI provides a powerful CSS and JavaScript editor to change on the fly the presentation and the behavior of your web pages.
Tools allow you to create, manage and publish web projects and HTML pages for Internet.","Categories
HTML/XHTML, Web Development, Web Design"
"pdf2xml convertor based on Xpdf library (http://www.foolabs.com/xpdf/home.html). It converts information contained in a PDF file into XML. First, you need to install xpdf and libxml2 (see documentation).
Hervé Déjean
Xerox Research Centre Europe

http://www.xrce.xerox.com/About-XRCE/People/Herve-Dejeanpdf2xml convertor based on Xpdf library (http://www.foolabs.com/xpdf/home.html). It converts information contained in a PDF file into XML. First, you need to install xpdf and libxml2 (see documentation).
Hervé Déjean
Xerox Research Centre Europe

http://www.xrce.xerox.com/About-XRCE/People/Herve-Dejean","Categories
XML, Other/Nonlisted Topic, Cataloguing"
"Easy, fast and free CMS Blog.
Nibbleblog it's a powerful engine for creating blogs, all you need is PHP to work. Very simple to install and configure (only 1 step).Easy, fast and free CMS Blog.
Nibbleblog it's a powerful engine for creating blogs, all you need is PHP to work. Very simple to install and configure (only 1 step).","Categories
XML, Site Management, Blogging"
"Gerber2PDF is a command-line tool to convert Gerber files to PDF for proofing and hobbyist printing purposes.

It converts multiple Gerber files at once, placing the resulting layers each on it's own page within the PDF. Each layer has a PDF bookmark for easy reference.

Layers can optionally be combined onto a single page and rendered with custom colours and transparency.

There is a Drill to Gerber converter available from the downloads page.Gerber2PDF is a command-line tool to convert Gerber files to PDF for proofing and hobbyist printing purposes.

It converts multiple Gerber files at once, placing the resulting layers each on it's own page within the PDF. Each layer has a PDF bookmark for easy reference.

Layers can optionally be combined onto a single page and rendered with custom colours and transparency.

There is a Drill to Gerber converter available from the downloads page.","Categories
Electronic Design Automation (EDA), PDF, Command Line Tools"
"FCOLLADA based COLLADA plugins for Maya and 3DSMax. Newer plugins with 1.5 support and support the files mentioned in ""Papervision3D Essentials"" by Paul Tondeur are available at http://opencollada.org . Please use this project for FCOLLADA related topiFCOLLADA based COLLADA plugins for Maya and 3DSMax. Newer plugins with 1.5 support and support the files mentioned in ""Papervision3D Essentials"" by Paul Tondeur are available at http://opencollada.org . Please use this project for FCOLLADA related topi","Categories
XML, 3D Modeling, 3D Rendering, Data Visualization"
"A Java API for XBRL providing comprehensive data access. It is suitable for searching, analysing and presenting LARGE amounts of XBRL data. XBRLAPI also releases a separate XLink processor, XML Base resolver and XPointer parser.A Java API for XBRL providing comprehensive data access. It is suitable for searching, analysing and presenting LARGE amounts of XBRL data. XBRLAPI also releases a separate XLink processor, XML Base resolver and XPointer parser.","Categories
XML"
"A real-time graph plotter. While your application is computing and logging results to a CSV file using the LiveGraph Writer API, the plotter lets you visualise and monitor the results live - by instantly plotting charts and graphs of the data.A real-time graph plotter. While your application is computing and logging results to a CSV file using the LiveGraph Writer API, the plotter lets you visualise and monitor the results live - by instantly plotting charts and graphs of the data.","Categories
Data Formats, Frameworks, Simulation, Interface Engine/Protocol Translator, Data Visualization, Information Analysis"
"MagpieRSS is a simple, functional PHP inteface for parsing RSS 1.0 (and earlier versions).

Built on PHP's XML (expat) parser, and with an integrated cache for storing the parsed RSS objects, Magpie is designed by simple, and 'PHP-like' to use.MagpieRSS is a simple, functional PHP inteface for parsing RSS 1.0 (and earlier versions).

Built on PHP's XML (expat) parser, and with an integrated cache for storing the parsed RSS objects, Magpie is designed by simple, and 'PHP-like' to use.","Categories
RSS, WWW/HTTP, Software Development"
"Writer2LaTeX and Writer2xhtml is a collection of converters from OpenDocument Format (ODF) to LaTeX/BibTeX, HTML+MathML and EPUB.
It is delivered as a standalone java library, as a command line application and as extensions for LibreOffice.Writer2LaTeX and Writer2xhtml is a collection of converters from OpenDocument Format (ODF) to LaTeX/BibTeX, HTML+MathML and EPUB.
It is delivered as a standalone java library, as a command line application and as extensions for LibreOffice.","Categories
Word Processors, HTML/XHTML, TeX/LaTeX, Office Suites"
"Jaxe is a free Java XML editor with a configurable GUI, using XML schemas for validation and XSL for exports in HTML or XML.Jaxe is a free Java XML editor with a configurable GUI, using XML schemas for validation and XSL for exports in HTML or XML.","Categories
Text Processing, XML"
"Aperture is a Java framework for extracting and querying full-text content and metadata from various information systems (file systems, web sites, mail boxes, ...) and the file formats (documents, images, ...) occurring in these systems.Aperture is a Java framework for extracting and querying full-text content and metadata from various information systems (file systems, web sites, mail boxes, ...) and the file formats (documents, images, ...) occurring in these systems.","Categories
Data Formats, Search Engines, Frameworks, Search"
PDF Chain is a graphical user interface for the PDF Toolkit (PDFtk). The GUI supports all common features of the command line tool in a comfortable way.PDF Chain is a graphical user interface for the PDF Toolkit (PDFtk). The GUI supports all common features of the command line tool in a comfortable way.,"Categories
Data Formats, Office/Business, PDF"
"Software for sustainability assessment, highly modular; initially focused on Life Cycle Assessments.Software for sustainability assessment, highly modular; initially focused on Life Cycle Assessments.","Categories
Data Formats, Simulation, Ecosystem Sciences"
"eLML (eLesson Markup Language) is an XML framework for creating structured eLessons based on a pedagogical model. eLML consists of an XMLSchema and XSLT files to create XHTML, PDF, LaTeX, IMS CP and SCORM versions, standards supported by most LMS.eLML (eLesson Markup Language) is an XML framework for creating structured eLessons based on a pedagogical model. eLML consists of an XMLSchema and XSLT files to create XHTML, PDF, LaTeX, IMS CP and SCORM versions, standards supported by most LMS.","Categories
XML, Frameworks, Education"
"Cross-platform command-line tool for creation of PDF documents from scans/photos of pages in JPEG (.jpg) format and the lightest weight ANSI C library to put multiple JPEG files into one PDF file.

You can add handwritten comments to PDF scans (over original images) with xournal: http://xournal.sourceforge.net/
It supports graphics tablets and saves comments to PDFs as vector data.Cross-platform command-line tool for creation of PDF documents from scans/photos of pages in JPEG (.jpg) format and the lightest weight ANSI C library to put multiple JPEG files into one PDF file.

You can add handwritten comments to PDF scans (over original images) with xournal: http://xournal.sourceforge.net/
It supports graphics tablets and saves comments to PDFs as vector data.","Categories
Image Converters, Digital Preservation, PDF"
"PdfBooklet is a Python Gtk application which allows to make books or booklets from existing pdf files. It can also adjust margins, rotate, scale, merge files or extract pages.PdfBooklet is a Python Gtk application which allows to make books or booklets from existing pdf files. It can also adjust margins, rotate, scale, merge files or extract pages.","Categories
PDF, PDF Merge"
Editor for both Csv files and Fixed width files. There is automatic attribute detection for single record Csv Files. You can edit Fixed Width file and Multi-Record Csv / Fixed width files using a Xml Schema. There is also limited editing available for Xml and PO files.Editor for both Csv files and Fixed width files. There is automatic attribute detection for single record Csv Files. You can edit Fixed Width file and Multi-Record Csv / Fixed width files using a Xml Schema. There is also limited editing available for Xml and PO files.,"Categories
Text Editors, XML, CSV"
HtmlCleaner is HTML parser written in Java. It transforms dirty HTML to well-formed XML following the same rules that the most web-browsers use.HtmlCleaner is HTML parser written in Java. It transforms dirty HTML to well-formed XML following the same rules that the most web-browsers use.,"Categories
HTML/XHTML"
SVG Document Object Model in C# on the .Net framework. Help build the future foundation of SVG on .Net.SVG Document Object Model in C# on the .Net framework. Help build the future foundation of SVG on .Net.,"Categories
XML, Image Viewers"
"WorkerPDF uses GhostScript https://www.ghostscript.com/.
WorkerPDF created for PDF conversion.
Program features:
- Compress pdf documents;
- Combine pdf;
- Moving pdf pages;
- Rotating pdf pages;
- Creating pdf from images;
- Convert pdf to images.
- Encrypt, decrypt pdf

WorkerPDF использует GhostScript https://www.ghostscript.com/.
WorkerPDF создан для преобразования PDF.
Возможности программы:
- Сжатие pdf документов;
- Объединение pdf;
- Перестановка страниц pdf;
- Поворот страниц pdf;
- Создание pdf из изображений;
- Преобразование pdf в изображения.
- Шифрование, дешифрование pdfWorkerPDF uses GhostScript https://www.ghostscript.com/.
WorkerPDF created for PDF conversion.
Program features:
- Compress pdf documents;
- Combine pdf;
- Moving pdf pages;
- Rotating pdf pages;
- Creating pdf from images;
- Convert pdf to images.
- Encrypt, decrypt pdf

WorkerPDF использует GhostScript https://www.ghostscript.com/.
WorkerPDF создан для преобразования PDF.
Возможности программы:
- Сжатие pdf документов;
- Объединение pdf;
- Перестановка страниц pdf;
- Поворот страниц pdf;
- Создание pdf из изображений;
- Преобразование pdf в изображения.
- Шифрование, дешифрование pdf","Categories
Data Formats, PDF, PDF Merge"
Starbatch is a batch lisp program for Autodesk Autocad drawings. Using StarBatch you can automate AutoCAD to save you time and money. Batch your favourite Lisp's while you complete other tasks.Starbatch is a batch lisp program for Autodesk Autocad drawings. Using StarBatch you can automate AutoCAD to save you time and money. Batch your favourite Lisp's while you complete other tasks.,"Categories
Mechanical and Civil Engineering, Computer-aided technologies (CADD/CAM/CAE), CAD"
"AsterixInspector - displays contents of files in Eurocontrol Asterix format. Asterix is a binary data exchange format in aviation, standardized by Eurocontrol.AsterixInspector - displays contents of files in Eurocontrol Asterix format. Asterix is a binary data exchange format in aviation, standardized by Eurocontrol.","Categories
Data Formats, Software Development, Mechanical and Civil Engineering"
jQuery4PHP ( jQuery for PHP ) is a PHP 5 library. Makes easy writing javascript code (jQuery syntax) using PHP objects. Develops Rich Internet Applications in an easy way without having to know javascript language with the help and power of jQuery.jQuery4PHP ( jQuery for PHP ) is a PHP 5 library. Makes easy writing javascript code (jQuery syntax) using PHP objects. Develops Rich Internet Applications in an easy way without having to know javascript language with the help and power of jQuery.,"Categories
HTML/XHTML, JSON, AJAX"
"ASN.1 types and codecs (BER, CER, DER) implementation in Python programming language.

A collection of various ASN.1-based protocols data structures is supplied in a dedicated Python package.

Project moved to GitHub: https://github.com/etingof/pyasn1ASN.1 types and codecs (BER, CER, DER) implementation in Python programming language.

A collection of various ASN.1-based protocols data structures is supplied in a dedicated Python package.

Project moved to GitHub: https://github.com/etingof/pyasn1","Categories
Data Formats, Code Generators, Compilers, Interface Engine/Protocol Translator"
json.py is an implementation of a JSON (http://json.org) reader and writer in Python. jsontests.py are unit tests demonstrating the correctness of the implementation.json.py is an implementation of a JSON (http://json.org) reader and writer in Python. jsontests.py are unit tests demonstrating the correctness of the implementation.,"Categories
Data Formats"
