Description,Category
"Amine is an Artificial Intelligence Multi-Layer Java Open Source Platform dedicated to the development of various kinds of Intelligent Systems and Agents (Knowledge-Based, Ontology-Based, Conceptual Graph -CG- Based, NLP, Reasoning and Learning, Natural Language Processing, etc.). Ontology, KB can be created and manipulated with various processes. CG theory is used as the main knowledge representation language.
Amine provides two languages: PROLOG+CG which extends PROLOG with CG and Amine modules, and SYNERGY which is a visual activation/propagation based language. CGs are considered by SYNERGY as activable/executable graphs.
See for more detail: //amine-platform.sourceforge.net/Amine is an Artificial Intelligence Multi-Layer Java Open Source Platform dedicated to the development of various kinds of Intelligent Systems and Agents (Knowledge-Based, Ontology-Based, Conceptual Graph -CG- Based, NLP, Reasoning and Learning, Natural Language Processing, etc.). Ontology, KB can be created and manipulated with various processes. CG theory is used as the main knowledge representation language.
Amine provides two languages: PROLOG+CG which extends PROLOG with CG and Amine modules, and SYNERGY which is a visual activation/propagation based language. CGs are considered by SYNERGY as activable/executable graphs.
See for more detail: //amine-platform.sourceforge.net/","Categories
Artificial Intelligence, Intelligent Agents, Machine Learning"
ChronosXP is a planetary hours astrology program for Windows. It runs from the system tray where it displays a glyph corresponding to the current planetary hour. Planetary hours/days can also be viewed for any given time or location.ChronosXP is a planetary hours astrology program for Windows. It runs from the system tray where it displays a glyph corresponding to the current planetary hour. Planetary hours/days can also be viewed for any given time or location.,"Categories
New Age, Astronomy"
"One-dimensional semiconductor device simulator. Developed since 1982, it is widely regarded as the industry standard simulator for the photovoltaic (solar cell) industry.One-dimensional semiconductor device simulator. Developed since 1982, it is widely regarded as the industry standard simulator for the photovoltaic (solar cell) industry.","Categories
Simulation, Physics"
"The development community in building GIS solutions is sustaining an enormous level of effort. The GeoAPI project aims to reduce duplication and increase interoperability by providing neutral, interface-only APIs derived from OGC/ISO Standards.The development community in building GIS solutions is sustaining an enormous level of effort. The GeoAPI project aims to reduce duplication and increase interoperability by providing neutral, interface-only APIs derived from OGC/ISO Standards.","Categories
Libraries, GIS"
"The Open Instrumentation Project provides open source software for graphical user interface and control of computer-based lab instruments. Current instruments include an oscilloscope, waveform generator, CircuitGear, multimeter and network analyser.The Open Instrumentation Project provides open source software for graphical user interface and control of computer-based lab instruments. Current instruments include an oscilloscope, waveform generator, CircuitGear, multimeter and network analyser.","Categories
User Interface (UI), Scientific/Engineering"
DICOM Anonymizer replaces the patient names in all the DICOM files in a folder (and sub-folders) with other strings you assigned. Works as a batch and works fast. Supports number index. Anonymizing is required for medical image processing.DICOM Anonymizer replaces the patient names in all the DICOM files in a folder (and sub-folders) with other strings you assigned. Works as a batch and works fast. Supports number index. Anonymizing is required for medical image processing.,"Categories
Medical"
"The C-Munipack is an astrophotometry software package, which offers a complete solution for reduction of images carried out by CCD or DSLR camera, intended on a observation of variable stars, exoplanets and minor Solar System bodies. It provides a simple and intuitive graphical user interface.The C-Munipack is an astrophotometry software package, which offers a complete solution for reduction of images carried out by CCD or DSLR camera, intended on a observation of variable stars, exoplanets and minor Solar System bodies. It provides a simple and intuitive graphical user interface.","Categories
Astronomy"
"The PyCogent project is moving to GitHub. When completed, you will find us at http://github.com/pycogent/pycogent/. You can find the PyCogent website at http://www.pycogent.org.The PyCogent project is moving to GitHub. When completed, you will find us at http://github.com/pycogent/pycogent/. You can find the PyCogent website at http://www.pycogent.org.","Categories
Bio-Informatics"
"Open source 3D physics and dynamics engine and library written in pure Java. This is a Java port of ODE / OpenDE (Open Dynamics Engine).

THIS PROJECT HAS BEEN MOVED TO A NEW LOCATION: http://www.ode4j.orgOpen source 3D physics and dynamics engine and library written in pure Java. This is a Java port of ODE / OpenDE (Open Dynamics Engine).

THIS PROJECT HAS BEEN MOVED TO A NEW LOCATION: http://www.ode4j.org","Categories
Robotics, Physics, Game Development Frameworks"
"This project is a quest for conscious artificial intelligence. A number of prototypes will be developed as the project progresses.

This project has 2 subprojects:
Object Pascal based CAI NEURAL API - https://github.com/joaopauloschuler/neural-api
Python based K-CAI NEURAL API - https://github.com/joaopauloschuler/k-neural-api

A video from the first prototype has been made:
http://www.youtube.com/watch?v=qH-IQgYy9zg

Above video shows a popperian agent collecting mining ore from 3 mining sites and bringing to the base. At the time the agent is born, it doesn't know how to walk nor it knows that it feels pleasure by mining. He has tact only (blind agent). The video shows learning, planning, executing and plan optimization.This project is a quest for conscious artificial intelligence. A number of prototypes will be developed as the project progresses.

This project has 2 subprojects:
Object Pascal based CAI NEURAL API - https://github.com/joaopauloschuler/neural-api
Python based K-CAI NEURAL API - https://github.com/joaopauloschuler/k-neural-api

A video from the first prototype has been made:
http://www.youtube.com/watch?v=qH-IQgYy9zg

Above video shows a popperian agent collecting mining ore from 3 mining sites and bringing to the base. At the time the agent is born, it doesn't know how to walk nor it knows that it feels pleasure by mining. He has tact only (blind agent). The video shows learning, planning, executing and plan optimization.","Categories
Bio-Informatics, Intelligent Agents, Machine Learning"
"Geomajas is a web mapping GIS software with full vectorial editing capabilities, and support for custom attribute relation models in the browser. It has built-in support for any type of query, selection, filtering, snapping, printing, ...Geomajas is a web mapping GIS software with full vectorial editing capabilities, and support for custom attribute relation models in the browser. It has built-in support for any type of query, selection, filtering, snapping, printing, ...","Categories
Dynamic Content, Frameworks, GIS"
Once upon a time there was a pocket calculator called the HP15C. It used a system called Reverse Polish Notation (RPN) for doing its calculations. The Fairwood Calculator is a RPN calculator designed for the computer.Once upon a time there was a pocket calculator called the HP15C. It used a system called Reverse Polish Notation (RPN) for doing its calculations. The Fairwood Calculator is a RPN calculator designed for the computer.,"Categories
Mathematics, Calculators, RPN Calculators"
"PySCeS is the Python Simulator of Cellular Systems. For a network of coupled reactions it does a stoichiometric matrix analysis, calculates the time course and steady state, and does a complete control analysis.PySCeS is the Python Simulator of Cellular Systems. For a network of coupled reactions it does a stoichiometric matrix analysis, calculates the time course and steady state, and does a complete control analysis.","Categories
Simulation, Chemistry, Bio-Informatics"
"Scientific calculator for PalmOS and PocketPC with graphing, financial operations, number conversions, complex numbers and much more.Scientific calculator for PalmOS and PocketPC with graphing, financial operations, number conversions, complex numbers and much more.","Categories
Mathematics, Calculators, Graphing Calculators"
Towhee is a Monte Carlo molecular simulation code originally designed for the prediction of fluid phase equilibria using atom-based force fields and the Gibbs ensemble with particular attention paid to algorithms addressing molecule conformation sampling.Towhee is a Monte Carlo molecular simulation code originally designed for the prediction of fluid phase equilibria using atom-based force fields and the Gibbs ensemble with particular attention paid to algorithms addressing molecule conformation sampling.,"Categories
Chemistry, Physics"
"MARF is a general cross-platform framework with a collection of algorithms for audio (voice, speech, and sound) and natural language text analysis and recognition along with sample applications (identification, NLP, etc.) of its use, implemented in Java.MARF is a general cross-platform framework with a collection of algorithms for audio (voice, speech, and sound) and natural language text analysis and recognition along with sample applications (identification, NLP, etc.) of its use, implemented in Java.","Categories
Frameworks, Distributed Computing, Artificial Intelligence, HMI, Speech, Audio Analysis"
"WIndows Dicom Open Viewer, is a simple viewer for DICOM medical images, to be used expecially on removable devices (such as Patient CDs). Partially based on ezDICOM sources.
----
Currently no one of the developers has enough time to go on with the code.
Please, feel free to contact the administrators in order to participate in the development.WIndows Dicom Open Viewer, is a simple viewer for DICOM medical images, to be used expecially on removable devices (such as Patient CDs). Partially based on ezDICOM sources.
----
Currently no one of the developers has enough time to go on with the code.
Please, feel free to contact the administrators in order to participate in the development.","Categories
Medical"
"Febrl (Freely Extensible Biomedical Record Linkage) does data standardisation (segmentation and cleaning) and probabilistic record linkage (""fuzzy"" matching) of one or more files or data sources which do not share a unique record key or identifier.Febrl (Freely Extensible Biomedical Record Linkage) does data standardisation (segmentation and cleaning) and probabilistic record linkage (""fuzzy"" matching) of one or more files or data sources which do not share a unique record key or identifier.","Categories
Bio-Informatics, Artificial Intelligence, Medical"
"EtherApe is a graphical network monitor modeled after etherman. Featuring Ethernet, IP, TCP, FDDI, Token Ring and wireless modes, it displays network activity graphically. Hosts and links change in size with traffic. Color coded protocols display.EtherApe is a graphical network monitor modeled after etherman. Featuring Ethernet, IP, TCP, FDDI, Token Ring and wireless modes, it displays network activity graphically. Hosts and links change in size with traffic. Color coded protocols display.","Categories
Monitoring, Data Visualization"
MiXiM is a simulator for wireless and mobile networks using the OMNeT++ simulation engine.MiXiM is a simulator for wireless and mobile networks using the OMNeT++ simulation engine.,"Categories
Wireless, Simulation"
K8055 User Interface is a Mac OS X based Cocoa application for controlling the Velleman K8055 USB interface. Included is a static library which can be used for developing other applications and closely replicates the Velleman Windows .DLL functions.K8055 User Interface is a Mac OS X based Cocoa application for controlling the Velleman K8055 USB interface. Included is a static library which can be used for developing other applications and closely replicates the Velleman Windows .DLL functions.,"Categories
Hardware, Robotics, HMI"
"See the new project page: https://nojhan.github.io/paradiseo/

(Archived project page: http://eodev.sourceforge.net/)See the new project page: https://nojhan.github.io/paradiseo/

(Archived project page: http://eodev.sourceforge.net/)","Categories
Genetic Algorithms, Artificial Intelligence"
"A Sequenced Binaural Wave Generator for Linux+Windows. May be used to generate sounds that entrain the brain's waves to oscillate at selected frequencies to aid in relaxation, lucid dreaming, meditation, clear thought, out-of-body experiences + moreA Sequenced Binaural Wave Generator for Linux+Windows. May be used to generate sounds that entrain the brain's waves to oscillate at selected frequencies to aid in relaxation, lucid dreaming, meditation, clear thought, out-of-body experiences + more","Categories
Bio-Informatics, Medical, Sound Synthesis"
"The project development has been moved on GitHub https://github.com/pcb2gcode/pcb2gcode
The GUI for pcb2gcode can be found here https://github.com/pcb2gcode/pcb2gcodeGUI

pcb2gcode is a command-line tool for isolation, routing and drilling of PCBs that provides full support for both single- and double-sided boards. For more information, see http://sourceforge.net/apps/mediawiki/pcb2gcode/The project development has been moved on GitHub https://github.com/pcb2gcode/pcb2gcode
The GUI for pcb2gcode can be found here https://github.com/pcb2gcode/pcb2gcodeGUI

pcb2gcode is a command-line tool for isolation, routing and drilling of PCBs that provides full support for both single- and double-sided boards. For more information, see http://sourceforge.net/apps/mediawiki/pcb2gcode/","Categories
Electronic Design Automation (EDA), Command Line Tools"
"SBEVSL is a collaborative project between Dowling and RIT on the development of a Structural Biology Extensible Visualization Scripting Language, so that users can move freely among various molecular graphics tools, such as rasmol, pymol, raster3d, etc.SBEVSL is a collaborative project between Dowling and RIT on the development of a Structural Biology Extensible Visualization Scripting Language, so that users can move freely among various molecular graphics tools, such as rasmol, pymol, raster3d, etc.","Categories
Bio-Informatics, Data Visualization"
GRid Advanced Simulation SystemGRid Advanced Simulation System,"Categories
Simulation"
"Math library for Delphi, FreePascal and LazarusMath library for Delphi, FreePascal and Lazarus","Categories
Mathematics"
"Free ladder & sequential (grafcet) languages as used on many PLC for programming automation process. Ladder language allows to realize programs on PLC in an electric way.
GTK graphical interface to edit/simulate.
Modbus protocol for SCADA connexion and remote Inputs/Outputs modules.
Logs events available.
Can run on embedded targets for real usages (without GTK interface), as Arietta, RaspberryPi, ... Xenomai support for real-time.Free ladder & sequential (grafcet) languages as used on many PLC for programming automation process. Ladder language allows to realize programs on PLC in an electric way.
GTK graphical interface to edit/simulate.
Modbus protocol for SCADA connexion and remote Inputs/Outputs modules.
Logs events available.
Can run on embedded targets for real usages (without GTK interface), as Arietta, RaspberryPi, ... Xenomai support for real-time.","Categories
Scientific/Engineering"
"OpenCyc is the open source version of the Cyc(r) technology, the world's largest and most complete general knowledge base and reasoning engine. A new release with even more content, better performance, and improved reliability will be up shortly.OpenCyc is the open source version of the Cyc(r) technology, the world's largest and most complete general knowledge base and reasoning engine. A new release with even more content, better performance, and improved reliability will be up shortly.","Categories
Artificial Intelligence"
PyNomo is a package for creating nomograph(s) [nomogram(s)] using Python language.PyNomo is a package for creating nomograph(s) [nomogram(s)] using Python language.,"Categories
Software Development, Data Visualization"
"galculator is a GTK 2 / GTK 3 based scientific calculator supporting algebraic mode as well as RPN. Features include arithmetic precedence handling, mathematical functions, different number bases (DEC, HEX, BIN, OCT) and angle bases (radiant, degree, and grad).

Please note: This project page at sf.net reflects the state of the project up to August 2015. Beginning in September 2015, the project homepage was moved to http://galculator.mnim.org, with the source code repositories and issue trackers hosted at https://github.com/galculator/galculator.galculator is a GTK 2 / GTK 3 based scientific calculator supporting algebraic mode as well as RPN. Features include arithmetic precedence handling, mathematical functions, different number bases (DEC, HEX, BIN, OCT) and angle bases (radiant, degree, and grad).

Please note: This project page at sf.net reflects the state of the project up to August 2015. Beginning in September 2015, the project homepage was moved to http://galculator.mnim.org, with the source code repositories and issue trackers hosted at https://github.com/galculator/galculator.","Categories
Mathematics, Calculators, RPN Calculators"
Dynamic COBOL copybook parser for Java. Supports parsing and writing of application data based on parsed copybooks. Coverts COBOL types to Java types and back to COBOL types with validation.Dynamic COBOL copybook parser for Java. Supports parsing and writing of application data based on parsed copybooks. Coverts COBOL types to Java types and back to COBOL types with validation.,"Categories
Interface Engine/Protocol Translator"
Dexter is a little java program to interactively or semi-automatically extract data from scanned graphs. In its applet incarnation it is used by the Astrophysics Data System. A rudimenary standalone version is provided as well.Dexter is a little java program to interactively or semi-automatically extract data from scanned graphs. In its applet incarnation it is used by the Astrophysics Data System. A rudimenary standalone version is provided as well.,"Categories
Data Visualization"
"This is an unusually easy-to-use module for Python that generates navigable 3D animations as a side effect of computations. See vpython.org for current stable downloads and much other information. As of 2012 April 10, source code updates take place at github.com/vpython.This is an unusually easy-to-use module for Python that generates navigable 3D animations as a side effect of computations. See vpython.org for current stable downloads and much other information. As of 2012 April 10, source code updates take place at github.com/vpython.","Categories
3D Rendering, Data Visualization, Education"
"DataCleaner is a data quality analysis application and a solution platform for DQ solutions. It's core is a strong data profiling engine, which is extensible and thereby adds data cleansing, transformations, enrichment, deduplication, matching and merging.

Website: http://datacleaner.github.ioDataCleaner is a data quality analysis application and a solution platform for DQ solutions. It's core is a strong data profiling engine, which is extensible and thereby adds data cleansing, transformations, enrichment, deduplication, matching and merging.

Website: http://datacleaner.github.io","Categories
Data Warehousing, Information Analysis, Business Intelligence"
"GG-Tracker tracks the location of your mobile device. It displays your position on the internet using Google Maps / Earth and uses live updates via ajax technology.

GG-Tracker can run standalone or integrated on an existing webpage. The application is built using the template framework Bootstrap which makes it fully responsive (fits on any screen). Also the supporting files for Google Maps, Streetview and Earth are 100% responsive.

GG-Tracker can potentially hook up to many different apps (iOS and Android) as long as they follow the OpenGTS or Garmin $GPRMC standards. The application itself runs on a standard Apache and MySQL setup.GG-Tracker tracks the location of your mobile device. It displays your position on the internet using Google Maps / Earth and uses live updates via ajax technology.

GG-Tracker can run standalone or integrated on an existing webpage. The application is built using the template framework Bootstrap which makes it fully responsive (fits on any screen). Also the supporting files for Google Maps, Streetview and Earth are 100% responsive.

GG-Tracker can potentially hook up to many different apps (iOS and Android) as long as they follow the OpenGTS or Garmin $GPRMC standards. The application itself runs on a standard Apache and MySQL setup.","Categories
GPS, GIS"
"The PAMGUARD project develops software to help detect, locate and classify marine mammals using Passive Acoustic Monitoring.

This project is being migrated to github at https://github.com/PAMGuard. Please go there for the latest updates.

thank you sourceforge for hosting us for all these years.The PAMGUARD project develops software to help detect, locate and classify marine mammals using Passive Acoustic Monitoring.

This project is being migrated to github at https://github.com/PAMGuard. Please go there for the latest updates.

thank you sourceforge for hosting us for all these years.","Categories
Ecosystem Sciences, Data Visualization, Information Analysis, Audio Analysis"
"Java based astronomical logging software which stores it's data in a free and open XML based format (OpenAstronomyLog).
Discontinued project: Please check out the fork: https://github.com/capape/observation-manager for an updated versionJava based astronomical logging software which stores it's data in a free and open XML based format (OpenAstronomyLog).
Discontinued project: Please check out the fork: https://github.com/capape/observation-manager for an updated version","Categories
XML, Astronomy"
"This library is meant for high performance calculations for science or 3D games/rasterizers using SIMD instructions of x86 processors to allow an unparalleled level of optimization. This takes advantage of MMX, 3DNow!, 3DNow!+/MMX+, & SSE/SSE2/SSE3/SSSE3This library is meant for high performance calculations for science or 3D games/rasterizers using SIMD instructions of x86 processors to allow an unparalleled level of optimization. This takes advantage of MMX, 3DNow!, 3DNow!+/MMX+, & SSE/SSE2/SSE3/SSSE3","Categories
3D Rendering, Mathematics, Physics"
"A java library for geometry applications. Provides a general framework for manipulating and creating geometric primitives, computing intersection points between shapes, composing them to create new shapes, and performing some measurements.

Important note: the repository has now moved to GitHub: https://github.com/dlegland/javaGeom
Please update bookmarks!A java library for geometry applications. Provides a general framework for manipulating and creating geometric primitives, computing intersection points between shapes, composing them to create new shapes, and performing some measurements.

Important note: the repository has now moved to GitHub: https://github.com/dlegland/javaGeom
Please update bookmarks!","Categories
Mathematics"
"PTools is a set of useful tools written in Pascal. It includes: scientific calculator, archiver, text editor, remote adminitration and more. It is designed to be portable across operating systems, specially Java-based mobiles, Windows and Unixes.PTools is a set of useful tools written in Pascal. It includes: scientific calculator, archiver, text editor, remote adminitration and more. It is designed to be portable across operating systems, specially Java-based mobiles, Windows and Unixes.","Categories
Text Processing, Archiving, Systems Administration, Mathematics, Calculators"
"MSTParser is a non-projective dependency parser that searches for maximum spanning trees over directed graphs. Models of dependency structure are based on large-margin discriminative training methods. Projective parsing is also supported.

mstparser 0.5.1 is now available via Maven Central. If you use Maven as your build tool, then you can add it as a dependency in your pom.xml file:

<dependency>
<groupId>net.sourceforge.mstparser</groupId>
<artifactId>mstparser</artifactId>
<version>0.5.1</version>
</dependency>MSTParser is a non-projective dependency parser that searches for maximum spanning trees over directed graphs. Models of dependency structure are based on large-margin discriminative training methods. Projective parsing is also supported.

mstparser 0.5.1 is now available via Maven Central. If you use Maven as your build tool, then you can add it as a dependency in your pom.xml file:

<dependency>
<groupId>net.sourceforge.mstparser</groupId>
<artifactId>mstparser</artifactId>
<version>0.5.1</version>
</dependency>","Categories
Artificial Intelligence, HMI"
