Description,Category
"A simple command line tool for text to image generation, using OpenAI's CLIP and a BigGAN. Ryan Murdock has done it again, combining OpenAI's CLIP and the generator from a BigGAN! This repository wraps up his work so it is easily accessible to anyone who owns a GPU. You will be able to have the GAN dream-up images using natural language with a one-line command in the terminal. User-made notebook with bug fixes and added features, like google drive integration. Images will be saved to wherever the command is invoked. If you have enough memory, you can also try using a bigger vision model released by OpenAI for improved generations. You can set the number of classes that you wish to restrict Big Sleep to use for the Big GAN with the --max-classes flag as follows (ex. 15 classes). This may lead to extra stability during training, at the cost of lost expressivity.A simple command line tool for text to image generation, using OpenAI's CLIP and a BigGAN. Ryan Murdock has done it again, combining OpenAI's CLIP and the generator from a BigGAN! This repository wraps up his work so it is easily accessible to anyone who owns a GPU. You will be able to have the GAN dream-up images using natural language with a one-line command in the terminal. User-made notebook with bug fixes and added features, like google drive integration. Images will be saved to wherever the command is invoked. If you have enough memory, you can also try using a bigger vision model released by OpenAI for improved generations. You can set the number of classes that you wish to restrict Big Sleep to use for the Big GAN with the --max-classes flag as follows (ex. 15 classes). This may lead to extra stability during training, at the cost of lost expressivity.","Categories
Terminals, Machine Learning, Command Line Tools"
"mssql-cli is an interactive command line query tool for SQL Server. This open-source tool works cross-platform and is proud to be a part of the dbcli community. mssql-cli supports a rich interactive command line experience, with features such as auto-completion, fewer keystrokes needed to complete complicated queries. Syntax highlighting, highlights T-SQL keywords. Query history, easily complete an auto-suggested query that was previously executed. Configuration file support, customize the mssql-cli experience for your needs. Multi-line queries, execute multiple queries at once using the multi-line edit mode. Non-interactive support, execute a query without jumping into the interactive experience.mssql-cli is an interactive command line query tool for SQL Server. This open-source tool works cross-platform and is proud to be a part of the dbcli community. mssql-cli supports a rich interactive command line experience, with features such as auto-completion, fewer keystrokes needed to complete complicated queries. Syntax highlighting, highlights T-SQL keywords. Query history, easily complete an auto-suggested query that was previously executed. Configuration file support, customize the mssql-cli experience for your needs. Multi-line queries, execute multiple queries at once using the multi-line edit mode. Non-interactive support, execute a query without jumping into the interactive experience.","Categories
Terminals, Database"
"Amazon ECS has released AWS Copilot, a command-line interface (CLI) tool that simplifies building, releasing, and operating production-ready containerized applications on Amazon ECS from a local development environment. The Amazon Elastic Container Service (Amazon ECS) command-line interface (CLI) provides high-level commands to simplify creating, updating, and monitoring clusters and tasks from a local development environment. The Amazon ECS CLI supports Docker Compose files, a popular open-source specification for defining and running multi-container applications. Use the ECS CLI as part of your everyday development and testing cycle as an alternative to the AWS Management Console. The AWS Command Line Interface (AWS CLI) is a unified client for AWS services that provides commands for all public API operations. These commands are lower level than those provided by the Amazon ECS CLI.Amazon ECS has released AWS Copilot, a command-line interface (CLI) tool that simplifies building, releasing, and operating production-ready containerized applications on Amazon ECS from a local development environment. The Amazon Elastic Container Service (Amazon ECS) command-line interface (CLI) provides high-level commands to simplify creating, updating, and monitoring clusters and tasks from a local development environment. The Amazon ECS CLI supports Docker Compose files, a popular open-source specification for defining and running multi-container applications. Use the ECS CLI as part of your everyday development and testing cycle as an alternative to the AWS Management Console. The AWS Command Line Interface (AWS CLI) is a unified client for AWS services that provides commands for all public API operations. These commands are lower level than those provided by the Amazon ECS CLI.","Categories
Data Formats, Terminals"
