Description,Category
"Audio toolkit for streaming, aiming at complex Internet radio systems. Our stream generator is highly extensible and flexible. Script based, it can be a fully automatic daemon streamer, but is also used for live shows with an user-friendly GUI.Audio toolkit for streaming, aiming at complex Internet radio systems. Our stream generator is highly extensible and flexible. Script based, it can be a fully automatic daemon streamer, but is also used for live shows with an user-friendly GUI.","Categories
Streaming, Video, Sound/Audio"
"This software allows you to view a multimedia library (audio, video) with 3D interface. It can play multimedia files with an internal player or by calling any other external player (ex: VLC, Winamp, Foobar, Media player ...) It supports plugins and skin.This software allows you to view a multimedia library (audio, video) with 3D interface. It can play multimedia files with an internal player or by calling any other external player (ex: VLC, Winamp, Foobar, Media player ...) It supports plugins and skin.","Categories
Video, MP3, Home Theater PC"
"Kyra is a simple, fully featured, industrial strength Sprite engine written in C++. The Kyra engine is suited to 2D, isometric, and quasi-3D games. It is built on top of SDL for cross platform use.Kyra is a simple, fully featured, industrial strength Sprite engine written in C++. The Kyra engine is suited to 2D, isometric, and quasi-3D games. It is built on top of SDL for cross platform use.","Categories
Games/Entertainment, Graphics"
"This library allows you to easily send and receive MIDI messages on the Arduino serial port. The purpose of this library is not to make a big MIDI controller or synth out of an Arduino board, but to help you do it, the application remains yours.

/!\ PLEASE NOTE /!\
Project is hosted on GitHub:
https://github.com/FortySevenEffects/arduino_midi_library
This SourceForge project is deprecated. Please download source/releases and post bug reports on GitHub.

Documentation:
http://arduinomidilib.fortyseveneffects.comThis library allows you to easily send and receive MIDI messages on the Arduino serial port. The purpose of this library is not to make a big MIDI controller or synth out of an Arduino board, but to help you do it, the application remains yours.

/!\ PLEASE NOTE /!\
Project is hosted on GitHub:
https://github.com/FortySevenEffects/arduino_midi_library
This SourceForge project is deprecated. Please download source/releases and post bug reports on GitHub.

Documentation:
http://arduinomidilib.fortyseveneffects.com","Categories
MIDI, Libraries"
"Project closed ! Please use JOGL. http://jogamp.org OpenGL[tm] for Java[tm], formerly known as GL4Java, supports Java with a native OpenGL mapping. The OS native OpenGL functionality is avaiable fromProject closed ! Please use JOGL. http://jogamp.org OpenGL[tm] for Java[tm], formerly known as GL4Java, supports Java with a native OpenGL mapping. The OS native OpenGL functionality is avaiable from","Categories
3D Rendering, Image Viewers"
"Convert text to International Morse Code. Input is ASCII text. Output can be: - . -..- - on the console, raw 8bit PCM suitable for piping to /dev/audio, .wav files or even (mp3|ogg). Good for headlines on your MP3 player or code practice.Convert text to International Morse Code. Input is ASCII text. Output can be: - . -..- - on the console, raw 8bit PCM suitable for piping to /dev/audio, .wav files or even (mp3|ogg). Good for headlines on your MP3 player or code practice.","Categories
Ham Radio, Sound Synthesis"
"ConversionSVG is a Windows GUI that controls the way Inkscape exports SVG files to PNG, EPS, PS and PDF file formats. The software also handles efficiently batch conversion and it comes with a Wizard to helps beginners.ConversionSVG is a Windows GUI that controls the way Inkscape exports SVG files to PNG, EPS, PS and PDF file formats. The software also handles efficiently batch conversion and it comes with a Wizard to helps beginners.","Categories
Image Converters"
"WinampMatrixMixer is a winamp output plugin. Its main purpose is to upmix stereo streams to multichannel (useful on 5.1 audio systems).
Based on last version of ac3filter, it does also the same audio processing (see ac3filter website for more details).WinampMatrixMixer is a winamp output plugin. Its main purpose is to upmix stereo streams to multichannel (useful on 5.1 audio systems).
Based on last version of ac3filter, it does also the same audio processing (see ac3filter website for more details).","Categories
Sound/Audio"
"UberPaint (formerly 4P) is a pixel pushing paint program heavily based on Electronic Arts' ""Deluxe Paint"". It tries to replicate the behaviors and functionality of DPaint 2, while adding support for more file formats and modern computer OSes.UberPaint (formerly 4P) is a pixel pushing paint program heavily based on Electronic Arts' ""Deluxe Paint"". It tries to replicate the behaviors and functionality of DPaint 2, while adding support for more file formats and modern computer OSes.","Categories
Raster Graphics"
"Motion monitors the video signal from one or more cameras (video4linux interface) and is able to detect if a significant part of the picture has changed. Features: interval snapshots, live streaming webcam, mpeg generation, database interface, OSD etc.

For the latest releases and deb packages go to the Motion home pageMotion monitors the video signal from one or more cameras (video4linux interface) and is able to detect if a significant part of the picture has changed. Features: interval snapshots, live streaming webcam, mpeg generation, database interface, OSD etc.

For the latest releases and deb packages go to the Motion home page","Categories
Security, Video"
"A collection of enhanced PPD files for Canon Pixma MP600 and MP610 all-in-one printers, and a Sane scanner driver for Canon Pixma MP140, MP210, MP520, MP610, MP710, MX700 for up to 4800 dpi resolution, that can be used with Sane 1.0.18 or 1.0.19.A collection of enhanced PPD files for Canon Pixma MP600 and MP610 all-in-one printers, and a Sane scanner driver for Canon Pixma MP140, MP210, MP520, MP610, MP710, MX700 for up to 4800 dpi resolution, that can be used with Sane 1.0.18 or 1.0.19.","Categories
Hardware Drivers, Printing, Scanner"
"AJT is a set of utility classes for Java for handling some bioinformatics data, graphics file export, GUI widgets, and classes that should long have been added to the official Java API.AJT is a set of utility classes for Java for handling some bioinformatics data, graphics file export, GUI widgets, and classes that should long have been added to the official Java API.","Categories
Software Development, Graphics, Bio-Informatics"
This is a PDF reader for the Be Operating System (BeOS). BePDF is based on xpdf 3.0. It handles PDF files up to PDF version 1.5 (Acrobat Reader 6.0).This is a PDF reader for the Be Operating System (BeOS). BePDF is based on xpdf 3.0. It handles PDF files up to PDF version 1.5 (Acrobat Reader 6.0).,"Categories
Printing, Image Viewers, PDF Readers"
"CoffeeMud is a text-based virtual reality game engine (a MUD). It is a mature, full-featured Java codebase. It includes web (HTTP) and email (SMTP) servers, chat (IMC2 and I3) and web clients, and supports ANSI, MXP, and MSP.CoffeeMud is a text-based virtual reality game engine (a MUD). It is a mature, full-featured Java codebase. It includes web (HTTP) and email (SMTP) servers, chat (IMC2 and I3) and web clients, and supports ANSI, MXP, and MSP.","Categories
Game Engines, VR Development, Virtual Reality"
Open SVC Decoder aims to provide a real-time coding framework for Scalable Video Coding extension of H.264/AVC.This project is AVC/SVC library decoding tools created at the IETR/INSA of Rennes. Please have a look at the project web site for more detailsOpen SVC Decoder aims to provide a real-time coding framework for Scalable Video Coding extension of H.264/AVC.This project is AVC/SVC library decoding tools created at the IETR/INSA of Rennes. Please have a look at the project web site for more details,"Categories
Codec"
"Arbaro is an implementation of the tree generating algorithm described
in Jason Weber & Joseph Penn: Creation and Rendering of Realistic TreesArbaro is an implementation of the tree generating algorithm described
in Jason Weber & Joseph Penn: Creation and Rendering of Realistic Trees","Categories
3D Modeling, 3D Rendering"
The Bauer stereophonic-to-binaural DSP (bs2b) library and plugins is designed to improve headphone listening of stereo audio records. Recommended for headphone prolonged listening to disable superstereo fatigue without essential distortions.The Bauer stereophonic-to-binaural DSP (bs2b) library and plugins is designed to improve headphone listening of stereo audio records. Recommended for headphone prolonged listening to disable superstereo fatigue without essential distortions.,"Categories
Audio Conversion"
"Advanced music player for GNU/Linux, also running on FreeBSD, OpenBSD and Microsoft Windows. Plays audio CDs, internet radio streams, podcasts and soundfiles in just about any audio format and has the feature of inserting no gaps between adjacent tracks.Advanced music player for GNU/Linux, also running on FreeBSD, OpenBSD and Microsoft Windows. Plays audio CDs, internet radio streams, podcasts and soundfiles in just about any audio format and has the feature of inserting no gaps between adjacent tracks.","Categories
Players"
"!!! IMPORTANT !!! THE PROJECT HAS BEEN MOVED TO https://github.com/lomo74/mfilemon

MFILEMON is a print monitor for 32 and 64 bit MS Windows (2000/XP/2003/2008/2012/Vista/7/8/10). It automates ""print to file"" jobs choosing the filename according to a pattern. It can redirect data to an external program (e.g. Ghostscript, to produce PDF).!!! IMPORTANT !!! THE PROJECT HAS BEEN MOVED TO https://github.com/lomo74/mfilemon

MFILEMON is a print monitor for 32 and 64 bit MS Windows (2000/XP/2003/2008/2012/Vista/7/8/10). It automates ""print to file"" jobs choosing the filename according to a pattern. It can redirect data to an external program (e.g. Ghostscript, to produce PDF).","Categories
Printing, Image Converters"
"This project is a software oscilloscope for the Universal Software Radio Peripheral. It includes such features as maximum level triggers on any channel, a spectrum analyzer, and more.This project is a software oscilloscope for the Universal Software Radio Peripheral. It includes such features as maximum level triggers on any channel, a spectrum analyzer, and more.","Categories
Communications, Audio Analysis"
VMukti open source is leading Asterisk/ Yate enabled p2p Video IP Communications Suite for Web / PSTN. These serverless broadband ready platform enable OS community to save 90% on capital & operating costs over proprietary software for conferencing &VMukti open source is leading Asterisk/ Yate enabled p2p Video IP Communications Suite for Web / PSTN. These serverless broadband ready platform enable OS community to save 90% on capital & operating costs over proprietary software for conferencing &,"Categories
Internet Phone, Enterprise, Video"
