Description,Category
"GLE is a graphics scripting language designed for creating publication quality graphs, plots, diagrams, figures, and slides. Text can be formatted with LaTeX/TeX markup. Its output formats include EPS, PS, PDF, JPEG, and PNG. GLE can operate as either a command line or GUI application.GLE is a graphics scripting language designed for creating publication quality graphs, plots, diagrams, figures, and slides. Text can be formatted with LaTeX/TeX markup. Its output formats include EPS, PS, PDF, JPEG, and PNG. GLE can operate as either a command line or GUI application.","Categories
Graphics, Data Visualization"
"A powerful editor for video games based on or similar to id Software's series of Quake games. Currently QuArK supports 41 distinct games, 5 generic game engines, and a countless number of expansions packs, addons, and mods. It integrates a map editor, model editor, archive editors, texture management, and much more.A powerful editor for video games based on or similar to id Software's series of Quake games. Currently QuArK supports 41 distinct games, 5 generic game engines, and a countless number of expansions packs, addons, and mods. It integrates a map editor, model editor, archive editors, texture management, and much more.","Categories
First Person Shooters, 3D Modeling, Graphic Design"
"SPTK is a suite of speech signal processing tools for UNIX
environments, e.g., LPC analysis, PARCOR analysis, LSP analysis,
PARCOR synthesis filter, LSP synthesis filter, vector
quantization techniques, and other extended versions of them.SPTK is a suite of speech signal processing tools for UNIX
environments, e.g., LPC analysis, PARCOR analysis, LSP analysis,
PARCOR synthesis filter, LSP synthesis filter, vector
quantization techniques, and other extended versions of them.","Categories
Speech, Audio Analysis, Sound Synthesis"
"libdc1394 is a library that provides a high level programming interface for application developers who wish to control and capture streams from IEEE 1394 based cameras that conform to the 1394-based Digital Camera Specifications (also known as the IIDC or DCAM Specifications). libdc1394 also supports some USB cameras that are IIDC compliant.

Besides capture and control, libdc1394 provides a full set of colour space conversion functions (including RAW decoding), vendor specific functions and direct camera register access.

Keywords: ieee1394, IIDC, DCAM, firewire, USB, machine vision, computer vision, video capture, librarylibdc1394 is a library that provides a high level programming interface for application developers who wish to control and capture streams from IEEE 1394 based cameras that conform to the 1394-based Digital Camera Specifications (also known as the IIDC or DCAM Specifications). libdc1394 also supports some USB cameras that are IIDC compliant.

Besides capture and control, libdc1394 provides a full set of colour space conversion functions (including RAW decoding), vendor specific functions and direct camera register access.

Keywords: ieee1394, IIDC, DCAM, firewire, USB, machine vision, computer vision, video capture, library","Categories
Hardware Drivers, Scientific/Engineering, Video Capture"
"Aural Probe is a sample librarian tool for computer musicians/audio engineers. Automatically and non-destructively index your disorganised sample collection from a list of folders into categories (kick, snare, hihats etc.) based on folder/filename wildcard matches. Easily audition samples, load/save favourites, and drag-and-drop straight into your sequencer.Aural Probe is a sample librarian tool for computer musicians/audio engineers. Automatically and non-destructively index your disorganised sample collection from a list of folders into categories (kick, snare, hihats etc.) based on folder/filename wildcard matches. Easily audition samples, load/save favourites, and drag-and-drop straight into your sequencer.","Categories
Audio Editing, Audio Analysis, Music Composition"
"Simple Movie Catalog will scan a given directory for movies, query imdb for info and generate a catalog in html which offers sorting and grouping of found movies by different criteria.

Note: source code has been moved to github: https://github.com/damienlangg/SimpleMovieCatalogSimple Movie Catalog will scan a given directory for movies, query imdb for info and generate a catalog in html which offers sorting and grouping of found movies by different criteria.

Note: source code has been moved to github: https://github.com/damienlangg/SimpleMovieCatalog","Categories
File Managers, Multimedia"
The development continues on the Git-hub https://github.com/Eule/StreamRipStarThe development continues on the Git-hub https://github.com/Eule/StreamRipStar,"Categories
Audio Recording"
"Edit MP3 ID3 and Ogg/Speex Vorbis tags easily. Create support files for audiobook NFO, SFV, PAR, M3U. Test file base on SFV and PAR.Edit MP3 ID3 and Ogg/Speex Vorbis tags easily. Create support files for audiobook NFO, SFV, PAR, M3U. Test file base on SFV and PAR.","Categories
Audio Editing"
"Chamonix is a CHM viewer for Mac OS X 10.4. It is an Objective-C app that uses CHM lib (http://sourceforge.net/projects/chmlib), Cocoa and WebKit. It supports ToC, Indexing, Search and Favourites and multiple CHM documents.Chamonix is a CHM viewer for Mac OS X 10.4. It is an Objective-C app that uses CHM lib (http://sourceforge.net/projects/chmlib), Cocoa and WebKit. It supports ToC, Indexing, Search and Favourites and multiple CHM documents.","Categories
Data Formats, Image Viewers"
"GeSHi - Generic Syntax Highlighter for PHP. Used to highlight almost any code for the web. Nearly 150 supported languages: PHP, HTML, C and more. Styles can be changed on the fly and CSS classes can be used to reduce the amount of XHTML compliant output.GeSHi - Generic Syntax Highlighter for PHP. Used to highlight almost any code for the web. Nearly 150 supported languages: PHP, HTML, C and more. Styles can be changed on the fly and CSS classes can be used to reduce the amount of XHTML compliant output.","Categories
Dynamic Content, Software Development, Presentation"
"<b>Direct Youtube To Mp3 Downloader App Link</b>
↓↓↓↓↓↓↓↓↓↓↓↓↓↓↓↓↓↓↓↓↓↓↓↓↓↓↓↓↓↓↓↓↓↓↓↓↓↓↓↓↓↓↓↓↓↓↓↓↓↓↓↓↓↓↓↓↓↓↓↓↓↓↓↓↓↓↓↓↓↓↓↓↓↓↓↓↓↓↓↓↓↓↓↓↓↓↓↓↓

https://fvdtube.com/en/youtube-mp3-converter/ <<<< Direct APK ***********

Youtube to mp3 Downloader for Android Phones is the best app for those who love watching youtube videos and the best thing about this application is that, you can download whatever youtube you like and keep it with you forever. The videos can be downloaded in whatever format you like as per the quality and resolution. Youtube Downloader for Android Phones also allows multiple video downloading at one time. This is surely one cool app for android phones.<b>Direct Youtube To Mp3 Downloader App Link</b>
↓↓↓↓↓↓↓↓↓↓↓↓↓↓↓↓↓↓↓↓↓↓↓↓↓↓↓↓↓↓↓↓↓↓↓↓↓↓↓↓↓↓↓↓↓↓↓↓↓↓↓↓↓↓↓↓↓↓↓↓↓↓↓↓↓↓↓↓↓↓↓↓↓↓↓↓↓↓↓↓↓↓↓↓↓↓↓↓↓

https://fvdtube.com/en/youtube-mp3-converter/ <<<< Direct APK ***********

Youtube to mp3 Downloader for Android Phones is the best app for those who love watching youtube videos and the best thing about this application is that, you can download whatever youtube you like and keep it with you forever. The videos can be downloaded in whatever format you like as per the quality and resolution. Youtube Downloader for Android Phones also allows multiple video downloading at one time. This is surely one cool app for android phones.","Categories
Communications, Video Downloaders, YouTube Downloaders"
"SageThumbs is a powerful shell extension allowing to preview enormous amount of image formats directly in Windows Explorer by using Pierre-e Gougelet's GFL library (XnView's author).

Please read carefully the following information:

As SageThumbs is a Windows Explorer context menu extension, there is no an executable file that you should launch to bring it up. To use it, just open any folder with image files in Windows Explorer, and then right-click a file you want to preview. You'll see the thumbnail immediately in the context menu.

System Requirements:

* Windows XP/2003/Vista/2008/7/2012/8/8.1 32/64-bit
* About 5 Mb of disk space + additional space for cacheSageThumbs is a powerful shell extension allowing to preview enormous amount of image formats directly in Windows Explorer by using Pierre-e Gougelet's GFL library (XnView's author).

Please read carefully the following information:

As SageThumbs is a Windows Explorer context menu extension, there is no an executable file that you should launch to bring it up. To use it, just open any folder with image files in Windows Explorer, and then right-click a file you want to preview. You'll see the thumbnail immediately in the context menu.

System Requirements:

* Windows XP/2003/Vista/2008/7/2012/8/8.1 32/64-bit
* About 5 Mb of disk space + additional space for cache","Categories
Image Viewers, Image Converters, Photo Management"
"A streamlined video editor with simple frame-by-frame timeline. Free, open-source, portable.
The default package is ready for use with many essential plugins included, and can be further extended with 3rd party codecs and filters.
See Wiki for detailed description: https://sourceforge.net/p/vdfiltermod/wiki.

Previous name of this project: VirtualDub FilterModA streamlined video editor with simple frame-by-frame timeline. Free, open-source, portable.
The default package is ready for use with many essential plugins included, and can be further extended with 3rd party codecs and filters.
See Wiki for detailed description: https://sourceforge.net/p/vdfiltermod/wiki.

Previous name of this project: VirtualDub FilterMod","Categories
Graphics, Video, Video Editing"
"Convert mkv/avi files in h264 to mp4 files without re-encode video stream. Subtitle will be embed as soft subtitle.Convert speed is fast as video is not re-encoded.Works on iPad.mp4box, mkvextract, beSweet,eac3to,mediainfo are used.Convert mkv/avi files in h264 to mp4 files without re-encode video stream. Subtitle will be embed as soft subtitle.Convert speed is fast as video is not re-encoded.Works on iPad.mp4box, mkvextract, beSweet,eac3to,mediainfo are used.","Categories
Audio Conversion, Video Converters"
"A small, easy-to-use program to access itunesU media & podcasts in Linux and Android.A small, easy-to-use program to access itunesU media & podcasts in Linux and Android.","Categories
Browsers, Education, Podcast"
"FAAC is an Advanced Audio Coder (MPEG2-AAC, MPEG4-AAC). The goal of FAAC is to explore the possibilities of AAC and exceed the quality of the currently best MP3 encoders.

You can submit pull requests via GitHub:
https://github.com/knik0/faac
https://github.com/knik0/faad2FAAC is an Advanced Audio Coder (MPEG2-AAC, MPEG4-AAC). The goal of FAAC is to explore the possibilities of AAC and exceed the quality of the currently best MP3 encoders.

You can submit pull requests via GitHub:
https://github.com/knik0/faac
https://github.com/knik0/faad2","Categories
Audio Conversion"
"cdrtfe is a CD/DVD/BD burning application for Microsoft Windows. You can burn data discs, Audio CDs, XCDs, (S)VCDs and DVD-Video discs. It supports creation and writing of ISO images and bootable discs.

cdrtfe has a multi-language interface and is also available as portable version.cdrtfe is a CD/DVD/BD burning application for Microsoft Windows. You can burn data discs, Audio CDs, XCDs, (S)VCDs and DVD-Video discs. It supports creation and writing of ISO images and bootable discs.

cdrtfe has a multi-language interface and is also available as portable version.","Categories
File Managers, Archiving, CD Ripping, CD Burners"
"A toolkit for building high-level compound widgets in Python using the Tkinter module. It contains a set of flexible and extensible megawidgets, including notebooks, comboboxes, selection widgets, paned widgets, scrolled widgets and dialog windows.

Python megawidgets is Python 3 compatible through the Pmw 2 download. Pmw 1 is destined for Python 2. Both are now accessible through the new pypi compatible package (credits for which go to Andy Robinson and the team at ReportLab).A toolkit for building high-level compound widgets in Python using the Tkinter module. It contains a set of flexible and extensible megawidgets, including notebooks, comboboxes, selection widgets, paned widgets, scrolled widgets and dialog windows.

Python megawidgets is Python 3 compatible through the Pmw 2 download. Pmw 1 is destined for Python 2. Both are now accessible through the new pypi compatible package (credits for which go to Andy Robinson and the team at ReportLab).","Categories
Software Development, Graphics"
"GOALBIT is a peer to peer distribution system, capable of distributing high-bandwidth live-content to all network peers preserving its perceived quality.GOALBIT is a peer to peer distribution system, capable of distributing high-bandwidth live-content to all network peers preserving its perceived quality.","Categories
Streaming, Video"
"FrostWire http://www.frostwire.com/ is a media player and Peer to Peer (P2P) information sharing client for the BitTorrent network.

This project is not affiliated with LimeWire LLC. FrostWires' source code is Licensed under the GNU GPL and Apache Open Source licenses.


System Requirements

Any of the following operating systems:

● Windows 10, 8, 7, Vista for Intel processors (64-bit only)

● Mac OS X 10.11 (El Capitan) or later (64-bit)

● Linux, Unix such as Solaris (64-bit)

● Android 7.0 or later

256 MB of RAM (512 MB Recommended)
An active internet connectionFrostWire http://www.frostwire.com/ is a media player and Peer to Peer (P2P) information sharing client for the BitTorrent network.

This project is not affiliated with LimeWire LLC. FrostWires' source code is Licensed under the GNU GPL and Apache Open Source licenses.


System Requirements

Any of the following operating systems:

● Windows 10, 8, 7, Vista for Intel processors (64-bit only)

● Mac OS X 10.11 (El Capitan) or later (64-bit)

● Linux, Unix such as Solaris (64-bit)

● Android 7.0 or later

256 MB of RAM (512 MB Recommended)
An active internet connection","Categories
File Sharing, Players, Media Players"
"Edit your avi, mpeg and nuv. Process audio and video. Cut.Edit your avi, mpeg and nuv. Process audio and video. Cut.","Categories
Non-Linear Editor"
A C# program used to visualize and extract frames from .GIF files. (you need .NET Framework 3.5 installed on your computer)A C# program used to visualize and extract frames from .GIF files. (you need .NET Framework 3.5 installed on your computer),"Categories
Image Viewers"
"Finds problems in MP3 files and helps the user to fix many of them using included tools. Looks at both the audio part (VBR info, quality, normalization) and the tags containing track information (ID3.) Also includes a tag editor and a file renamer.Finds problems in MP3 files and helps the user to fix many of them using included tools. Looks at both the audio part (VBR info, quality, normalization) and the tags containing track information (ID3.) Also includes a tag editor and a file renamer.","Categories
Audio Editing, Audio Analysis"
"BRL-CAD is a powerful cross-platform constructive solid geometry solid modeling system that includes an interactive geometry editor, ray-tracing for rendering & geometric analyses, network distributed framebuffer support, image & signal-processing tools.BRL-CAD is a powerful cross-platform constructive solid geometry solid modeling system that includes an interactive geometry editor, ray-tracing for rendering & geometric analyses, network distributed framebuffer support, image & signal-processing tools.","Categories
Symmetric Multiprocessing (SMP), Benchmark, 3D Modeling, 3D Rendering, Image Converters, Scientific/Engineering"
"Google2SRT allows you to download, save and convert multiple subtitles and translations from YouTube and Google Video to SubRip (.srt) format, which is recognized by most video players. You can download XML subtitles or simply type video's URL, Google2SRT will do the rest.Google2SRT allows you to download, save and convert multiple subtitles and translations from YouTube and Google Video to SubRip (.srt) format, which is recognized by most video players. You can download XML subtitles or simply type video's URL, Google2SRT will do the rest.","Categories
XML, Internet, Video Converters, Speech Recognition"
"FFmpegYAG is an advanced GUI for the popular FFmpeg audio/video encoding tool.
To use all features (split/concat, x264 10 bit, HE-AAC) it is recommend to use the FFmpeg Hi (http://sourceforge.net/projects/ffmpeg-hi/) build.

Main features:

* batch encoding for multiple tasks
* interactive video preview, real-time video/audio playback
* multiple streams processing for video/audio/subtitles
* trim file to segments (with optional fade in/out filters) and concatenate themFFmpegYAG is an advanced GUI for the popular FFmpeg audio/video encoding tool.
To use all features (split/concat, x264 10 bit, HE-AAC) it is recommend to use the FFmpeg Hi (http://sourceforge.net/projects/ffmpeg-hi/) build.

Main features:

* batch encoding for multiple tasks
* interactive video preview, real-time video/audio playback
* multiple streams processing for video/audio/subtitles
* trim file to segments (with optional fade in/out filters) and concatenate them","Categories
Video, Video Converters, Multimedia"
"FreePiano is a virtual MIDI keyboard and a VST host for windows.
You can use freepiano to Play piano with computer keyboard or MIDI keyboard with any vst instrument you like, or output through MIDI.
Or generate any MIDI message with any key on the keyboard.You can also record your song and export a MP4 movie to share with your friends.FreePiano is a virtual MIDI keyboard and a VST host for windows.
You can use freepiano to Play piano with computer keyboard or MIDI keyboard with any vst instrument you like, or output through MIDI.
Or generate any MIDI message with any key on the keyboard.You can also record your song and export a MP4 movie to share with your friends.","Categories
Sound/Audio"
"A DLNA compatible, fully transcoding, media server designed for serving media (movies, TV shows, music, photos) to DLNA compliant televisions and media players (Streamium, PS3, XBox 360). Also subtitles and audio language selection are supported.A DLNA compatible, fully transcoding, media server designed for serving media (movies, TV shows, music, photos) to DLNA compliant televisions and media players (Streamium, PS3, XBox 360). Also subtitles and audio language selection are supported.","Categories
Home Theater PC"
"LiVES mixes realtime video performance and non-linear editing in one professional quality application. It is designed to be simple to use, yet powerful. It is small in size, yet it has many advanced features.

Using LiVES, you can start editing and making video right away, without having to worry about formats, frame sizes, or framerates. It is a very flexible tool which is used by both professional VJ's and video editors - mix and switch clips from the keyboard, use dozens of realtime effects, trim and edit your clips in the clip editor, and bring them together using the multitrack timeline. You can even record your performance in real time, and then edit it further or render it straight away.

For the more technically minded, the application is frame and sample accurate, and it can be controlled remotely or scripted for use as a video server. And it supports all of the latest free standards.LiVES mixes realtime video performance and non-linear editing in one professional quality application. It is designed to be simple to use, yet powerful. It is small in size, yet it has many advanced features.

Using LiVES, you can start editing and making video right away, without having to worry about formats, frame sizes, or framerates. It is a very flexible tool which is used by both professional VJ's and video editors - mix and switch clips from the keyboard, use dozens of realtime effects, trim and edit your clips in the clip editor, and bring them together using the multitrack timeline. You can even record your performance in real time, and then edit it further or render it straight away.

For the more technically minded, the application is frame and sample accurate, and it can be controlled remotely or scripted for use as a video server. And it supports all of the latest free standards.","Categories
Video Converters, Non-Linear Editor, Realtime Processing"
"Most digital cameras produce EXIF files, which are JPEG files with extra tags that contain information about the image. The EXIF library allows you to parse an EXIF file and read the data from those tags.

Development has moved to https://github.com/libexif/. See https://libexif.github.io for more details.Most digital cameras produce EXIF files, which are JPEG files with extra tags that contain information about the image. The EXIF library allows you to parse an EXIF file and read the data from those tags.

Development has moved to https://github.com/libexif/. See https://libexif.github.io for more details.","Categories
Digital Camera"
"VirtualDubMod is based on VirtualDub by Avery Lee. Born as a unification of several modifications, new features have been added including support for the matroska format. This project has been discontinued since 2004-2005.VirtualDubMod is based on VirtualDub by Avery Lee. Born as a unification of several modifications, new features have been added including support for the matroska format. This project has been discontinued since 2004-2005.","Categories
Video"
"getID3() is a PHP script that extracts useful information (such as ID3 tags, bitrate, playtime, etc.) from MP3s & other multimedia file formats (Ogg, WMA, WMV, ASF, WAV, AVI, AAC, VQF, FLAC, MusePack, Real, QuickTime, Monkey's Audio, MIDI and more).getID3() is a PHP script that extracts useful information (such as ID3 tags, bitrate, playtime, etc.) from MP3s & other multimedia file formats (Ogg, WMA, WMV, ASF, WAV, AVI, AAC, VQF, FLAC, MusePack, Real, QuickTime, Monkey's Audio, MIDI and more).","Categories
Audio Analysis"
"Aria Maestosa is a midi sequencer/editor. It lets you compose, edit and play midi files with a few clicks in a user-friendly interface offering score, keyboard, guitar, drum and controller views.

Git repository: https://github.com/ariamaestosa/ariamaestosaAria Maestosa is a midi sequencer/editor. It lets you compose, edit and play midi files with a few clicks in a user-friendly interface offering score, keyboard, guitar, drum and controller views.

Git repository: https://github.com/ariamaestosa/ariamaestosa","Categories
Players, Audio Editing, MIDI"
"Universal Media Server is a DLNA-compliant UPnP Media Server

Universal Media Server supports all major operating systems, with versions for Windows, Linux and Mac OS X.

The program streams or transcodes many different media formats with little or no configuration.

UMS is powered by MEncoder, FFmpeg, tsMuxeR, AviSynth, MediaInfo and more, which combine to offer support for a wide range of media formats

Check out the list of media renderers here:
http://www.universalmediaserver.com/about/Universal Media Server is a DLNA-compliant UPnP Media Server

Universal Media Server supports all major operating systems, with versions for Windows, Linux and Mac OS X.

The program streams or transcodes many different media formats with little or no configuration.

UMS is powered by MEncoder, FFmpeg, tsMuxeR, AviSynth, MediaInfo and more, which combine to offer support for a wide range of media formats

Check out the list of media renderers here:
http://www.universalmediaserver.com/about/","Categories
Video, Sound/Audio, Multimedia"
"Domination is a game that is a bit like the well known board game of Risk or RisiKo. It has many game options and includes many maps.

Written in java it includes a map editor, a simple map format, multiplayer network play, single player, hotseat, 5 user interfaces and many more features, it works in all OSs that run java 1.5 or higher, iOS and Android.Domination is a game that is a bit like the well known board game of Risk or RisiKo. It has many game options and includes many maps.

Written in java it includes a map editor, a simple map format, multiplayer network play, single player, hotseat, 5 user interfaces and many more features, it works in all OSs that run java 1.5 or higher, iOS and Android.","Categories
Desktop Environment, Board Games, Turn Based Strategy, Vector Graphics"
"TupiTube Desk is a 2D animation tool for desktop environments focused on usability for children and amateur artists. It is available for Windows, Mac and Linux operating systemsTupiTube Desk is a 2D animation tool for desktop environments focused on usability for children and amateur artists. It is available for Windows, Mac and Linux operating systems","Categories
Animation"
