Description,Category
mod_gsoap is an Apache module that allows Apache to serve SOAP requests via the Gsoap library. Modules are available for both Apache 1.3 and 2.x.mod_gsoap is an Apache module that allows Apache to serve SOAP requests via the Gsoap library. Modules are available for both Apache 1.3 and 2.x.,"Categories
SOAP, HTTP Servers, Distributed Computing"
"HSPL is Human Speakable Programming Language, allowing for communication between human-to-computer and human-to-human in the same language.

This project has moved to http://sourceforge.net/p/spel

We are currently working on human-to-computer programming-language with mostly English base vocabulary.

Though once we have that, we plan to add support for other world Languages, including Chinese, Spanish, Russian, Arabic, Hindi, among others.

Eventually HSPL shall be the foundation of GIOS the General Intelligence Operating System. Which is an open source operating system, that can be used for intelligent robots, computers and technological host-bodies.

Regularly post on blog about HSPL at
http://weyounet.info/?s=hsplHSPL is Human Speakable Programming Language, allowing for communication between human-to-computer and human-to-human in the same language.

This project has moved to http://sourceforge.net/p/spel

We are currently working on human-to-computer programming-language with mostly English base vocabulary.

Though once we have that, we plan to add support for other world Languages, including Chinese, Spanish, Russian, Arabic, Hindi, among others.

Eventually HSPL shall be the foundation of GIOS the General Intelligence Operating System. Which is an open source operating system, that can be used for intelligent robots, computers and technological host-bodies.

Regularly post on blog about HSPL at
http://weyounet.info/?s=hspl","Categories
Data Formats, Interpreters"
blat(mat) is a Braille to print translator for maths. It takes a Spanish Six-dot Mathematical Braille (not Nemeth Code) text and converts it to an HTML file ready to be translated into XHTML+MathML by ASCIIMathML (javascript).blat(mat) is a Braille to print translator for maths. It takes a Spanish Six-dot Mathematical Braille (not Nemeth Code) text and converts it to an HTML file ready to be translated into XHTML+MathML by ASCIIMathML (javascript).,"Categories
Data Formats, Mathematics, Computer Aided Instruction (CAI)"
"oNVDL provides a Java based implementation of the Namespace-based Validation and Dispatching Language (NVDL) on top of Jing supporting XML Schema, Relax NG and Schematron and an XSLT 2.0 implementation of the dispatching part of NVDL.oNVDL provides a Java based implementation of the Namespace-based Validation and Dispatching Language (NVDL) on top of Jing supporting XML Schema, Relax NG and Schematron and an XSLT 2.0 implementation of the dispatching part of NVDL.","Categories
XML"
"SPIDR (Space Physics Interactive Data Resource) is a distributed database and application server network, built to select, visualize and model historical space weather data. SPIDR is a web-application and a grid of data mining web-services.SPIDR (Space Physics Interactive Data Resource) is a distributed database and application server network, built to select, visualize and model historical space weather data. SPIDR is a web-application and a grid of data mining web-services.","Categories
Data Formats, Database, Data Visualization, Astronomy, Earth Sciences"
XAIRA (XML Aware Indexing and Retrieval Architecture) supports indexing and analysis of large XML textual resources such as natural language corpora.XAIRA (XML Aware Indexing and Retrieval Architecture) supports indexing and analysis of large XML textual resources such as natural language corpora.,"Categories
XML, Database Engines/Servers, TEI"
"phpMyWebServices is a framework that can serve dotNET-like Web services coded in PHP, so it works on all apache/php servers (MySQL not required). With it, you can easy host any webservice on the most of free hosting services !!!phpMyWebServices is a framework that can serve dotNET-like Web services coded in PHP, so it works on all apache/php servers (MySQL not required). With it, you can easy host any webservice on the most of free hosting services !!!","Categories
SOAP, Dynamic Content, Frameworks"
"Software libraries and tools designed for implementation and testing of the Common Image Generator Interface (CIGI), an interface for communication between an image generator (IG) and host device in simulations.Software libraries and tools designed for implementation and testing of the Common Image Generator Interface (CIGI), an interface for communication between an image generator (IG) and host device in simulations.","Categories
Data Formats, Simulation, Interface Engine/Protocol Translator, Data Visualization"
"The oBIX toolkit provides a Java software library for implementing oBIX enabled applications. The toolkit contains a data model for obj trees, XML encoder/decoder, REST session management, and a Swing diagnostics tool.The oBIX toolkit provides a Java software library for implementing oBIX enabled applications. The toolkit contains a data model for obj trees, XML encoder/decoder, REST session management, and a Swing diagnostics tool.","Categories
XML, HTML/XHTML"
"AJAX framework that uses messages to control AJAX requests. Easy to use AJAX framework that provides message queue, XSLT, XPath, encryption (SHA1, MD5), web service access (SOAP, XML-RPC, JSON-RPC), cross browser AJAX, AJAX history and cache control.AJAX framework that uses messages to control AJAX requests. Easy to use AJAX framework that provides message queue, XSLT, XPath, encryption (SHA1, MD5), web service access (SOAP, XML-RPC, JSON-RPC), cross browser AJAX, AJAX history and cache control.","Categories
WWW/HTTP, Web Services, AJAX"
"A C/C++ based client and server implementation of the OGSA Basic Execution Service, used to provide a Web Services interface to distributed resource managers such as Platform LSF and PBS/PBS Pro. The SOAP stack is provided by the gSOAP toolkit.A C/C++ based client and server implementation of the OGSA Basic Execution Service, used to provide a Web Services interface to distributed resource managers such as Platform LSF and PBS/PBS Pro. The SOAP stack is provided by the gSOAP toolkit.","Categories
XML, SOAP, Communications, Distributed Computing, Internet"
"TeXCAD is a program for drawing or retouching {picture}s in LaTeX. It extends the original {picture} capabilities, even without any obligatory LaTeX package, class or style sheet. Core of TeXCAD is totally portable. MS Windows version available.TeXCAD is a program for drawing or retouching {picture}s in LaTeX. It extends the original {picture} capabilities, even without any obligatory LaTeX package, class or style sheet. Core of TeXCAD is totally portable. MS Windows version available.","Categories
TeX/LaTeX, Vector Graphics"
Curl Data Kit - a Curl Open Source project The CDK library facilitates datacentric application development in Curl. It includes support for client side SQLite databases and support for AMF servers like BlazeDS and WebORBCurl Data Kit - a Curl Open Source project The CDK library facilitates datacentric application development in Curl. It includes support for client side SQLite databases and support for AMF servers like BlazeDS and WebORB,"Categories
Database, WWW/HTTP, Web Services"
MM7 protocol library for fast and easy MMSC(Multimedia Messaging Service) client development even for non-telecom guys. Easy to use classes covers all needed functionality for MMS applications developers and Content Providers. Written for .NET 2.0 in C#.MM7 protocol library for fast and easy MMSC(Multimedia Messaging Service) client development even for non-telecom guys. Easy to use classes covers all needed functionality for MMS applications developers and Content Providers. Written for .NET 2.0 in C#.,"Categories
Data Formats, SOAP, Communications, Software Development"
RSS Reader is a mobile J2ME (Java ME) app. that runs on Java enabled phones. User can store multiple RSS/ATOM feeds as bookmarks. Can import from OPLM file or HTML file with links. Can read offline. MIDP 2.0/some MIDP 1.0. Specify which MIDP w/issueRSS Reader is a mobile J2ME (Java ME) app. that runs on Java enabled phones. User can store multiple RSS/ATOM feeds as bookmarks. Can import from OPLM file or HTML file with links. Can read offline. MIDP 2.0/some MIDP 1.0. Specify which MIDP w/issue,"Categories
XML, RSS, WWW/HTTP"
"The goal of the Tokyo Project is to design a process, an architecture, and tools to provide an XML view of non-XML data. This way, applications can view and create non-XML documents as easily as XML ones.The goal of the Tokyo Project is to design a process, an architecture, and tools to provide an XML view of non-XML data. This way, applications can view and create non-XML documents as easily as XML ones.","Categories
XML"
"CookXml is a powerful dynamic XML data binding tool for Java. It is designed to be easily extensible and yet simple to use, with advanced exception handling. CookSwing and CookSwt are tag libraries for CookXml to do XML->GUI (XUL) for Swing and SWT.CookXml is a powerful dynamic XML data binding tool for Java. It is designed to be easily extensible and yet simple to use, with advanced exception handling. CookSwing and CookSwt are tag libraries for CookXml to do XML->GUI (XUL) for Swing and SWT.","Categories
XML, Interpreters, User Interface (UI)"
"Simple regular expression-based URI validation, compliant with RFC 2396. Uses regexes based on the ABNF data in RFC 2396.Simple regular expression-based URI validation, compliant with RFC 2396. Uses regexes based on the ABNF data in RFC 2396.","Categories
Data Formats, Software Development, Internet"
"OpenPCL - Open Source PCL Viewer, Converter & Toolkit. It can be used as a backend component for developers/integrators or as a standalone desktop application for end users.OpenPCL - Open Source PCL Viewer, Converter & Toolkit. It can be used as a backend component for developers/integrators or as a standalone desktop application for end users.","Categories
Data Formats, Enterprise, User Interface (UI), Printing"
The newly introduced security policy for Flash requires the servers to serve the security policy for allowing socket connections to their servers at port 843. This application satisfies this requirement by serving policy files for flash clients.The newly introduced security policy for Flash requires the servers to serve the security policy for allowing socket connections to their servers at port 843. This application satisfies this requirement by serving policy files for flash clients.,"Categories
XML"
Vienna is a freeware Mac OSX off-line reader for the CIX conferencing system with additional support for RSS/Atom feeds.Vienna is a freeware Mac OSX off-line reader for the CIX conferencing system with additional support for RSS/Atom feeds.,"Categories
RSS, Conferencing, Internet"
qxsl-fo project is intended for generating xsl-fo document using GUI to lay-out FO and XML nodes.qxsl-fo project is intended for generating xsl-fo document using GUI to lay-out FO and XML nodes.,"Categories
XML, Desktop Environment"
A web server that runs on the wiiA web server that runs on the wii,"Categories
HTTP Servers, Web Services"
"Tools for mass spectrometry, especially for protein mass spectrometry and proteomics: Quantification tools, converters for Applied Biosystems (Q Star and Q Trap), calculation of in-silico fragmentation spectra, converter for Mascot result filesTools for mass spectrometry, especially for protein mass spectrometry and proteomics: Quantification tools, converters for Applied Biosystems (Q Star and Q Trap), calculation of in-silico fragmentation spectra, converter for Mascot result files","Categories
Data Formats, Bio-Informatics, Information Analysis"
xml.dom.easydom for python primarily behaves like any xml.dom.* you already use. Additionaly easydom provides operator overloadings which render xml processing descriptions more readable and hence less error-prone. See about 90% of your xml-code boosted.xml.dom.easydom for python primarily behaves like any xml.dom.* you already use. Additionaly easydom provides operator overloadings which render xml processing descriptions more readable and hence less error-prone. See about 90% of your xml-code boosted.,"Categories
XML"
Integrate the power of the fully AJAX enabled technology of ICEfaces into the framework of the ESRI WebADF. No need to code in Javascript or to handle XML communication to build AJAX functionalities. OnlineDemo: http://www2.pch.etat.lu/pchViewerIntegrate the power of the fully AJAX enabled technology of ICEfaces into the framework of the ESRI WebADF. No need to code in Javascript or to handle XML communication to build AJAX functionalities. OnlineDemo: http://www2.pch.etat.lu/pchViewer,"Categories
Frameworks, AJAX, GIS"
"The first 3D game engine built in C# for .NET, predecessor to the Visual3D Game Engine (https://www.poweraccess.net/visual3d-game-engine), an All-in-One Game Development Tool for Next-Gen 3D Games, MMOs, Simulations and Virtual Worlds powered by Microsoft XNA.The first 3D game engine built in C# for .NET, predecessor to the Visual3D Game Engine (https://www.poweraccess.net/visual3d-game-engine), an All-in-One Game Development Tool for Next-Gen 3D Games, MMOs, Simulations and Virtual Worlds powered by Microsoft XNA.","Categories
XML, Games/Entertainment, Software Development, Distributed Computing, 3D Rendering, Graphic Design"
QDBMP (Quick n' Dirty BMP) is a lightweight minimalistic cross-platform C library for handling BMP image files. It is intended to provide small applications with basic image I/O capabilities by utilizing the widely used BMP format.QDBMP (Quick n' Dirty BMP) is a lightweight minimalistic cross-platform C library for handling BMP image files. It is intended to provide small applications with basic image I/O capabilities by utilizing the widely used BMP format.,"Categories
Data Formats, Graphics"
Convert various graphics and video formats to ZX Spectrum and Timex Sinclair formats.Convert various graphics and video formats to ZX Spectrum and Timex Sinclair formats.,"Categories
Data Formats, Image Converters, Video Converters"
"Object oriented configuration library for easy internal representation of configuration data to the programmer, and to allow an interface for outputting and inputting the data to and from many different file formats.Object oriented configuration library for easy internal representation of configuration data to the programmer, and to allow an interface for outputting and inputting the data to and from many different file formats.","Categories
Data Formats, Software Development"
The JWMSClient is a simple Java Swing Client to visualize overlapped maps retrieved from an (Open GIS Consortium) WMS 1.x Server implementation.The JWMSClient is a simple Java Swing Client to visualize overlapped maps retrieved from an (Open GIS Consortium) WMS 1.x Server implementation.,"Categories
Data Formats"
tziCal is a conversion utility for converting time zone data from the tz (Olsen) database to iCalendar (.ics) files. See RFC 2445 for details on iCalendar files and VTIMEZONE components.tziCal is a conversion utility for converting time zone data from the tz (Olsen) database to iCalendar (.ics) files. See RFC 2445 for details on iCalendar files and VTIMEZONE components.,"Categories
Data Formats, Calendar"
"EWB is a freeware components package for Borland Delphi 5 to D2009. It allow you to create a Web Browser, Chat Client, web updater, Html/Xml Editors and more. home page :http://www.bsalsa.com download link: http://www.bsalsa.com/DP/download.php?file=4EWB is a freeware components package for Borland Delphi 5 to D2009. It allow you to create a Web Browser, Chat Client, web updater, Html/Xml Editors and more. home page :http://www.bsalsa.com download link: http://www.bsalsa.com/DP/download.php?file=4","Categories
HTML/XHTML, Browsers, Software Development"
"The openLiberty Client library project is a Liberty Alliance Web Services Client (WSC) Java library supporting Web Service Invocations, using SAML. All discussion lists, public forums, wiki, etc. for this project are hosted at http://www.openliberty.orgThe openLiberty Client library project is a Liberty Alliance Web Services Client (WSC) Java library supporting Web Service Invocations, using SAML. All discussion lists, public forums, wiki, etc. for this project are hosted at http://www.openliberty.org","Categories
SOAP, Security, WWW/HTTP, Authentication/Directory, Networking"
"LeafRSS is designed to be a low-maintenance, learning RSS aggregator, with the ability to publish the aggregated results either in a standalone website, an rss feed for news readers, or as an embedded template within an existing site.LeafRSS is designed to be a low-maintenance, learning RSS aggregator, with the ability to publish the aggregated results either in a standalone website, an rss feed for news readers, or as an embedded template within an existing site.","Categories
RSS, Dynamic Content"
"Osxcart, or OS X Converting And Reading Tool, is a library designed to import file formats used in Mac OS X, NeXTSTEP, and GnuSTEP into GTK+/GLib-based programs easily, using a lightweight interface.

The ""s"" in Osxcart is silent.

Right now, the Osxcart library includes a module for reading and writing property lists ("".plist"" files) in XML format, and a module for importing and exporting RTF documents to and from GtkTextBuffers.Osxcart, or OS X Converting And Reading Tool, is a library designed to import file formats used in Mac OS X, NeXTSTEP, and GnuSTEP into GTK+/GLib-based programs easily, using a lightweight interface.

The ""s"" in Osxcart is silent.

Right now, the Osxcart library includes a module for reading and writing property lists ("".plist"" files) in XML format, and a module for importing and exporting RTF documents to and from GtkTextBuffers.","Categories
Data Formats, Libraries"
"JDeliciousFeedApi is a very simple to use Java API to access the information provided by delicious.com over RSS feeds. It does not depend on other libraries, therefore it is a really lightweight piece of software.JDeliciousFeedApi is a very simple to use Java API to access the information provided by delicious.com over RSS feeds. It does not depend on other libraries, therefore it is a really lightweight piece of software.","Categories
RSS, RSS Feed Readers, Libraries"
"FairLuck is an API to access an externalised RNG. We provide libraries to access fair random related services, although not strictly required to access the fundamental XML-RPC layer, they can be used easily for gaming applications developers to enable the fairluck feature.FairLuck is an API to access an externalised RNG. We provide libraries to access fair random related services, although not strictly required to access the fundamental XML-RPC layer, they can be used easily for gaming applications developers to enable the fairluck feature.","Categories
XML-RPC, Game Development Frameworks"
TurtleScript is a semantic web project to demonstrate the utility of including the Turtle RDF serialization in HTML files as a form of metadata. It is intended as proposed alternative or supplement to microformats and RDFa.TurtleScript is a semantic web project to demonstrate the utility of including the Turtle RDF serialization in HTML files as a form of metadata. It is intended as proposed alternative or supplement to microformats and RDFa.,"Categories
WWW/HTTP, Semantic Web"
"Config is an Ada package for parsing configuration files (.ini, .inf, .cfg, ...) and retrieving keys of various types. New values for single keys, or entire sections, can be set. Standalone and unconditionally portable code.Config is an Ada package for parsing configuration files (.ini, .inf, .cfg, ...) and retrieving keys of various types. New values for single keys, or entire sections, can be set. Standalone and unconditionally portable code.","Categories
Data Formats, Software Development"
"This program allows to extract some data from Google Picasa database to famous format files: all face marks into text file, each preview or thumbnail into separate jpeg file.This program allows to extract some data from Google Picasa database to famous format files: all face marks into text file, each preview or thumbnail into separate jpeg file.","Categories
Data Formats"
an images to pdf converteran images to pdf converter,"Categories
Data Formats"
"HybridAuth enable developers to easily build social applications to engage websites vistors and customers on a social level by implementing social signin, social sharing, users profiles, friends list, activities stream, status updates and more.

HybridAuth goal is to act as an abstract api between your application and various social apis and identities providers such as Facebook, Twitter, MySpace and Google.HybridAuth enable developers to easily build social applications to engage websites vistors and customers on a social level by implementing social signin, social sharing, users profiles, friends list, activities stream, status updates and more.

HybridAuth goal is to act as an abstract api between your application and various social apis and identities providers such as Facebook, Twitter, MySpace and Google.","Categories
Web Services, Social Networking"
