Description,Category
A .Blend file with Python functionality for simple toolpath generation and location data gathering/formatting for use on an nc mill. This file is in early development and is currently very limited in functionality. Documentation is spotty.A .Blend file with Python functionality for simple toolpath generation and location data gathering/formatting for use on an nc mill. This file is in early development and is currently very limited in functionality. Documentation is spotty.,"Categories
Other/Nonlisted Topic"
"Full description: www.classroom306.com/stylesheet_project A standardized stylesheet for all websites, helping facilitate the movement towards complete semantics on the web. To be used in common scenarios, prior to applying site-specific styles.Full description: www.classroom306.com/stylesheet_project A standardized stylesheet for all websites, helping facilitate the movement towards complete semantics on the web. To be used in common scenarios, prior to applying site-specific styles.","Categories
HTML/XHTML, Other/Nonlisted Topic, Semantic Web"
LilyPondBeans is a GUI front-end for the LilyPond (www.lilypond.org) music notation software.LilyPondBeans is a GUI front-end for the LilyPond (www.lilypond.org) music notation software.,"Categories
Integrated Development Environments (IDE), Other/Nonlisted Topic, Audio Editing, MIDI, Music Composition"
This is a series of packages that are configured for a specific purpose. Note The packages are for Windows only. but are independent on all modern browsers. But it looks the Best in Mozilla Firefox based browsers.This is a series of packages that are configured for a specific purpose. Note The packages are for Windows only. but are independent on all modern browsers. But it looks the Best in Mozilla Firefox based browsers.,"Categories
Other/Nonlisted Topic"
Please download from: http://www.splashportal.net/HypnoQuitPlease download from: http://www.splashportal.net/HypnoQuit,"Categories
Other/Nonlisted Topic"
Driver for graphical LCD display unit (128x64) controlled with two KS0107 driver circuits written in c (uses avr-libc). Target platform is Atmel AVR. Low level drivers as well as additional graphical functions are provided.Driver for graphical LCD display unit (128x64) controlled with two KS0107 driver circuits written in c (uses avr-libc). Target platform is Atmel AVR. Low level drivers as well as additional graphical functions are provided.,"Categories
Other/Nonlisted Topic"
"Grub4DOS Toolbox for Windows is a small utility that allows the user to install, uninstall and modify the Grub4DOS boot manager with great ease in Windows 2000 and above. It also performs some other related useful functions.Grub4DOS Toolbox for Windows is a small utility that allows the user to install, uninstall and modify the Grub4DOS boot manager with great ease in Windows 2000 and above. It also performs some other related useful functions.","Categories
Other/Nonlisted Topic"
"DAFT (Desktop Anthropomorphic Friend Thing) aims to create a pale imitation of life on the desktop of the everyday user. Aims to be simple, light weight and cross platform.DAFT (Desktop Anthropomorphic Friend Thing) aims to create a pale imitation of life on the desktop of the everyday user. Aims to be simple, light weight and cross platform.","Categories
Other/Nonlisted Topic, Simulation Games"
PyX10 provides a set of modules for controlling X10 home automation devices from within Python applications. Currently PyX10 wraps the XAL library which can be found at http://xal.sourceforge.net .PyX10 provides a set of modules for controlling X10 home automation devices from within Python applications. Currently PyX10 wraps the XAL library which can be found at http://xal.sourceforge.net .,"Categories
Other/Nonlisted Topic"
"Unofficial IOE is a project that documents information about all the projects being developed at Institute of Engineering, Pulchowk Campus (Nepal) as requirement for Engineering (Electronics/Computer) courses offered by IOE.Unofficial IOE is a project that documents information about all the projects being developed at Institute of Engineering, Pulchowk Campus (Nepal) as requirement for Engineering (Electronics/Computer) courses offered by IOE.","Categories
Other/Nonlisted Topic"
"WiggleMouse is a cross platform java program that will wiggle the mouse at an interval entered by the user through a gui.

For code and latest features please check out https://github.com/samuelskanberg/wigglemouseWiggleMouse is a cross platform java program that will wiggle the mouse at an interval entered by the user through a gui.

For code and latest features please check out https://github.com/samuelskanberg/wigglemouse","Categories
Other/Nonlisted Topic"
"OpenLogos is an utility to help qualitative analyses of textual material, based on a database manager with facilities for tagging and retrieve text snippets with code, and tabulating snippets and words across multiple documents.OpenLogos is an utility to help qualitative analyses of textual material, based on a database manager with facilities for tagging and retrieve text snippets with code, and tabulating snippets and words across multiple documents.","Categories
Other/Nonlisted Topic"
Guymager is a fast and most user friendly forensic imager. It is based on libewf and libguytools. See the guymager home page on http://guymager.sourceforge.netGuymager is a fast and most user friendly forensic imager. It is based on libewf and libguytools. See the guymager home page on http://guymager.sourceforge.net,"Categories
Other/Nonlisted Topic"
"Joystick/gamepad to X event converter.
Any device supported by the joydev driver (/dev/input/jsX) can be used as input source. The joystick buttons can be maped to keys and to mouse buttons, the joystick axes to keys or mouse pointer movements.Joystick/gamepad to X event converter.
Any device supported by the joydev driver (/dev/input/jsX) can be used as input source. The joystick buttons can be maped to keys and to mouse buttons, the joystick axes to keys or mouse pointer movements.","Categories
Other/Nonlisted Topic"
"A document that describes Public-Key Infrastructures, the PKIX standards, explains practical PKI functionality and gives an overview of available open-source PKI implementations. Its goal is to foster the creation of a hign quality open-source PKI.A document that describes Public-Key Infrastructures, the PKIX standards, explains practical PKI functionality and gives an overview of available open-source PKI implementations. Its goal is to foster the creation of a hign quality open-source PKI.","Categories
Other/Nonlisted Topic, Security, Internet"
"The Address Book is a free, open source address management system, utilizing the combined power of PHP scripting and MySQL databases to provide a flexible, robust system allowing users to add a virtually unlimited number of addresses and other info.The Address Book is a free, open source address management system, utilizing the combined power of PHP scripting and MySQL databases to provide a flexible, robust system allowing users to add a virtually unlimited number of addresses and other info.","Categories
Email, Other/Nonlisted Topic, Dynamic Content"
"PV (""Pipe Viewer"") is a tool for monitoring the progress of data through a pipeline. It can be inserted into any normal pipeline between two processes to give a visual indication of how quickly data is passing through, how long it has taken, how near to completion it is, and an estimate of how long it will be until completion.PV (""Pipe Viewer"") is a tool for monitoring the progress of data through a pipeline. It can be inserted into any normal pipeline between two processes to give a visual indication of how quickly data is passing through, how long it has taken, how near to completion it is, and an estimate of how long it will be until completion.","Categories
Other/Nonlisted Topic, Systems Administration"
"Provide an accurate, high-quality and complete translation of Xaraya CMS (www.xaraya.com) to the Brazilian Portuguese language. Other localization works and related tools are welcome too. Xaraya sounds like: http://www.xaraya.com/xcommon/media/xaraya.wavProvide an accurate, high-quality and complete translation of Xaraya CMS (www.xaraya.com) to the Brazilian Portuguese language. Other localization works and related tools are welcome too. Xaraya sounds like: http://www.xaraya.com/xcommon/media/xaraya.wav","Categories
Other/Nonlisted Topic, Dynamic Content, Site Management"
Web-based (php) BOINC client for viewing a state of multiple running serversWeb-based (php) BOINC client for viewing a state of multiple running servers,"Categories
Other/Nonlisted Topic"
Downloads programme guides and converts it between various formats.Downloads programme guides and converts it between various formats.,"Categories
Other/Nonlisted Topic"
DICTC is handy DICT client for Win32. Use the DICT protocol (RFC2229) to access human language dictionary databases via the Internet.DICTC is handy DICT client for Win32. Use the DICT protocol (RFC2229) to access human language dictionary databases via the Internet.,"Categories
Other/Nonlisted Topic, Education, Dictionary"
"Open Source Tools from ForensicZone.com
PTFinderFE
SSDeepFE
Enscript for Ram AnalysisOpen Source Tools from ForensicZone.com
PTFinderFE
SSDeepFE
Enscript for Ram Analysis","Categories
Other/Nonlisted Topic, Exam"
"Eclipse plugin for Software Engineering experimentation. The plugin is configurable via XML. It presents tasks, questions and timers and accepts the subject's answers. Answers and reactions are logged for later evaluation.Eclipse plugin for Software Engineering experimentation. The plugin is configurable via XML. It presents tasks, questions and timers and accepts the subject's answers. Answers and reactions are logged for later evaluation.","Categories
Other/Nonlisted Topic"
"MatLinks/Chorus is an open source project which aims to augment Matlab, Simulink, and Octave with toolboxes of useful functions not included in the standard distributions.MatLinks/Chorus is an open source project which aims to augment Matlab, Simulink, and Octave with toolboxes of useful functions not included in the standard distributions.","Categories
Other/Nonlisted Topic, Mathematics"
FLOSSmole (formerly OSSmole) is a set of tools for gathering metrics and publishing analyses about development of free/libre/open source projects. UPDATE: Our data is now released to Google Code. Please see our new home page at http://flossmole.orgFLOSSmole (formerly OSSmole) is a set of tools for gathering metrics and publishing analyses about development of free/libre/open source projects. UPDATE: Our data is now released to Google Code. Please see our new home page at http://flossmole.org,"Categories
Other/Nonlisted Topic"
OpenTAPAS: Technology Assisted Practice Application Suite (TAPAS) is a term that describes digital tools that assist physicians deliver care in a paper based office. OpenTAPAS builds upon the HL7 compliant Electronic Medical Summary StandardOpenTAPAS: Technology Assisted Practice Application Suite (TAPAS) is a term that describes digital tools that assist physicians deliver care in a paper based office. OpenTAPAS builds upon the HL7 compliant Electronic Medical Summary Standard,"Categories
Other/Nonlisted Topic, Medical"
"A Manchu OpenType (TrueType-flavored) font which allows you write and read Manchu script articles correctly.

ManjuKey is a standard Windows IME used for input Manchu characters.A Manchu OpenType (TrueType-flavored) font which allows you write and read Manchu script articles correctly.

ManjuKey is a standard Windows IME used for input Manchu characters.","Categories
Other/Nonlisted Topic, Localization (L10N), Printing"
"Nomad PIM is a free extensible personal information manager. It contains modules for personal notes, journal, address book, personal finances, task management, time tracking and evaluating basic fitness measurements.Nomad PIM is a free extensible personal information manager. It contains modules for personal notes, journal, address book, personal finances, task management, time tracking and evaluating basic fitness measurements.","Categories
Other/Nonlisted Topic, Accounting, Scheduling, To-Do Lists, Task Managers"
"phpMyRecipes is a simple Web-based application for storing and retrieving recipes, using PHP for the interface and MySQL for the back-end database. Security and search functions are built-in.phpMyRecipes is a simple Web-based application for storing and retrieving recipes, using PHP for the interface and MySQL for the back-end database. Security and search functions are built-in.","Categories
Other/Nonlisted Topic"
BEEJ is a Boolean Expression Editor for Java. This library provides a GUI interface to build complex (or simple) expressions with your options as a base component.BEEJ is a Boolean Expression Editor for Java. This library provides a GUI interface to build complex (or simple) expressions with your options as a base component.,"Categories
Other/Nonlisted Topic, Front-Ends, Code Generators"
"Software to help volunteer organizations track workers, projects, and services. Handles reminders, responses, pledges of service, multiple work opportunities, project managers, etc. Written as an web/EJB application.Software to help volunteer organizations track workers, projects, and services. Handles reminders, responses, pledges of service, multiple work opportunities, project managers, etc. Written as an web/EJB application.","Categories
Other/Nonlisted Topic, Sociology"
"Provide code to allow PalmOS developers to easily support Sony OS4 and OS5 silkscreen, Palm OS 5.2+ DIA, Handera Silk and Dana AlphaSmart large screen, in portrait and landscape mode as possible. Minimal changes to existing code are needed.Provide code to allow PalmOS developers to easily support Sony OS4 and OS5 silkscreen, Palm OS 5.2+ DIA, Handera Silk and Dana AlphaSmart large screen, in portrait and landscape mode as possible. Minimal changes to existing code are needed.","Categories
Other/Nonlisted Topic, Software Development"
DRM (Degital Rights Management) for people - Derivative Works with Creative Commons License Works.DRM (Degital Rights Management) for people - Derivative Works with Creative Commons License Works.,"Categories
Other/Nonlisted Topic"
Graphical Botanical Database Management Tool keeps track of a very large number of variables in the growth of plants their environment and experiments performed Producing custom reports and displaying images. UPDATE-XGBDMT IS NOW PLATFORM INDEPENDANT.Graphical Botanical Database Management Tool keeps track of a very large number of variables in the growth of plants their environment and experiments performed Producing custom reports and displaying images. UPDATE-XGBDMT IS NOW PLATFORM INDEPENDANT.,"Categories
Other/Nonlisted Topic, Front-Ends, Database Engines/Servers, WWW/HTTP"
"DBLens is a Oracle-based toolkit for performing collaborative
filtering. DBLens is a collection of PL/SQL code and accompanying
shell scripts that provides a flexible and efficient method for
performing collaborative filtering.DBLens is a Oracle-based toolkit for performing collaborative
filtering. DBLens is a collection of PL/SQL code and accompanying
shell scripts that provides a flexible and efficient method for
performing collaborative filtering.","Categories
Other/Nonlisted Topic, Database, Scientific/Engineering"
"Debian NewbieDOC: documentation by and for Debian newbies.

Share your experience and help us create documentation to help out next week's Debian newbies! Edit existing documents and create new ones on the documentation website wiki. The resulting documentation is periodically packaged in a .deb file for the Debian distribution and its derivatives.Debian NewbieDOC: documentation by and for Debian newbies.

Share your experience and help us create documentation to help out next week's Debian newbies! Edit existing documents and create new ones on the documentation website wiki. The resulting documentation is periodically packaged in a .deb file for the Debian distribution and its derivatives.","Categories
Communications, Other/Nonlisted Topic, Education"
A topic map engine in PythonA topic map engine in Python,"Categories
Other/Nonlisted Topic"
"WebLETS is a fully web-enabled LETSystem (Local Exchange and Trade System), incorporating most if not all typical functionality of traditional LETS software and/or paper based systems. This may now be the best open source LETS software availiable.WebLETS is a fully web-enabled LETSystem (Local Exchange and Trade System), incorporating most if not all typical functionality of traditional LETS software and/or paper based systems. This may now be the best open source LETS software availiable.","Categories
Other/Nonlisted Topic, Accounting, Education"
"Ever wanted to shut your Windows down at a certain time?
Then Timed Shutdown is your tool!
This utility is a fast program (small in filesize) to shut down Windows whenever you want.Ever wanted to shut your Windows down at a certain time?
Then Timed Shutdown is your tool!
This utility is a fast program (small in filesize) to shut down Windows whenever you want.","Categories
Other/Nonlisted Topic"
"Fingerprint Imaging Software -- fingerprint pattern classification, minutae detection, Wavelet Scalar Quantization(wsq) compression, ANSI/NIST-ITL 1-2000 reference implementation, baseline and lossless jpeg, image utilities, math and MLP neural net libsFingerprint Imaging Software -- fingerprint pattern classification, minutae detection, Wavelet Scalar Quantization(wsq) compression, ANSI/NIST-ITL 1-2000 reference implementation, baseline and lossless jpeg, image utilities, math and MLP neural net libs","Categories
Other/Nonlisted Topic, Image Viewers, Image Converters, Artificial Intelligence, Mathematics, Sociology"
"Various projects focusing on, but not limited to, Python, robotics and microcontrollers.Various projects focusing on, but not limited to, Python, robotics and microcontrollers.","Categories
Other/Nonlisted Topic, Software Development, Robotics"
Providing word support for medical systems.Providing word support for medical systems.,"Categories
Other/Nonlisted Topic"
A C/C++ library to guess the encoding and charset of a stringA C/C++ library to guess the encoding and charset of a string,"Categories
Other/Nonlisted Topic"
"This project presents a web based Heijunka-Kanban board. It uses a MySql database to manage kanban (sign cards) on a Heijunka (leveling) board. It supports states, priorities, owners, and one level of nesting along with child kanbans.This project presents a web based Heijunka-Kanban board. It uses a MySql database to manage kanban (sign cards) on a Heijunka (leveling) board. It supports states, priorities, owners, and one level of nesting along with child kanbans.","Categories
Other/Nonlisted Topic, Project Management, QA Automation"
"SensorLock is a locking program designed for the HTC Touch Diamond/Pro. Locking and unlocking is done by rotating the phone and unlike most other locking programs, it does not interfere with or remove focus from running applications.SensorLock is a locking program designed for the HTC Touch Diamond/Pro. Locking and unlocking is done by rotating the phone and unlike most other locking programs, it does not interfere with or remove focus from running applications.","Categories
Other/Nonlisted Topic"
"OSeP stands for Open Source ePortfolio. OSeP is a web application started by the the University of Minnesota (U of M) for entering, saving, organizing, viewing, and selectively sharing your personal, professional, and educational records.OSeP stands for Open Source ePortfolio. OSeP is a web application started by the the University of Minnesota (U of M) for entering, saving, organizing, viewing, and selectively sharing your personal, professional, and educational records.","Categories
Other/Nonlisted Topic"
"We aim to provide a non-commercial private, secure, reliable and open electronic voting alternative to the commercial offerings of questionable quality.We aim to provide a non-commercial private, secure, reliable and open electronic voting alternative to the commercial offerings of questionable quality.","Categories
Communications, Other/Nonlisted Topic, Internet"
"A simple but effective romrenamer written in Java. Runs on Linux and Windows and comes with a bundled installer. Reads NDS, RAR and Zipfiles Can extract directly to NDS or Zipfile. Datasource is provided as XMLFile from http://www.advanscene.com/A simple but effective romrenamer written in Java. Runs on Linux and Windows and comes with a bundled installer. Reads NDS, RAR and Zipfiles Can extract directly to NDS or Zipfile. Datasource is provided as XMLFile from http://www.advanscene.com/","Categories
Other/Nonlisted Topic, Games/Entertainment, File Managers, Emulators"
"The Tithi Timer application displays a highly-accurate Hindu / Indian lunisolar calendar. Currently displays month, paksha, and tithi start times.The Tithi Timer application displays a highly-accurate Hindu / Indian lunisolar calendar. Currently displays month, paksha, and tithi start times.","Categories
Other/Nonlisted Topic"
"XOSD displays text on your screen, sounds simple right? The difference is it is unmanaged and shaped, so it appears transparent. This gives the effect of an On Screen Display, like your TV/VCR etc. Comes with an XMMS plugin.XOSD displays text on your screen, sounds simple right? The difference is it is unmanaged and shaped, so it appears transparent. This gives the effect of an On Screen Display, like your TV/VCR etc. Comes with an XMMS plugin.","Categories
Other/Nonlisted Topic"
Free Opentype Unicode Fonts for the Bengali (Bangla) scriptFree Opentype Unicode Fonts for the Bengali (Bangla) script,"Categories
Other/Nonlisted Topic"
"Xconq is an engine for turn-based strategy games. Variety of game genres run under Xconq: historical, sci-fi, fantasy, and modern. AIs. Network games. Multiple UIs and platforms. Easy-to-learn game design language. Large games library availableXconq is an engine for turn-based strategy games. Variety of game genres run under Xconq: historical, sci-fi, fantasy, and modern. AIs. Network games. Multiple UIs and platforms. Easy-to-learn game design language. Large games library available","Categories
Other/Nonlisted Topic, Turn Based Strategy, Interpreters, GIS"
Portatux is an interactive ncurses interface as well as a command line tool for controlling the 8 data pins in the parallel port in Linux and FreeBSD.Portatux is an interactive ncurses interface as well as a command line tool for controlling the 8 data pins in the parallel port in Linux and FreeBSD.,"Categories
Other/Nonlisted Topic, Hardware, Electronic Design Automation (EDA), Exam"
"FretBoard is a PalmOS reference tool for stringed instruments like Guitar, Bass, Banjo and many others. It displays notes, chords and scales on any instrument. Much better than the books which have collected dust on your shelves for years... Now alsoFretBoard is a PalmOS reference tool for stringed instruments like Guitar, Bass, Banjo and many others. It displays notes, chords and scales on any instrument. Much better than the books which have collected dust on your shelves for years... Now also","Categories
Other/Nonlisted Topic, Sound/Audio"
"Infocard Organizer is a Java application/outliner that enables easy editing of infocards (InfoML). InfoML is a XML standard for storing and organizing ""chunks"" of information, along with metadata. It meets most users' needs but can also be customiInfocard Organizer is a Java application/outliner that enables easy editing of infocards (InfoML). InfoML is a XML standard for storing and organizing ""chunks"" of information, along with metadata. It meets most users' needs but can also be customi","Categories
Text Processing, Other/Nonlisted Topic"
"A platform-independent vocabulary trainer with correction of mistakes during query, automatic download of audio files from websites, long-term memory aimed queries, semiautomatic supplement of vocables with dictionaries and much more useful features!A platform-independent vocabulary trainer with correction of mistakes during query, automatic download of audio files from websites, long-term memory aimed queries, semiautomatic supplement of vocables with dictionaries and much more useful features!","Categories
Other/Nonlisted Topic"
"Stage Manager is meant to help stage usage managing between cues (artists) in venues consisting of multiple events (rehearsal, performance etc.). It essentially provides a virtual running cue sheet with an info view for artists currently on stage.Stage Manager is meant to help stage usage managing between cues (artists) in venues consisting of multiple events (rehearsal, performance etc.). It essentially provides a virtual running cue sheet with an info view for artists currently on stage.","Categories
Other/Nonlisted Topic, Time Tracking"
Stingray 3 is a high performance engine Sequential Electronic Fuel Injection and Electronic Ignition controller designed specifically for light experimental aircraft and off-road applications.Stingray 3 is a high performance engine Sequential Electronic Fuel Injection and Electronic Ignition controller designed specifically for light experimental aircraft and off-road applications.,"Categories
Other/Nonlisted Topic, Mobile"
An (extensible) open source java clone of the popular BubbleBreaker (Bubble Breaker) game.An (extensible) open source java clone of the popular BubbleBreaker (Bubble Breaker) game.,"Categories
Other/Nonlisted Topic, Board Games, Puzzle Games"
