Description,Category
"ReadBarC reads barcodes using a Symbian OS cellphone with a integrated digital camera. Point the camera at a barcode, click capture, and the barcode is displayed on the screen. The code is also saved in the clipboard so it can be used by other programs.ReadBarC reads barcodes using a Symbian OS cellphone with a integrated digital camera. Point the camera at a barcode, click capture, and the barcode is displayed on the screen. The code is also saved in the clipboard so it can be used by other programs.","Categories
Digital Camera"
"FixTag is a Java MP3 tag editor. It searches for MP3 files with inconsistent filenames and ID3 tags, supports individual editing as well as batch updates of ID3 tags, and automatic file renaming based on a user defined pattern. Supports ID3v1 and ID3v2.xFixTag is a Java MP3 tag editor. It searches for MP3 files with inconsistent filenames and ID3 tags, supports individual editing as well as batch updates of ID3 tags, and automatic file renaming based on a user defined pattern. Supports ID3v1 and ID3v2.x","Categories
CD Ripping, MP3"
A Linux Alsa driver for the Gadget Labs Wavepro 824 card.A Linux Alsa driver for the Gadget Labs Wavepro 824 card.,"Categories
Operating System Kernels, Hardware Drivers, Sound/Audio"
Audiobook joiner and converter for Mac OS X. This application is a perfect companion for your IPod. The program will join MP3 files into an audio book format (M4B).Audiobook joiner and converter for Mac OS X. This application is a perfect companion for your IPod. The program will join MP3 files into an audio book format (M4B).,"Categories
Sound/Audio"
"Fract is a free, Open-source PC Benchmark based on realtime software rendering. It is designed to provide 100% unbiased results that really correspond to the raw performance of your CPU and system bus.Fract is a free, Open-source PC Benchmark based on realtime software rendering. It is designed to provide 100% unbiased results that really correspond to the raw performance of your CPU and system bus.","Categories
Benchmark, 3D Rendering"
"A Linux CLI tool for converting multiple audio types from one format to another.

It supports the following audio formats:

3G2, 3GP, 8SVX, AAC, AC3, ADTS, AIFF, AL, AMB, AMR, APE, AU, AVR, BONK, CAF, CDR, CVU, DAT, DTS, DVMS, F32, F64, FAP, FLA, FLAC, FSSD, GSRT, HCOM, IMA, IRCAM, LA, MAT, AUD, MAT4, MAT5, M4A, M4R, MP2, MP3, MP4, MP4A, MPC, MPP, NIST, OFF, OFR, OFS, OPUS, OGA,OGG, PAF, PRC, PVF, RA, RAM, RAW, RF64, SD2, SF, SHN, SMP, SND,SOU, SPX, SRN, TAK, TTA, TXW, VOC, VMS, VQF, W64, WAV, WMA, and WV.

It can also extract audio from the following video extensions:

RM, RV, ASF, DivX, MPG, MKV, MPEG, AVI, MOV, OGM, OGV, QT, VCD, SVCD, M4V, NSV, NUV, PSP, SMK, VOB, FLV, WEBM and WMV.

Parallel Processing, a CD ripping function with CDDB support, batch conversion, tag preservation for most supported formats, independent tag reading & writing, service menus for KDE Dolphin/Konqueror, Gnome Nautilus script, and action scripts for Nemo/Thunar are also provided.A Linux CLI tool for converting multiple audio types from one format to another.

It supports the following audio formats:

3G2, 3GP, 8SVX, AAC, AC3, ADTS, AIFF, AL, AMB, AMR, APE, AU, AVR, BONK, CAF, CDR, CVU, DAT, DTS, DVMS, F32, F64, FAP, FLA, FLAC, FSSD, GSRT, HCOM, IMA, IRCAM, LA, MAT, AUD, MAT4, MAT5, M4A, M4R, MP2, MP3, MP4, MP4A, MPC, MPP, NIST, OFF, OFR, OFS, OPUS, OGA,OGG, PAF, PRC, PVF, RA, RAM, RAW, RF64, SD2, SF, SHN, SMP, SND,SOU, SPX, SRN, TAK, TTA, TXW, VOC, VMS, VQF, W64, WAV, WMA, and WV.

It can also extract audio from the following video extensions:

RM, RV, ASF, DivX, MPG, MKV, MPEG, AVI, MOV, OGM, OGV, QT, VCD, SVCD, M4V, NSV, NUV, PSP, SMK, VOB, FLV, WEBM and WMV.

Parallel Processing, a CD ripping function with CDDB support, batch conversion, tag preservation for most supported formats, independent tag reading & writing, service menus for KDE Dolphin/Konqueror, Gnome Nautilus script, and action scripts for Nemo/Thunar are also provided.","Categories
Audio Conversion, Audio Editing, Multimedia"
"A Biblia Falada é um software para leitura e estudo da Biblia Sagrada. Muito simples de usar e totalmente acessível para deficientes visuais, traz, além do novo sistema de leitura, os textos completos da edição Revista e Atualizada.A Biblia Falada é um software para leitura e estudo da Biblia Sagrada. Muito simples de usar e totalmente acessível para deficientes visuais, traz, além do novo sistema de leitura, os textos completos da edição Revista e Atualizada.","Categories
Religion and Philosophy, Speech"
"WARNING: THIS PROJECT IS OBSOLETE NOW,
check the recent version at https://sourceforge.net/projects/naps2/

This software makes scanning of documents (including from ADF and Duplex) as simple as possible. Requires .NET Framework 2.0WARNING: THIS PROJECT IS OBSOLETE NOW,
check the recent version at https://sourceforge.net/projects/naps2/

This software makes scanning of documents (including from ADF and Duplex) as simple as possible. Requires .NET Framework 2.0","Categories
Scanner"
"Omega48 is a virtual printer driver for Microsoft Windows which allows you to convert the document to the graphics formats such as EMF, BMP and non formated text file (UNICODE or ANSI). Omega48 allows to save MS Windows Spool (SPL) and Shadow (SHD) filesOmega48 is a virtual printer driver for Microsoft Windows which allows you to convert the document to the graphics formats such as EMF, BMP and non formated text file (UNICODE or ANSI). Omega48 allows to save MS Windows Spool (SPL) and Shadow (SHD) files","Categories
Hardware Drivers, Printing, Image Converters"
"JVending is a content provisioning system that implements most of the J2EE Client Provisioning Specification (JSR-124). JVending provides catalog management and device detection. Project also includes WAP push, MMS client and a registry for devices.JVending is a content provisioning system that implements most of the J2EE Client Provisioning Specification (JSR-124). JVending provides catalog management and device detection. Project also includes WAP push, MMS client and a registry for devices.","Categories
File Sharing, WAP, Frameworks, Multimedia"
"A general-purpose library that generates three-dimensional coherent noise. Useful for terrain generation and procedural texture generation. Uses a broad number of techniques (Perlin noise, ridged multifractal, etc.) and combinations of those techniques.A general-purpose library that generates three-dimensional coherent noise. Useful for terrain generation and procedural texture generation. Uses a broad number of techniques (Perlin noise, ridged multifractal, etc.) and combinations of those techniques.","Categories
Graphics"
"Webcam application for windows, encoding streaming data with video and sound into Flash Live Video FLV using encoder ffMpeg for broadcasting live on the web .Webcam application for windows, encoding streaming data with video and sound into Flash Live Video FLV using encoder ffMpeg for broadcasting live on the web .","Categories
Streaming, Video Capture, Audio Recording"
"Structure Synth generates 3D structures by specifying a design grammar. Even simple systems may generate surprising and complex structures. Structure Synth offers a graphical environment with multiple tabs, syntax highlighting, and OpenGL preview.Structure Synth generates 3D structures by specifying a design grammar. Even simple systems may generate surprising and complex structures. Structure Synth offers a graphical environment with multiple tabs, syntax highlighting, and OpenGL preview.","Categories
3D Modeling, 3D Rendering"
"Audio, video and CD/DVD player that uses DirectShow technology. It can read (but not modify) ID3/Ogg/APE/WMA tags and show sub/srt/aqt/dks subtitles. CD information can be obtained from freedb, CD-TEXT or cdplayer.ini and submitted to freedb.Audio, video and CD/DVD player that uses DirectShow technology. It can read (but not modify) ID3/Ogg/APE/WMA tags and show sub/srt/aqt/dks subtitles. CD information can be obtained from freedb, CD-TEXT or cdplayer.ini and submitted to freedb.","Categories
Players, Media Players, CD Playing"
3D game engine and multiplayer/singleplayer FPS game3D game engine and multiplayer/singleplayer FPS game,"Categories
First Person Shooters, 3D Rendering"
ExportSWC is a plugin written for the FlashDevelop IDE (http://www.flashdevelop.org) used to generate SWC files for Flash/Flex code libraries on the PC. Tutorial: http://blog.log2e.com/2008/05/07/creating-a-swc-component-in-flashdevelop/ExportSWC is a plugin written for the FlashDevelop IDE (http://www.flashdevelop.org) used to generate SWC files for Flash/Flex code libraries on the PC. Tutorial: http://blog.log2e.com/2008/05/07/creating-a-swc-component-in-flashdevelop/,"Categories
Software Development, Multimedia"
D-Fend Reloaded is a graphical environment for DOSBox. D-Fend Reloaded is a successor of the discontinued D-Fend. Both environments look alike and D-Fend Reloaded contains all features of D-Fend. Even the D-Fend config files can be used.D-Fend Reloaded is a graphical environment for DOSBox. D-Fend Reloaded is a successor of the discontinued D-Fend. Both environments look alike and D-Fend Reloaded contains all features of D-Fend. Even the D-Fend config files can be used.,"Categories
Other/Nonlisted Topic, Games/Entertainment, Emulators"
"Launchy is a free utility designed to help you forget about your start menu, your desktop icons, and your file manager. Launchy indexes and launches your applications, documents, project files, folders, and bookmarks with just a few keystrokes!Launchy is a free utility designed to help you forget about your start menu, your desktop icons, and your file manager. Launchy indexes and launches your applications, documents, project files, folders, and bookmarks with just a few keystrokes!","Categories
Other/Nonlisted Topic, Desktop Environment, Search"
"Modular, touch screen friendly navigation system with GPS tracking, realtime routing engine and support for various vector map formats. Works on a wide range of devices, from computers to smartphones.Modular, touch screen friendly navigation system with GPS tracking, realtime routing engine and support for various vector map formats. Works on a wide range of devices, from computers to smartphones.","Categories
Other/Nonlisted Topic, GIS"
"Q Light Controller is a cross-platform application to control DMX or analog lighting systems like moving heads, dimmers, scanners and other effects. Our goal is to replace expensive and somewhat limited hardware lighting desks with free software.Q Light Controller is a cross-platform application to control DMX or analog lighting systems like moving heads, dimmers, scanners and other effects. Our goal is to replace expensive and somewhat limited hardware lighting desks with free software.","Categories
Other/Nonlisted Topic"
"Brewtarget is free brewing software for Linux, Mac, and Windows. Compatible with BeerSmith. Generates instructions for you from the recipe and interactive mash designer! Hit all your targets with brewtarget.Brewtarget is free brewing software for Linux, Mac, and Windows. Compatible with BeerSmith. Generates instructions for you from the recipe and interactive mash designer! Hit all your targets with brewtarget.","Categories
Other/Nonlisted Topic"
"DictionaryForMIDs is an dictionary application for cell phones, tablets and PCs. The dictionary is completely installed on the device (""offline dictionary""), i.e. after installation there is no need for an internet connection.
DictionaryForMIDs can be set up for any dictionary, for any language, or for any other lookup-purpose. The DfM-Creator tool is used to set up a dictionary for use with DictionaryForMIDs.DictionaryForMIDs is an dictionary application for cell phones, tablets and PCs. The dictionary is completely installed on the device (""offline dictionary""), i.e. after installation there is no need for an internet connection.
DictionaryForMIDs can be set up for any dictionary, for any language, or for any other lookup-purpose. The DfM-Creator tool is used to set up a dictionary for use with DictionaryForMIDs.","Categories
Other/Nonlisted Topic, Education, Dictionary"
"XMLStarlet is a set of command line utilities (tools) to transform, query, validate, and edit XML documents and files using simple set of shell commands in similar way it is done for text files with UNIX grep, sed, awk, diff, patch, join, etc utilities.XMLStarlet is a set of command line utilities (tools) to transform, query, validate, and edit XML documents and files using simple set of shell commands in similar way it is done for text files with UNIX grep, sed, awk, diff, patch, join, etc utilities.","Categories
Text Processing, Other/Nonlisted Topic, Interpreters, System Shells"
Open Source Worship Presentation Software. This project has moved to Launchpad: https://launchpad.net/openlpOpen Source Worship Presentation Software. This project has moved to Launchpad: https://launchpad.net/openlp,"Categories
Other/Nonlisted Topic, Office/Business, Religion and Philosophy, Media Players"
"QLC+ is a fork of the great QLC project written by Heikki Junnila. This project aims to continue the development of QLC and to introduce new features.
The primary goal is to bring QLC+ at the level of other lighting control commercial softwares.
Please download the latest version from https://www.qlcplus.org.QLC+ is a fork of the great QLC project written by Heikki Junnila. This project aims to continue the development of QLC and to introduce new features.
The primary goal is to bring QLC+ at the level of other lighting control commercial softwares.
Please download the latest version from https://www.qlcplus.org.","Categories
Other/Nonlisted Topic"
A web-based project management tool for workgroups. Encourage groups and individuals to work collaboratively. This tool aims to be functional and elegant without being complicated or graphically intensive.A web-based project management tool for workgroups. Encourage groups and individuals to work collaboratively. This tool aims to be functional and elegant without being complicated or graphically intensive.,"Categories
Other/Nonlisted Topic, Scheduling, To-Do Lists, Project Management"
"OpenSong is a free software application for managing chords and lyrics sheets (lead sheets), presenting lyrics (and custom slides) using a projector, and much more! Great for worship leaders and musicians!OpenSong is a free software application for managing chords and lyrics sheets (lead sheets), presenting lyrics (and custom slides) using a projector, and much more! Great for worship leaders and musicians!","Categories
Other/Nonlisted Topic, Religion and Philosophy, Presentation"
"OS X FOSS portable applications are packaged so you can carry around on any portable device, USB thumb drive, iPod, portable hard drive, memory card, other portable device (or also on your internal hard disk), taking your preferences with you.OS X FOSS portable applications are packaged so you can carry around on any portable device, USB thumb drive, iPod, portable hard drive, memory card, other portable device (or also on your internal hard disk), taking your preferences with you.","Categories
Text Editors, Communications, Other/Nonlisted Topic, Office/Business, Internet, Simulation, Physics, Multimedia"
"An easy to use application to design your kitchen garden or your house farm. Helps you plan your plants ( vegetables, fruit trees, herbs, flowers ) so that it respects the rules of crop rotation and companion planting. Based on square foot gardening. Requires Java 8.An easy to use application to design your kitchen garden or your house farm. Helps you plan your plants ( vegetables, fruit trees, herbs, flowers ) so that it respects the rules of crop rotation and companion planting. Based on square foot gardening. Requires Java 8.","Categories
Other/Nonlisted Topic, Ecosystem Sciences, Data Visualization"
Moved to https://codeberg.org/andybalaam/FreeGuideMoved to https://codeberg.org/andybalaam/FreeGuide,"Categories
Other/Nonlisted Topic, Games/Entertainment, Internet"
"A java LDAP client with LDIF support, security (inc SSL, SASL & GSSAPI), translated into many languages (inc. Chinese), online help, user forms and many other features.

The commercial version is available at https://jxworkbench.com for $9.95. It extends JXplorer to include:
- custom LDAP reporting - to pdf, word etc.
- Find and Replace with regexp and attribute substitution
- A secure password vault to store directory connections
- etc.

Support for JXplorer and JXWorkbench is available at http://jxplorer.org.

Commercial support available from sales@jxworkbench.comA java LDAP client with LDIF support, security (inc SSL, SASL & GSSAPI), translated into many languages (inc. Chinese), online help, user forms and many other features.

The commercial version is available at https://jxworkbench.com for $9.95. It extends JXplorer to include:
- custom LDAP reporting - to pdf, word etc.
- Find and Replace with regexp and attribute substitution
- A secure password vault to store directory connections
- etc.

Support for JXplorer and JXWorkbench is available at http://jxplorer.org.

Commercial support available from sales@jxworkbench.com","Categories
Other/Nonlisted Topic, Security, LDAP"
Virtual Magnifying Glass is designed for visually-impaired and others who need to magnify a part of the screen. Unlike similar programs it does not open a separate window for the magnification but instead puts a movable magnifying glass on screen.Virtual Magnifying Glass is designed for visually-impaired and others who need to magnify a part of the screen. Unlike similar programs it does not open a separate window for the magnification but instead puts a movable magnifying glass on screen.,"Categories
Other/Nonlisted Topic, Graphics"
"Simple, web-based address & phone book, contact manager, organizer. Groups, addresses, e-Mails, phone numbers & birthdays. vCards, LDIF, Excel, iPhone, Gmail & Google-Maps supported. PHP / MySQL based. http://php-addressbook.sourceforge.net/demoSimple, web-based address & phone book, contact manager, organizer. Groups, addresses, e-Mails, phone numbers & birthdays. vCards, LDIF, Excel, iPhone, Gmail & Google-Maps supported. PHP / MySQL based. http://php-addressbook.sourceforge.net/demo","Categories
Email, Other/Nonlisted Topic, CRM, Social Networking"
"Cybera is an Internet cafe administration system. It works with prepaid cards or client accounts or in a post paid Self Service mode. Features include workstation control, user rights lockdown, accounting, stats and screen replication for CAI.Cybera is an Internet cafe administration system. It works with prepaid cards or client accounts or in a post paid Self Service mode. Features include workstation control, user rights lockdown, accounting, stats and screen replication for CAI.","Categories
Other/Nonlisted Topic, Point of Sale (POS), Systems Administration, Computer Aided Instruction (CAI)"
"phpABook is a simple address/contact management system that uses PHP and MySQL. It provides many features that you would find in a similar offline, OS specific application. It also has multi-user capabilities.

NEWS: We are cooking an all new version - new code, new features, new design. Subscribe the mailing list to keep updated.phpABook is a simple address/contact management system that uses PHP and MySQL. It provides many features that you would find in a similar offline, OS specific application. It also has multi-user capabilities.

NEWS: We are cooking an all new version - new code, new features, new design. Subscribe the mailing list to keep updated.","Categories
Other/Nonlisted Topic, CRM, WWW/HTTP"
"easystroke is a gesture-recognition application for X11. It aims to be highly configurable while at the same time providing an intuitive user interface. It was designed primarily for use on a Tablet PC, but it also works well with a mouse.easystroke is a gesture-recognition application for X11. It aims to be highly configurable while at the same time providing an intuitive user interface. It was designed primarily for use on a Tablet PC, but it also works well with a mouse.","Categories
Other/Nonlisted Topic"
"Megacubo is an intuitive, multi-language and cross-platform IPTV player with support for history, bookmarks and much more.

You can add as many IPTV lists you want (M3U format) and record live broadcasts to your PC or device.

With Miniplayer mode, you can work or navigate on your PC while watching any broadcast.Megacubo is an intuitive, multi-language and cross-platform IPTV player with support for history, bookmarks and much more.

You can add as many IPTV lists you want (M3U format) and record live broadcasts to your PC or device.

With Miniplayer mode, you can work or navigate on your PC while watching any broadcast.","Categories
Streaming, Other/Nonlisted Topic"
"Belgelendirme Çalışma Grubu, Linux ile ilgili olarak, NASIL, kılavuz ve bilgi sayfaları ile yardım belgelerinin çevrilmesi, yeni belgelerin hazırlanması, eski belgelerin arşivlenmesiyle ilgilenir.Belgelendirme Çalışma Grubu, Linux ile ilgili olarak, NASIL, kılavuz ve bilgi sayfaları ile yardım belgelerinin çevrilmesi, yeni belgelerin hazırlanması, eski belgelerin arşivlenmesiyle ilgilenir.","Categories
Other/Nonlisted Topic"
"As of now, you can get Ehcache only from ehcache.org or Maven central.

A simple, fast, thread safe, standards based cache for Java, and provides memory and disk stores and distributed operation for clusters. ehcache is widely used in such open source projects as Hibernate and Spring. Terracotta offers enterprise editionAs of now, you can get Ehcache only from ehcache.org or Maven central.

A simple, fast, thread safe, standards based cache for Java, and provides memory and disk stores and distributed operation for clusters. ehcache is widely used in such open source projects as Hibernate and Spring. Terracotta offers enterprise edition","Categories
Other/Nonlisted Topic, Frameworks, Clustering"
A fully featured nutrition and biomarker tracking tool. Designed for practitioners of Caloric Restrictrion (CRON) Diets.A fully featured nutrition and biomarker tracking tool. Designed for practitioners of Caloric Restrictrion (CRON) Diets.,"Categories
Other/Nonlisted Topic"
"Use your favorite keyboard layout everywhere! I learned the Colemak keyboard layout, but I can not install at school, so I wrote a portable keyboard layout program in autohotkey. It no requires install or administrator privileges.Use your favorite keyboard layout everywhere! I learned the Colemak keyboard layout, but I can not install at school, so I wrote a portable keyboard layout program in autohotkey. It no requires install or administrator privileges.","Categories
Other/Nonlisted Topic, Hardware Drivers"
"Perl scripts to manage a tennis club with its database held by PostgreSQL. Includes tournaments, profiles, rankings, challenges, galleries, head-to-heads, courts online reservation, etc.Perl scripts to manage a tennis club with its database held by PostgreSQL. Includes tournaments, profiles, rankings, challenges, galleries, head-to-heads, courts online reservation, etc.","Categories
Other/Nonlisted Topic"
"Development of CRG is now in

https://www.facebook.com/groups/126006504596245 (This is for DEVELOPERS). For Users, use the normal Derby Scoreboard group

https://www.facebook.com/groups/derbyscoreboard/Development of CRG is now in

https://www.facebook.com/groups/126006504596245 (This is for DEVELOPERS). For Users, use the normal Derby Scoreboard group

https://www.facebook.com/groups/derbyscoreboard/","Categories
Chat, Other/Nonlisted Topic, Sports Games"
"AllChars provides a quick, easy-to-remember way of creating accents like é Ü ç î æ and special characters like ƒ ² ‰ © £ ± ß ° 1/2 ¿ « » ™ „ in most Windows programs. AllChars emulates the *nix Compose key on Windows.AllChars provides a quick, easy-to-remember way of creating accents like é Ü ç î æ and special characters like ƒ ² ‰ © £ ± ß ° 1/2 ¿ « » ™ „ in most Windows programs. AllChars emulates the *nix Compose key on Windows.","Categories
Other/Nonlisted Topic, Office/Business, Internationalization (I18N)"
"The National Library of New Zealand's Metadata Extraction Tool automatically extracts preservation-related metadata from digital files, then output that metadata in XML formats. It can be used through a graphical user interface or command-line interface.

Please take the latest code from 'https://github.com/DIA-NZ/Metadata-Extraction-Tool.git'. The code on source forge will not be updated henceforth as it is moved to github.The National Library of New Zealand's Metadata Extraction Tool automatically extracts preservation-related metadata from digital files, then output that metadata in XML formats. It can be used through a graphical user interface or command-line interface.

Please take the latest code from 'https://github.com/DIA-NZ/Metadata-Extraction-Tool.git'. The code on source forge will not be updated henceforth as it is moved to github.","Categories
Data Formats, Other/Nonlisted Topic, Information Analysis"
"TreeLine stores almost any kind of information in an organized tree structure. Each node in the tree can contain several fields, forming a mini-database.TreeLine stores almost any kind of information in an organized tree structure. Each node in the tree can contain several fields, forming a mini-database.","Categories
Other/Nonlisted Topic"
