Description,Category
"GenerateData is a general purpose data generation engine. No plug-ins, no APIs, just data generation made easy. From single files, to referentially sound databases, point, click, tweak and generate.GenerateData is a general purpose data generation engine. No plug-ins, no APIs, just data generation made easy. From single files, to referentially sound databases, point, click, tweak and generate.","Categories
Data Formats, Data Warehousing, Database"
"This software is an implementation of a Socknet Profile Provider, the kind of website that contains and maintains users' profiles on the Socknet. This is the code used at http://foolishmortal.org.This software is an implementation of a Socknet Profile Provider, the kind of website that contains and maintains users' profiles on the Socknet. This is the code used at http://foolishmortal.org.","Categories
Web Services, Social Networking"
"MieZ is a WYSIWYG-editor for TikZ documents.

This project is now being developed on http://github.com/Antimon2000/MieZMieZ is a WYSIWYG-editor for TikZ documents.

This project is now being developed on http://github.com/Antimon2000/MieZ","Categories
TeX/LaTeX, Vector Graphics"
