Description,Category
"The Ada Terminal Emulator provides a rich set of terminal emulation capabilities, implemented in Ada 2012 (with some C) to run under Windows.

All source code for the terminal emulator is provided under the GNU General Public License. The package was developed using GNAT and GWindows.

In addition to providing simple ""dumb"" terminal emulation, the package provides full emulation of DEC VT52/VT100/VT102 compatible terminals, including double height and double width characters, smooth scrolling, special graphics, display controls and national replacement character sets. The emulator also implements a substantial subset of VT220/VT320/VT420, ANSI.SYS and ISO 6429 capabilities.

The demo programs provided include a fully functional serial communications client, a telnet client, a program that allows stdin/stdout/stderr of any program to be redirected to a terminal window, and various other demos and games implemented using the packageThe Ada Terminal Emulator provides a rich set of terminal emulation capabilities, implemented in Ada 2012 (with some C) to run under Windows.

All source code for the terminal emulator is provided under the GNU General Public License. The package was developed using GNAT and GWindows.

In addition to providing simple ""dumb"" terminal emulation, the package provides full emulation of DEC VT52/VT100/VT102 compatible terminals, including double height and double width characters, smooth scrolling, special graphics, display controls and national replacement character sets. The emulator also implements a substantial subset of VT220/VT320/VT420, ANSI.SYS and ISO 6429 capabilities.

The demo programs provided include a fully functional serial communications client, a telnet client, a program that allows stdin/stdout/stderr of any program to be redirected to a terminal window, and various other demos and games implemented using the package","Categories
Serial, Terminal Emulators, Communications"
"Simple, flexible Infinite Scroll for Ember CLI Apps. As of v2.0.0, we support Node 10 and above. We test against ember-source > 3.8. Try out v2.0.0. If it doesn't work or you don't have the right polyfills because you are on an older Ember version, then v1.4.9 will be your best bet. Ember Infinity is based on a component-service approach wherein your application is viewed as an interaction between your components (ephemeral state) and service (long-term state). As a result, we can intelligently store your model state to provide you the ability to cache and invalidate your cache when you need to. If you provide an optional infinityCache timestamp (in ms), the infinity service model hook will return the existing collection (and not make a network request) if the timestamp has not yet expired. Be careful as this will also circumvent your ability to receive fresh data on every route visit.Simple, flexible Infinite Scroll for Ember CLI Apps. As of v2.0.0, we support Node 10 and above. We test against ember-source > 3.8. Try out v2.0.0. If it doesn't work or you don't have the right polyfills because you are on an older Ember version, then v1.4.9 will be your best bet. Ember Infinity is based on a component-service approach wherein your application is viewed as an interaction between your components (ephemeral state) and service (long-term state). As a result, we can intelligently store your model state to provide you the ability to cache and invalidate your cache when you need to. If you provide an optional infinityCache timestamp (in ms), the infinity service model hook will return the existing collection (and not make a network request) if the timestamp has not yet expired. Be careful as this will also circumvent your ability to receive fresh data on every route visit.","Categories
Terminals, Software Development"
"Ember.js is a productive, battle-tested JavaScript framework for building modern web applications. It includes everything you need to build rich UIs that work on any device. Some of the best development teams in the world have been iterating on their products for years with Ember. With scalable UI architecture baked-in from the start, you'll be working with the same patterns these organizations use every step of the way. Ember’s out-of-the-box experience has everything you need to start building on day one and keep shipping for years. Benefit from our years of experience to help your team be productive—faster. You'll never have to wire together your own framework ever again! Ember CLI is the backbone of modern Ember apps, providing code generators to create new entities and putting the necessary files in the right place, every time. Ember apps come with a built-in development environment with fast rebuilds, auto-reload, and a test runner!Ember.js is a productive, battle-tested JavaScript framework for building modern web applications. It includes everything you need to build rich UIs that work on any device. Some of the best development teams in the world have been iterating on their products for years with Ember. With scalable UI architecture baked-in from the start, you'll be working with the same patterns these organizations use every step of the way. Ember’s out-of-the-box experience has everything you need to start building on day one and keep shipping for years. Benefit from our years of experience to help your team be productive—faster. You'll never have to wire together your own framework ever again! Ember CLI is the backbone of modern Ember apps, providing code generators to create new entities and putting the necessary files in the right place, every time. Ember apps come with a built-in development environment with fast rebuilds, auto-reload, and a test runner!","Categories
Terminals, Software Development"
"Observer CLI is a library to be dropped into any beam nodes, to be used to assist DevOps people to diagnose problems in production nodes. Provide a high-performance tool usable both in development and production settings. Focus on important and detailed information about real-time running systems. Keep minimal consumption. Increments are values that are mostly useful when compared to a previous one to have an idea of what they're doing because otherwise, they'd never stop increasing: bytes in and out of the node, number of garbage collector runs, words of memory that were garbage collected, and the global reductions count for the node. Total scheduler utilization will equal 1.0 when all schedulers have been active all the time between the two refresh intervals. The result being that there is a decent chunk of CPU usage that would be mostly free for scheduling actual Erlang work (assuming the schedulers are busy waiting more than trying to select tasks to run).Observer CLI is a library to be dropped into any beam nodes, to be used to assist DevOps people to diagnose problems in production nodes. Provide a high-performance tool usable both in development and production settings. Focus on important and detailed information about real-time running systems. Keep minimal consumption. Increments are values that are mostly useful when compared to a previous one to have an idea of what they're doing because otherwise, they'd never stop increasing: bytes in and out of the node, number of garbage collector runs, words of memory that were garbage collected, and the global reductions count for the node. Total scheduler utilization will equal 1.0 when all schedulers have been active all the time between the two refresh intervals. The result being that there is a decent chunk of CPU usage that would be mostly free for scheduling actual Erlang work (assuming the schedulers are busy waiting more than trying to select tasks to run).","Categories
Terminals"
"Current stable release: version 1.3 (2022-11-10)
More info in wiki.Current stable release: version 1.3 (2022-11-10)
More info in wiki.","Categories
Serial"
"MQTT X is a cross-platform MQTT 5.0 client tool open sourced by EMQ, which can run on macOS, Linux and Windows, and supports formatting MQTT payload. MQTT X simplifies test operation with the help of a familiar, chat-like interface. It’s easy and quick to create multiple, simultaneous online MQTT client connections, and can test the connection, publishing, and subscription functions of MQTT/TCP, MQTT/TLS, MQTT/WebSocket as well as other MQTT protocol features. MQTT stands for MQ Telemetry Transport. It is a publish/subscribe, extremely simple and lightweight messaging protocol, designed for constrained devices and low-bandwidth, high-latency or unreliable networks. To run MQTT Broker locally, EMQX is recommended: An Open-Source, Cloud-Native, Distributed MQTT Broker for IoT. After the MQTT is connected successfully, you can perform MQTT publish and subscription tests.MQTT X is a cross-platform MQTT 5.0 client tool open sourced by EMQ, which can run on macOS, Linux and Windows, and supports formatting MQTT payload. MQTT X simplifies test operation with the help of a familiar, chat-like interface. It’s easy and quick to create multiple, simultaneous online MQTT client connections, and can test the connection, publishing, and subscription functions of MQTT/TCP, MQTT/TLS, MQTT/WebSocket as well as other MQTT protocol features. MQTT stands for MQ Telemetry Transport. It is a publish/subscribe, extremely simple and lightweight messaging protocol, designed for constrained devices and low-bandwidth, high-latency or unreliable networks. To run MQTT Broker locally, EMQX is recommended: An Open-Source, Cloud-Native, Distributed MQTT Broker for IoT. After the MQTT is connected successfully, you can perform MQTT publish and subscription tests.","Categories
Terminals, MQTT Brokers, MQTT Clients"
"electerm is a terminal/ssh/sftp client(linux, mac, win) based on electron/ssh2/node-pty/xterm/antd/subx and many other libs. Works as a terminal/file manager or ssh/sftp client(similar to xshell). Global hotkey to toggle window visibility (similar to guake, default is ctrl + 2) Multi platform(linux, mac, win). Multi-language support(electerm-locales, contributions/fixes welcome) Double click to directly edit (small) remote files. Edit (small) local files with built-in editor. Auth with publicKey + password. Support Zmodem(rz, sz). Support Trzsz(trz/tsz), similar to rz/sz, and compatible with tmux. Transparent window(Mac, win). Terminal background image. Global/session proxy. Quick commands. UI/terminal theme. Sync bookmarks/themes/quick commands to github/gitee secret gist. Support serial Port(version > 1.21.8). Quick input to one or all terminals.electerm is a terminal/ssh/sftp client(linux, mac, win) based on electron/ssh2/node-pty/xterm/antd/subx and many other libs. Works as a terminal/file manager or ssh/sftp client(similar to xshell). Global hotkey to toggle window visibility (similar to guake, default is ctrl + 2) Multi platform(linux, mac, win). Multi-language support(electerm-locales, contributions/fixes welcome) Double click to directly edit (small) remote files. Edit (small) local files with built-in editor. Auth with publicKey + password. Support Zmodem(rz, sz). Support Trzsz(trz/tsz), similar to rz/sz, and compatible with tmux. Transparent window(Mac, win). Terminal background image. Global/session proxy. Quick commands. UI/terminal theme. Sync bookmarks/themes/quick commands to github/gitee secret gist. Support serial Port(version > 1.21.8). Quick input to one or all terminals.","Categories
Terminals, SFTP Clients"
"A versatile test tool running on Windows/Linux/Android.
Works as data transceiver/realtime plotter/shortcut/file transceiver.
Supports serial port, Bluetooth SPP client/server, Bluetooth LE client, TCP client/server, UDP.
Homepage: https://github.com/wh201906/SerialTestA versatile test tool running on Windows/Linux/Android.
Works as data transceiver/realtime plotter/shortcut/file transceiver.
Supports serial port, Bluetooth SPP client/server, Bluetooth LE client, TCP client/server, UDP.
Homepage: https://github.com/wh201906/SerialTest","Categories
Serial, Networking"
"The Command Line Parser Library offers CLR applications a clean and concise API for manipulating command line arguments and related tasks, such as defining switches, options and verb commands. It allows you to display a help screen with a high degree of customization and a simple way to report syntax errors to the end user. Include wiki documentation with lot of examples ready to run online. Support Source Link and symbolic nuget package snupkg. Tested in Windows, Linux Ubuntu 18.04 and Mac OS. Most of features applies with a CoC philosophy. You can also map to every type with a constructor that accepts a string (like System.Uri) for reference and value types. Map to sequences (via IEnumerable<T> and similar) and scalar types, including Enums and Nullable<T>. Doesn't depend on other packages (No dependencies beyond standard base libraries).The Command Line Parser Library offers CLR applications a clean and concise API for manipulating command line arguments and related tasks, such as defining switches, options and verb commands. It allows you to display a help screen with a high degree of customization and a simple way to report syntax errors to the end user. Include wiki documentation with lot of examples ready to run online. Support Source Link and symbolic nuget package snupkg. Tested in Windows, Linux Ubuntu 18.04 and Mac OS. Most of features applies with a CoC philosophy. You can also map to every type with a constructor that accepts a string (like System.Uri) for reference and value types. Map to sequences (via IEnumerable<T> and similar) and scalar types, including Enums and Nullable<T>. Doesn't depend on other packages (No dependencies beyond standard base libraries).","Categories
Terminals"
"cheat allows you to create and view interactive cheatsheets on the command line. It was designed to help remind *nix system administrators of options for commands that they use frequently, but not frequently enough to remember. Flags may be combined in intuitive ways. Example: to search sheets on the ""personal"" cheatpath that are tagged with ""networking"" and match a regex. Cheatsheets are plain-text files with no file extension, and are named according to the command used to view them. Cheatsheet text may optionally be preceded by a YAML frontmatter header that assigns tags and specifies syntax. Cheatsheets are stored on ""cheatpaths"", which are directories that contain cheatsheets. Cheatpaths are specified in the conf.yml file. It can be useful to configure cheat against multiple cheatpaths. A common pattern is to store cheatsheets from multiple repositories on individual cheatpaths.cheat allows you to create and view interactive cheatsheets on the command line. It was designed to help remind *nix system administrators of options for commands that they use frequently, but not frequently enough to remember. Flags may be combined in intuitive ways. Example: to search sheets on the ""personal"" cheatpath that are tagged with ""networking"" and match a regex. Cheatsheets are plain-text files with no file extension, and are named according to the command used to view them. Cheatsheet text may optionally be preceded by a YAML frontmatter header that assigns tags and specifies syntax. Cheatsheets are stored on ""cheatpaths"", which are directories that contain cheatsheets. Cheatpaths are specified in the conf.yml file. It can be useful to configure cheat against multiple cheatpaths. A common pattern is to store cheatsheets from multiple repositories on individual cheatpaths.","Categories
Terminals, Documentation"
"Webterminal implemented by django. This project focus on DevOps and Continuous Delivery. For now it supports almost 90% of remote management protocols such as vnc, ssh, RDP, telnet, sftp... It supports the possibility to monitor and record user actions when users use this project to manage their server! You can also replay the user action such as a video. Hope you enjoy it. Webterminal helper support (use your favorite tools to manage and connect server) VNC, RDP, SFTP Remote file browser (download, delete, update and upload files). Ubuntu webterminal helper support. Mac webterminal helper support. Windows webterminal helper support. Commercial version provides mstsc helper.Webterminal implemented by django. This project focus on DevOps and Continuous Delivery. For now it supports almost 90% of remote management protocols such as vnc, ssh, RDP, telnet, sftp... It supports the possibility to monitor and record user actions when users use this project to manage their server! You can also replay the user action such as a video. Hope you enjoy it. Webterminal helper support (use your favorite tools to manage and connect server) VNC, RDP, SFTP Remote file browser (download, delete, update and upload files). Ubuntu webterminal helper support. Mac webterminal helper support. Windows webterminal helper support. Commercial version provides mstsc helper.","Categories
Terminals, DevOps, CI/CD, Remote Desktop"
"ecs-deploy simplifies deployments on Amazon ECS by providing a convenience CLI tool for complex actions, which are executed pretty often. Support for complex task definitions (e.g. multiple containers & task role), easily redeploy the current task definition (including docker pull of eventually updated images), deploy new versions/tags or all containers or just a single container in your task definition, scale up or down by adjusting the desired count of running tasks, add or adjust containers environment variables. Run one-off tasks from the CLI, automatically monitor deployments in New Relic.ecs-deploy simplifies deployments on Amazon ECS by providing a convenience CLI tool for complex actions, which are executed pretty often. Support for complex task definitions (e.g. multiple containers & task role), easily redeploy the current task definition (including docker pull of eventually updated images), deploy new versions/tags or all containers or just a single container in your task definition, scale up or down by adjusting the desired count of running tasks, add or adjust containers environment variables. Run one-off tasks from the CLI, automatically monitor deployments in New Relic.","Categories
Terminals, Software Development"
"Exoframe is a self-hosted tool that allows simple one-command deployments using Docker. Simple function deployments. Multiple deployment endpoints and multi-user support. Simple update procedure for client, server and Traefik. Optional automatic subdomain assignment (i.e. every deployment gets its own subdomain). Swarm mode deployments. Complex recipes support (i.e. deploy complex systems in one command).Exoframe is a self-hosted tool that allows simple one-command deployments using Docker. Simple function deployments. Multiple deployment endpoints and multi-user support. Simple update procedure for client, server and Traefik. Optional automatic subdomain assignment (i.e. every deployment gets its own subdomain). Swarm mode deployments. Complex recipes support (i.e. deploy complex systems in one command).","Categories
Terminals, Software Development"
"Easy and fun way to work with remote servers over SSH. This project is being renamed as previous name ""Snowflake"" is confusing since there is already a popular product with the same name. Muon is a graphical SSH client. It has an enhanced SFTP file browser, SSH terminal emulator, remote resource/process manager, server disk space analyzer, remote text editor, huge remote log viewer, and lots of other helpful tools, which makes it easy to work with remote servers. Muon provides functionality similar to web-based control panels but, it works over SSH from the local computer, hence no installation is required on the server. It runs on Linux and Windows. Muon has been tested with several Linux and UNIX servers, like Ubuntu server, CentOS, RHEL, OpenSUSE, FreeBSD, OpenBSD, NetBSD, and HP-UX. The application is targeted mainly towards web/backend developers who often deploy/debug their code on remote servers and not overly fond of complex terminal-based commands.Easy and fun way to work with remote servers over SSH. This project is being renamed as previous name ""Snowflake"" is confusing since there is already a popular product with the same name. Muon is a graphical SSH client. It has an enhanced SFTP file browser, SSH terminal emulator, remote resource/process manager, server disk space analyzer, remote text editor, huge remote log viewer, and lots of other helpful tools, which makes it easy to work with remote servers. Muon provides functionality similar to web-based control panels but, it works over SSH from the local computer, hence no installation is required on the server. It runs on Linux and Windows. Muon has been tested with several Linux and UNIX servers, like Ubuntu server, CentOS, RHEL, OpenSUSE, FreeBSD, OpenBSD, NetBSD, and HP-UX. The application is targeted mainly towards web/backend developers who often deploy/debug their code on remote servers and not overly fond of complex terminal-based commands.","Categories
Terminals, Emulators, SFTP Clients"
"Execa improves child processes execution with a promise interface, cross-platform support, local binaries, interleaved output, and more. nvexeca is a thin wrapper around Execa to run any file or command using any Node.js version. nvexeca executes a single file or command. It does not change the node nor npm global binaries. To run a specific Node.js version for an entire project or shell session, please use nvm, nvm-windows, n or nvs instead. This package is an ES module and must be loaded using an import or import() statement, not require(). File or command to execute. Both global and local binaries can be executed. The first time nvexeca is run with a new VERSION, the Node binary is downloaded under the hood. This initially takes few seconds. However subsequent runs are almost instantaneous.Execa improves child processes execution with a promise interface, cross-platform support, local binaries, interleaved output, and more. nvexeca is a thin wrapper around Execa to run any file or command using any Node.js version. nvexeca executes a single file or command. It does not change the node nor npm global binaries. To run a specific Node.js version for an entire project or shell session, please use nvm, nvm-windows, n or nvs instead. This package is an ES module and must be loaded using an import or import() statement, not require(). File or command to execute. Both global and local binaries can be executed. The first time nvexeca is run with a new VERSION, the Node binary is downloaded under the hood. This initially takes few seconds. However subsequent runs are almost instantaneous.","Categories
Terminals, Software Development"
"CLI to interactively upgrade Gradle dependencies, inspired by yarn. Easily upgrade your dependencies and Gradle itself by simply selecting what you want to upgrade. To get the data for the outdated dependencies, the gradle-versions-plugin is required. Simply run gradle-upgrade-interactive. The gradle-versions-plugin is called to generate a JSON report containing the outdated dependencies. The CLI will then prompt all outdated dependencies and the selected dependency upgrades will be written to the Gradle build file.CLI to interactively upgrade Gradle dependencies, inspired by yarn. Easily upgrade your dependencies and Gradle itself by simply selecting what you want to upgrade. To get the data for the outdated dependencies, the gradle-versions-plugin is required. Simply run gradle-upgrade-interactive. The gradle-versions-plugin is called to generate a JSON report containing the outdated dependencies. The CLI will then prompt all outdated dependencies and the selected dependency upgrades will be written to the Gradle build file.","Categories
Terminals"
"Run any command on specific Node.js versions. node >=14.18.0 must be globally installed. However the command run by nve can use any Node version (providing it is compatible with it). The first time nve is run with a new VERSION, the Node binary is downloaded under the hood. This initially takes few seconds. However subsequent runs are almost instantaneous. Tools like nvm, nvm-windows, n or nvs are meant to execute a specific Node.js version for an entire machine, project or shell session. It does not need a separate installation step for each Node version, it can run the major release's latest minor/patch version automatically, works on Windows. No need to run as Administrator. It does not require Bash and it is installed as a Node module (as opposed to a Bash installation script downloaded with curl).Run any command on specific Node.js versions. node >=14.18.0 must be globally installed. However the command run by nve can use any Node version (providing it is compatible with it). The first time nve is run with a new VERSION, the Node binary is downloaded under the hood. This initially takes few seconds. However subsequent runs are almost instantaneous. Tools like nvm, nvm-windows, n or nvs are meant to execute a specific Node.js version for an entire machine, project or shell session. It does not need a separate installation step for each Node version, it can run the major release's latest minor/patch version automatically, works on Windows. No need to run as Administrator. It does not require Bash and it is installed as a Node module (as opposed to a Bash installation script downloaded with curl).","Categories
Terminals, Software Development"
