Description,Category
"Yencee is a command line program for posting binary files to newsgroups, using the yEnc encoding. It takes the files as parameter, splits them in sizable chunks, and posts them to one or more newsgroups. Supports reposting of selected parts.Yencee is a command line program for posting binary files to newsgroups, using the yEnc encoding. It takes the files as parameter, splits them in sizable chunks, and posts them to one or more newsgroups. Supports reposting of selected parts.","Categories
Usenet News"
"Gamers.IRC is a full MSL Script for mIRC, the most popular Windows IRC client. Gamers.IRC is for Windows 95 and higher.

Source code: Download and run the installer. Open the .grc and .ini files with notepad.Gamers.IRC is a full MSL Script for mIRC, the most popular Windows IRC client. Gamers.IRC is for Windows 95 and higher.

Source code: Download and run the installer. Open the .grc and .ini files with notepad.","Categories
IRC Clients, Internet"
"Net Statistics is a network monitoring tool. Watch device status, parameters and statistics for incoming and outgoing traffic, and summary info. Traffic diagram shows last few minutes in real-time for easy monitoring of network activity.Net Statistics is a network monitoring tool. Watch device status, parameters and statistics for incoming and outgoing traffic, and summary info. Traffic diagram shows last few minutes in real-time for easy monitoring of network activity.","Categories
Communications, Monitoring, Internet"
Blog management application based on Qt 4.Blog management application based on Qt 4.,"Categories
Text Editors, Communications"
Vehicle diagnostic program including OBDII Scantool and support for certain manufacturer-specific controllers.Vehicle diagnostic program including OBDII Scantool and support for certain manufacturer-specific controllers.,"Categories
Communications"
"pycrc is an easy to use CRC (cyclic redundancy check) calculator and C source code generator. The generated source code can be optimized for simplicity, speed or space. pycrc contains a long parameter list of common CRC models.
The program is self contained and does not require installation. Apart from a python installation, it does not require other libraries to be installed.pycrc is an easy to use CRC (cyclic redundancy check) calculator and C source code generator. The generated source code can be optimized for simplicity, speed or space. pycrc contains a long parameter list of common CRC models.
The program is self contained and does not require installation. Apart from a python installation, it does not require other libraries to be installed.","Categories
Communications, Algorithms, Code Generators"
"AirDC++ is light and easy to use client for Direct Connect network, allowing users to share files with friends and other people on internet or local network. It has more features compared to for example DC++ and StrongDC++, in which it is based on.AirDC++ is light and easy to use client for Direct Connect network, allowing users to share files with friends and other people on internet or local network. It has more features compared to for example DC++ and StrongDC++, in which it is based on.","Categories
Chat, File Sharing"
"JVending is a content provisioning system that implements most of the J2EE Client Provisioning Specification (JSR-124). JVending provides catalog management and device detection. Project also includes WAP push, MMS client and a registry for devices.JVending is a content provisioning system that implements most of the J2EE Client Provisioning Specification (JSR-124). JVending provides catalog management and device detection. Project also includes WAP push, MMS client and a registry for devices.","Categories
File Sharing, WAP, Frameworks, Multimedia"
"AmphetaDesk is a cross-platform, highly customizable, news aggregator - it sits on your desktop, downloads the latest news that interests you, and displays them in a quick, easy to use and customizable webpage. No webserver required.AmphetaDesk is a cross-platform, highly customizable, news aggregator - it sits on your desktop, downloads the latest news that interests you, and displays them in a quick, easy to use and customizable webpage. No webserver required.","Categories
Communications, Desktop Environment, Internet"
