Description,Category
A complete open source implementation of DIS (Distributed Interactive Simulation) in C++. 1278.1 and 1278.1a are fully implemented including enumerations. Includes several utility classes to help with developing your DIS app. DIS 7 work is ongoing.A complete open source implementation of DIS (Distributed Interactive Simulation) in C++. 1278.1 and 1278.1a are fully implemented including enumerations. Includes several utility classes to help with developing your DIS app. DIS 7 work is ongoing.,"Categories
Data Formats, Simulation Games, Simulation"
"cantools is a set of libraries and command line tools for handling ASC, BLF, CLG, VSB, MDF, and DBC files. The tools can be used to analyze and convert the data to other formats. Shared libraries for parsing and accessing these files are also provided.cantools is a set of libraries and command line tools for handling ASC, BLF, CLG, VSB, MDF, and DBC files. The tools can be used to analyze and convert the data to other formats. Shared libraries for parsing and accessing these files are also provided.","Categories
Data Formats"
"This is a delphi library implementing JSON (XML alternative, http://www.json.org) data format and objects structure. Lightweight and fast.This is a delphi library implementing JSON (XML alternative, http://www.json.org) data format and objects structure. Lightweight and fast.","Categories
Data Formats, Software Development"
"All-in-one program for creating 2D scrolling games. Compile your games into stand-alone .NET executables or customizable C# source code. The IDE and framework are build on OpenTK, which wraps OpenGL, so generated games can be cross-platform.All-in-one program for creating 2D scrolling games. Compile your games into stand-alone .NET executables or customizable C# source code. The IDE and framework are build on OpenTK, which wraps OpenGL, so generated games can be cross-platform.","Categories
XML, Side-Scrolling, Frameworks, Code Generators, Design, Raster Graphics"
"""xmlsh"" is derived from the design and goals the unix shell and core commands but with XML expressions and documents added as core features to the shell. xmlsh can be used as a drop-in replacement for scripting xml transformations instead of sh.""xmlsh"" is derived from the design and goals the unix shell and core commands but with XML expressions and documents added as core features to the shell. xmlsh can be used as a drop-in replacement for scripting xml transformations instead of sh.","Categories
XML, Interpreters, System Shells"
"Web data extraction (web data mining, web scraping) tool. It leverages well proved XML and text processing techologies in order to easely extract useful data from arbitrary web pages.Web data extraction (web data mining, web scraping) tool. It leverages well proved XML and text processing techologies in order to easely extract useful data from arbitrary web pages.","Categories
XML, HTML/XHTML, Search Engines, Frameworks"
"Codepage Converter - Convert HTML/Text files to different encoding formats e.g. ANSI to UTF-8 or Unicode. Convert multiple files with 1 click. Works with all encodings.

* The issue with UTF-8 has now been fixed.Codepage Converter - Convert HTML/Text files to different encoding formats e.g. ANSI to UTF-8 or Unicode. Convert multiple files with 1 click. Works with all encodings.

* The issue with UTF-8 has now been fixed.","Categories
Data Formats, Site Management, Localization (L10N), Internationalization (I18N)"
The COLLADA Document Object Model (DOM) is an application programming interface (API) that provides a C++ object representation of a COLLADA XML instance document. Contact a project admin to become a developer!The COLLADA Document Object Model (DOM) is an application programming interface (API) that provides a C++ object representation of a COLLADA XML instance document. Contact a project admin to become a developer!,"Categories
XML, Games/Entertainment, Graphics"
pstoedit is a tool converting PostScript and PDF files into various other formats suported by different drawing editors. As a prerequesite it needs GhostScript to be installed (binary installation is sufficient).pstoedit is a tool converting PostScript and PDF files into various other formats suported by different drawing editors. As a prerequesite it needs GhostScript to be installed (binary installation is sufficient).,"Categories
Image Converters, Vector Graphics, PDF"
"Test, validate and diagnose communication protocols in medical environments (DICOM, HL7 and IHE). DVTk is a must have for software developers, test engineers and service engineers that work in the healthcare domain. NEW. Services on www.dvtk.org!Test, validate and diagnose communication protocols in medical environments (DICOM, HL7 and IHE). DVTk is a must have for software developers, test engineers and service engineers that work in the healthcare domain. NEW. Services on www.dvtk.org!","Categories
Data Formats, Software Testing, Interface Engine/Protocol Translator"
A Mozilla Firefox extension for interacting with Amazon Compute Cloud (Amazon EC2). The source code also functions as an example of how to use the Amazon EC2 Query API from JavaScript.A Mozilla Firefox extension for interacting with Amazon Compute Cloud (Amazon EC2). The source code also functions as an example of how to use the Amazon EC2 Query API from JavaScript.,"Categories
Web Services"
"Converts Google Earth KML file to a CSV file, and vice versa. This enables you to plot all custom POIs with Google Earth first before transferring them into your Garmin GPS using the POI Loader.Converts Google Earth KML file to a CSV file, and vice versa. This enables you to plot all custom POIs with Google Earth first before transferring them into your Garmin GPS using the POI Loader.","Categories
Data Formats, Information Analysis, GIS"
"A Windows Property Handler which backs onto Taglib, allowing Windows Explorer, Windows Search and other applications using the same API to access metadata from a wide range of media formats.A Windows Property Handler which backs onto Taglib, allowing Windows Explorer, Windows Search and other applications using the same API to access metadata from a wide range of media formats.","Categories
Data Formats, Sound/Audio"
"ONVIF Device Manager is a Network Video Client (NVC) to manage Network Video Transmitters (NVT), Network Video Storage (NVS) and Network Video Analytics (NVA) devices. Implements Discovery, Device, Media, Imaging, Analytics, Events and PTZ services. Written in C# and uses ffmpeg for media decoding.

English User Guide
https://wiki.allprojects.info/display/ODMDOC/ONVIF+Device+Manager.+Installation+and+User+Guide

Russian User Guide
https://wiki.allprojects.info/display/ODMDOC/RUONVIF Device Manager is a Network Video Client (NVC) to manage Network Video Transmitters (NVT), Network Video Storage (NVS) and Network Video Analytics (NVA) devices. Implements Discovery, Device, Media, Imaging, Analytics, Events and PTZ services. Written in C# and uses ffmpeg for media decoding.

English User Guide
https://wiki.allprojects.info/display/ODMDOC/ONVIF+Device+Manager.+Installation+and+User+Guide

Russian User Guide
https://wiki.allprojects.info/display/ODMDOC/RU","Categories
Streaming, Video, Web Services"
"This library is free for any kind of use, including commercial use. It is licensed under the MIT license.

The parser is compatible with Excel and with OpenOffice/LibreOffice Calc, and can parse hard cases of CSV files


Check the Wiki page for usage examples and APIThis library is free for any kind of use, including commercial use. It is licensed under the MIT license.

The parser is compatible with Excel and with OpenOffice/LibreOffice Calc, and can parse hard cases of CSV files


Check the Wiki page for usage examples and API","Categories
Data Formats"
NOTICE: wimlib hosting has been moved to a dedicated website at https://wimlib.net. All files and source code have been removed from SourceForge and can be found on the new website.NOTICE: wimlib hosting has been moved to a dedicated website at https://wimlib.net. All files and source code have been removed from SourceForge and can be found on the new website.,"Categories
Data Formats"
"Simple XML parser written in C, with limited XPath and Unicode support and customizable tags. 'Simple' means that it does not implement all XML specifications, only the most widely used ones.Simple XML parser written in C, with limited XPath and Unicode support and customizable tags. 'Simple' means that it does not implement all XML specifications, only the most widely used ones.","Categories
XML, XML Parsers"
"A really wonderful software to visualise and analyse GPS traces in many different ways (speed and elevation variation, etc.), with different background maps (hiking map, road map, orienteering map, aerial image, cycling map, etc.). It is possible to make KML exports.A really wonderful software to visualise and analyse GPS traces in many different ways (speed and elevation variation, etc.), with different background maps (hiking map, road map, orienteering map, aerial image, cycling map, etc.). It is possible to make KML exports.","Categories
Data Formats, Mobile, Sports Games"
"SmartSlog (Smart Space Ontology) is a software/application development kit (SDK or ADK) for programming Smart-M3 agents (Knowledge Processors, KPs) that consume/produce smart space content according with its high-level ontological representation. SmartSlog applies the code generation approach: given an OWL ontology description, the ontology programming library is produced. The latter provides API to access the smart space via a Smart-M3 Semantic Information Broker (SIB) and data structures and functions to represent and maintain locally in KP code all ontology classes, relations, properties, and individuals.

Since 2012 the project is supported by grant KA179 of Karelia ENPI programme, http://kareliaenpi.eu/

More information about project: http://oss.fruct.org/wiki/SmartSlog
Smart-M3 on Wikipedia: http://en.wikipedia.org/wiki/Smart-M3SmartSlog (Smart Space Ontology) is a software/application development kit (SDK or ADK) for programming Smart-M3 agents (Knowledge Processors, KPs) that consume/produce smart space content according with its high-level ontological representation. SmartSlog applies the code generation approach: given an OWL ontology description, the ontology programming library is produced. The latter provides API to access the smart space via a Smart-M3 Semantic Information Broker (SIB) and data structures and functions to represent and maintain locally in KP code all ontology classes, relations, properties, and individuals.

Since 2012 the project is supported by grant KA179 of Karelia ENPI programme, http://kareliaenpi.eu/

More information about project: http://oss.fruct.org/wiki/SmartSlog
Smart-M3 on Wikipedia: http://en.wikipedia.org/wiki/Smart-M3","Categories
Code Generators, Embedded Systems, Semantic Web"
"NO LONGER MAINTAINED, NO LONGER SUPPORTED

The Digital Preservation Recorder (DPR) has been developed by the National Archives of Australia to manage a digital preservation workflow. It features antivirus integration and makes use of the Xena framework for preservation conversions of data objectsNO LONGER MAINTAINED, NO LONGER SUPPORTED

The Digital Preservation Recorder (DPR) has been developed by the National Archives of Australia to manage a digital preservation workflow. It features antivirus integration and makes use of the Xena framework for preservation conversions of data objects","Categories
XML, Archiving, Digital Preservation"
"SVG-cards is a collection of decks of playing cards made with the SVG format. They feature high-quality design from different styles and countries (poker, bridge, french, spanish, etc...) and vectorial representation: it means at any resolution on any support, the quality will remain the same.SVG-cards is a collection of decks of playing cards made with the SVG format. They feature high-quality design from different styles and countries (poker, bridge, french, spanish, etc...) and vectorial representation: it means at any resolution on any support, the quality will remain the same.","Categories
Card Games, XML, Graphics"
A server-side web-based AJAX-enabled RSS/Atom feed aggregator/news tracking tool. Requires PHP 4/5 and MySQL 4/5. Can host on Windows/Linux/BSD/MacOSX and browse on IE6/IE7/Firefox/Safari/Chrome/et al. See our web site for more details.A server-side web-based AJAX-enabled RSS/Atom feed aggregator/news tracking tool. Requires PHP 4/5 and MySQL 4/5. Can host on Windows/Linux/BSD/MacOSX and browse on IE6/IE7/Firefox/Safari/Chrome/et al. See our web site for more details.,"Categories
RSS, RSS Feed Readers"
"VGMToolbox is a C# based tool to assist VGM collectors and dumpers. It includes tools to extract, optimize, and build VGM formats as well as auditing and exploration utilities. [GBS, KSS, MDX, NSF(E), SID, S98, SPC, VGM, XA, XMA, xSF (PSF/PSF2/etc)]VGMToolbox is a C# based tool to assist VGM collectors and dumpers. It includes tools to extract, optimize, and build VGM formats as well as auditing and exploration utilities. [GBS, KSS, MDX, NSF(E), SID, S98, SPC, VGM, XA, XMA, xSF (PSF/PSF2/etc)]","Categories
Data Formats, Games/Entertainment, Audio Analysis"
"Program converts Opera Contacts file to gmail contacts file "".csv"", which you can import to gmail contacts.Program converts Opera Contacts file to gmail contacts file "".csv"", which you can import to gmail contacts.","Categories
Data Formats"
"HIPAATalk - Contains stored procedures and sample DTS packages for parsing and converting X12 to flat tables and creating HIPAA-compliant X12 files. Currently reads 820, 834, 835, 837P/I/D, 841, 997, TA1, and creates 835, 837P/I/D, 834, 277U, 997, TA1.HIPAATalk - Contains stored procedures and sample DTS packages for parsing and converting X12 to flat tables and creating HIPAA-compliant X12 files. Currently reads 820, 834, 835, 837P/I/D, 841, 997, TA1, and creates 835, 837P/I/D, 834, 277U, 997, TA1.","Categories
Data Formats, Database, Frameworks"
"JODConverter automates conversions between office document formats using OpenOffice.org. Supported formats include OpenDocument, PDF, RTF, Word, Excel, PowerPoint, and Flash. It can be used as a Java library, a command line tool, or a Web application.JODConverter automates conversions between office document formats using OpenOffice.org. Supported formats include OpenDocument, PDF, RTF, Word, Excel, PowerPoint, and Flash. It can be used as a Java library, a command line tool, or a Web application.","Categories
Data Formats, Office/Business, Dynamic Content"
"An implementation of DSSSL, a style language to format SGML or XML documents.
OpenJade contains backends for various formats (RTF, HTML, TeX, MIF, SGML2SGML, and FOT). This project also maintains OpenSP.An implementation of DSSSL, a style language to format SGML or XML documents.
OpenJade contains backends for various formats (RTF, HTML, TeX, MIF, SGML2SGML, and FOT). This project also maintains OpenSP.","Categories
XML, SGML, DocBook, HTML/XHTML, TeX/LaTeX, Interpreters"
IBM Z/Series packed and zone decimal conversion routines in Java. Demo program include with code usage sample.IBM Z/Series packed and zone decimal conversion routines in Java. Demo program include with code usage sample.,"Categories
Data Formats"
"ShowDown is a simple yet powerful tool for automating the process of finding and downloading new episodes of your favorite shows as they air. Simply choose your shows from the ever growing list of supported shows, then let ShowDown do the rest.ShowDown is a simple yet powerful tool for automating the process of finding and downloading new episodes of your favorite shows as they air. Simply choose your shows from the ever growing list of supported shows, then let ShowDown do the rest.","Categories
RSS, BitTorrent, Video"
"Imaging is native Object Pascal (Delphi and FPC) image loading, saving and manipulation library. It is available for several platforms and does not require any third party dynamic libraries.Imaging is native Object Pascal (Delphi and FPC) image loading, saving and manipulation library. It is available for several platforms and does not require any third party dynamic libraries.","Categories
Data Formats, Graphics, Libraries"
"ConcatPDF is the tool to concatenate PDF files. It can concatenate, extract, encrypt, decrypt, configure PDF files, convert image files to PDF. GUI version and CUI version are both available.

iText.NET is iText porting on .NET Framework by J#. This library allows you to generate PDF, (X)HTML, XML, RTF files on Microsoft.NET Framework including ASP.NET.ConcatPDF is the tool to concatenate PDF files. It can concatenate, extract, encrypt, decrypt, configure PDF files, convert image files to PDF. GUI version and CUI version are both available.

iText.NET is iText porting on .NET Framework by J#. This library allows you to generate PDF, (X)HTML, XML, RTF files on Microsoft.NET Framework including ASP.NET.","Categories
Text Processing, Dynamic Content, PDF"
"JMEDS is a lightweight, modular and extendable software framework for using the ""Devices Profile for Web-Services (DPWS)"" in Java based environments. It runs on Java CLDC (e.g. on embedded devices), CDC, Android and SE platforms.

12.02.2014 v2.0.0 beta 10
fixed the EXI release and included schema files for EXI's schema informed mode,
multiple other bug fixes

25.09.2013
Bugfix release of JMEDS Framework: v2.0.0 beta 9a

30.08.2013 v2.0.0 beta 9
New version of JMEDS Framework

We are doing our best to answer all questions from you and fix the bugs that are found as fast as we can! So don't hesitate to ask questions or report unexpected behaviour/bugs that you might find.

DPWS Explorer released on http://ws4d.e-technik.uni-rostock.de/dpws-explorer/JMEDS is a lightweight, modular and extendable software framework for using the ""Devices Profile for Web-Services (DPWS)"" in Java based environments. It runs on Java CLDC (e.g. on embedded devices), CDC, Android and SE platforms.

12.02.2014 v2.0.0 beta 10
fixed the EXI release and included schema files for EXI's schema informed mode,
multiple other bug fixes

25.09.2013
Bugfix release of JMEDS Framework: v2.0.0 beta 9a

30.08.2013 v2.0.0 beta 9
New version of JMEDS Framework

We are doing our best to answer all questions from you and fix the bugs that are found as fast as we can! So don't hesitate to ask questions or report unexpected behaviour/bugs that you might find.

DPWS Explorer released on http://ws4d.e-technik.uni-rostock.de/dpws-explorer/","Categories
SOAP, Frameworks, Web Services"
"Decodes CGI data from standard input, $QUERY_STRING , and $HTTP_COOKIE. Stores data in lookup table(s) for easy retrieval. Uploads files by copying
directly to files created with mkstemp(). Has several handy string conversion
functions.Decodes CGI data from standard input, $QUERY_STRING , and $HTTP_COOKIE. Stores data in lookup table(s) for easy retrieval. Uploads files by copying
directly to files created with mkstemp(). Has several handy string conversion
functions.","Categories
HTML/XHTML, CGI Scripts"
"gputils is a collection of tools for Microchip PIC microcontrollers. Its goal is to be fully compatible with Microchip's tools, MPASM, MPLINK, and MPLIB.gputils is a collection of tools for Microchip PIC microcontrollers. Its goal is to be fully compatible with Microchip's tools, MPASM, MPLINK, and MPLIB.","Categories
Data Formats, Compilers, Electronic Design Automation (EDA), Earth Sciences"
"SEEKING NEW MAINTAINER.

Java-library for manipulating the file-format of the gnucash open source accounting-software. Usable to automate accounting-tasks using e.g. HBCI or invoice-parsing or to simplify the preparation of your taxes. Contains a portable gnucash-viewer/editor.SEEKING NEW MAINTAINER.

Java-library for manipulating the file-format of the gnucash open source accounting-software. Usable to automate accounting-tasks using e.g. HBCI or invoice-parsing or to simplify the preparation of your taxes. Contains a portable gnucash-viewer/editor.","Categories
Data Formats, Accounting"
This Java application serves to transform W3C XML Schema instances into interactive diagrams in SVG format. The diagram represents structure of XML files and provides information about individual items – elements and attributes.This Java application serves to transform W3C XML Schema instances into interactive diagrams in SVG format. The diagram represents structure of XML files and provides information about individual items – elements and attributes.,"Categories
XML, Documentation, Presentation, Data Visualization"
PyXB (“pixbee”) is a pure Python package that generates Python source code for classes that correspond to data structures defined by XMLSchema. In concept it is similar to JAXB for Java and CodeSynthesis XSD for C++.PyXB (“pixbee”) is a pure Python package that generates Python source code for classes that correspond to data structures defined by XMLSchema. In concept it is similar to JAXB for Java and CodeSynthesis XSD for C++.,"Categories
XML, Code Generators, Web Services"
"DDay.iCal is an iCal (RFC 5545) class library for .NET 2.0 and above, Silverlight. It aims at being as RFC 5545 compliant as possible, while targeting compatibility with popular calendaring applications, like Apple iCal, Outlook 2007, etc.DDay.iCal is an iCal (RFC 5545) class library for .NET 2.0 and above, Silverlight. It aims at being as RFC 5545 compliant as possible, while targeting compatibility with popular calendaring applications, like Apple iCal, Outlook 2007, etc.","Categories
Data Formats, Calendar, Resource Management, Interpreters"
"Windows file viewer for delimited text files like CSV or Tab delimited files.

Nothing needs to be configured. In case of unusual formatting of the text files the option can be adjusted.

Simply open any delimited text file and access the information in tabular form.Windows file viewer for delimited text files like CSV or Tab delimited files.

Nothing needs to be configured. In case of unusual formatting of the text files the option can be adjusted.

Simply open any delimited text file and access the information in tabular form.","Categories
Text Editors, CSV"
Json schema validator in php. It is a PHP class that validates a json data structure against a schema definition. It is a simple class that returns an object containing the result and errors that happened.Json schema validator in php. It is a PHP class that validates a json data structure against a schema definition. It is a simple class that returns an object containing the result and errors that happened.,"Categories
JSON"
"[2014-10-31] This project is obsolete, for latest version (6.1.3) see GitHub https://github.com/digital-preservation/droid (source) and http://www.nationalarchives.gov.uk/information-management/manage-information/preserving-digital-records/droid/ (binary)

DROID (Digital Record Object Identification) is an automatic file format identification tool. It is the first in a planned series of tools developed by The National Archives under the umbrella of its PRONOM technical registry service.

[2013-01-24] The binary download of the latest version of DROID has now been moved to The National Archives website: http://www.nationalarchives.gov.uk/information-management/projects-and-work/droid.htm

The source code for the latest version of DROID remains available via Github: http://digital-preservation.github.com/droid/

[2012-09-07] DROID 6.1 has been released. New project hosting for the project can be found on GitHub: http://digital-preservation.github.com/droid/[2014-10-31] This project is obsolete, for latest version (6.1.3) see GitHub https://github.com/digital-preservation/droid (source) and http://www.nationalarchives.gov.uk/information-management/manage-information/preserving-digital-records/droid/ (binary)

DROID (Digital Record Object Identification) is an automatic file format identification tool. It is the first in a planned series of tools developed by The National Archives under the umbrella of its PRONOM technical registry service.

[2013-01-24] The binary download of the latest version of DROID has now been moved to The National Archives website: http://www.nationalarchives.gov.uk/information-management/projects-and-work/droid.htm

The source code for the latest version of DROID remains available via Github: http://digital-preservation.github.com/droid/

[2012-09-07] DROID 6.1 has been released. New project hosting for the project can be found on GitHub: http://digital-preservation.github.com/droid/","Categories
Data Formats, Archiving, Digital Preservation"
