Description,Category
"Portecle is a user friendly GUI application for creating, managing and examining key stores, keys, certificates, certificate requests, certificate revocation lists and more.Portecle is a user friendly GUI application for creating, managing and examining key stores, keys, certificates, certificate requests, certificate revocation lists and more.","Categories
Cryptography"
"This is a plugin to KeePass <http://www.KeePass.info> to provide an enhanced entry view.

For the rationale and design behind this project, see the forum post linked to as the homepageThis is a plugin to KeePass <http://www.KeePass.info> to provide an enhanced entry view.

For the rationale and design behind this project, see the forum post linked to as the homepage","Categories
Password Managers"
"OWASP Mantra - Free and Open Source Browser based Security Framework, is a collection of free and open source tools integrated into a web browser, which can become handy for penetration testers, web application developers, security professionals etc.OWASP Mantra - Free and Open Source Browser based Security Framework, is a collection of free and open source tools integrated into a web browser, which can become handy for penetration testers, web application developers, security professionals etc.","Categories
Security, Browsers"
"Looking for free Open Source Antivirus for Windows? Download ClamWin Free Antivirus and get free virus scanning and free virus definition updates. Free Antivirus software for Windows, using the well-respected ClamAV scanning engine. Includes virus scanner, scheduler, virus database updates, context menu integration to MS Windows Explorer and Add-in to MS Outlook. Also features easy setup program.Looking for free Open Source Antivirus for Windows? Download ClamWin Free Antivirus and get free virus scanning and free virus definition updates. Free Antivirus software for Windows, using the well-respected ClamAV scanning engine. Includes virus scanner, scheduler, virus database updates, context menu integration to MS Windows Explorer and Add-in to MS Outlook. Also features easy setup program.","Categories
Security, Antivirus, Anti-Malware"
"A KeePass plugin that downloads and stores favicons. A favicon is the little icon / logo used to identify many websites, typically displayed in the browser's address bar, bookmark list and on tabs.A KeePass plugin that downloads and stores favicons. A favicon is the little icon / logo used to identify many websites, typically displayed in the browser's address bar, bookmark list and on tabs.","Categories
Site Management, Password Managers"
"Synchronizes multiple folders with each other, keeping them up-to-date. One folder of each pair is kept encrypted.

Very useful when using cloud storage tools like SkyDrive, GDrive or Dropbox.Synchronizes multiple folders with each other, keeping them up-to-date. One folder of each pair is kept encrypted.

Very useful when using cloud storage tools like SkyDrive, GDrive or Dropbox.","Categories
Cryptography"
"mcrypt, and the accompanying libmcrypt, are intended to be replacements for the old Unix crypt, except that they are under the GPL and support an ever-wider range of algorithms and modes.mcrypt, and the accompanying libmcrypt, are intended to be replacements for the old Unix crypt, except that they are under the GPL and support an ever-wider range of algorithms and modes.","Categories
Cryptography, Software Development, Mathematics"
"NetworkMiner is a Network Forensic Analysis Tool (NFAT) for Windows that can detect the OS, hostname and open ports of network hosts through packet sniffing or by parsing a PCAP file. NetworkMiner can also extract transmitted files from network traffic.

New versions of NetworkMiner are released exclusively on www.netresec.com since version 2.0 of NetworkMiner. This page on SourceForge is only kept to provide hosting of older versions of the software.

To get the latest version of NetworkMiner, please visit:
http://www.netresec.com/?page=NetworkMinerNetworkMiner is a Network Forensic Analysis Tool (NFAT) for Windows that can detect the OS, hostname and open ports of network hosts through packet sniffing or by parsing a PCAP file. NetworkMiner can also extract transmitted files from network traffic.

New versions of NetworkMiner are released exclusively on www.netresec.com since version 2.0 of NetworkMiner. This page on SourceForge is only kept to provide hosting of older versions of the software.

To get the latest version of NetworkMiner, please visit:
http://www.netresec.com/?page=NetworkMiner","Categories
Security, Monitoring, Information Analysis"
"EncFSMP can create, mount and edit EncFS (encrypted file system) folders on Windows and Mac OS X.EncFSMP can create, mount and edit EncFS (encrypted file system) folders on Windows and Mac OS X.","Categories
Cryptography"
"Untangle is a Linux-based network gateway with pluggable modules for network applications like spam blocking, web filtering, anti-virus, anti-spyware, intrusion prevention, bandwidth control, captive portal, VPN, firewall, and more. Visit http://untangle.comUntangle is a Linux-based network gateway with pluggable modules for network applications like spam blocking, web filtering, anti-virus, anti-spyware, intrusion prevention, bandwidth control, captive portal, VPN, firewall, and more. Visit http://untangle.com","Categories
Email, Security, Networking, Logging, Internet"
SourceAFIS is a software library for human fingerprint recognition. It can compare two fingerprints 1:1 or search a large database for matching fingerprint. It takes raw fingerprint images on input and produces matching score on output. Click the website link above for more info.SourceAFIS is a software library for human fingerprint recognition. It can compare two fingerprints 1:1 or search a large database for matching fingerprint. It takes raw fingerprint images on input and produces matching score on output. Click the website link above for more info.,"Categories
Security, Algorithms, Libraries"
"Open1X is an open source implementation of the IEEE 802.1X protocol. This project includes support for the supplicant, while other projects (e.g., FreeRADIUS) provide support for the authentication server.Open1X is an open source implementation of the IEEE 802.1X protocol. This project includes support for the supplicant, while other projects (e.g., FreeRADIUS) provide support for the authentication server.","Categories
Security, Systems Administration, Networking"
"Darik's Boot and Nuke (""DBAN"") is a self-contained boot image that securely wipes the hard disks of most computers. DBAN is appropriate for bulk or emergency data destruction.Darik's Boot and Nuke (""DBAN"") is a self-contained boot image that securely wipes the hard disks of most computers. DBAN is appropriate for bulk or emergency data destruction.","Categories
Security, File Systems"
"-- WARNING --

HiJackThis is an inactive project and it is not updated anymore. You may want to look at the existent unofficial forks though:

https://github.com/dragokas/hijackthis/

--

HijackThis is a free utility that generates an in depth report of registry and file settings from your computer. HijackThis scan results make no separation between safe and unsafe settings , which gives you the ability to selectively remove items from your machine. In addition to scan and remove capabilities, HijackThis comes with several useful tools to manually remove malware from your computer. However, HijackThis does not make value based calls between what is considered good or bad. It is important to exercise caution and avoid making changes to your computer settings, unless you have expert knowledge. Source code is available SourceForge, under Code and also as a zip file under Files.-- WARNING --

HiJackThis is an inactive project and it is not updated anymore. You may want to look at the existent unofficial forks though:

https://github.com/dragokas/hijackthis/

--

HijackThis is a free utility that generates an in depth report of registry and file settings from your computer. HijackThis scan results make no separation between safe and unsafe settings , which gives you the ability to selectively remove items from your machine. In addition to scan and remove capabilities, HijackThis comes with several useful tools to manually remove malware from your computer. However, HijackThis does not make value based calls between what is considered good or bad. It is important to exercise caution and avoid making changes to your computer settings, unless you have expert knowledge. Source code is available SourceForge, under Code and also as a zip file under Files.","Categories
Anti-Malware"
"EJBCA is an enterprise class PKI Certificate Authority built on JEE technology. It is a robust, high performance, platform independent, flexible, and component based CA to be used standalone or integrated in other JEE applications.EJBCA is an enterprise class PKI Certificate Authority built on JEE technology. It is a robust, high performance, platform independent, flexible, and component based CA to be used standalone or integrated in other JEE applications.","Categories
Cryptography, Authentication/Directory"
THIS PROJECT HAS MOVED TO GITHUB!: https://github.com/kaikramer/keystore-explorerTHIS PROJECT HAS MOVED TO GITHUB!: https://github.com/kaikramer/keystore-explorer,"Categories
Cryptography"
"Liberté Linux is a secure, lightweight, and easy to use Gentoo-based Linux distribution intended as a communication aid in hostile environments. Liberté installs on a USB key, and boots on any computer or laptop.Liberté Linux is a secure, lightweight, and easy to use Gentoo-based Linux distribution intended as a communication aid in hostile environments. Liberté installs on a USB key, and boots on any computer or laptop.","Categories
Email, Security, Live CD"
Port of the Password Safe application to AndroidPort of the Password Safe application to Android,"Categories
Password Managers"
"DAR is a command-line backup and archiving tool that uses selective compression (not compressing already compressed files), strong encryption, may split an archive in different files of given size and provides on-fly hashing, supports differential backup with or without binary delta, ftp and sftp protocols to remote cloud storage

Archive internal's catalog, allows very quick restoration even a single file from a huge, eventually sliced, compressed, encrypted archive eventually located on a remote cloud storage, by only reading/fetching the necessary data to perform the operation.

Dar saves *all* UNIX inode types, takes care of hard links, sparse files as well as Extended Attributes (MacOS X file forks, Linux ACL, SELinux tags, user attributes) and some Filesystem Specific Attributes (Linux ext2/3/4, Mac OS X HFS+)

more details at: http://dar.linux.free.fr/doc/Features.htmlDAR is a command-line backup and archiving tool that uses selective compression (not compressing already compressed files), strong encryption, may split an archive in different files of given size and provides on-fly hashing, supports differential backup with or without binary delta, ftp and sftp protocols to remote cloud storage

Archive internal's catalog, allows very quick restoration even a single file from a huge, eventually sliced, compressed, encrypted archive eventually located on a remote cloud storage, by only reading/fetching the necessary data to perform the operation.

Dar saves *all* UNIX inode types, takes care of hard links, sparse files as well as Extended Attributes (MacOS X file forks, Linux ACL, SELinux tags, user attributes) and some Filesystem Specific Attributes (Linux ext2/3/4, Mac OS X HFS+)

more details at: http://dar.linux.free.fr/doc/Features.html","Categories
Cryptography, Backup, Systems Administration"
"A java LDAP client with LDIF support, security (inc SSL, SASL & GSSAPI), translated into many languages (inc. Chinese), online help, user forms and many other features.

The commercial version is available at https://jxworkbench.com for $9.95. It extends JXplorer to include:
- custom LDAP reporting - to pdf, word etc.
- Find and Replace with regexp and attribute substitution
- A secure password vault to store directory connections
- etc.

Support for JXplorer and JXWorkbench is available at http://jxplorer.org.

Commercial support available from sales@jxworkbench.comA java LDAP client with LDIF support, security (inc SSL, SASL & GSSAPI), translated into many languages (inc. Chinese), online help, user forms and many other features.

The commercial version is available at https://jxworkbench.com for $9.95. It extends JXplorer to include:
- custom LDAP reporting - to pdf, word etc.
- Find and Replace with regexp and attribute substitution
- A secure password vault to store directory connections
- etc.

Support for JXplorer and JXWorkbench is available at http://jxplorer.org.

Commercial support available from sales@jxworkbench.com","Categories
Other/Nonlisted Topic, Security, LDAP"
"Cntlm is an NTLM / NTLMv2 authenticating HTTP/1.1 proxy. It caches auth'd connections for reuse, offers TCP/IP tunneling (port forwarding) thru parent proxy and much much more. It's in C, very fast and resource-efficient. Go to http://cntlm.sf.net/Cntlm is an NTLM / NTLMv2 authenticating HTTP/1.1 proxy. It caches auth'd connections for reuse, offers TCP/IP tunneling (port forwarding) thru parent proxy and much much more. It's in C, very fast and resource-efficient. Go to http://cntlm.sf.net/","Categories
Security, Desktop Environment, WWW/HTTP, Networking"
"This is a user space TSS for TPM 2.0. It implements the functionality equivalent to (but not API compatible with) the TCG TSS working group's ESAPI, SAPI, and TCTI API's (and perhaps more) but with a hopefully simpler interface.

It comes with over 110 ""TPM tools"" samples that can be used for scripted apps, rapid prototyping, education, and debugging.

It also comes with a web based TPM interface, suitable for a demo to an audience that is unfamiliar with TCG technology. It is also useful for basic TPM management.

See the below link for operating system, platform, and hardware support.

See the companion IBM TPM 2.0 at https://sourceforge.net/projects/ibmswtpm2/
and attestation at projects/ibmtpm2acs

I welcome (1) bug reports, (2) documentation requests, (3) suggestions for ECC tests, and (4) requests for features for which you have an immediate need.

See the wiki for additional support - additions to the documentation.This is a user space TSS for TPM 2.0. It implements the functionality equivalent to (but not API compatible with) the TCG TSS working group's ESAPI, SAPI, and TCTI API's (and perhaps more) but with a hopefully simpler interface.

It comes with over 110 ""TPM tools"" samples that can be used for scripted apps, rapid prototyping, education, and debugging.

It also comes with a web based TPM interface, suitable for a demo to an audience that is unfamiliar with TCG technology. It is also useful for basic TPM management.

See the below link for operating system, platform, and hardware support.

See the companion IBM TPM 2.0 at https://sourceforge.net/projects/ibmswtpm2/
and attestation at projects/ibmtpm2acs

I welcome (1) bug reports, (2) documentation requests, (3) suggestions for ECC tests, and (4) requests for features for which you have an immediate need.

See the wiki for additional support - additions to the documentation.","Categories
Security"
"This is a plugin to KeePass <http://www.KeePass.info> to allow the AutoType functionality to work with browser URLs as well as window titles.

If integration with KeePass Check for Updates is required, install http://sourceforge.net/projects/kpsfupdatecheckerThis is a plugin to KeePass <http://www.KeePass.info> to allow the AutoType functionality to work with browser URLs as well as window titles.

If integration with KeePass Check for Updates is required, install http://sourceforge.net/projects/kpsfupdatechecker","Categories
Password Managers"
"Netdisco is an SNMP-based L2/L3 network management tool designed for moderate to large networks. Routers and switches are polled to log IP and MAC addresses and map them to switch ports. Automatic L2 network topology discovery, display, and inventory.Netdisco is an SNMP-based L2/L3 network management tool designed for moderate to large networks. Routers and switches are polled to log IP and MAC addresses and map them to switch ports. Automatic L2 network topology discovery, display, and inventory.","Categories
Security, Systems Administration, Monitoring"
"MailArchiva is a powerful, full featured email archiving (email archiver) and compliance solution for mail systems such as Microsoft Exchange. It stores all incoming, outgoing and internal emails for long term storage. A web based user interface is availMailArchiva is a powerful, full featured email archiving (email archiver) and compliance solution for mail systems such as Microsoft Exchange. It stores all incoming, outgoing and internal emails for long term storage. A web based user interface is avail","Categories
Email Spam Filter, Mail Transfer Agents, Enterprise, Data Warehousing, Database, Security"
"pdfcrack is a command line, password recovery tool for PDF-files.pdfcrack is a command line, password recovery tool for PDF-files.","Categories
Cryptography, Benchmark, PDF, Password Recovery"
"What does WinlockPro do?

Brings the entire Windows 10 metro theme across all versions of windows(XP and above)
Proprietary password encryption technology
Flash Drive Unlock!
View login attempts that have occurred
Sends you an email if many failed attempts occur
Shuts down the computer if multiple failed attempts occur
Desktop widget which can be used to easily control all aspects of the software
Ability to leave notes on the Lock Screen interface
Extremely simple to use
Almost every small aspect of the software can be customized
Fonts, colors, styles, positions, wallpapers, avatars, EVERYTHING can be changed to your liking
Now has a minimalist mode, to make it even easier to use
Dual monitor support
G-mail integration - Ability to control WinlockPro with simple email commands.
A whole lot more to be discovered

Future

I am currently building a cross platform app that will allow users to control WinlockPro from their mobile phones.What does WinlockPro do?

Brings the entire Windows 10 metro theme across all versions of windows(XP and above)
Proprietary password encryption technology
Flash Drive Unlock!
View login attempts that have occurred
Sends you an email if many failed attempts occur
Shuts down the computer if multiple failed attempts occur
Desktop widget which can be used to easily control all aspects of the software
Ability to leave notes on the Lock Screen interface
Extremely simple to use
Almost every small aspect of the software can be customized
Fonts, colors, styles, positions, wallpapers, avatars, EVERYTHING can be changed to your liking
Now has a minimalist mode, to make it even easier to use
Dual monitor support
G-mail integration - Ability to control WinlockPro with simple email commands.
A whole lot more to be discovered

Future

I am currently building a cross platform app that will allow users to control WinlockPro from their mobile phones.","Categories
Security, Desktop Environment, Password Managers"
"Clam sentinel is a program that detects file system changes and automatically scans the files added or modified using ClamWin. Require the installation of ClamWin. For Microsoft Windows 98/98SE/Me/2000/XP/Vista, Windows 7 and Windows 8.1.Clam sentinel is a program that detects file system changes and automatically scans the files added or modified using ClamWin. Require the installation of ClamWin. For Microsoft Windows 98/98SE/Me/2000/XP/Vista, Windows 7 and Windows 8.1.","Categories
Antivirus, Anti-Malware"
"Automated network based hard disk drives / storage devices erasure is server based software which installs on a central server. Server is connected to network switches and several PXE boot enabled workstations are attached to the network. As soon as the workstation is powered on, it boots off the network via the server and begins wiping all the attached hard disk drives. Once all the hard drives are wiped, data related to each hard disk is stored in the central server’s database. Read WIKI

Automated unattended network based data
erasure wiping
Comprehensive Reporting
Web GUI reporting
Generates certificate of data erasure
Barcodes Labels
Graphs Pie / Bar / Line Charts
Hard Disks bad sectors & health reporting
Hard Disk SMART Data collection
Database Driven Distributed System
Hard Disk Drives health reports
Part Open Source
* Friendly GUI Graphical User Interface
Mass Hard Disk Drive Destruction Data Wiping
HDD Data Eraser
Storage Array Data WipeAutomated network based hard disk drives / storage devices erasure is server based software which installs on a central server. Server is connected to network switches and several PXE boot enabled workstations are attached to the network. As soon as the workstation is powered on, it boots off the network via the server and begins wiping all the attached hard disk drives. Once all the hard drives are wiped, data related to each hard disk is stored in the central server’s database. Read WIKI

Automated unattended network based data
erasure wiping
Comprehensive Reporting
Web GUI reporting
Generates certificate of data erasure
Barcodes Labels
Graphs Pie / Bar / Line Charts
Hard Disks bad sectors & health reporting
Hard Disk SMART Data collection
Database Driven Distributed System
Hard Disk Drives health reports
Part Open Source
* Friendly GUI Graphical User Interface
Mass Hard Disk Drive Destruction Data Wiping
HDD Data Eraser
Storage Array Data Wipe","Categories
Security, Networking, Logging"
"Ralasafe Access Control Middleware focus on data-level privilege management, including database row/column and content privilege management. It also manages 2) login control; 3) function-level privilege management; and 4) URL privilege authenticationRalasafe Access Control Middleware focus on data-level privilege management, including database row/column and content privilege management. It also manages 2) login control; 3) function-level privilege management; and 4) URL privilege authentication","Categories
Security, Software Development"
"Network Security Toolkit (NST) is a bootable ISO image (Live USB Flash Drive) based on Fedora 36 providing easy access to best-of-breed Open Source Network Security Applications and should run on most x86_64 systems.

The main intent of developing this toolkit was to provide the security professional and network administrator with a comprehensive set of Open Source Network Security Tools. The majority of tools published in the article: Top 125 Security Tools by INSECURE.ORG are available in the toolkit. An advanced Web User Interface (WUI) is provided for system/network administration, navigation, automation, network monitoring, host geolocation, network analysis and configuration of many network and security applications found within the NST distribution. In the virtual world, NST can be used as a network security analysis, validation and monitoring tool on enterprise virtual servers hosting virtual machines.Network Security Toolkit (NST) is a bootable ISO image (Live USB Flash Drive) based on Fedora 36 providing easy access to best-of-breed Open Source Network Security Applications and should run on most x86_64 systems.

The main intent of developing this toolkit was to provide the security professional and network administrator with a comprehensive set of Open Source Network Security Tools. The majority of tools published in the article: Top 125 Security Tools by INSECURE.ORG are available in the toolkit. An advanced Web User Interface (WUI) is provided for system/network administration, navigation, automation, network monitoring, host geolocation, network analysis and configuration of many network and security applications found within the NST distribution. In the virtual world, NST can be used as a network security analysis, validation and monitoring tool on enterprise virtual servers hosting virtual machines.","Categories
Communications, Security, Systems Administration, Internet"
BASE is the Basic Analysis and Security Engine. It is based on the code from the Analysis Console for Intrusion Databases (ACID) project. This application provides a web front-end to query and analyze the alerts coming from a SNORT IDS system.BASE is the Basic Analysis and Security Engine. It is based on the code from the Analysis Console for Intrusion Databases (ACID) project. This application provides a web front-end to query and analyze the alerts coming from a SNORT IDS system.,"Categories
Security, Systems Administration, Firewall, Monitoring, Logging"
"NOTE PROJECT MIGRATED TO GITHUB - https://github.com/samrocketman/ekeyfinder

is a Magical Jelly Bean Keyfinder fork. It is a utility that retrieves the product key used to install Windows from your registry or from an unbootable Windows installation. It works on Windows 9X, ME, NT/2K/XP, and Vista/Win7 and for other software.NOTE PROJECT MIGRATED TO GITHUB - https://github.com/samrocketman/ekeyfinder

is a Magical Jelly Bean Keyfinder fork. It is a utility that retrieves the product key used to install Windows from your registry or from an unbootable Windows installation. It works on Windows 9X, ME, NT/2K/XP, and Vista/Win7 and for other software.","Categories
Security, Systems Administration, Logging"
