Description,Category
"Spanish Support site for forums phpBB, MODs, templates, icons, and others downloads. Translation phpBB, Icy Phoenix and others CMS based in phpBB.Spanish Support site for forums phpBB, MODs, templates, icons, and others downloads. Translation phpBB, Icy Phoenix and others CMS based in phpBB.","Categories
BBS, Message Board"
Software Defined Radio Transceiver project is written in Python while using GNU Radio and USRP. The goal is to create a software HF transceiver with various modes. Go here for more info: http://apps.sourceforge.net/mediawiki/sdr/index.php?title=Main_PageSoftware Defined Radio Transceiver project is written in Python while using GNU Radio and USRP. The goal is to create a software HF transceiver with various modes. Go here for more info: http://apps.sourceforge.net/mediawiki/sdr/index.php?title=Main_Page,"Categories
Ham Radio, User Interface (UI), Scientific/Engineering"
RapidCRC is a tool for windows for checking and creating CRC32 and MD5 checksums (.sfv/.md5 files). Goal is to use the fastest available (assembly) implementations for this task. Specialty: direct support for CRC32 checksums stored in filenames.RapidCRC is a tool for windows for checking and creating CRC32 and MD5 checksums (.sfv/.md5 files). Goal is to use the fastest available (assembly) implementations for this task. Specialty: direct support for CRC32 checksums stored in filenames.,"Categories
File Sharing, Other/Nonlisted Topic, Archiving"
"husky is a bunch of os-independent software for fidonet. It consitsts of tosser hpt, fileechoprocessor htick, message editor msged TE, libraries fidoconfig, smapi etc. Russian documentation may be found in Wiki http://sf.net/apps/mediawiki/husky/

The new development has been moved to https://github.com/huskyproject/husky is a bunch of os-independent software for fidonet. It consitsts of tosser hpt, fileechoprocessor htick, message editor msged TE, libraries fidoconfig, smapi etc. Russian documentation may be found in Wiki http://sf.net/apps/mediawiki/husky/

The new development has been moved to https://github.com/huskyproject/","Categories
FIDO"
Terminal gnutella2 leaf-mode client for BSD GNU/Linux OSTerminal gnutella2 leaf-mode client for BSD GNU/Linux OS,"Categories
Gnutella"
"QmailAdmin is a web interface for managing email addresses in
virtual domains created by Vpopmail.QmailAdmin is a web interface for managing email addresses in
virtual domains created by Vpopmail.","Categories
Email, Systems Administration"
Twisted protocols providing access to the Asterisk PBX's AMI and FastAGI interfaces from within the same programming process.Twisted protocols providing access to the Asterisk PBX's AMI and FastAGI interfaces from within the same programming process.,"Categories
Telephony"
"A nearly full options telnet 5250 terminal emulator. It includes a programmers API to improve 5250 panels by adding field popups, hints, ...A nearly full options telnet 5250 terminal emulator. It includes a programmers API to improve 5250 panels by adding field popups, hints, ...","Categories
Terminal Emulators, Telnet, Communications"
libtorrent is a C++ implementation of the BitTorrent protocol with the goals of being efficient and easy to use.libtorrent is a C++ implementation of the BitTorrent protocol with the goals of being efficient and easy to use.,"Categories
File Sharing"
"A forwarding address system with a web user management interface. End users can supply disposable email addresses (DEA) that, by default, expire after receiving a few emails but can be extended. Users can whitelist senders. Includes a captchaA forwarding address system with a web user management interface. End users can supply disposable email addresses (DEA) that, by default, expire after receiving a few emails but can be extended. Users can whitelist senders. Includes a captcha","Categories
Email Spam Filter"
"ShowDown is a simple yet powerful tool for automating the process of finding and downloading new episodes of your favorite shows as they air. Simply choose your shows from the ever growing list of supported shows, then let ShowDown do the rest.ShowDown is a simple yet powerful tool for automating the process of finding and downloading new episodes of your favorite shows as they air. Simply choose your shows from the ever growing list of supported shows, then let ShowDown do the rest.","Categories
RSS, BitTorrent, Video"
"A Club member administration tool written in PHP using a MySQL database. Clubdata is highly configurable, supports different membership types, a lot of membership features, mass e-mails, Excel-export, PDF-export and sophisticated authentication. ClubA Club member administration tool written in PHP using a MySQL database. Clubdata is highly configurable, supports different membership types, a lot of membership features, mass e-mails, Excel-export, PDF-export and sophisticated authentication. Club","Categories
Email, Other/Nonlisted Topic, Office/Business, WWW/HTTP"
"Copfilter is a easy to install addon for the opensource firewall IPCop. It filters POP3, SMTP, HTTP, and FTP traffic for viruses and spam using various open source programs.Copfilter is a easy to install addon for the opensource firewall IPCop. It filters POP3, SMTP, HTTP, and FTP traffic for viruses and spam using various open source programs.","Categories
Email Spam Filter, Anti-Spam, Anti-Malware"
"(This site is DEPRECATED. Please visit https://github.com/verdammelt/tnef)

TNEF provides a way to unpack those pesky Microsoft MS-TNEF MIME attachments. It operates like tar in order to upack any files which may have been put into the MS-TNEF attachment instead of being attached seperately.(This site is DEPRECATED. Please visit https://github.com/verdammelt/tnef)

TNEF provides a way to unpack those pesky Microsoft MS-TNEF MIME attachments. It operates like tar in order to upack any files which may have been put into the MS-TNEF attachment instead of being attached seperately.","Categories
Email"
"Kiax is a softphone (soft phone, VoIP client) with a simple and comfortable user interface for making VoIP calls to Asterisk PBX. It depends on the iaxclient library to use Asterisk's IAX2 protocol for easy call configuration and audio setup.Kiax is a softphone (soft phone, VoIP client) with a simple and comfortable user interface for making VoIP calls to Asterisk PBX. It depends on the iaxclient library to use Asterisk's IAX2 protocol for easy call configuration and audio setup.","Categories
Internet Phone, VoIP, PBX, Softphones"
Flashlight-VNC is a VNC Viewer written in Flash. It can connect to a VNC server and control a remote computer. It supports Tight Encoding and other encodings.Flashlight-VNC is a VNC Viewer written in Flash. It can connect to a VNC server and control a remote computer. It supports Tight Encoding and other encodings.,"Categories
Web Conferencing"
"Open Information Systems for Emergency Services (Open ISES) is a community of software developers, paramedics, EMTs, law enforcement & fire fighters working together to create open source software & training materials for the emergency service community.Open Information Systems for Emergency Services (Open ISES) is a community of software developers, paramedics, EMTs, law enforcement & fire fighters working together to create open source software & training materials for the emergency service community.","Categories
Communications, Database, Software Development, Software Distribution, Bio-Informatics, Education"
"eMail traffic is on the rise. With over 100 man-years of development time behind it and a clean, intuitive interface that makes handling messages a breeze, Hermes Messenger (formerly known as QUALCOMM Eudora) is more than a way to send and receive mail: it's a powerful management tool with features to increase your productivity and enhance your communications. It is the best eMail program for people who get lots of it. If you're not yet one of them, you soon will be. Take control of your eMail before it takes control of you! Hermes provides industrial-strength communication, free of ads and free of cost.eMail traffic is on the rise. With over 100 man-years of development time behind it and a clean, intuitive interface that makes handling messages a breeze, Hermes Messenger (formerly known as QUALCOMM Eudora) is more than a way to send and receive mail: it's a powerful management tool with features to increase your productivity and enhance your communications. It is the best eMail program for people who get lots of it. If you're not yet one of them, you soon will be. Take control of your eMail before it takes control of you! Hermes provides industrial-strength communication, free of ads and free of cost.","Categories
POP3, IMAP, Email Clients, Messaging"
"EZ Intranet Messenger is designed to work within a LAN segment, without the presence of centralized server. Its primary goal is to provide instant messaging service, along with online status notification, file transmission, and real time public chat.EZ Intranet Messenger is designed to work within a LAN segment, without the presence of centralized server. Its primary goal is to provide instant messaging service, along with online status notification, file transmission, and real time public chat.","Categories
Chat, Messaging"
"Googsystray is a system tray app for Google Voice, GMail, Google Calendar, Google Reader, and Google Docs. It notifies on new messages, alerts, etc., and provides basic services quickly.Googsystray is a system tray app for Google Voice, GMail, Google Calendar, Google Reader, and Google Docs. It notifies on new messages, alerts, etc., and provides basic services quickly.","Categories
Telephony, Email, Desktop Environment"
"Miranda IM is an open source, multi-protocol instant messaging client designed to be very light on system resources, extremely fast and customizable. A powerful plugin-based architecture make Miranda IM one of the most flexible clients on the planet.Miranda IM is an open source, multi-protocol instant messaging client designed to be very light on system resources, extremely fast and customizable. A powerful plugin-based architecture make Miranda IM one of the most flexible clients on the planet.","Categories
MSN Messenger, AOL Instant Messenger, IRC Clients, ICQ, Messaging"
"GO Contact Sync is a tool that synchronizes your contacts between Microsoft Outlook and Google Mail, it removes the hassle of entering details more than once.

This project is superseded by http://sourceforge.net/projects/googlesyncmodGO Contact Sync is a tool that synchronizes your contacts between Microsoft Outlook and Google Mail, it removes the hassle of entering details more than once.

This project is superseded by http://sourceforge.net/projects/googlesyncmod","Categories
File Sync"
Web-MeetMe is a suite of PHP pages to allow for scheduling and managing conferences on an Asterisk PBX.Web-MeetMe is a suite of PHP pages to allow for scheduling and managing conferences on an Asterisk PBX.,"Categories
Conferencing, PBX"
"Serial line sniffer (slsnif).
slsnif is a serial port logging utility. It listens to the specified serial port and logs all data going through this port in both directions.Serial line sniffer (slsnif).
slsnif is a serial port logging utility. It listens to the specified serial port and logs all data going through this port in both directions.","Categories
Communications, Software Testing, Debuggers, Logging, Hardware"
"Spicebird is an open-source email and collaboration suite based on the Mozilla platform. It provides integrated e-mail, contacts, calendaring and instant messaging. It can connect to any SMTP/IMAP email server, CalDav Calendar server and Jabber serveSpicebird is an open-source email and collaboration suite based on the Mozilla platform. It provides integrated e-mail, contacts, calendaring and instant messaging. It can connect to any SMTP/IMAP email server, CalDav Calendar server and Jabber serve","Categories
Usenet News, Email Clients, Calendar, To-Do Lists, XMPP, Email Servers"
iFolder is a safe and secure way to share and synchronize files across computers and within teams. http://ifolder.com Report Bugs : http://tinyurl.com/ifolderbugs Open Bugs : http://tinyurl.com/ifolderopenbugsiFolder is a safe and secure way to share and synchronize files across computers and within teams. http://ifolder.com Report Bugs : http://tinyurl.com/ifolderbugs Open Bugs : http://tinyurl.com/ifolderopenbugs,"Categories
File Sharing, File Sync"
JML is a java Msn Messenger library that supports MSNP8-MSNP15. It is optimized for multiple users and is intended to be very easy to follow and use.JML is a java Msn Messenger library that supports MSNP8-MSNP15. It is optimized for multiple users and is intended to be very easy to follow and use.,"Categories
MSN Messenger, Messaging"
"Quazaa is a cross platform multi-network peer-to-peer (P2P) file-sharing client inspired by Shareaza which will support Gnutella2, Ares, eDonkey2000 (eMule), HTTP, FTP, and BitTorrent. Using the Qt software development kitQuazaa is a cross platform multi-network peer-to-peer (P2P) file-sharing client inspired by Shareaza which will support Gnutella2, Ares, eDonkey2000 (eMule), HTTP, FTP, and BitTorrent. Using the Qt software development kit","Categories
File Sharing, BitTorrent, Gnutella"
"BitTorrent is a tool for distributed download. Go to http://www.bittorrent.com/ for the latest version, or http://www.bittorrent.com/dl/?C=M;O=D for source and older versions.BitTorrent is a tool for distributed download. Go to http://www.bittorrent.com/ for the latest version, or http://www.bittorrent.com/dl/?C=M;O=D for source and older versions.","Categories
File Sharing, File Transfer Protocol (FTP), WWW/HTTP"
"FMA is a SMS Manager, Mobile Phone Monitor, Remote Control Agent, Phonebook Manager, Organizer, Fun and much more; whatever you want it to be, it is whatever a mobile phone should have :-) (Currently based on Sony Ericsson features set).FMA is a SMS Manager, Mobile Phone Monitor, Remote Control Agent, Phonebook Manager, Organizer, Fun and much more; whatever you want it to be, it is whatever a mobile phone should have :-) (Currently based on Sony Ericsson features set).","Categories
Chat, Telephony, Calendar"
"The Hewlett-Packard Linux Imaging and Printing Project provides a unified single and multi-function connectivity solution for Linux. For support and help, please visit https://launchpad.net/hplipThe Hewlett-Packard Linux Imaging and Printing Project provides a unified single and multi-function connectivity solution for Linux. For support and help, please visit https://launchpad.net/hplip","Categories
Fax, Hardware Drivers, Printing, Scanner"
"DTMF detector and generator. Was used standard C++,so DTMF detector and generator completely cross platform.It used robust and reliable fixed-point algorithm, so can fast work on fixed-point architecture.DTMF detector and generator. Was used standard C++,so DTMF detector and generator completely cross platform.It used robust and reliable fixed-point algorithm, so can fast work on fixed-point architecture.","Categories
Telephony"
"ArmCord is a custom client designed to enhance your Discord experience while keeping everything lightweight.

- Standalone client
ArmCord is built as a standalone client and doesn't rely on the original Discord client in anyway.
- Various mods built in
Enjoy Vencord, Shelter and their many features, or have a more vanilla experience, it's your choice!
- Made for Privacy™
ArmCord automatically blocks all of Discord's trackers; even without any client mods you can feel safe and secure!
- Supports Rich Presence
Unlike other clients ArmCord supports rich presence (game activity) out of the box thanks to arRPC.
- Mobile support
ArmCord has a **experimental** mobile support for phones running Linux such as the PinePhone. While this is still far from ideal solution, we're slowly trying to improve it.
- Much more stable
ArmCord is using a newer build of Electron than the stock Discord app. This means you can have a much more stable and secure experience.ArmCord is a custom client designed to enhance your Discord experience while keeping everything lightweight.

- Standalone client
ArmCord is built as a standalone client and doesn't rely on the original Discord client in anyway.
- Various mods built in
Enjoy Vencord, Shelter and their many features, or have a more vanilla experience, it's your choice!
- Made for Privacy™
ArmCord automatically blocks all of Discord's trackers; even without any client mods you can feel safe and secure!
- Supports Rich Presence
Unlike other clients ArmCord supports rich presence (game activity) out of the box thanks to arRPC.
- Mobile support
ArmCord has a **experimental** mobile support for phones running Linux such as the PinePhone. While this is still far from ideal solution, we're slowly trying to improve it.
- Much more stable
ArmCord is using a newer build of Electron than the stock Discord app. This means you can have a much more stable and secure experience.","Categories
Chat"
"Free teleprompter software for all video creators. Built with ease of use, fast performance, control accuracy, and cross-platform support in mind. QPrompt works with studio teleprompters and tablet teleprompters, cellphones, and webcams. It was also designed for use in video conferences.Free teleprompter software for all video creators. Built with ease of use, fast performance, control accuracy, and cross-platform support in mind. QPrompt works with studio teleprompters and tablet teleprompters, cellphones, and webcams. It was also designed for use in video conferences.","Categories
Word Processors, Video, Video Conferencing"
"Il s'agit d'un outil d'aide à l'analyse des mails UIConsult.

L'outil se présent sous forme d'application en ligne de commande permettant
au chef de secteur de gagner du temps dans la rédaction des RCom.Il s'agit d'un outil d'aide à l'analyse des mails UIConsult.

L'outil se présent sous forme d'application en ligne de commande permettant
au chef de secteur de gagner du temps dans la rédaction des RCom.","Categories
Email, Information Analysis"
"Motrix is a full-featured, cross-platform download manager that supports downloading HTTP, FTP, BitTorrent, Magnet, Baidu Net Disk and more. It’s got an interface that’s clean, simple and easy to use, plus a number of great features. It can handle up to 10 concurrent downloads, can support 64 threads in a single task, support speed limit and more! It comes in both Chinese and English with many other translations in the works, and has dark mode available.Motrix is a full-featured, cross-platform download manager that supports downloading HTTP, FTP, BitTorrent, Magnet, Baidu Net Disk and more. It’s got an interface that’s clean, simple and easy to use, plus a number of great features. It can handle up to 10 concurrent downloads, can support 64 threads in a single task, support speed limit and more! It comes in both Chinese and English with many other translations in the works, and has dark mode available.","Categories
File Sharing, BitTorrent, File Transfer Protocol (FTP), Download Managers"
"The Business Bot Platform (BBP) - Community Edition is a chatbot platform for private and professional chatbots. It provides support for Facebook Messenger, Signal, Slack, Telegram, Microsoft Skype for Business, Threema and XMPP.

The Business Bot Platform Community Edition provides a software solution for chatbot applications developed with Java. It is designed to be easy to use (pluggable chatbots) and extensible as well as integrate in your chatbot application without knowledge about various instant messenger APIs. It is flexible through its plugin architecture and has a repository for chatbot applications (e.g. Wikipedia, Wiktionary, Calculator) which are installable by one-click. Also supporting RiveScript and AIML 2.0.

BBP is a web application which handles all incoming and outgoing instant messages and comes with a dashboard for all platform activities. Moreover, it supports artificial intelligence (e.g. Ms LUIS and TensorFlow) BBP is based on Apache, MySQL, and TomcatThe Business Bot Platform (BBP) - Community Edition is a chatbot platform for private and professional chatbots. It provides support for Facebook Messenger, Signal, Slack, Telegram, Microsoft Skype for Business, Threema and XMPP.

The Business Bot Platform Community Edition provides a software solution for chatbot applications developed with Java. It is designed to be easy to use (pluggable chatbots) and extensible as well as integrate in your chatbot application without knowledge about various instant messenger APIs. It is flexible through its plugin architecture and has a repository for chatbot applications (e.g. Wikipedia, Wiktionary, Calculator) which are installable by one-click. Also supporting RiveScript and AIML 2.0.

BBP is a web application which handles all incoming and outgoing instant messages and comes with a dashboard for all platform activities. Moreover, it supports artificial intelligence (e.g. Ms LUIS and TensorFlow) BBP is based on Apache, MySQL, and Tomcat","Categories
Chat, HMI, Chatbot"
"Feb. 7, 2019

Transmission is a respected Fast, Easy, and Free BitTorrent Client, as from their site https://transmissionbt.com/about

Unofficial Linux and Window builds run perfect either service or daemon.

32 bit and 64 bit versions.
32 (runs everywhere), 64 only 64-bit Windows.

Decision made to maintain choice 2.7x core rather than somewhat buggy 2.8x-2.9x cores. That's why you will see infrequent and less bug fixes than official branches. All the features of 2.8x-2.9x (except rename). Run this solid 2.77+ port for extended days, it doesn't crash or lock. Prime for seedbox use.

The included remote GUI port is fine tuned to the daemon released here.

Temporary piece support. https://trac.transmissionbt.com/ticket/532 plus many featured enhancements! Tested, stable enhancements user requested.

Specifically modified and bug tested for Linux GCC and Windows (cygwin gcc/g++) compilers.

Current release 14734-18 020619
https://github.com/cfpp2p/transmission/releasesFeb. 7, 2019

Transmission is a respected Fast, Easy, and Free BitTorrent Client, as from their site https://transmissionbt.com/about

Unofficial Linux and Window builds run perfect either service or daemon.

32 bit and 64 bit versions.
32 (runs everywhere), 64 only 64-bit Windows.

Decision made to maintain choice 2.7x core rather than somewhat buggy 2.8x-2.9x cores. That's why you will see infrequent and less bug fixes than official branches. All the features of 2.8x-2.9x (except rename). Run this solid 2.77+ port for extended days, it doesn't crash or lock. Prime for seedbox use.

The included remote GUI port is fine tuned to the daemon released here.

Temporary piece support. https://trac.transmissionbt.com/ticket/532 plus many featured enhancements! Tested, stable enhancements user requested.

Specifically modified and bug tested for Linux GCC and Windows (cygwin gcc/g++) compilers.

Current release 14734-18 020619
https://github.com/cfpp2p/transmission/releases","Categories
File Sharing, BitTorrent, Direct Connect"
"LibreOffice is a free and powerful office suite. Word processor, spreadsheet, presentations, diagrams, databases, formula editors, charts, and more. Compatible with Windows, Mac, and Linux.Features
InstraBrick
CrashMore
Unstablify","Categories
Telephony"
"package update 10/24/2020
- due to recent changes to dev repo of youtube-dl project, youtube-dl binary is excluded from the package (You will need to download it separately in order to use tube downloading features.)

Thanks to youtube-dl project http://youtube-dl.org/
Downloads Video/Audio from supported sites (plus generic video sites)
Thanks to Aria2c project; https://aria2.github.io/
Downloads from virtually any protocols , magnet links / torrent networks with chunked multi connection option!
- Downloads Playlists at once ! (mp3/mp4 format)
- Converts downloaded videos to mp4.
- Pause-Resume dl's (just enter same URL to resume).
- Builtin update for youtube-dl
- No privacy intrusion, home-calls, telemetry, analytics, ads etc.package update 10/24/2020
- due to recent changes to dev repo of youtube-dl project, youtube-dl binary is excluded from the package (You will need to download it separately in order to use tube downloading features.)

Thanks to youtube-dl project http://youtube-dl.org/
Downloads Video/Audio from supported sites (plus generic video sites)
Thanks to Aria2c project; https://aria2.github.io/
Downloads from virtually any protocols , magnet links / torrent networks with chunked multi connection option!
- Downloads Playlists at once ! (mp3/mp4 format)
- Converts downloaded videos to mp4.
- Pause-Resume dl's (just enter same URL to resume).
- Builtin update for youtube-dl
- No privacy intrusion, home-calls, telemetry, analytics, ads etc.","Categories
File Sharing, File Transfer Protocol (FTP), Other file transfer protocol"
"WebTorrent Desktop is for streaming torrents on Mac, Windows or Linux. It connects to both BitTorrent and WebTorrent peers. Now there's no need to wait for files to finish downloading. You can watch or play right away with WebTorrent Desktop.WebTorrent Desktop is for streaming torrents on Mac, Windows or Linux. It connects to both BitTorrent and WebTorrent peers. Now there's no need to wait for files to finish downloading. You can watch or play right away with WebTorrent Desktop.","Categories
BitTorrent"
