Description,Category
"RICcreator is an editor for the LEGO Mindstorms RIC image format and aims to bring out the formats advanced features for everybody. The goal is to support every feature apparent in John Hansen's enhanced firmware for Windows, Mac and Linux users.RICcreator is an editor for the LEGO Mindstorms RIC image format and aims to bring out the formats advanced features for everybody. The goal is to support every feature apparent in John Hansen's enhanced firmware for Windows, Mac and Linux users.","Categories
Data Formats, Graphic Design"
C++ library for working with OWL ontologiesC++ library for working with OWL ontologies,"Categories
XML, Artificial Intelligence, Libraries"
"Schema validation with simple dom php classes, that will check the xsd file before the xml based forms will accept any submit. The ajax wrapper should work with widgets to show any validation error to the form user.Schema validation with simple dom php classes, that will check the xsd file before the xml based forms will accept any submit. The ajax wrapper should work with widgets to show any validation error to the form user.","Categories
XML, Object Oriented, Digital Preservation"
"WAPI, or WOMBAT API, is a SOAP-based API built in the context of the WOMBAT FP7 project (http://www.wombat-project.eu) to facilitate the remote access and exploration of security-related datasets.WAPI, or WOMBAT API, is a SOAP-based API built in the context of the WOMBAT FP7 project (http://www.wombat-project.eu) to facilitate the remote access and exploration of security-related datasets.","Categories
SOAP, Security"
"This application converts the XML Polar file (from polarpersonaltrainer.com) to TCX Garmin file. All websites which register your trainers don't allow XML files from Polar. Tested with these models: RS300X, CS200This application converts the XML Polar file (from polarpersonaltrainer.com) to TCX Garmin file. All websites which register your trainers don't allow XML files from Polar. Tested with these models: RS300X, CS200","Categories
XML, Sports Games"
"Ever wanted to read your Google Reader RSS feeds on your Amazon Kindle while being offline and with a nice ebook formatting ? greader2kindle will retrieve your most recent unread news, and send them to your kindle as a proper mobipocket ebook.Ever wanted to read your Google Reader RSS feeds on your Amazon Kindle while being offline and with a nice ebook formatting ? greader2kindle will retrieve your most recent unread news, and send them to your kindle as a proper mobipocket ebook.","Categories
DocBook, RSS Feed Readers, eBook Readers"
Thymeleaf is a java web template engine designed for XML/XHTML/HTML5.Thymeleaf is a java web template engine designed for XML/XHTML/HTML5.,"Categories
HTML/XHTML"
This project has moved! Go to https://github.com/yenrab/qcdbsyncThis project has moved! Go to https://github.com/yenrab/qcdbsync,"Categories
Database, WWW/HTTP, JSON"
Python script converting Palm Keyring export file into KeePass 1.x XML import filePython script converting Palm Keyring export file into KeePass 1.x XML import file,"Categories
XML, Mobile, File Sync"
The Versioning Machine is a framework and an interface for displaying multiple versions of text encoded according to the Text Encoding Initiative (TEI) P5 Guidelines for critical apparatus.The Versioning Machine is a framework and an interface for displaying multiple versions of text encoded according to the Text Encoding Initiative (TEI) P5 Guidelines for critical apparatus.,"Categories
TEI"
"Substitutes the missing GPS information in Garmin TCX files when devices lacking a GPS receiver are used to collect training data (Garmin FR 60, heartrate and pedometer only). GpxTcxWelder integrates GPS info from a GPX v1.1 files into TCX filesSubstitutes the missing GPS information in Garmin TCX files when devices lacking a GPS receiver are used to collect training data (Garmin FR 60, heartrate and pedometer only). GpxTcxWelder integrates GPS info from a GPX v1.1 files into TCX files","Categories
XML, GPS"
"The YALTools is a set of command line tools written in ruby for CouchDB. It provides a unix like command set, mkdb, rmdb, lsdbs, lsdocs, putdocs, csv2json, and more. It aims to provide a power of filters and pipes in *NIX environment.The YALTools is a set of command line tools written in ruby for CouchDB. It provides a unix like command set, mkdb, rmdb, lsdbs, lsdocs, putdocs, csv2json, and more. It aims to provide a power of filters and pipes in *NIX environment.","Categories
Front-Ends, JSON"
A Program for converting .msg-files to .txt-files and extracting the attachmentsA Program for converting .msg-files to .txt-files and extracting the attachments,"Categories
Data Formats, Email"
SEG-Y files need special compression because they don't compress well using gzip and the like. The code is cross-platform C++ using nothing else than standard system libraries. This is a spin-off from the OpendTect project (http://opendtect.org).SEG-Y files need special compression because they don't compress well using gzip and the like. The code is cross-platform C++ using nothing else than standard system libraries. This is a spin-off from the OpendTect project (http://opendtect.org).,"Categories
Data Formats, File Compression, Earth Sciences"
"The Perl 3D-extension of MFPic LaTeX package aimed to high quality draw of spatial objects, such as vectors, curves, bounded surfaces.The Perl 3D-extension of MFPic LaTeX package aimed to high quality draw of spatial objects, such as vectors, curves, bounded surfaces.","Categories
TeX/LaTeX, 3D Modeling, Mathematics"
"A powerful Java Template Engine, great for building HTML or XML docs. Chunk can handle many other needs and situations as well. In-tag filters & default values, multiple snippets per file, layered themes, macros, conditional includes, localization & more.A powerful Java Template Engine, great for building HTML or XML docs. Chunk can handle many other needs and situations as well. In-tag filters & default values, multiple snippets per file, layered themes, macros, conditional includes, localization & more.","Categories
HTML/XHTML, CGI Scripts, Admin Templates"
Small tools to convert binary data format from spectrometers and oscilloscopes. Now the translators for * Starnford SR430 * LeCROY oscilloscope are included.Small tools to convert binary data format from spectrometers and oscilloscopes. Now the translators for * Starnford SR430 * LeCROY oscilloscope are included.,"Categories
Data Formats, Test and Measurement"
"ThreeTen provides a modern date and time library for Java and is the reference implementation for JSR-310. It includes many of the lessons of the Joda-Time project and aims to standardise date and time concepts in computing. Code now integrated into OpenJDK, this project is archived.ThreeTen provides a modern date and time library for Java and is the reference implementation for JSR-310. It includes many of the lessons of the Joda-Time project and aims to standardise date and time concepts in computing. Code now integrated into OpenJDK, this project is archived.","Categories
Data Formats, Internationalization (I18N), Libraries"
"extJWNL (Extended Java WordNet Library) is a Java API for creating, reading and updating dictionaries in WordNet format. extJWNL is an upgraded version of JWNL. The library features support for creating, editing and writing dictionaries; dictionary encodings, including UTF-8; Java generics; huge dictionaries; instance dictionaries and static singletone dictionary; Maven and more.extJWNL (Extended Java WordNet Library) is a Java API for creating, reading and updating dictionaries in WordNet format. extJWNL is an upgraded version of JWNL. The library features support for creating, editing and writing dictionaries; dictionary encodings, including UTF-8; Java generics; huge dictionaries; instance dictionaries and static singletone dictionary; Maven and more.","Categories
Data Formats, Scientific/Engineering, Research"
The goal of this package of classes is to generate XHTML code perfectly indented and without errors. It also allows to manipulate HTML templates. There's one PHP class by HTML tag and some classes contain facility methods to set the content.The goal of this package of classes is to generate XHTML code perfectly indented and without errors. It also allows to manipulate HTML templates. There's one PHP class by HTML tag and some classes contain facility methods to set the content.,"Categories
HTML/XHTML, Dynamic Content"
Tex to HTML translatorTex to HTML translator,"Categories
HTML/XHTML, TeX/LaTeX, Desktop Publishing"
"FigTeX manages images and their easy inclusion in LaTeX documents. Similar to BibTex, the image information is stored in an external file and is imported into the document as needed. It comes with a comfortable GUI for managing the image library.FigTeX manages images and their easy inclusion in LaTeX documents. Similar to BibTex, the image information is stored in an external file and is imported into the document as needed. It comes with a comfortable GUI for managing the image library.","Categories
Text Processing, TeX/LaTeX, Photo Management"
"Intermediate Vulnerability Information Language is is an XML schema for the exchange of vulnerability information from one tool handling vulnerability information to the other.

This project has moved to GitHub: https://github.com/schubergphilis/ivilIntermediate Vulnerability Information Language is is an XML schema for the exchange of vulnerability information from one tool handling vulnerability information to the other.

This project has moved to GitHub: https://github.com/schubergphilis/ivil","Categories
XML, Security"
"HTMLArea 4 is a browser based WYSIWYG editor that easily replaces the TEXTAREA in your web pages. It is written in JavaScript, and suitable for use in any modern web browser, and any page on your web site. Current version is 4.0-2016-08-29HTMLArea 4 is a browser based WYSIWYG editor that easily replaces the TEXTAREA in your web pages. It is written in JavaScript, and suitable for use in any modern web browser, and any page on your web site. Current version is 4.0-2016-08-29","Categories
Text Editors, HTML/XHTML, Browsers"
"Java library that implements the PESC College Transcript object and all dependent objects. It provides Marshalling and Unmarshalling from java objects to PESC XML files. To be used in an IDE such as eclipse for auto-completion of fields.

The latest version (support for PESC CollegeTranscript 1.6) has been moved to github:
https://github.com/jamhgit/pesc-transcript-jarJava library that implements the PESC College Transcript object and all dependent objects. It provides Marshalling and Unmarshalling from java objects to PESC XML files. To be used in an IDE such as eclipse for auto-completion of fields.

The latest version (support for PESC CollegeTranscript 1.6) has been moved to github:
https://github.com/jamhgit/pesc-transcript-jar","Categories
Data Formats, School Management"
Provides XML Data Binding for C++ through XML Schema. Features: a) xsd2cpp - generates C++ XML Objects(X/O mapping) b) XML I/O ie. marshalling-unmarshalling(serialization-deserialization) c) roundtrip retains processing instructions and commentsProvides XML Data Binding for C++ through XML Schema. Features: a) xsd2cpp - generates C++ XML Objects(X/O mapping) b) XML I/O ie. marshalling-unmarshalling(serialization-deserialization) c) roundtrip retains processing instructions and comments,"Categories
XML, Agile Development Tools, Libraries"
"A full-featured lightweight wrapper library of the native html canvas element written in Javascript, aimed to make visualization and animation using canvas simpler. Features animation support, layers, event capture, multitouch and many examples.A full-featured lightweight wrapper library of the native html canvas element written in Javascript, aimed to make visualization and animation using canvas simpler. Features animation support, layers, event capture, multitouch and many examples.","Categories
HTML/XHTML, CGI Scripts, Libraries"
"A GUI for creating and editing TAGxML files for TAGEngine games, written in python. See https://sourceforge.net/projects/tagengine/A GUI for creating and editing TAGxML files for TAGEngine games, written in python. See https://sourceforge.net/projects/tagengine/","Categories
XML, Game Development Frameworks"
This site was created with the aim of serving in learning a language. Especially we'll try to help listen it. It also comes with the goal of being free and collaborative. Therefore anyone who wants to participate is welcome.This site was created with the aim of serving in learning a language. Especially we'll try to help listen it. It also comes with the goal of being free and collaborative. Therefore anyone who wants to participate is welcome.,"Categories
MP3, AJAX, Languages"
"Report library + visual editor for Qt based applications.

Project moved to https://sourceforge.net/projects/qsqlmon/Report library + visual editor for Qt based applications.

Project moved to https://sourceforge.net/projects/qsqlmon/","Categories
XML, Libraries, Report Generators"
"fb2bin: A program to list binary attachment in FB2 files, extract them to files and replace these attachments by files.fb2bin: A program to list binary attachment in FB2 files, extract them to files and replace these attachments by files.","Categories
XML, Library"
chm reader for samsung wave mobiles. Bada Oschm reader for samsung wave mobiles. Bada Os,"Categories
Data Formats"
Run Maxima programs via the web in batch mode. Maxima is a Computer Algebra System written in Lisp.Run Maxima programs via the web in batch mode. Maxima is a Computer Algebra System written in Lisp.,"Categories
Mathematics, Computer Aided Instruction (CAI), Web Services"
"Develop: domain secure, and performing secure Domain Name System (DNS) dynamic updates. Domain Name System Security Extensions
Servlet API Package
The javax.servlet.http package contains a number of classes and interfaces that describe and define the contracts between a servlet class running under the HTTP protocol and the runtime environment provided for an instance of such a class by a conforming servlet container.Develop: domain secure, and performing secure Domain Name System (DNS) dynamic updates. Domain Name System Security Extensions
Servlet API Package
The javax.servlet.http package contains a number of classes and interfaces that describe and define the contracts between a servlet class running under the HTTP protocol and the runtime environment provided for an instance of such a class by a conforming servlet container.","Categories
HTML/XHTML, CGI Scripts, Business Performance Management"
"The Systems Biology Format Converter (SBFC) is a Java generic framework aiming to translate any systems biology model format into another.

The SBFC Web Site providing detailed feature description and instructions for installing, using and developing new modules is: http://sbfc.sourceforge.net/ .

Currently, SBFC allows the user to convert SBML models into the formats: BioPax, Matlab, Octave, XPP, DOT, and SBGN. Due to its modular design fast development and addition of new converters is highly facilitated.

SBFC can be executed in two modes:
1. standalone executable downloading the package provided in this website;
2. web-service at http://www.ebi.ac.uk/biomodels/tools/converters .

For general discussion about SBFC, please use the forum sbfc-forum@googlegroups.com .

A mailing-list is also available for developers: sbfc-devel@googlegroups.com


Thanks for using SBFC!

The SBFC TeamThe Systems Biology Format Converter (SBFC) is a Java generic framework aiming to translate any systems biology model format into another.

The SBFC Web Site providing detailed feature description and instructions for installing, using and developing new modules is: http://sbfc.sourceforge.net/ .

Currently, SBFC allows the user to convert SBML models into the formats: BioPax, Matlab, Octave, XPP, DOT, and SBGN. Due to its modular design fast development and addition of new converters is highly facilitated.

SBFC can be executed in two modes:
1. standalone executable downloading the package provided in this website;
2. web-service at http://www.ebi.ac.uk/biomodels/tools/converters .

For general discussion about SBFC, please use the forum sbfc-forum@googlegroups.com .

A mailing-list is also available for developers: sbfc-devel@googlegroups.com


Thanks for using SBFC!

The SBFC Team","Categories
Data Formats, Simulation, Bio-Informatics"
"PHP View-Controller framework similar to Adobe Flex framework. It is component based, event driven framework. Components can be defined in XML with possibility of inline PHP binding expressions or directly in PHP as PHP class.PHP View-Controller framework similar to Adobe Flex framework. It is component based, event driven framework. Components can be defined in XML with possibility of inline PHP binding expressions or directly in PHP as PHP class.","Categories
HTML/XHTML, Dynamic Content, Software Development"
The London Datastore (http://data.london.gov.uk) was created by the Greater London Authority (GLA) as an innovation towards freeing London’s data. This SourceForge Project will be used to Open Source our development efforts surrounding data formatsThe London Datastore (http://data.london.gov.uk) was created by the Greater London Authority (GLA) as an innovation towards freeing London’s data. This SourceForge Project will be used to Open Source our development efforts surrounding data formats,"Categories
XML, CSV, Semantic Web"
"Given an XSD schema and an XSA.xml configuration file, XML Skeleton Annotations (XSA) generates JSF forms UI to create XML records compliant to the XSD and following the XML skeleton defined in XSA.xml, still keeping everything under your control.Given an XSD schema and an XSA.xml configuration file, XML Skeleton Annotations (XSA) generates JSF forms UI to create XML records compliant to the XSD and following the XML skeleton defined in XSA.xml, still keeping everything under your control.","Categories
XML, Code Generators, TEI"
"Simple PHP class to check the validity of a VAT number from the European Union countries. Just include the class and call the function vat::check_vat($vat_number,$state_code). The state_code is the country 2 letter abbreviation (eg. GB, DE, AT etc.)Simple PHP class to check the validity of a VAT number from the European Union countries. Just include the class and call the function vat::check_vat($vat_number,$state_code). The state_code is the country 2 letter abbreviation (eg. GB, DE, AT etc.)","Categories
User Interface (UI), QA Automation, Web Services"
"The Universal Batch Converter is a project to take all the myriad file conversion programs, and provide a powerful but easy to use interface for all types of file conversion.The Universal Batch Converter is a project to take all the myriad file conversion programs, and provide a powerful but easy to use interface for all types of file conversion.","Categories
Data Formats, Audio Conversion, Image Converters"
A parser to read and write RoadXML files.A parser to read and write RoadXML files.,"Categories
Data Formats"
"SYMPLiK RANGEHOOD is a Javadoc-like tool for Oracle database. This pure-Java program ""sucks up"" data dictionary and object source code from database and generate document for Tables, Views, Triggers, Packages, Procedures, Functions, and others.SYMPLiK RANGEHOOD is a Javadoc-like tool for Oracle database. This pure-Java program ""sucks up"" data dictionary and object source code from database and generate document for Tables, Views, Triggers, Packages, Procedures, Functions, and others.","Categories
HTML/XHTML, Front-Ends, Documentation"
"off site: http://bote.to4tonado.com System Info: - Battle Of The Elements - a game based on open source, giving developers the right to download it in free mode and do their completion, thereby complicating the world.off site: http://bote.to4tonado.com System Info: - Battle Of The Elements - a game based on open source, giving developers the right to download it in free mode and do their completion, thereby complicating the world.","Categories
Web Services, MMORPG"
Very easy manipulation of XML with syntax like jQuery. One small file with lots of power. Highly extensible. Examples and Documentation are on the site. Great for a quick Data Import script.Very easy manipulation of XML with syntax like jQuery. One small file with lots of power. Highly extensible. Examples and Documentation are on the site. Great for a quick Data Import script.,"Categories
XML, HTML/XHTML, Dynamic Content"
The main objective of the EXIP project is to provide a C library for parsing and serialization of Efficient XML Interchange (EXI) Format streams. The focus is portability and efficiency for embedded systems development.The main objective of the EXIP project is to provide a C library for parsing and serialization of Efficient XML Interchange (EXI) Format streams. The focus is portability and efficiency for embedded systems development.,"Categories
Data Formats"
"An semantic editor for describing public administration services. Produces ontologies containing a workflow description in owl notation. Can be used for modelling processes in different fields, but was originally focused on semantically describing government services with their corresponding documents, fees and other information items.

Launch the editor with Java Web Start at http://ri.tdf.lvAn semantic editor for describing public administration services. Produces ontologies containing a workflow description in owl notation. Can be used for modelling processes in different fields, but was originally focused on semantically describing government services with their corresponding documents, fees and other information items.

Launch the editor with Java Web Start at http://ri.tdf.lv","Categories
Semantic Web, Data Modeling"
Wh32Edit is an army and savegame editor for the game Dark OmenWh32Edit is an army and savegame editor for the game Dark Omen,"Categories
Data Formats, Hex Editors"
"A PHP encapsulation of the AJAX sack library so that developers need only code in PHP to implement AJAX, Feedback will be good to improve this component set.
Now supporting cross browser drag and drop events, no other library dependencies.A PHP encapsulation of the AJAX sack library so that developers need only code in PHP to implement AJAX, Feedback will be good to improve this component set.
Now supporting cross browser drag and drop events, no other library dependencies.","Categories
Dynamic Content, AJAX, Libraries"
"This is a soap server to build converter server to convert files from any format to any format. A set of adapters classes, makes rbconverter highly modular and adaptable to use any applications for make conversions.This is a soap server to build converter server to convert files from any format to any format. A set of adapters classes, makes rbconverter highly modular and adaptable to use any applications for make conversions.","Categories
Web Services, Knowledge Management"
"A Transport Stream analyser for the Brazilian D-TV system (SBTVD / ISDB-Tb). It shows in a GUI the SI/PSI structure of the stream in a tree-view, bitrate statistics for each ES, specific Closed Caption, EPG and DSMCC carroussel decoding plus more.A Transport Stream analyser for the Brazilian D-TV system (SBTVD / ISDB-Tb). It shows in a GUI the SI/PSI structure of the stream in a tree-view, bitrate statistics for each ES, specific Closed Caption, EPG and DSMCC carroussel decoding plus more.","Categories
Data Formats, Streaming, Video"
An implementation of the VP8 image/video codec in pure Java.An implementation of the VP8 image/video codec in pure Java.,"Categories
Data Formats, Image Converters, Codec"
Mentat is a set of educational tools aimed to help teachers create courses - sets of tasks and students to learn with assistance of computer.Main feature is the ability to verify analytical response and assist student basing on his previous results.Mentat is a set of educational tools aimed to help teachers create courses - sets of tasks and students to learn with assistance of computer.Main feature is the ability to verify analytical response and assist student basing on his previous results.,"Categories
XML, Computer Aided Instruction (CAI)"
Converts TeX equations from a file using simple tags to images and replaces them by the corresponding <img> HTML tags in the output file.Converts TeX equations from a file using simple tags to images and replaces them by the corresponding <img> HTML tags in the output file.,"Categories
HTML/XHTML, TeX/LaTeX"
"Smart servers that can provide customized snippets of digital orthophotos using just-in-time geoprocessing and interoperable web-based components.

These servers are based on the MITOthoServers who was under the GNU Public License (GPL).Smart servers that can provide customized snippets of digital orthophotos using just-in-time geoprocessing and interoperable web-based components.

These servers are based on the MITOthoServers who was under the GNU Public License (GPL).","Categories
Web Services, Mapping"
jSOAP is designed for mobile devices which runs a J2ME platform. With jSOAP you can deal with a webservice using SOAP. jSOAP is very usefull when you don't now before the application starts how is structured the webservice. No need of WSDL !jSOAP is designed for mobile devices which runs a J2ME platform. With jSOAP you can deal with a webservice using SOAP. jSOAP is very usefull when you don't now before the application starts how is structured the webservice. No need of WSDL !,"Categories
SOAP, Internet Phone, Mobile"
